,Submission Title,Comment,Date Posted,Author,Score,ProcessedComments,SentimentLabel,SentimentProb,HumanSentiment,StockSearch,Date
49467,"Weekend Discussion Thread for the Weekend of June 11, 2021",Jim Cramer prefers the male Siri voice.,06-11-2021,UsingYourWifi,49.0,jim cramer prefers the male siri voice,neutral,0.8635891,,False,2021-06-11
55536,"Daily Discussion Thread for June 28, 2021",Wish bout to moon now athhhh,06-28-2021,Sleeplessneet,17.0,wish bout to moon now athhhh,neutral,0.8819152,,False,2021-06-28
47299,"Daily Discussion Thread for June 07, 2021",Buying more calls on CLOV because we move the market,06-07-2021,feel-the-pump,18.0,buying more calls on clov because we move the market,neutral,0.82525754,,False,2021-06-07
45028,"Daily Discussion Thread for June 01, 2021",GME should change its ticker to DFV,06-01-2021,restlessleg,17.0,gme should change its ticker to dfv,neutral,0.8221628,,False,2021-06-01
47905,"Daily Discussion Thread for June 08, 2021",Wish just took me by surprise and saved my whole day,06-08-2021,Father_cunningham,16.0,wish just took me by surprise and saved my whole day,positive,0.9414456,,False,2021-06-08
50647,"Daily Discussion Thread for June 15, 2021","Welcome, new VZIO bagholders",06-15-2021,kvyatbestdriver,12.0,welcome new vzio bagholders,positive,0.74821186,,False,2021-06-15
54273,"Daily Discussion Thread for June 24, 2021",TSLA has no ceiling,06-24-2021,Contextual-Investor,11.0,tsla has no ceiling,neutral,0.4847371,,False,2021-06-24
50911,"Daily Discussion Thread for June 16, 2021",Cash gang is code for paper hand bitch,06-16-2021,romo8476,17.0,cash gang is code for paper hand bitch,negative,0.8298884,,False,2021-06-16
46088,"Daily Discussion Thread for June 04, 2021","beats chest, buys more BB",06-04-2021,Nervous-Sky2414,29.0,beats chest buys more bb,neutral,0.7458879,,False,2021-06-04
49136,"Daily Discussion Thread for June 11, 2021",SENS is going to gamma squeeze soon,06-11-2021,repos39,16.0,sens is going to gamma squeeze soon,neutral,0.83163565,,False,2021-06-11
47186,"Daily Discussion Thread for June 07, 2021",I love the smell of cow toots and bull farts in the morning. CLNE bullish.,06-07-2021,Rusino,17.0,i love the smell of cow toots and bull farts in the morning clne bullish,positive,0.9073776,,False,2021-06-07
49585,"Weekend Discussion Thread for the Weekend of June 11, 2021",I just want you guys to know the only reason I buy high and sell low is to be allowed to come here and hang out with all of you retards.,06-13-2021,dadgrows,14.0,i just want you guys to know the only reason i buy high and sell low is to be allowed to come here and hang out with all of you retards,negative,0.6906346,,False,2021-06-13
49839,"Daily Discussion Thread for June 14, 2021",CLNE take me to the moon ðŸŒ™,06-14-2021,Sikitishvilliiii,29.0,clne take me to the moon,neutral,0.6647931,,False,2021-06-14
47295,"Daily Discussion Thread for June 07, 2021",CLNE really gets strong resistance. They know it's about to double if 13 is hit before next Friday,06-07-2021,yellowyeahyeahyeah,17.0,clne really gets strong resistance they know its about to double if 13 is hit before next friday,neutral,0.8169224,,False,2021-06-07
56598,"Daily Discussion Thread for June 30, 2021",WISH WITH A STEEL CHAIR,06-30-2021,YOLOPLAYALLDAY,8.0,wish with a steel chair,neutral,0.83677024,,False,2021-06-30
55534,"Daily Discussion Thread for June 28, 2021",Volume on WKHS picking up,06-28-2021,DesperateRoutine27,16.0,volume on wkhs picking up,neutral,0.8358266,,False,2021-06-28
53187,"Daily Discussion Thread for June 22, 2021",GSAT going to be in that other thread soon.,06-22-2021,Tbonepermabull,17.0,gsat going to be in that other thread soon,neutral,0.8958033,,False,2021-06-22
51499,"Daily Discussion Thread for June 17, 2021","I will not FOMO into ME

I will not FOMO into ME

I will not FOMO into ME

I will not FOMO into ME",06-17-2021,Why_Thinks_Much,10.0,i will not fomo into me i will not fomo into me i will not fomo into me i will not fomo into me,negative,0.59419525,,False,2021-06-17
52682,"Daily Discussion Thread for June 21, 2021",$WISH wishing for 30+ðŸš€ðŸš€ðŸš€,06-21-2021,91baby,23.0,wish wishing for 30,neutral,0.7686577,,False,2021-06-21
44890,"Daily Discussion Thread for June 01, 2021",Bb break 11.60,06-01-2021,Turbulent-Sort2964,20.0,bb break 11 60,neutral,0.777104,,False,2021-06-01
55006,"Weekend Discussion Thread for the Weekend of June 25, 2021",I went to ikea with my cousin today and holy shit thereâ€™s so much ass in the ikea. The place was leaking ass. White women love shitty furniture.,06-26-2021,binkyboy_,17.0,i went to ikea with my cousin today and holy shit theres so much ass in the ikea the place was leaking ass white women love shitty furniture,negative,0.9809985,,False,2021-06-26
54745,"Daily Discussion Thread for June 25, 2021",Just buy PSFE itâ€™ll work out for the best,06-25-2021,AllDatDalton,13.0,just buy psfe itll work out for the best,positive,0.8315231,,False,2021-06-25
50061,"Daily Discussion Thread for June 14, 2021",Wheres my CLNE peeps at??? ðŸ„ðŸ„ðŸŒ¿ðŸŒ¿ðŸŒªðŸŒ¬ðŸŒ¬ðŸŒ–ðŸŒ–,06-14-2021,BigboyJayjayjetplane,19.0,wheres my clne peeps at,neutral,0.8578029,,False,2021-06-14
50901,"Daily Discussion Thread for June 16, 2021","Lmao late 2023 and yâ€™all panicking? 

All of you must be new here.

Business as usual by tomorrow or max next week.",06-16-2021,InTheMoneyAlex,16.0,lmao late 2023 and yall panicking all of you must be new here business as usual by tomorrow or max next week,neutral,0.50221986,,False,2021-06-16
50981,"Daily Discussion Thread for June 16, 2021","I WISH my WISHes higher, WISHâ€˜m much higher ðŸš€ðŸš€ðŸš€ðŸš€ðŸš€ðŸ¦goðŸŒ™",06-16-2021,krass-k,15.0,i wish my wishes higher wish m much higher go,positive,0.7893341,,False,2021-06-16
47850,"Daily Discussion Thread for June 08, 2021",Let's make wish end the day on a high ðŸš€,06-08-2021,purptrip4343,16.0,lets make wish end the day on a high,positive,0.9047775,,False,2021-06-08
50800,"Daily Discussion Thread for June 16, 2021",Guess Iâ€™m holding BB till the end of time,06-16-2021,pizzatacotruck69,30.0,guess im holding bb till the end of time,neutral,0.84885746,,False,2021-06-16
50587,"Daily Discussion Thread for June 15, 2021",Jesus after dabbling in meme stocks trading AAPL is like watching fucking paint dry. I'm up but just not having any goddamned fun.,06-15-2021,ForRolls,13.0,jesus after dabbling in meme stocks trading aapl is like watching fucking paint dry im up but just not having any goddamned fun,negative,0.9755859,,False,2021-06-15
46058,"Daily Discussion Thread for June 04, 2021",BB,06-04-2021,StinkyDuck86,33.0,bb,neutral,0.5110977,,False,2021-06-04
48301,"Daily Discussion Thread for June 09, 2021",Wish is a beast!!!!!!,06-09-2021,Manster420,20.0,wish is a beast,neutral,0.6263885,,False,2021-06-09
49152,"Daily Discussion Thread for June 11, 2021",Literally WKHS started mooning right when I put a $13.9 stop lossðŸ¤£ letâ€™s go,06-11-2021,geebz42,16.0,literally wkhs started mooning right when i put a 13 9 stop loss lets go,neutral,0.79751134,,False,2021-06-11
52107,"Daily Discussion Thread for June 18, 2021",Friday is when all the shorts have to cover right? ðŸ¤¡,06-18-2021,RadioAdam,9.0,friday is when all the shorts have to cover right,neutral,0.84526134,,False,2021-06-18
50853,"Daily Discussion Thread for June 16, 2021","Letâ€™s be real- $WKHS is about to moon

- EDIT , Workhorse announced they are moving forward with challenging USPS contract in court today. http://www.reuters.com/article/us-workhorse-group-usps-idUSKCN2DS1SZ?utm_source=34553&utm_medium=partner",06-16-2021,jjsibs,18.0,lets be real wkhs is about to moon edit workhorse announced they are moving forward with challenging usps contract in court today http www reuters com article us workhorse group usps iduskcn2ds1sz utm_source 34553 utm_medium partner,neutral,0.8955801,,False,2021-06-16
48589,"Daily Discussion Thread for June 10, 2021",You built different if you see an stock rise 1200% in a few hours and you buy a the top ðŸ˜‚ðŸ˜‚,06-10-2021,igsurvey,16.0,you built different if you see an stock rise 1200 in a few hours and you buy a the top,neutral,0.7511597,,False,2021-06-10
50754,"Daily Discussion Thread for June 15, 2021",WISH catching a bid,06-15-2021,telepathist11,11.0,wish catching a bid,neutral,0.7811673,,False,2021-06-15
52310,"Weekend Discussion Thread for the Weekend of June 18, 2021",Does anyone else not like leaving there house?,06-20-2021,reddituser1234566789,17.0,does anyone else not like leaving there house,negative,0.66717184,,False,2021-06-20
49517,"Weekend Discussion Thread for the Weekend of June 11, 2021","God I'm so tired of these damn forex traders trying to DM ME, ""hey I'm a blah blah professional trader. I've never lost on a trade in my life! How would you like to learn how to make 4x your yearly salary and become financially free?!? Pay my 1 time sub fee of 599.99!"" STFU you garbage.",06-12-2021,GeorgeWashingtonTFP,13.0,god im so tired of these damn forex traders trying to dm me hey im a blah blah professional trader ive never lost on a trade in my life how would you like to learn how to make 4x your yearly salary and become financially free pay my 1 time sub fee of 599 99 stfu you garbage,negative,0.9479652,,False,2021-06-12
48554,"Daily Discussion Thread for June 10, 2021",Hell yea WISH,06-10-2021,Separate_Dig8810,16.0,hell yea wish,neutral,0.5464847,,False,2021-06-10
51747,"Daily Discussion Thread for June 18, 2021",Letâ€™s go WISH ðŸš€ðŸš€ðŸš€,06-18-2021,Billionaire_Spencer,25.0,lets go wish,neutral,0.6421272,,False,2021-06-18
50934,"Daily Discussion Thread for June 16, 2021",JPow is like a dad admitting to his family theyâ€™re actually NOT going to be taking the trip to Disney World. But my long term projection is that we might get to Busch Gardens.,06-16-2021,BirdyPooPoo,16.0,jpow is like a dad admitting to his family theyre actually not going to be taking the trip to disney world but my long term projection is that we might get to busch gardens,neutral,0.6695114,,False,2021-06-16
53251,"Daily Discussion Thread for June 22, 2021",Not selling a single $WISH call.,06-22-2021,SnooDoughnuts3377,13.0,not selling a single wish call,neutral,0.5184307,,False,2021-06-22
46341,"Daily Discussion Thread for June 04, 2021","The amount of bots tells me someone is nervous. Always means it will be a great day for BB, AMC and GME ðŸš€ðŸš€ðŸš€ðŸš€",06-04-2021,stenglboy96,21.0,the amount of bots tells me someone is nervous always means it will be a great day for bb amc and gme,positive,0.42679164,,False,2021-06-04
55317,"Weekend Discussion Thread for the Weekend of June 25, 2021","Looking at SOFI after todayâ€™s dump. A few execs can sell some shares? Who cares, gimme discount please",06-25-2021,FreshAquariums,8.0,looking at sofi after todays dump a few execs can sell some shares who cares gimme discount please,neutral,0.7907841,,False,2021-06-25
51878,"Daily Discussion Thread for June 18, 2021","I donâ€™t feel so good, Mr. Stark",06-18-2021,TheGhostofBillHwang,12.0,i dont feel so good mr stark,negative,0.9235177,,False,2021-06-18
46452,"Daily Discussion Thread for June 04, 2021","Its crazy that I've made more $ this week pushing green buttons on my phone, than I usually make busting ass framing houses.. can it really be this simple?",06-04-2021,badfish821,19.0,its crazy that ive made more this week pushing green buttons on my phone than i usually make busting ass framing houses can it really be this simple,neutral,0.40407437,,False,2021-06-04
49219,"Daily Discussion Thread for June 11, 2021",WKHS w that V,06-11-2021,odity9,15.0,wkhs w that v,neutral,0.70871514,,False,2021-06-11
47137,"Daily Discussion Thread for June 07, 2021","Mr.CLNE, pull up with my whole damn teamðŸ˜«",06-07-2021,gruey15243,20.0,mr clne pull up with my whole damn team,negative,0.8307374,,False,2021-06-07
48093,"Daily Discussion Thread for June 09, 2021",Lets buy WKHS calls above $20 for the gamma squeeze and short squeeze.  We can make this epic!!,06-09-2021,ArachnidBeneficial61,26.0,lets buy wkhs calls above 20 for the gamma squeeze and short squeeze we can make this epic,positive,0.58222866,,False,2021-06-09
45431,"Daily Discussion Thread for June 02, 2021",AMC...AMC...AMC ONWARD TO $100,06-02-2021,JRod_Canes,27.0,amc amc amc onward to 100,neutral,0.7909457,,False,2021-06-02
52963,"Daily Discussion Thread for June 21, 2021","If we keep talking about $SPY, do you think it will get past at least one lazy reporter talking about ""hot stocks on Wallstreetbets""?",06-21-2021,Gamboleer,11.0,if we keep talking about spy do you think it will get past at least one lazy reporter talking about hot stocks on wallstreetbets,neutral,0.53465563,,False,2021-06-21
53341,"Daily Discussion Thread for June 22, 2021",This fucking guy on CNBC is saying â€œwork makes life worth livingâ€ I want to smack the bald off his head.,06-22-2021,YogurtclosetNo8544,12.0,this fucking guy on cnbc is saying work makes life worth living i want to smack the bald off his head,negative,0.9576529,,False,2021-06-22
48362,"Daily Discussion Thread for June 09, 2021",Almost time to double down on WISH,06-09-2021,pedrollpalma,20.0,almost time to double down on wish,neutral,0.7490365,,False,2021-06-09
46960,"Weekend Discussion Thread for the Weekend of June 04, 2021","Holding 123 shares of BB at 14.50 praying for a better week. Not feeling great.

Everyone enjoy the weekend and have more than a few casuals tonight.",06-04-2021,donOFsquan,10.0,holding 123 shares of bb at 14 50 praying for a better week not feeling great everyone enjoy the weekend and have more than a few casuals tonight,positive,0.87482065,,False,2021-06-04
50499,"Daily Discussion Thread for June 15, 2021",TLRY needs more rockets ðŸš€,06-15-2021,Intelligent_Ad_6831,14.0,tlry needs more rockets,neutral,0.7797417,,False,2021-06-15
47275,"Daily Discussion Thread for June 07, 2021","CLNE Doesnt know how to stop, it wants it.",06-07-2021,Flimsy_Ad_6145,16.0,clne doesnt know how to stop it wants it,negative,0.534713,,False,2021-06-07
50522,"Daily Discussion Thread for June 15, 2021",GOEV GAMMA SQUEEZE INCOMJING,06-15-2021,oldfagbtw,14.0,goev gamma squeeze incomjing,neutral,0.74612516,,False,2021-06-15
52044,"Daily Discussion Thread for June 18, 2021",What a fuckin' awful week...,06-18-2021,D-s-DOG,10.0,what a fuckin awful week,negative,0.9778538,,False,2021-06-18
56320,"Daily Discussion Thread for June 29, 2021",Me and Sofia to the moon,06-29-2021,Jay3377,9.0,me and sofia to the moon,neutral,0.59157693,,False,2021-06-29
45937,"Daily Discussion Thread for June 03, 2021","The BB selling is not us, we will shake them out. Its us against them. BBuy and hold âœ‹",06-03-2021,Broccoli_Rabe2,31.0,the bb selling is not us we will shake them out its us against them bbuy and hold,neutral,0.63425016,,False,2021-06-03
48029,"Daily Discussion Thread for June 09, 2021",WISH charging back lfg,06-09-2021,cptphoto,25.0,wish charging back lfg,neutral,0.7586584,,False,2021-06-09
45126,"Daily Discussion Thread for June 02, 2021","Amc either opening at 40 or 100 tomorrow, your guess is as good as mine",06-02-2021,AdministrativeOne495,35.0,amc either opening at 40 or 100 tomorrow your guess is as good as mine,positive,0.59872496,,False,2021-06-02
55737,"Daily Discussion Thread for June 28, 2021",UWMC and CLNE teamed up to beat my account to death the past month. Iâ€™m numb at this point,06-28-2021,Robo123abc,12.0,uwmc and clne teamed up to beat my account to death the past month im numb at this point,negative,0.8925517,,False,2021-06-28
54761,"Daily Discussion Thread for June 25, 2021",LZB is too easy.,06-25-2021,Substantial_Diver_34,13.0,lzb is too easy,neutral,0.4715863,,False,2021-06-25
55099,"Weekend Discussion Thread for the Weekend of June 25, 2021",Who else is holding a lot of bags?,06-27-2021,Schocking_news,12.0,who else is holding a lot of bags,neutral,0.7077968,,False,2021-06-27
48193,"Daily Discussion Thread for June 09, 2021","WISH gang, can yâ€™all come pick me up at 14.65?",06-09-2021,24dunbar,23.0,wish gang can yall come pick me up at 14 65,neutral,0.7580156,,False,2021-06-09
55169,"Weekend Discussion Thread for the Weekend of June 25, 2021",I canâ€™t wait to go all in on TSLA calls for next week. Letâ€™s see that baby ðŸš€ðŸš€ðŸš€,06-26-2021,morningwood15,10.0,i cant wait to go all in on tsla calls for next week lets see that baby,positive,0.9790041,,False,2021-06-26
44696,"Daily Discussion Thread for June 01, 2021",Lets go BB!!! You can't spell Brr Brr with out BB ðŸš€ðŸš€ðŸš€ðŸŒ•,06-01-2021,Takoyak1,30.0,lets go bb you cant spell brr brr with out bb,neutral,0.66497016,,False,2021-06-01
54502,"Daily Discussion Thread for June 25, 2021",$PSFE!  Better than..........today!,06-25-2021,littleonesoyousay,22.0,psfe better than today,positive,0.6797294,,False,2021-06-25
53987,"Daily Discussion Thread for June 23, 2021",PLTR. Has been slowly creeping since last week.,06-23-2021,Thereisnopurpose12,10.0,pltr has been slowly creeping since last week,neutral,0.64100504,,False,2021-06-23
51752,"Daily Discussion Thread for June 18, 2021",WKHS AND WISH bc IM A RETARD,06-18-2021,pm_me_ur_cute_puppy,24.0,wkhs and wish bc im a retard,negative,0.73245144,,False,2021-06-18
56249,"Daily Discussion Thread for June 29, 2021","Come on $Wish, grabbing on the down low now time for you to show us the money![gif](emote|free_emotes_pack|upvote)",06-29-2021,BeerMoney069,11.0,come on wish grabbing on the down low now time for you to show us the money gif emote free_emotes_pack upvote,neutral,0.6324982,,False,2021-06-29
45151,"Daily Discussion Thread for June 02, 2021",$BB IS GOING TO FLY SOON. $BB GANG GET READY,06-02-2021,Reebo123,41.0,bb is going to fly soon bb gang get ready,neutral,0.5031756,,False,2021-06-02
46874,"Weekend Discussion Thread for the Weekend of June 04, 2021",Congrats to NVDA holders...,06-04-2021,TheDudeAbidesFarOut,11.0,congrats to nvda holders,positive,0.9361496,,False,2021-06-04
49360,"Daily Discussion Thread for June 11, 2021","Meme stocks have cratered the last couple of days. This is... .depressing. Friday-Tuesday everything was to the moon. It was like having a second, much better job. Now it's like... being unemployed but still paying your bills. Blah.",06-11-2021,Icy-Engineering1583,12.0,meme stocks have cratered the last couple of days this is depressing friday tuesday everything was to the moon it was like having a second much better job now its like being unemployed but still paying your bills blah,negative,0.91641474,,False,2021-06-11
47184,"Daily Discussion Thread for June 07, 2021",CLNE SHARHOLDERS! I did my part and Iâ€™m heading to bed Iâ€™m leaving the rest to you! Make me proud!ðŸ€ðŸ“ˆðŸš€ðŸŽ‰,06-07-2021,Carlsanime,17.0,clne sharholders i did my part and im heading to bed im leaving the rest to you make me proud,positive,0.8261592,,False,2021-06-07
50734,"Daily Discussion Thread for June 15, 2021",DKNG just got shorted. Time to squeeze the shit out of Hidenberg,06-15-2021,reactbooter,11.0,dkng just got shorted time to squeeze the shit out of hidenberg,negative,0.8558935,,False,2021-06-15
45797,"Daily Discussion Thread for June 03, 2021","Bought BB today at $19, holding till tomorrow at least. Friday Bump ðŸ‘",06-03-2021,Coolrunning39,33.0,bought bb today at 19 holding till tomorrow at least friday bump,neutral,0.90061736,,False,2021-06-03
49521,"Weekend Discussion Thread for the Weekend of June 11, 2021",Thisâ€¦.feels like a different place in the middle of the night on a weekend.,06-12-2021,_SpectreVenom_,15.0,this feels like a different place in the middle of the night on a weekend,neutral,0.6348134,,False,2021-06-12
47291,"Daily Discussion Thread for June 07, 2021",CLOV gamma squeeze is just beginning! ðŸš€ðŸš€ðŸš€,06-07-2021,x_is_for_box,17.0,clov gamma squeeze is just beginning,neutral,0.8326644,,False,2021-06-07
53376,"Daily Discussion Thread for June 22, 2021","Sell wall GSAT, should be broken now, going to tear upward",06-22-2021,gofundyourselves,12.0,sell wall gsat should be broken now going to tear upward,negative,0.60360473,,False,2021-06-22
53398,"Daily Discussion Thread for June 22, 2021",he said MEME stocks lol,06-22-2021,kindafast215,11.0,he said meme stocks lol,neutral,0.6841694,,False,2021-06-22
47226,"Daily Discussion Thread for June 07, 2021",Holding my CLOV call! Tendies for breakfast are sounding pretty good.,06-07-2021,danathanz,18.0,holding my clov call tendies for breakfast are sounding pretty good,positive,0.9829342,,False,2021-06-07
53064,"Daily Discussion Thread for June 22, 2021",Iâ€™m a fucking moron and Iâ€™m never investing again,06-22-2021,Matterial,36.0,im a fucking moron and im never investing again,negative,0.980464,,False,2021-06-22
51441,"Daily Discussion Thread for June 17, 2021",Wake ME up before you go go ðŸš€ðŸš€ðŸš€,06-17-2021,Ben-Hurr,11.0,wake me up before you go go,neutral,0.68482846,,False,2021-06-17
51526,"Daily Discussion Thread for June 17, 2021","Come on, everyone! If we all buy 300 UWMC, sacrafice a goat, and chant at the same time, it might close above $9.99 by October, 23rd, 2077",06-17-2021,Ordinary-Broccoli-41,27.0,come on everyone if we all buy 300 uwmc sacrafice a goat and chant at the same time it might close above 9 99 by october 23rd 2077,neutral,0.6823393,,False,2021-06-17
55191,"Weekend Discussion Thread for the Weekend of June 25, 2021","Iâ€™m signing off of the weekend thread for tonight. People trying to say Iâ€™m full of shit. But ask yourselfâ€¦ maybe your soul is full of shit? Yes I do drugs. Yes I drink a lot. Life is strange. But nothing is more honest than my shitposting. I like to narrate my lonely life in a new city; Austin. Iâ€™ve gotten lucky mostly through some very shitty times. How do you go back to how things were? You canâ€™t. Anyway, thanks for coming to my TED talk. Goodnight WSB.",06-27-2021,sobewankanobe,9.0,im signing off of the weekend thread for tonight people trying to say im full of shit but ask yourself maybe your soul is full of shit yes i do drugs yes i drink a lot life is strange but nothing is more honest than my shitposting i like to narrate my lonely life in a new city austin ive gotten lucky mostly through some very shitty times how do you go back to how things were you cant anyway thanks for coming to my ted talk goodnight wsb,neutral,0.35381007,,False,2021-06-27
55855,"Daily Discussion Thread for June 28, 2021",WORKHORSE PEOPLE. LETS.  GOOO.,06-28-2021,Ok-Impact4149,46.0,workhorse people lets gooo,positive,0.5875252,,False,2021-06-28
47983,"Daily Discussion Thread for June 09, 2021",WISH LETS GOOOO ðŸš€,06-09-2021,ProfessionalSlight32,31.0,wish lets goooo,positive,0.63708603,,False,2021-06-09
49571,"Weekend Discussion Thread for the Weekend of June 11, 2021",Coffee achieved now to get high af and stare at shit in my backyard,06-12-2021,PrazePuts,13.0,coffee achieved now to get high af and stare at shit in my backyard,negative,0.63194567,,False,2021-06-12
48442,"Daily Discussion Thread for June 10, 2021",Holy Fuck Wish wish just shanked a bear in the neck ðŸ”ªðŸ»,06-10-2021,goldensteaks,25.0,holy fuck wish wish just shanked a bear in the neck,negative,0.92589986,,False,2021-06-10
48287,"Daily Discussion Thread for June 09, 2021",Dip is about to be over!  WISH baby!,06-09-2021,ruaanwtds4r,22.0,dip is about to be over wish baby,neutral,0.6252708,,False,2021-06-09
51308,"Daily Discussion Thread for June 17, 2021",PLTR with the slow and steady increase. It's almost as if it wants to break out and just need a little push. ðŸ¤”,06-17-2021,abootcamppeasant,14.0,pltr with the slow and steady increase its almost as if it wants to break out and just need a little push,neutral,0.78026086,,False,2021-06-17
45469,"Daily Discussion Thread for June 02, 2021",Iâ€™m a BB guyâ€¦ but honestly credit where itâ€™s due. What you guys have done with AMC is one for the history books. Still BB next tho.,06-02-2021,Zealousideal-Put7914,29.0,im a bb guy but honestly credit where its due what you guys have done with amc is one for the history books still bb next tho,positive,0.7061975,,False,2021-06-02
55091,"Weekend Discussion Thread for the Weekend of June 25, 2021",Can't wait to be rich on Monday,06-27-2021,yushey__,13.0,cant wait to be rich on monday,positive,0.9628145,,False,2021-06-27
51825,"Daily Discussion Thread for June 18, 2021","Rate hikes in 18 months?
Sell everything!!! ðŸ¤¡",06-18-2021,Accomplished-Dig-424,13.0,rate hikes in 18 months sell everything,neutral,0.55856115,,False,2021-06-18
52188,"Daily Discussion Thread for June 18, 2021",CLOV lets go!!,06-18-2021,Mcchickenborn,24.0,clov lets go,neutral,0.5591254,,False,2021-06-18
45936,"Daily Discussion Thread for June 03, 2021",We unite against the shorties. HOLD THE LINE OF BB,06-03-2021,Embarrassed-End4105,32.0,we unite against the shorties hold the line of bb,neutral,0.7344282,,False,2021-06-03
56278,"Daily Discussion Thread for June 29, 2021","I have some time off so I opted to wake and bake today like the cool kids 


My chocolate muffins are almost ready ðŸ¤¤",06-29-2021,TLMontgomery,10.0,i have some time off so i opted to wake and bake today like the cool kids my chocolate muffins are almost ready,positive,0.90792054,,False,2021-06-29
53529,"Daily Discussion Thread for June 23, 2021","Iâ€™m a responsible degenerate, I invest in  $CLNE energy",06-23-2021,MoneyNinja23,26.0,im a responsible degenerate i invest in clne energy,negative,0.83241546,,False,2021-06-23
53101,"Daily Discussion Thread for June 22, 2021",The fact theyâ€™re saying â€œmeme stocksâ€ in a house hearing is mind blowing.,06-22-2021,ContrarianThinking,21.0,the fact theyre saying meme stocks in a house hearing is mind blowing,neutral,0.47380665,,False,2021-06-22
54863,"Daily Discussion Thread for June 25, 2021","WSB pumping Lazy Boy is pretty ironic, total boomer furniture. ðŸ˜‚",06-25-2021,DLew13,11.0,wsb pumping lazy boy is pretty ironic total boomer furniture,neutral,0.5040508,,False,2021-06-25
47121,"Daily Discussion Thread for June 07, 2021",CLOV you magnificient bastard! ðŸ˜ŠðŸš€,06-07-2021,ickstar009,22.0,clov you magnificient bastard,negative,0.88575006,,False,2021-06-07
55094,"Weekend Discussion Thread for the Weekend of June 25, 2021",My power is out and we are in the 100s today. California Dreaming.,06-27-2021,rudiger13,12.0,my power is out and we are in the 100s today california dreaming,neutral,0.47663915,,False,2021-06-27
47383,"Daily Discussion Thread for June 07, 2021","TLRYs smart boys. Instead going up fast, itâ€™s making higher lows allllll through the day",06-07-2021,fifthjack_TTV,14.0,tlrys smart boys instead going up fast its making higher lows allllll through the day,neutral,0.5808224,,False,2021-06-07
54620,"Daily Discussion Thread for June 25, 2021",Lmao no fucking way WISH letâ€™s goooooo,06-25-2021,aqualatte,13.0,lmao no fucking way wish lets goooooo,negative,0.8882388,,False,2021-06-25
44639,"Daily Discussion Thread for June 01, 2021","Fuck it , just bought some sweet BB",06-01-2021,armagnacXO,32.0,fuck it just bought some sweet bb,negative,0.625631,,False,2021-06-01
54350,"Daily Discussion Thread for June 24, 2021",What are you guys doing to PLTR? That thing is flying and is probably your fault,06-24-2021,SnooDoughnuts3377,11.0,what are you guys doing to pltr that thing is flying and is probably your fault,negative,0.7881881,,False,2021-06-24
49396,"Weekend Discussion Thread for the Weekend of June 11, 2021","A foolish man complains about a hole in his pantsâ€¦

A wise man uses that hole to scratch his balls. 

Thank you for coming to my Ted Talk",06-12-2021,tomtomtomj,46.0,a foolish man complains about a hole in his pants a wise man uses that hole to scratch his balls thank you for coming to my ted talk,negative,0.6169627,,False,2021-06-12
46785,"Weekend Discussion Thread for the Weekend of June 04, 2021","Mods giving 15 day old accounts flair 

ðŸ¤¡ðŸ¤¡ðŸ¤¡

I feel like Mufasa walking into the wasteland full of retarded hyenas.

Oh sorry, TILRAY ðŸš€ðŸŒ‘",06-06-2021,Catheter_Trader,12.0,mods giving 15 day old accounts flair i feel like mufasa walking into the wasteland full of retarded hyenas oh sorry tilray,negative,0.89990366,,False,2021-06-06
47216,"Daily Discussion Thread for June 07, 2021",BB,06-07-2021,dtoledo5,18.0,bb,neutral,0.5110977,,False,2021-06-07
47656,"Daily Discussion Thread for June 08, 2021",WISH GANGGGGGGGG,06-08-2021,PresenceOwn7626,19.0,wish gangggggggg,neutral,0.64349735,,False,2021-06-08
48083,"Daily Discussion Thread for June 09, 2021",WISH is picking up steam,06-09-2021,Seychumaru,27.0,wish is picking up steam,neutral,0.54029435,,False,2021-06-09
48228,"Daily Discussion Thread for June 09, 2021",WISHHHH LETS GOOOOO WOOHWOWHOWHO,06-09-2021,zheng_ole,23.0,wishhhh lets gooooo woohwowhowho,positive,0.8578285,,False,2021-06-09
44842,"Daily Discussion Thread for June 01, 2021",If BB ends today 13+ Iâ€™m painting my nails wathever color u guys choose,06-01-2021,CinaNeko,19.0,if bb ends today 13 im painting my nails wathever color u guys choose,neutral,0.91564274,,False,2021-06-01
56431,"Daily Discussion Thread for June 30, 2021",TLRY Curleaf CEO confirmed Schumer introducing legislation to legalize weed in early July ðŸš€ðŸš€ðŸš€,06-30-2021,MoneyBanks206,11.0,tlry curleaf ceo confirmed schumer introducing legislation to legalize weed in early july,neutral,0.84275246,,False,2021-06-30
51076,"Daily Discussion Thread for June 16, 2021",Holy fucking shit. I am fucked boys.,06-16-2021,bsr92,14.0,holy fucking shit i am fucked boys,negative,0.9764627,,False,2021-06-16
56793,"Daily Discussion Thread for June 30, 2021",Diamond hand = Stockhold syndrome,06-30-2021,fugatorio,7.0,diamond hand stockhold syndrome,neutral,0.69336146,,False,2021-06-30
56305,"Daily Discussion Thread for June 29, 2021"," Another day, another morning I should have sold at open.",06-29-2021,Griffinhunters,8.0,another day another morning i should have sold at open,negative,0.49510917,,False,2021-06-29
46529,"Weekend Discussion Thread for the Weekend of June 04, 2021",Sweet BB,06-04-2021,Bardy_Bard,150.0,sweet bb,positive,0.60795677,,False,2021-06-04
53375,"Daily Discussion Thread for June 22, 2021",TSLA you donâ€™t belong in the low 600s. Get your ass back to 900 ASAP.,06-22-2021,RADIO02118,12.0,tsla you dont belong in the low 600s get your ass back to 900 asap,negative,0.91351885,,False,2021-06-22
47225,"Daily Discussion Thread for June 07, 2021","#IF YOUâ€™RE RETARDED AND YOU KNOW IT CLAP YOUR HANDS 



#ðŸ‘ðŸ‘ðŸ‘",06-07-2021,BusinessManDoBiznez,18.0,if youre retarded and you know it clap your hands,negative,0.95934606,,False,2021-06-07
49020,"Daily Discussion Thread for June 11, 2021",UWMC buying after the 9:30 dump. Itâ€™s like clockwork everyday.  Prove me wrong day traders.,06-11-2021,ScroogeMcBux,17.0,uwmc buying after the 9 30 dump its like clockwork everyday prove me wrong day traders,neutral,0.57084084,,False,2021-06-11
45219,"Daily Discussion Thread for June 02, 2021",blackberry to 20,06-02-2021,Crisuveli,34.0,blackberry to 20,neutral,0.8227857,,False,2021-06-02
46150,"Daily Discussion Thread for June 04, 2021","Deep in the red with BB but hey, i like the stock. Anyone wanna go to Wendy's?",06-04-2021,Derangedsaladbowl,27.0,deep in the red with bb but hey i like the stock anyone wanna go to wendys,positive,0.805384,,False,2021-06-04
53038,"Daily Discussion Thread for June 21, 2021",The wish 30 minute chart is making me spin,06-21-2021,Puff1nlol,11.0,the wish 30 minute chart is making me spin,neutral,0.6329714,,False,2021-06-21
46105,"Daily Discussion Thread for June 04, 2021",BB this is the way lads. Don't be scared to buy in at opening prices. It's going to fly. WE'RE GOING TO FLY,06-04-2021,tnucuoykcuf,28.0,bb this is the way lads dont be scared to buy in at opening prices its going to fly were going to fly,neutral,0.5889977,,False,2021-06-04
52073,"Daily Discussion Thread for June 18, 2021",Imagine calling that walnut sized grey matter in your head an algo,06-18-2021,konga_gaming,9.0,imagine calling that walnut sized grey matter in your head an algo,neutral,0.6507059,,False,2021-06-18
56243,"Daily Discussion Thread for June 29, 2021",the fuck is going on with SOFI lol,06-29-2021,rioferd888,11.0,the fuck is going on with sofi lol,negative,0.9323781,,False,2021-06-29
46209,"Daily Discussion Thread for June 04, 2021",How is the BB gang doing?,06-04-2021,PrazePuts,27.0,how is the bb gang doing,neutral,0.8499108,,False,2021-06-04
56665,"Daily Discussion Thread for June 30, 2021",-8.5% on DIDI. Maybe I made the wrong move buying 1000 at 15.98 ðŸ˜žðŸ˜žðŸ˜ž,06-30-2021,FearlessTrader,8.0,8 5 on didi maybe i made the wrong move buying 1000 at 15 98,negative,0.62033314,,False,2021-06-30
55016,"Weekend Discussion Thread for the Weekend of June 25, 2021",I've lost only 100$ this week and I feel like a fucking winner,06-26-2021,confused_pupper,16.0,ive lost only 100 this week and i feel like a fucking winner,positive,0.5192721,,False,2021-06-26
47576,"Daily Discussion Thread for June 08, 2021",GME BULLS WE WILL SEE 500,06-08-2021,myjobisontheline,67.0,gme bulls we will see 500,neutral,0.82385135,,False,2021-06-08
56165,"Daily Discussion Thread for June 29, 2021",Ahh fuck sofi might be setting up to go violent to the upside,06-29-2021,Strangerdanger8812,12.0,ahh fuck sofi might be setting up to go violent to the upside,negative,0.94386363,,False,2021-06-29
48199,"Daily Discussion Thread for June 09, 2021",How high is $CLF aiming?,06-09-2021,swankykiwi,22.0,how high is clf aiming,neutral,0.84681684,,False,2021-06-09
49730,"Weekend Discussion Thread for the Weekend of June 11, 2021","75k to 3k in 2 months. Theta should be jailed for rape.

Edit: Iâ€™m done with options when I lose the 3k",06-11-2021,cryptooakmont,10.0,75k to 3k in 2 months theta should be jailed for rape edit im done with options when i lose the 3k,negative,0.872923,,False,2021-06-11
44594,"Daily Discussion Thread for June 01, 2021","#Mr Gorbachev, open the Casino",06-01-2021,fooledbyvechain,31.0,mr gorbachev open the casino,neutral,0.8365324,,False,2021-06-01
52001,"Daily Discussion Thread for June 18, 2021",I literally woke up. Saw the SPY was 3 points down. Closed my eyes and went back to sleep.,06-18-2021,tonyMIA23,9.0,i literally woke up saw the spy was 3 points down closed my eyes and went back to sleep,neutral,0.6327703,,False,2021-06-18
56409,"Daily Discussion Thread for June 30, 2021","Wow, Robinhood just got slapped with a $70M fine for harming millions of their customers.",06-30-2021,MarksVette,13.0,wow robinhood just got slapped with a 70m fine for harming millions of their customers,negative,0.9560706,,False,2021-06-30
44762,"Daily Discussion Thread for June 01, 2021",Putting additional 5k in BB. This is mental ðŸš€ðŸš€ðŸš€,06-01-2021,Leading-Slice-7369,22.0,putting additional 5k in bb this is mental,negative,0.65826267,,False,2021-06-01
55900,"Daily Discussion Thread for June 29, 2021",CLOV has hit a new daily high,06-29-2021,OpusL,29.0,clov has hit a new daily high,positive,0.78486013,,False,2021-06-29
56440,"Daily Discussion Thread for June 30, 2021",They freed Pill Cosby so time to load up on WISH. Since apparently everything that fucks you without consent is getting free reign today.,06-30-2021,mike_n30,13.0,they freed pill cosby so time to load up on wish since apparently everything that fucks you without consent is getting free reign today,negative,0.7445935,,False,2021-06-30
48136,"Daily Discussion Thread for June 09, 2021",Time to make my WISH come true,06-09-2021,Pretend_Knowledge_25,25.0,time to make my wish come true,positive,0.81966585,,False,2021-06-09
53247,"Daily Discussion Thread for June 22, 2021",Let's go WISH! ðŸš€ðŸš€ðŸš€,06-22-2021,frankieholmes447,14.0,lets go wish,neutral,0.6421272,,False,2021-06-22
48202,"Daily Discussion Thread for June 09, 2021",Somebody save my WISH,06-09-2021,meetpatel3627,24.0,somebody save my wish,neutral,0.6660114,,False,2021-06-09
47044,"Daily Discussion Thread for June 07, 2021",if CLOVs after hours represents how its going to play in the market tomorrow then we in for a ride,06-07-2021,Ok-3k,25.0,if clovs after hours represents how its going to play in the market tomorrow then we in for a ride,neutral,0.88818574,,False,2021-06-07
50485,"Daily Discussion Thread for June 15, 2021",Organized crime is bullish. All in DKNG.,06-15-2021,retard_trader,15.0,organized crime is bullish all in dkng,neutral,0.52953446,,False,2021-06-15
50237,"Daily Discussion Thread for June 14, 2021",Holding WISH,06-14-2021,TundiTough,15.0,holding wish,neutral,0.6702104,,False,2021-06-14
52560,"Weekend Discussion Thread for the Weekend of June 18, 2021","Be BB bag holder. Watch stock soar 5% in after hours. Excite.orgasm. Wake up in morning to find AllYourTendiesAreBelongToShorts.jpg. Slowly you crawl back to bed in the fetal position and suck your thumb. ""I'm gonna crush the shorts"" you say as crippling anxiety and debt takes you over.",06-19-2021,hereforthereads123,10.0,be bb bag holder watch stock soar 5 in after hours excite orgasm wake up in morning to find allyourtendiesarebelongtoshorts jpg slowly you crawl back to bed in the fetal position and suck your thumb im gonna crush the shorts you say as crippling anxiety and debt takes you over,negative,0.5337312,,False,2021-06-19
50604,"Daily Discussion Thread for June 15, 2021",PLTR with the pump fakeâ€¦ gets me every time ðŸ˜’,06-15-2021,GuwopGOAT,14.0,pltr with the pump fake gets me every time,negative,0.7747822,,False,2021-06-15
49930,"Daily Discussion Thread for June 14, 2021","It looks like the top three tickers for tomorrow will be CLNE, CRSR, and WISH.",06-14-2021,Dinosaur_Eats_Pizza,23.0,it looks like the top three tickers for tomorrow will be clne crsr and wish,neutral,0.67777795,,False,2021-06-14
55270,"Weekend Discussion Thread for the Weekend of June 25, 2021",I have Monday and Tuesday off to stare at the market all day. Life is good for once.,06-27-2021,Daybyhour69er,9.0,i have monday and tuesday off to stare at the market all day life is good for once,positive,0.9706659,,False,2021-06-27
51242,"Daily Discussion Thread for June 16, 2021",Green by close - JPOW will save us !,06-16-2021,BorisYeltzen,12.0,green by close jpow will save us,positive,0.5105478,,False,2021-06-16
47761,"Daily Discussion Thread for June 08, 2021",ðŸ¤¡ðŸ¤¡ When meme stocks pay more than your actual job ðŸ¤¡ðŸ¤¡,06-08-2021,3lcamin0,17.0,when meme stocks pay more than your actual job,negative,0.57228,,False,2021-06-08
49054,"Daily Discussion Thread for June 11, 2021",Puts on my sex life after I tell the wife I blew up my account,06-11-2021,AdrianThatGuy,17.0,puts on my sex life after i tell the wife i blew up my account,negative,0.65151435,,False,2021-06-11
45232,"Daily Discussion Thread for June 02, 2021",BB to 20 tonight not a meme,06-02-2021,iyioi,32.0,bb to 20 tonight not a meme,neutral,0.811779,,False,2021-06-02
55612,"Daily Discussion Thread for June 28, 2021",SOFI Jan calls for that easy money,06-28-2021,rankiba,14.0,sofi jan calls for that easy money,neutral,0.74594957,,False,2021-06-28
53928,"Daily Discussion Thread for June 23, 2021","If I had sold every morning at open, I would be a millionaire.",06-23-2021,Dinoclorox,9.0,if i had sold every morning at open i would be a millionaire,positive,0.5458257,,False,2021-06-23
55976,"Daily Discussion Thread for June 29, 2021",CLOV: I aint heard no bell,06-29-2021,CompetitiveReindeer7,19.0,clov i aint heard no bell,neutral,0.6225764,,False,2021-06-29
54453,"Daily Discussion Thread for June 24, 2021",Thereâ€™s a beautiful golden joint pattern forming on the TLRY charts,06-24-2021,glenndanzign00b,11.0,theres a beautiful golden joint pattern forming on the tlry charts,positive,0.95683014,,False,2021-06-24
56733,"Daily Discussion Thread for June 30, 2021",NIO AMD NTLA LETS FUCKING GOOOO,06-30-2021,Fitzy564,8.0,nio amd ntla lets fucking goooo,negative,0.513133,,False,2021-06-30
56565,"Daily Discussion Thread for June 30, 2021",**CLNE** perking up? Pls moon,06-30-2021,BrightEyedNovice,9.0,clne perking up pls moon,neutral,0.6860477,,False,2021-06-30
47603,"Daily Discussion Thread for June 08, 2021","CLNE and WKHS ðŸ‘ðŸ¼
For fun, Iâ€™m also on DFLYF",06-08-2021,SEO_rtiz,19.0,clne and wkhs for fun im also on dflyf,positive,0.7661291,,False,2021-06-08
44809,"Daily Discussion Thread for June 01, 2021",Rise BB rise,06-01-2021,Visual-Ganache-2289,24.0,rise bb rise,neutral,0.60729903,,False,2021-06-01
56506,"Daily Discussion Thread for June 30, 2021",I need to go back to bed. I just caught myself starting at AMC and wondering why it had dropped to the mid-50's when Ryzen chips are selling so well.,06-30-2021,Gamboleer,9.0,i need to go back to bed i just caught myself starting at amc and wondering why it had dropped to the mid 50s when ryzen chips are selling so well,negative,0.4708526,,False,2021-06-30
49124,"Daily Discussion Thread for June 11, 2021",CLF mooning !! get take a seat on this ðŸš€ and right your seatbelts ðŸš€,06-11-2021,Easy-Following2771,16.0,clf mooning get take a seat on this and right your seatbelts,negative,0.5844774,,False,2021-06-11
50194,"Daily Discussion Thread for June 14, 2021",CLNE volume already massively increasing,06-14-2021,RAGEEEEEEEE,17.0,clne volume already massively increasing,neutral,0.6963124,,False,2021-06-14
55084,"Weekend Discussion Thread for the Weekend of June 25, 2021","Drunkenly won $3600 last night putting $100 on Black 17 at Treasure Island in Vegas, kind of want to get a pirate flag tatted on my ass now. The only game of roulette i played all weekend.",06-26-2021,MikeyDabs414,11.0,drunkenly won 3600 last night putting 100 on black 17 at treasure island in vegas kind of want to get a pirate flag tatted on my ass now the only game of roulette i played all weekend,neutral,0.47314742,,False,2021-06-26
48180,"Daily Discussion Thread for June 09, 2021",I WISH I was rich sometimes I truly do,06-09-2021,baseball362,23.0,i wish i was rich sometimes i truly do,neutral,0.43605354,,False,2021-06-09
55075,"Weekend Discussion Thread for the Weekend of June 25, 2021",Fridayâ€™s are always my worst trading days,06-25-2021,yaboigoat53,12.0,fridays are always my worst trading days,negative,0.93339276,,False,2021-06-25
48269,"Daily Discussion Thread for June 09, 2021","C L N E - TO - M O O N 

SUNS IN 4",06-09-2021,Personal_Owl_6918,22.0,c l n e to m o o n suns in 4,neutral,0.8387213,,False,2021-06-09
51706,"Daily Discussion Thread for June 17, 2021",Let's go UWMC!,06-17-2021,Jazzlike_Bite_5986,8.0,lets go uwmc,neutral,0.5232725,,False,2021-06-17
46876,"Weekend Discussion Thread for the Weekend of June 04, 2021","Guys. I found out how to break through my gambling addiction.

Crippling depression and masturbation.",06-04-2021,Eyes-4-Blindy,11.0,guys i found out how to break through my gambling addiction crippling depression and masturbation,negative,0.7261428,,False,2021-06-04
54646,"Daily Discussion Thread for June 25, 2021",LZB TO THE MOON ðŸš€,06-25-2021,TankforTua,14.0,lzb to the moon,neutral,0.6736407,,False,2021-06-25
47585,"Daily Discussion Thread for June 08, 2021",Wish wish wish,06-08-2021,BoulderBoulder16,22.0,wish wish wish,neutral,0.69888324,,False,2021-06-08
54079,"Daily Discussion Thread for June 24, 2021",CLNE is still a great company ðŸ‘ðŸ’°,06-24-2021,Similar-Emergency338,19.0,clne is still a great company,positive,0.9140655,,False,2021-06-24
55877,"Daily Discussion Thread for June 29, 2021",CLOV TENDIES COMING ðŸ€,06-29-2021,gratefulred1414,39.0,clov tendies coming,neutral,0.8418713,,False,2021-06-29
51060,"Daily Discussion Thread for June 16, 2021",UWMC you beautiful bitch,06-16-2021,DGNAU,13.0,uwmc you beautiful bitch,negative,0.5455193,,False,2021-06-16
55840,"Daily Discussion Thread for June 28, 2021",God damn it WISH!! Break $15,06-28-2021,razorramonheyyo,11.0,god damn it wish break 15,negative,0.71287173,,False,2021-06-28
55755,"Daily Discussion Thread for June 28, 2021","When literally all of tech is bigly green and you're holding piece of shit red GOOGL like a ðŸ¤¡


Fuck you goog I'm never paying for youtube premium or turning off ublock origin or sponsorblock. Pure content is going straight into my eyeballs with zero fucking ads for life.",06-28-2021,Captain_Yolo_,12.0,when literally all of tech is bigly green and youre holding piece of shit red googl like a fuck you goog im never paying for youtube premium or turning off ublock origin or sponsorblock pure content is going straight into my eyeballs with zero fucking ads for life,negative,0.958579,,False,2021-06-28
50343,"Daily Discussion Thread for June 15, 2021",#CLF DOIN THAT THANG,06-15-2021,99W9,21.0,clf doin that thang,neutral,0.5192273,,False,2021-06-15
44673,"Daily Discussion Thread for June 01, 2021",If BB breaks $11.86 it's little resistance after that,06-01-2021,DayLate10kShort,28.0,if bb breaks 11 86 its little resistance after that,neutral,0.8573921,,False,2021-06-01
48910,"Daily Discussion Thread for June 11, 2021",CLNE and Sens,06-11-2021,FutureSailor1994,48.0,clne and sens,neutral,0.72316885,,False,2021-06-11
55672,"Daily Discussion Thread for June 28, 2021",SOFI 20 EOD? Why the fuck not?,06-28-2021,Krasnak,13.0,sofi 20 eod why the fuck not,negative,0.8749602,,False,2021-06-28
52212,"Weekend Discussion Thread for the Weekend of June 18, 2021","Remember, if you like the stock at $59 youâ€™ll fucking love it at $5.90.",06-18-2021,burtburtburtcg,165.0,remember if you like the stock at 59 youll fucking love it at 5 90,positive,0.7147252,,False,2021-06-18
46041,"Daily Discussion Thread for June 04, 2021","BB volume? Hello? BB apes??? ARE WE STILL HERE??? LETS PUSH THIS UP, UNDER 15$ IS ON SALE! ðŸ‘ðŸ’Ž",06-04-2021,StonedTurtle420710,38.0,bb volume hello bb apes are we still here lets push this up under 15 is on sale,neutral,0.5416536,,False,2021-06-04
55480,"Daily Discussion Thread for June 28, 2021","WKHS like that slimy, juicy whitehead zit after eating too many mayo sandwiches as a kid. Going to pop and shoot into space anytime now... Don't miss out!",06-28-2021,JimAmigo1,18.0,wkhs like that slimy juicy whitehead zit after eating too many mayo sandwiches as a kid going to pop and shoot into space anytime now dont miss out,negative,0.48631606,,False,2021-06-28
48855,"Daily Discussion Thread for June 10, 2021",WKHS about to ðŸš€,06-10-2021,TrappedOnScooter,11.0,wkhs about to,neutral,0.78328305,,False,2021-06-10
54474,"Daily Discussion Thread for June 24, 2021",TSLA GO MONKEYS GO,06-24-2021,Fabulous_Citron581,11.0,tsla go monkeys go,neutral,0.68683666,,False,2021-06-24
47320,"Daily Discussion Thread for June 07, 2021",I'm likin TLRY!,06-07-2021,samwisegordon,14.0,im likin tlry,positive,0.565793,,False,2021-06-07
55345,"Weekend Discussion Thread for the Weekend of June 25, 2021","Yo dude what the actual fuck happened with BB. I sold ccâ€™s on that shit last week and Iâ€™m up 60%. 

Downside is my shares are busted af. 

I thought this was supposed to be the next meme stonk turns out itâ€™s just trash",06-26-2021,Houston_swimmer,9.0,yo dude what the actual fuck happened with bb i sold ccs on that shit last week and im up 60 downside is my shares are busted af i thought this was supposed to be the next meme stonk turns out its just trash,negative,0.9783542,,False,2021-06-26
53485,"Daily Discussion Thread for June 22, 2021",***PENISES DOWN***,06-22-2021,BuffaloRhode,10.0,penises down,neutral,0.70146745,,False,2021-06-22
46559,"Weekend Discussion Thread for the Weekend of June 04, 2021",#4 6/11 BB $29 calls yoloing hard rn,06-05-2021,AxemanFromMA,22.0,4 6 11 bb 29 calls yoloing hard rn,neutral,0.71832705,,False,2021-06-05
52718,"Daily Discussion Thread for June 21, 2021",WISH chart so beautiful,06-21-2021,fwoot_fwies,21.0,wish chart so beautiful,positive,0.96870375,,False,2021-06-21
44780,"Daily Discussion Thread for June 01, 2021",TAKE DOWN 11.50 BB GANG,06-01-2021,somethingesque,24.0,take down 11 50 bb gang,neutral,0.770223,,False,2021-06-01
54636,"Daily Discussion Thread for June 25, 2021",SPCE OVER EVERYTHING,06-25-2021,Comrade_Cholula,13.0,spce over everything,neutral,0.5494585,,False,2021-06-25
52528,"Weekend Discussion Thread for the Weekend of June 18, 2021","Fucking knew it and did it anyway... Down 25%.. Sold fucking puts yesterday and bought calls......


What I posted after the fed meeting.....


>I know I bought at 422....i am up 30% but still negative 2%. Hope to sell in the morning during the sell off and switch to calls before the market tanks again and ends back up around 415-420 by the end of the month",06-18-2021,3dprintsAnomus,11.0,fucking knew it and did it anyway down 25 sold fucking puts yesterday and bought calls what i posted after the fed meeting i know i bought at 422 i am up 30 but still negative 2 hope to sell in the morning during the sell off and switch to calls before the market tanks again and ends back up around 415 420 by the end of the month,negative,0.75934935,,False,2021-06-18
56316,"Daily Discussion Thread for June 29, 2021",AMD consistently making solid gains. I see it easily surpassing $100/share *soon*,06-29-2021,VaultBoy3,11.0,amd consistently making solid gains i see it easily surpassing 100 share soon,positive,0.9565699,,False,2021-06-29
45066,"Daily Discussion Thread for June 02, 2021","BB pattern looking identical to yesterday. Open at $11ish, between 10a-11a drop to about 10.50 and then incline up from there.",06-02-2021,huckle_berry93,45.0,bb pattern looking identical to yesterday open at 11ish between 10a 11a drop to about 10 50 and then incline up from there,neutral,0.90813357,,False,2021-06-02
46084,"Daily Discussion Thread for June 04, 2021","I was down 140k earlier on the day 

Now Iâ€™m only down 128k

To those who said I couldnâ€™t do it. Fuck you ðŸ˜Ž",06-04-2021,WallStreetRetardd,36.0,i was down 140k earlier on the day now im only down 128k to those who said i couldnt do it fuck you,negative,0.8879552,,False,2021-06-04
46484,"Daily Discussion Thread for June 04, 2021","Buy more BooBs

&#x200B;

\#BB",06-04-2021,FutureSailor1994,17.0,buy more boobs x200b bb,neutral,0.6539946,,False,2021-06-04
55872,"Daily Discussion Thread for June 29, 2021",CLOV is making me feel like a proud daddy the way I was hyping him up the past week ðŸ€ðŸ€ðŸ˜­ðŸ˜­ðŸ˜­,06-29-2021,XanaxDealer,44.0,clov is making me feel like a proud daddy the way i was hyping him up the past week,positive,0.95085984,,False,2021-06-29
55090,"Weekend Discussion Thread for the Weekend of June 25, 2021","Have a nice weekend everyone, including ðŸŒˆðŸ»s, and except of course Britney's dad.",06-27-2021,AlmightySnoo,12.0,have a nice weekend everyone including s and except of course britneys dad,positive,0.9678011,,False,2021-06-27
47187,"Daily Discussion Thread for June 07, 2021",Clov looking marvellous at the moment,06-07-2021,TheOtherMountainGoat,19.0,clov looking marvellous at the moment,positive,0.97423637,,False,2021-06-07
49405,"Weekend Discussion Thread for the Weekend of June 11, 2021",If you're still pumping tickers on the weekend thread. You ain't drunk.,06-12-2021,F10andTheHotKeys,38.0,if youre still pumping tickers on the weekend thread you aint drunk,neutral,0.56893444,,False,2021-06-12
56510,"Daily Discussion Thread for June 30, 2021",Sold 1 of my NIO calls....I feel like a dirty bitch but I can't pass up a 150% gain.,06-30-2021,Cratic_Elite,8.0,sold 1 of my nio calls i feel like a dirty bitch but i cant pass up a 150 gain,negative,0.6523006,,False,2021-06-30
47610,"Daily Discussion Thread for June 08, 2021",$WISH 10$ before power hour,06-08-2021,MikeBkillinIt,19.0,wish 10 before power hour,neutral,0.8710232,,False,2021-06-08
49612,"Weekend Discussion Thread for the Weekend of June 11, 2021","Told my boomer coworker I didn't like the name Peg cause it reminds me of pegging and he said ""don't tell me what that is""",06-12-2021,GoBeaversOSU,12.0,told my boomer coworker i didnt like the name peg cause it reminds me of pegging and he said dont tell me what that is,negative,0.7900375,,False,2021-06-12
47139,"Daily Discussion Thread for June 07, 2021",CLNE the fckg Phoenix!!,06-07-2021,DLKobe,20.0,clne the fckg phoenix,negative,0.89368856,,False,2021-06-07
55152,"Weekend Discussion Thread for the Weekend of June 25, 2021",**DRUNK Oâ€™CLOCK**,06-26-2021,amoistsock,11.0,drunk oclock,neutral,0.7606714,,False,2021-06-26
50136,"Daily Discussion Thread for June 14, 2021",CLNE GONNA BREAK 15 today. JUMP ON THE ROCKET,06-14-2021,Door1234562,16.0,clne gonna break 15 today jump on the rocket,neutral,0.52244633,,False,2021-06-14
55557,"Daily Discussion Thread for June 28, 2021",Donâ€™t buy PLTR.  Itâ€™s only for winners.,06-28-2021,TequilaTrader,15.0,dont buy pltr its only for winners,neutral,0.5801546,,False,2021-06-28
47686,"Daily Discussion Thread for June 08, 2021",Come on CLNE Gang,06-08-2021,cgallizzi,18.0,come on clne gang,neutral,0.6972552,,False,2021-06-08
45132,"Daily Discussion Thread for June 02, 2021",Screw it im giving BB a go,06-02-2021,tachycardia69,36.0,screw it im giving bb a go,neutral,0.4598914,,False,2021-06-02
53490,"Daily Discussion Thread for June 22, 2021","Good luck, and get fucked",06-22-2021,post_pudding,10.0,good luck and get fucked,negative,0.895519,,False,2021-06-22
45565,"Daily Discussion Thread for June 03, 2021","Bb under 30 is a must,lol",06-03-2021,diamondhands95,57.0,bb under 30 is a must lol,positive,0.6121918,,False,2021-06-03
47494,"Daily Discussion Thread for June 08, 2021","CLNE sale is just that, a sale.",06-08-2021,HeineBenn,26.0,clne sale is just that a sale,neutral,0.6228748,,False,2021-06-08
46760,"Weekend Discussion Thread for the Weekend of June 04, 2021",Anyone else surprised there's no crap post stickied to the top tonight?,06-05-2021,TLMontgomery,12.0,anyone else surprised theres no crap post stickied to the top tonight,neutral,0.69179314,,False,2021-06-05
45775,"Daily Discussion Thread for June 03, 2021",BB opens at $20 and makes its way to $30 throughout the day I would nut my pants again,06-03-2021,YungGuap225,39.0,bb opens at 20 and makes its way to 30 throughout the day i would nut my pants again,neutral,0.47881147,,False,2021-06-03
55159,"Weekend Discussion Thread for the Weekend of June 25, 2021","not quite poor as I want to be, give me one more week in the market",06-26-2021,Kristoferrari,10.0,not quite poor as i want to be give me one more week in the market,neutral,0.5625492,,False,2021-06-26
55383,"Daily Discussion Thread for June 28, 2021",WKHS volume ðŸ˜ðŸ˜,06-28-2021,Elibro19,32.0,wkhs volume,neutral,0.73292243,,False,2021-06-28
55293,"Weekend Discussion Thread for the Weekend of June 25, 2021",I think I have a gambling addiction,06-26-2021,TheGhostofBillHwang,23.0,i think i have a gambling addiction,negative,0.8481853,,False,2021-06-26
55897,"Daily Discussion Thread for June 29, 2021",CLOV IS GONE BRO LIFTOFF LETS FUCKING GO,06-29-2021,thelundyy,30.0,clov is gone bro liftoff lets fucking go,negative,0.67251796,,False,2021-06-29
52047,"Daily Discussion Thread for June 18, 2021","Didn't get to buy into UWMC at 9.60 at 11:30 this morning? Well don't fear, it's still the same exact price. Get in now before it goes to 9.61!",06-18-2021,tallpaulpaultall,10.0,didnt get to buy into uwmc at 9 60 at 11 30 this morning well dont fear its still the same exact price get in now before it goes to 9 61,negative,0.49455705,,False,2021-06-18
53309,"Daily Discussion Thread for June 22, 2021","$WISH GREEN AGAIN, CRUSHED SOME SHORTS NOW TIME TO FLY AGAINðŸš€ðŸš€ðŸš€ðŸš€ðŸš€ðŸš€ðŸš€",06-22-2021,National-Bridge3497,12.0,wish green again crushed some shorts now time to fly again,neutral,0.710707,,False,2021-06-22
45747,"Daily Discussion Thread for June 03, 2021",BB going up up up,06-03-2021,Stringbag,35.0,bb going up up up,positive,0.69801307,,False,2021-06-03
50141,"Daily Discussion Thread for June 14, 2021","$CLNE catalysts are this week, apes ($AMZN meeting, 6/18 expiration). +13% so far.. Watch it and play it carefully otherwise you'd walk out smelling like cow farts ðŸ„ðŸ’¨ but who cares how you smell if your wallets on the inCLNE ðŸš€",06-14-2021,campa17,20.0,clne catalysts are this week apes amzn meeting 6 18 expiration 13 so far watch it and play it carefully otherwise youd walk out smelling like cow farts but who cares how you smell if your wallets on the inclne,negative,0.54315406,,False,2021-06-14
52575,"Weekend Discussion Thread for the Weekend of June 18, 2021",Jesus fuck off plants give me my nostrils back,06-20-2021,kortokrizzle,10.0,jesus fuck off plants give me my nostrils back,negative,0.8524544,,False,2021-06-20
54890,"Daily Discussion Thread for June 25, 2021",SPCE is having a crazy day wow,06-25-2021,novydoo,11.0,spce is having a crazy day wow,positive,0.80393916,,False,2021-06-25
46788,"Weekend Discussion Thread for the Weekend of June 04, 2021","I will challenge anyone in here to a weedwacking competition. Iâ€™m out here blazing the cleanest freshest lines. To those who wanna respond with that you have landscapers, just a heads up after they are done mowing your lawn they also mow your wifeâ€™s holes down too.",06-06-2021,FrankCarmody,14.0,i will challenge anyone in here to a weedwacking competition im out here blazing the cleanest freshest lines to those who wanna respond with that you have landscapers just a heads up after they are done mowing your lawn they also mow your wifes holes down too,neutral,0.5233746,,False,2021-06-06
56529,"Daily Discussion Thread for June 30, 2021","fuck, i shouldve sold at open",06-30-2021,xanre_,9.0,fuck i shouldve sold at open,negative,0.91870123,,False,2021-06-30
52806,"Daily Discussion Thread for June 21, 2021",Gonna break $13 just a matter of time,06-21-2021,Puzzled_Lobster_69,16.0,gonna break 13 just a matter of time,positive,0.527497,,False,2021-06-21
45541,"Daily Discussion Thread for June 03, 2021",upvote if you weren't pussies to sell AMC and BB at stop loss,06-03-2021,htailor_atx,74.0,upvote if you werent pussies to sell amc and bb at stop loss,neutral,0.48667008,,False,2021-06-03
55282,"Weekend Discussion Thread for the Weekend of June 25, 2021",About to take a freezing cold shower and take control of my mind. Wish me luck please..,06-27-2021,Small_Guava_8545,10.0,about to take a freezing cold shower and take control of my mind wish me luck please,positive,0.5752969,,False,2021-06-27
47379,"Daily Discussion Thread for June 07, 2021","TLRY green and steady, 20 in the rear view mirror ez",06-07-2021,MoonPandaBlastOff,15.0,tlry green and steady 20 in the rear view mirror ez,neutral,0.7790461,,False,2021-06-07
55182,"Weekend Discussion Thread for the Weekend of June 25, 2021",Officially hit the poverty line today. Looking anywhere to cut costs. My landscaper is saying I should not open the pool this summer? My kids are going to be wrecked if they have to go to the public pool though... :/,06-26-2021,Mcdolnalds,10.0,officially hit the poverty line today looking anywhere to cut costs my landscaper is saying i should not open the pool this summer my kids are going to be wrecked if they have to go to the public pool though,negative,0.7348451,,False,2021-06-26
45457,"Daily Discussion Thread for June 02, 2021","BB!! If we can get past 16 today, we got 20 tomorrow!",06-02-2021,lateral_moves,27.0,bb if we can get past 16 today we got 20 tomorrow,positive,0.5906944,,False,2021-06-02
44715,"Daily Discussion Thread for June 01, 2021",BB is my first meme stock. Been in spacs and boomer shit too long. You morons better make me rich.,06-01-2021,KoreshGlasses,28.0,bb is my first meme stock been in spacs and boomer shit too long you morons better make me rich,negative,0.73635644,,False,2021-06-01
50178,"Daily Discussion Thread for June 14, 2021","Not making my dog sit for treats tonight, WOOF!",06-14-2021,Puzzled_Lobster_69,17.0,not making my dog sit for treats tonight woof,negative,0.6171955,,False,2021-06-14
47584,"Daily Discussion Thread for June 08, 2021",I WISH we can hit $20,06-08-2021,Urmamasaho,22.0,i wish we can hit 20,positive,0.5944585,,False,2021-06-08
55771,"Daily Discussion Thread for June 28, 2021",WORKHORSE LETS GOOOðŸ“ˆðŸŽðŸ“ˆðŸŽ,06-28-2021,Ok-Impact4149,33.0,workhorse lets gooo,positive,0.58767486,,False,2021-06-28
47328,"Daily Discussion Thread for June 07, 2021",CLOV up 20% today. Iâ€™d read a bunch of people talking about it but wasnâ€™t anticipating much for a while,06-07-2021,lethargic_apathy,16.0,clov up 20 today id read a bunch of people talking about it but wasnt anticipating much for a while,neutral,0.5898873,,False,2021-06-07
48983,"Daily Discussion Thread for June 11, 2021",Gotta play safe today. $2000 more to $CLF,06-11-2021,giorgiojunglist,20.0,gotta play safe today 2000 more to clf,neutral,0.6776561,,False,2021-06-11
45761,"Daily Discussion Thread for June 03, 2021",THE BLACKBERRY BUSH IS BLOOMING,06-03-2021,Direct_Blacksmith470,33.0,the blackberry bush is blooming,positive,0.82904434,,False,2021-06-03
47595,"Daily Discussion Thread for June 08, 2021",Keep GME off the most talked about thread. See what happens.,06-08-2021,Slut_Spoiler,97.0,keep gme off the most talked about thread see what happens,neutral,0.7067594,,False,2021-06-08
54428,"Daily Discussion Thread for June 24, 2021",TSLA meme reversion back to 694.20,06-24-2021,RADIO02118,10.0,tsla meme reversion back to 694 20,neutral,0.8731142,,False,2021-06-24
52419,"Weekend Discussion Thread for the Weekend of June 18, 2021","Time to bring back and enforce â€œpositions or banâ€

It used to be that if someone was peddling a ticker they had to show that they put their money where their mouth was. 

Now we have these fucking retards here posting about how UWMC is going to squeeze if people just go buy more stock.  Writing shit like that is actually insulting to real retards who are vastly more intelligent than the fuck clown who wrote the â€œDDâ€

Iâ€™m also not taking advice from someone who has $75 in fractional shares trying to tell me to diamond hand an investment. Fuck you. 

Fuck all this shit and especially fuck you retarded apes for ruining a good sub. 

Fuckers.",06-18-2021,Tsukune_Surprise,137.0,time to bring back and enforce positions or ban it used to be that if someone was peddling a ticker they had to show that they put their money where their mouth was now we have these fucking retards here posting about how uwmc is going to squeeze if people just go buy more stock writing shit like that is actually insulting to real retards who are vastly more intelligent than the fuck clown who wrote the dd im also not taking advice from someone who has 75 in fractional shares trying to tell me to diamond hand an investment fuck you fuck all this shit and especially fuck you retarded apes for ruining a good sub fuckers,negative,0.9757699,,False,2021-06-18
49035,"Daily Discussion Thread for June 11, 2021",Just went all in 1 $23 WKHS call exp 07/02. wish me luck :)),06-11-2021,Apprehensive-Box-107,18.0,just went all in 1 23 wkhs call exp 07 02 wish me luck,positive,0.74192584,,False,2021-06-11
45742,"Daily Discussion Thread for June 03, 2021",Bb can hit 25 by end of the day,06-03-2021,Background-Pie-9403,36.0,bb can hit 25 by end of the day,neutral,0.67398626,,False,2021-06-03
47349,"Daily Discussion Thread for June 07, 2021",Get CLOV to $12 damnit!,06-07-2021,benotaur,16.0,get clov to 12 damnit,negative,0.5729514,,False,2021-06-07
52904,"Daily Discussion Thread for June 21, 2021",Damn this sub really is just a pump and dump graveyard now. Itâ€™s so obvious this market is coming down. Which is why Iâ€™m buying calls instead.,06-21-2021,BigNOKers,13.0,damn this sub really is just a pump and dump graveyard now its so obvious this market is coming down which is why im buying calls instead,negative,0.87205684,,False,2021-06-21
67351,"Daily Discussion Thread for July 28, 2021",Fucking bipolar SPY. I have no idea whatâ€™s going to do today. I donâ€™t see it repeating yesterdayâ€™s. And history have shown a red day today.,07-28-2021,Phantom_Journey,8.0,fucking bipolar spy i have no idea whats going to do today i dont see it repeating yesterdays and history have shown a red day today,negative,0.93967783,,False,2021-07-28
59933,"Daily Discussion Thread for July 09, 2021",Clf going hard. Gotta love steel,07-09-2021,Delfitus,9.0,clf going hard gotta love steel,positive,0.812869,,False,2021-07-09
68176,"Daily Discussion Thread for July 30, 2021",Come back to this in a week when SPY is at an ATH.,07-30-2021,BigDharvey,8.0,come back to this in a week when spy is at an ath,neutral,0.8955156,,False,2021-07-30
65716,"Weekend Discussion Thread for the Weekend of July 23, 2021",Internet money doesnâ€™t give me the same high as options.,07-25-2021,giovanny2214,11.0,internet money doesnt give me the same high as options,negative,0.57514596,,False,2021-07-25
60833,"Daily Discussion Thread for July 12, 2021",I've realized that following Wsb only leads to money loss so I started following a random Twitter account and I'm up biggly on Disney.,07-12-2021,Daybyhour69er,10.0,ive realized that following wsb only leads to money loss so i started following a random twitter account and im up biggly on disney,negative,0.75269735,,False,2021-07-12
57930,"Weekend Discussion Thread for the Weekend of July 02, 2021",Good job everyone and happy 4th,07-04-2021,Temporary_Ad9687,10.0,good job everyone and happy 4th,positive,0.98716885,,False,2021-07-04
68579,"Weekend Discussion Thread for the Weekend of July 30, 2021",Just popped and edible sippin on some Jack till it kicks in enjoying the weekend till I have to work tomorrow,07-30-2021,Beefer69420,9.0,just popped and edible sippin on some jack till it kicks in enjoying the weekend till i have to work tomorrow,positive,0.8080588,,False,2021-07-30
67276,"Daily Discussion Thread for July 28, 2021",TLRY making a new day high! Keep goin' lil buddy!!,07-28-2021,Tenniford13,9.0,tlry making a new day high keep goin lil buddy,positive,0.8694365,,False,2021-07-28
58093,"Weekend Discussion Thread for the Weekend of July 02, 2021",Lazy Yankees open the casino,07-05-2021,kemar7856,8.0,lazy yankees open the casino,negative,0.7659999,,False,2021-07-05
60386,"Weekend Discussion Thread for the Weekend of July 09, 2021",Pretending to like futbol once in a while out of social pressure is so lame,07-11-2021,quarantrader,11.0,pretending to like futbol once in a while out of social pressure is so lame,negative,0.8124409,,False,2021-07-11
68591,"Weekend Discussion Thread for the Weekend of July 30, 2021","If you think about it, the government is forcing us to gamble. Why else place limits on Roths and 401ks.",07-31-2021,-_1_2_3_-,9.0,if you think about it the government is forcing us to gamble why else place limits on roths and 401ks,negative,0.6026351,,False,2021-07-31
66872,"Daily Discussion Thread for July 27, 2021",People up in here buying China stocks for that one bounce that will take them from -50 to -40,07-27-2021,TrumpAllOverMe,21.0,people up in here buying china stocks for that one bounce that will take them from 50 to 40,neutral,0.8458351,,False,2021-07-27
68282,"Daily Discussion Thread for July 30, 2021",Just buy calls on whatever is down the most. Simple mathðŸ˜€ðŸ˜€,07-30-2021,Montgomery4461,9.0,just buy calls on whatever is down the most simple math,neutral,0.78710586,,False,2021-07-30
68463,"Weekend Discussion Thread for the Weekend of July 30, 2021",I took $6k to $58k in February. Went to 0 and I still havenâ€™t gotten to $20k since then. Whatâ€™s your story?,07-31-2021,Unitedtendies,10.0,i took 6k to 58k in february went to 0 and i still havent gotten to 20k since then whats your story,negative,0.5839264,,False,2021-07-31
63019,"Weekend Discussion Thread for the Weekend of July 16, 2021","Honestly I have no problem going ðŸŒˆ.

Itâ€™s just numbers on a screen people. Make money on the direction theyâ€™re moving. ðŸ’ª",07-17-2021,CUM-CEO,13.0,honestly i have no problem going its just numbers on a screen people make money on the direction theyre moving,neutral,0.6194124,,False,2021-07-17
62500,"Daily Discussion Thread for July 16, 2021","""This is definitely the bottom"" - Me as I continue to buy calls",07-16-2021,leaveit2,11.0,this is definitely the bottom me as i continue to buy calls,negative,0.60581607,,False,2021-07-16
63007,"Weekend Discussion Thread for the Weekend of July 16, 2021",My gf is on vacation with her best male friend and Iâ€™m here sitting with a red portfolio.,07-16-2021,EatMaTesticles,57.0,my gf is on vacation with her best male friend and im here sitting with a red portfolio,neutral,0.663719,,False,2021-07-16
57195,"Daily Discussion Thread for July 01, 2021",Got $7k to invest. Might go balls deep into goat milk futures,07-01-2021,Monst3rr,6.0,got 7k to invest might go balls deep into goat milk futures,neutral,0.8098501,,False,2021-07-01
65120,"Daily Discussion Thread for July 23, 2021","robinhood removed my PDT flag as a one time courtesy so long as i agreed to understanding what PDT is. can't help but feel the cs rep knows i'll end up hitting it again anyway within a week. thanks, derek",07-23-2021,Pontiac1979,21.0,robinhood removed my pdt flag as a one time courtesy so long as i agreed to understanding what pdt is cant help but feel the cs rep knows ill end up hitting it again anyway within a week thanks derek,neutral,0.61243546,,False,2021-07-23
58659,"Daily Discussion Thread for July 07, 2021","SPY: All time high

My portfolio: All time why",07-07-2021,SpiderBiteHurts,21.0,spy all time high my portfolio all time why,neutral,0.5911197,,False,2021-07-07
65844,"Weekend Discussion Thread for the Weekend of July 23, 2021",Local virgin ðŸ˜‚ðŸ˜‚ðŸ˜‚ðŸ˜‚,07-25-2021,CallsareFreeMoney,9.0,local virgin,neutral,0.72583926,,False,2021-07-25
58851,"Daily Discussion Thread for July 07, 2021",Yoooo lost all my fuckin money. Can I alt f4 and it won't save my progress?,07-07-2021,TheRealGmoney69,10.0,yoooo lost all my fuckin money can i alt f4 and it wont save my progress,negative,0.97439754,,False,2021-07-07
65433,"Daily Discussion Thread for July 23, 2021",Market on easy mode. Everyone is making money so easily brokers should just give it away. This is the true American Dream.,07-23-2021,okLetsgo311,8.0,market on easy mode everyone is making money so easily brokers should just give it away this is the true american dream,neutral,0.44178164,,False,2021-07-23
62251,"Daily Discussion Thread for July 15, 2021",Too scared to buy puts or calls,07-15-2021,saeed47,9.0,too scared to buy puts or calls,negative,0.7382741,,False,2021-07-15
65948,"Weekend Discussion Thread for the Weekend of July 23, 2021",I'm kinda beat ngl,07-24-2021,CptTonyStark,8.0,im kinda beat ngl,negative,0.53250253,,False,2021-07-24
66164,"Daily Discussion Thread for July 26, 2021",someone go to r/latestagecapitalism and say something about how a cop helped you once,07-26-2021,fatnigmongolfagotcuz,11.0,someone go to r latestagecapitalism and say something about how a cop helped you once,neutral,0.74393934,,False,2021-07-26
62356,"Daily Discussion Thread for July 15, 2021","It's not a loss until you sell

 it's not a loss until you sell

 it's not a loss until you sell",07-15-2021,nobd22,8.0,its not a loss until you sell its not a loss until you sell its not a loss until you sell,neutral,0.61477584,,False,2021-07-15
57457,"Daily Discussion Thread for July 02, 2021","Based on the $WISH and $BB numbers pre-market, I should just bend over and get ready to take it.",07-02-2021,2punk,9.0,based on the wish and bb numbers pre market i should just bend over and get ready to take it,neutral,0.87989837,,False,2021-07-02
58971,"Daily Discussion Thread for July 07, 2021","has negg been talked about, and I  just missed it? How did this go unnoticed!?",07-07-2021,notspeedy01,10.0,has negg been talked about and i just missed it how did this go unnoticed,negative,0.5507688,,False,2021-07-07
67996,"Daily Discussion Thread for July 30, 2021","I donâ€™t know why everyone is upset we are red, you just have to invest in safe and reliable companies.. like DIDI

Edit: still climbing +3.5%",07-30-2021,VacationLover1,11.0,i dont know why everyone is upset we are red you just have to invest in safe and reliable companies like didi edit still climbing 3 5,neutral,0.55034876,,False,2021-07-30
63005,"Weekend Discussion Thread for the Weekend of July 16, 2021","$100 impulse buy : +270%ðŸ“ˆ

$10,000 impulse buy : -98%ðŸ“‰",07-17-2021,nosalute,35.0,100 impulse buy 270 10 000 impulse buy 98,neutral,0.87589526,,False,2021-07-17
61710,"Daily Discussion Thread for July 14, 2021",I just want a 100million. Is that too much to ask for mr market?,07-14-2021,JohnnyAutist,10.0,i just want a 100million is that too much to ask for mr market,neutral,0.560792,,False,2021-07-14
62457,"Daily Discussion Thread for July 16, 2021",I was up 125k coming into February for a 30% return over 1 month (without GME.) Then I dropped to 85k and eventually worked back up to 100k for a while. But now I've lost 35k this month. Feels bad man.,07-16-2021,curtix7,13.0,i was up 125k coming into february for a 30 return over 1 month without gme then i dropped to 85k and eventually worked back up to 100k for a while but now ive lost 35k this month feels bad man,negative,0.8027014,,False,2021-07-16
66224,"Daily Discussion Thread for July 26, 2021",guys I think spy could go up here... or maybe even down,07-26-2021,HeyMyNameIsDylan,8.0,guys i think spy could go up here or maybe even down,neutral,0.83894664,,False,2021-07-26
67125,"Daily Discussion Thread for July 28, 2021","LETS GO, bought puts on FB before close",07-28-2021,noicedeb8r,15.0,lets go bought puts on fb before close,neutral,0.81710166,,False,2021-07-28
58866,"Daily Discussion Thread for July 07, 2021",The WSB meme stocks are getting massacred today,07-07-2021,Djov,11.0,the wsb meme stocks are getting massacred today,negative,0.87528986,,False,2021-07-07
60646,"Daily Discussion Thread for July 12, 2021",CLOV going parabolic,07-12-2021,rbaut1836,12.0,clov going parabolic,neutral,0.78153527,,False,2021-07-12
65353,"Daily Discussion Thread for July 23, 2021",What a great day to have purchased my first SPY calls. 5 contracts September 17 459 strike price. Made like 300$ today,07-23-2021,TheDiscomfort,8.0,what a great day to have purchased my first spy calls 5 contracts september 17 459 strike price made like 300 today,positive,0.9697175,,False,2021-07-23
65962,"Weekend Discussion Thread for the Weekend of July 23, 2021","Note to all the cringey dumbasses in the ""manipulation"" thread.  Learn how to fucking inverse on occasion instead of crying and blaming someone else for your shitastic decisions.",07-24-2021,actuarythrowaway445,8.0,note to all the cringey dumbasses in the manipulation thread learn how to fucking inverse on occasion instead of crying and blaming someone else for your shitastic decisions,negative,0.9757622,,False,2021-07-24
61952,"Daily Discussion Thread for July 15, 2021",Boobies should be cancer free. Today is a really special day. Hopefully we see 300% gains and with options even more with all the multiples,07-15-2021,kaascous123,16.0,boobies should be cancer free today is a really special day hopefully we see 300 gains and with options even more with all the multiples,positive,0.9725918,,False,2021-07-15
67655,"Daily Discussion Thread for July 29, 2021",I have a hunch that HOOD ipo has potential for the 3rd resurgence of meme stocks,07-29-2021,anonymouser3,9.0,i have a hunch that hood ipo has potential for the 3rd resurgence of meme stocks,positive,0.77129394,,False,2021-07-29
68587,"Weekend Discussion Thread for the Weekend of July 30, 2021",I'm officially embarrassed to be going to bars solo so often in my town I'm ubering to one further away.  I hope I don't get a hooker tonight.,07-31-2021,HookersForDahl2017,9.0,im officially embarrassed to be going to bars solo so often in my town im ubering to one further away i hope i dont get a hooker tonight,negative,0.8923906,,False,2021-07-31
68325,"Weekend Discussion Thread for the Weekend of July 30, 2021",After a long day of reading about how gross it is to breath in public I like to go to pornhub to watch the latest video of a girl swallowing 25 loads at the glory hole.,07-31-2021,inglorious_tardbas,25.0,after a long day of reading about how gross it is to breath in public i like to go to pornhub to watch the latest video of a girl swallowing 25 loads at the glory hole,negative,0.89983374,,False,2021-07-31
65412,"Daily Discussion Thread for July 23, 2021",The spy rocket to $440 is going to be glorious,07-23-2021,MikeHoncho527,8.0,the spy rocket to 440 is going to be glorious,positive,0.9455071,,False,2021-07-23
60299,"Weekend Discussion Thread for the Weekend of July 09, 2021",SPCE high sex club,07-11-2021,chefromnba2k,12.0,spce high sex club,negative,0.6146419,,False,2021-07-11
58718,"Daily Discussion Thread for July 07, 2021",Funny how it can take me weeks to make good profit only to have it all taken in 1 day lmfao.,07-07-2021,LoneWolfSpartan,14.0,funny how it can take me weeks to make good profit only to have it all taken in 1 day lmfao,negative,0.47069004,,False,2021-07-07
63925,"Daily Discussion Thread for July 20, 2021","LMAO, I can't fucking believe the market were probably pricing in Bezos dying in a fireball this morning. So fucking dumb.",07-20-2021,CalyShadezz,11.0,lmao i cant fucking believe the market were probably pricing in bezos dying in a fireball this morning so fucking dumb,negative,0.96179926,,False,2021-07-20
65347,"Daily Discussion Thread for July 23, 2021",An intern from Bloomberg News wants to interview me LOL,07-23-2021,margin_call_rep,8.0,an intern from bloomberg news wants to interview me lol,neutral,0.55704194,,False,2021-07-23
56911,"Daily Discussion Thread for July 01, 2021",You guys are all gay,07-01-2021,nigtits69,12.0,you guys are all gay,negative,0.9572854,,False,2021-07-01
64162,"Daily Discussion Thread for July 20, 2021",Big money said recession cancelled lol,07-20-2021,GuwopGOAT,9.0,big money said recession cancelled lol,neutral,0.55826783,,False,2021-07-20
57400,"Daily Discussion Thread for July 02, 2021",This is all bill Cosbyâ€™s fault. Pass me the bottle of sleeping pill..,07-02-2021,Trip9711,11.0,this is all bill cosbys fault pass me the bottle of sleeping pill,negative,0.8194419,,False,2021-07-02
59826,"Daily Discussion Thread for July 09, 2021",This is likely the start of a multi day rally filled with green dildos from the heavens above. God bless our savior jpow for providing us this bountiful harvest. Let us all buy spy calls to assure jpow we've received his blessings,07-09-2021,krootz1,9.0,this is likely the start of a multi day rally filled with green dildos from the heavens above god bless our savior jpow for providing us this bountiful harvest let us all buy spy calls to assure jpow weve received his blessings,positive,0.9655084,,False,2021-07-09
67442,"Daily Discussion Thread for July 29, 2021","I lost like 40k last year when I had to cover my NKLA short after the vaporware truck preorder was announced. The stock doubled along with the borrow fee jumped to like 1000% annualized so it was impossible to hold the short no matter how obviously fraudulent it was. I hope he ends up broke and in prison, but of course that won't happen.",07-29-2021,tedfor,15.0,i lost like 40k last year when i had to cover my nkla short after the vaporware truck preorder was announced the stock doubled along with the borrow fee jumped to like 1000 annualized so it was impossible to hold the short no matter how obviously fraudulent it was i hope he ends up broke and in prison but of course that wont happen,negative,0.89548767,,False,2021-07-29
67530,"Daily Discussion Thread for July 29, 2021",Things Iâ€™ve done well with options: 1. Buying SPY calls on red days and selling on green days. 2. Buying long calls on companies with likely catalysts. 3. Buying FDs on meme stocks if I get in early. Things Iâ€™ve done poorly at: 1. Buying puts on anything. 2. Playing earnings even when IV is not historically high. 3. Bottom fishing on stocks I havenâ€™t followed for a while.,07-29-2021,PortGlass,11.0,things ive done well with options 1 buying spy calls on red days and selling on green days 2 buying long calls on companies with likely catalysts 3 buying fds on meme stocks if i get in early things ive done poorly at 1 buying puts on anything 2 playing earnings even when iv is not historically high 3 bottom fishing on stocks i havent followed for a while,neutral,0.46754873,,False,2021-07-29
60458,"Weekend Discussion Thread for the Weekend of July 09, 2021","SpaceX launches seem professional with coverage like NASA back in the old days, Virgin Galactic seems like an intermission in between Saturday morning cartoons",07-11-2021,barkwoofgrrr,10.0,spacex launches seem professional with coverage like nasa back in the old days virgin galactic seems like an intermission in between saturday morning cartoons,neutral,0.5649562,,False,2021-07-11
63817,"Daily Discussion Thread for July 20, 2021","Spy calls will print, 440 by Friday",07-20-2021,Lightningm340,12.0,spy calls will print 440 by friday,neutral,0.9026124,,False,2021-07-20
63877,"Daily Discussion Thread for July 20, 2021",Spy 432 eod,07-20-2021,MikeHoncho527,10.0,spy 432 eod,neutral,0.70077425,,False,2021-07-20
61678,"Daily Discussion Thread for July 14, 2021","People please chill the heck out. I know we all have FD's and its excruciating when a stock drops 1% and completely wipes you out. That's cause we're morons. The stock market needs red days, its absurd that its been so green. We could have a week of red days and it would be HEALTHY. But the market shows a little bit of red and this sub is like BUBBLE IS BURST START COLLECTING WOOD FOR FIRE AND BUILD ALL THE TOOLS YOU CAN WE'RE HEADED BACK TO THE STONE AGE",07-14-2021,discombobulantics,10.0,people please chill the heck out i know we all have fds and its excruciating when a stock drops 1 and completely wipes you out thats cause were morons the stock market needs red days its absurd that its been so green we could have a week of red days and it would be healthy but the market shows a little bit of red and this sub is like bubble is burst start collecting wood for fire and build all the tools you can were headed back to the stone age,negative,0.79516613,,False,2021-07-14
61361,"Daily Discussion Thread for July 13, 2021",Im bout to scromit,07-13-2021,YaBoyDildoLegs,8.0,im bout to scromit,neutral,0.6427196,,False,2021-07-13
66661,"Daily Discussion Thread for July 27, 2021",sitting cash gang. praying for you retards playing earnings,07-27-2021,stevoacp1,10.0,sitting cash gang praying for you retards playing earnings,negative,0.51265097,,False,2021-07-27
64449,"Daily Discussion Thread for July 21, 2021","I know people like to talk shit about millennials and how they are special snowflakes with a ""everybody"" deserves an award mentality.......

But Jeff Bezos just gave himself a medal for flying into space (as a passenger) and Sir Richard cried on TV as he awarded himself astronaut wings......

TLDR even boomers love awards.....",07-21-2021,william_cutting_1,8.0,i know people like to talk shit about millennials and how they are special snowflakes with a everybody deserves an award mentality but jeff bezos just gave himself a medal for flying into space as a passenger and sir richard cried on tv as he awarded himself astronaut wings tldr even boomers love awards,neutral,0.4194393,,False,2021-07-21
58960,"Daily Discussion Thread for July 07, 2021",NEGG halted for volatility looks like,07-07-2021,MyopiaCapital,9.0,negg halted for volatility looks like,neutral,0.6663655,,False,2021-07-07
62738,"Daily Discussion Thread for July 16, 2021",If PYPL hits 302 today I'll never gamble again. Today.,07-16-2021,tallpaulpaultall,8.0,if pypl hits 302 today ill never gamble again today,negative,0.8428929,,False,2021-07-16
66961,"Daily Discussion Thread for July 28, 2021","ðŸ»

SPY down .01%: ""HAHA fuck you bulls. My puts printing ðŸ¤£ðŸ¤£ðŸ¤£""

SPY up .01%: [deleted]",07-28-2021,jkbpttrsn,19.0,spy down 01 haha fuck you bulls my puts printing spy up 01 deleted,negative,0.88768166,,False,2021-07-28
61312,"Daily Discussion Thread for July 13, 2021","Oh wow, I got too high and was commenting on the 9th thread thinking reddit was broken. Fuck sake.  Anyway my NOK calls are soaring",07-13-2021,UsuallyATroll,8.0,oh wow i got too high and was commenting on the 9th thread thinking reddit was broken fuck sake anyway my nok calls are soaring,negative,0.7565286,,False,2021-07-13
64161,"Daily Discussion Thread for July 20, 2021",Tim apple is not yet done with you bears,07-20-2021,GoldDecision7,8.0,tim apple is not yet done with you bears,neutral,0.66657823,,False,2021-07-20
62517,"Daily Discussion Thread for July 16, 2021","Oh, hey. SPY is green after being red yesterday, WHAT A SURPRISE",07-16-2021,InspectorDabbit87,11.0,oh hey spy is green after being red yesterday what a surprise,positive,0.81271845,,False,2021-07-16
60356,"Weekend Discussion Thread for the Weekend of July 09, 2021",Richard Branson attempts to masturbate in space.,07-11-2021,iwangotamarjo,12.0,richard branson attempts to masturbate in space,neutral,0.66482574,,False,2021-07-11
63119,"Weekend Discussion Thread for the Weekend of July 16, 2021",Itâ€™s probably the worst time to buy a car this year.,07-17-2021,IllmaticaL1,9.0,its probably the worst time to buy a car this year,negative,0.9542765,,False,2021-07-17
64655,"Daily Discussion Thread for July 22, 2021",Delta variant able to crash networks now. This shit is evolving very quickly.,07-22-2021,Starmedia11,20.0,delta variant able to crash networks now this shit is evolving very quickly,negative,0.8669509,,False,2021-07-22
63940,"Daily Discussion Thread for July 20, 2021","I'm up 200% today, 300% since Monday and all I can think about is the 10 bagger I traded out of too early Friday. This is a disease.",07-20-2021,Bobgar7,10.0,im up 200 today 300 since monday and all i can think about is the 10 bagger i traded out of too early friday this is a disease,negative,0.62703705,,False,2021-07-20
59610,"Daily Discussion Thread for July 09, 2021","Seeing a lot of great ""long term hold"" talk here

Which are great and all, but have you ever thought about trying to have a sportscar, hookers, mansions and yachts before your joints break, dick quits, and your tastebuds are dead?

Leave the long term and your millions to your next 3 generations in r/investing.

This is r/wallstreetbets",07-09-2021,Captain_Yolo_,15.0,seeing a lot of great long term hold talk here which are great and all but have you ever thought about trying to have a sportscar hookers mansions and yachts before your joints break dick quits and your tastebuds are dead leave the long term and your millions to your next 3 generations in r investing this is r wallstreetbets,neutral,0.4204288,,False,2021-07-09
61103,"Daily Discussion Thread for July 13, 2021",Nok call options are cheap and printing,07-13-2021,Fistfullofoatmeal,13.0,nok call options are cheap and printing,positive,0.57629305,,False,2021-07-13
65889,"Weekend Discussion Thread for the Weekend of July 23, 2021","**THIS**

**IS**

**SHITPOSTING!!!!!**",07-23-2021,ForestFyre,8.0,this is shitposting,negative,0.95170474,,False,2021-07-23
58360,"Daily Discussion Thread for July 06, 2021","The stock market is what I like to call, fake and ghey",07-06-2021,thebumfuzzle98,10.0,the stock market is what i like to call fake and ghey,negative,0.7466317,,False,2021-07-06
63607,"Daily Discussion Thread for July 19, 2021","Just clocked in at Wendyâ€™s dumpster

Why are so many of you here this morning?",07-19-2021,CMac681,10.0,just clocked in at wendys dumpster why are so many of you here this morning,neutral,0.4754851,,False,2021-07-19
66782,"Daily Discussion Thread for July 27, 2021","I was 2% away from a margin call, then I realized I could just inject more borrowed money into the account ðŸ˜ƒ 

No longer in danger",07-27-2021,MemoryProof,7.0,i was 2 away from a margin call then i realized i could just inject more borrowed money into the account no longer in danger,neutral,0.6829647,,False,2021-07-27
60643,"Daily Discussion Thread for July 12, 2021",SPY green...everything I own red...back to normal,07-12-2021,HookersForDahl2017,13.0,spy green everything i own red back to normal,neutral,0.59795946,,False,2021-07-12
57906,"Weekend Discussion Thread for the Weekend of July 02, 2021",This is like a dream where you're in your old house that burned down and everything is just right. There's a nostalgic haze when you look at everyone's face and smiles as far as the eyes can see. I hope it never ends.,07-03-2021,lucasandrew,10.0,this is like a dream where youre in your old house that burned down and everything is just right theres a nostalgic haze when you look at everyones face and smiles as far as the eyes can see i hope it never ends,positive,0.85997427,,False,2021-07-03
61668,"Daily Discussion Thread for July 14, 2021",Spy getting crushed. My puts eating,07-14-2021,Gyata97,9.0,spy getting crushed my puts eating,negative,0.72603,,False,2021-07-14
58749,"Daily Discussion Thread for July 07, 2021",Remember when social media first became a thing and a post would be like â€œRESHARE THIS OR YOUR **GRANDMA** WILL FUCKING **DIE**â€ and people would actually repost it,07-07-2021,StonkGoUp,13.0,remember when social media first became a thing and a post would be like reshare this or your grandma will fucking die and people would actually repost it,negative,0.82563454,,False,2021-07-07
65696,"Weekend Discussion Thread for the Weekend of July 23, 2021",I always thought Tokyo was a bustling city but literally no one in the stadium,07-24-2021,quarantrader,11.0,i always thought tokyo was a bustling city but literally no one in the stadium,negative,0.5564856,,False,2021-07-24
58051,"Weekend Discussion Thread for the Weekend of July 02, 2021",CLNE in the 9s loading the clip up Tuesday ðŸ’ªðŸ’¨ðŸš€,07-04-2021,Moodclouds,7.0,clne in the 9s loading the clip up tuesday,neutral,0.9258685,,False,2021-07-04
60813,"Daily Discussion Thread for July 12, 2021",Boss walked in almost saw me looking at WOOF calls switched it to porn just in time thank God.,07-12-2021,Wedonotbecomeone,9.0,boss walked in almost saw me looking at woof calls switched it to porn just in time thank god,positive,0.45367277,,False,2021-07-12
57467,"Daily Discussion Thread for July 02, 2021",When is the last time you actually walked into a GameStop?,07-02-2021,DarkMatter917,9.0,when is the last time you actually walked into a gamestop,neutral,0.76673776,,False,2021-07-02
67716,"Daily Discussion Thread for July 29, 2021",FOMO is kicking in over at CLF,07-29-2021,kazkado0,9.0,fomo is kicking in over at clf,neutral,0.4848702,,False,2021-07-29
61902,"Daily Discussion Thread for July 15, 2021",# YOLO'D CHILD TAX CREDIT ON SPY CALLS,07-15-2021,nosalute,24.0,yolod child tax credit on spy calls,neutral,0.77830297,,False,2021-07-15
65169,"Daily Discussion Thread for July 23, 2021","Whichever one of you re tards wrapped my burrito at Chipotle just now, you did a bad job.",07-23-2021,Jeff_Bezels,13.0,whichever one of you re tards wrapped my burrito at chipotle just now you did a bad job,negative,0.97343856,,False,2021-07-23
59039,"Daily Discussion Thread for July 07, 2021","Well, I might be losing money on SPY options but at least I'm not pumping this NEGG bullshit",07-07-2021,One_Spicy_Nipple,9.0,well i might be losing money on spy options but at least im not pumping this negg bullshit,negative,0.8065741,,False,2021-07-07
62838,"Weekend Discussion Thread for the Weekend of July 16, 2021",My best buddy is getting married today at 22 years old. Fuck heâ€™s signing his life away so youngðŸ˜«,07-17-2021,CuckyBoy78,24.0,my best buddy is getting married today at 22 years old fuck hes signing his life away so young,negative,0.41257587,,False,2021-07-17
56852,"Daily Discussion Thread for July 01, 2021","How to be a ðŸŒˆðŸ»
1.	Wait for line to go red
2.	Start screaming, â€œTHE END IS NIGH!â€ 
3.	Be wrong 99.999999999% of the time
4.	Donâ€™t buy stocks or options and brag about being cash gang
5.	Spend that cash on heavy bars of silver 
6.	????
7.	Do not profit",07-01-2021,Typical-Mouse-4804,15.0,how to be a 1 wait for line to go red 2 start screaming the end is nigh 3 be wrong 99 999999999 of the time 4 dont buy stocks or options and brag about being cash gang 5 spend that cash on heavy bars of silver 6 7 do not profit,negative,0.6099471,,False,2021-07-01
61500,"Daily Discussion Thread for July 14, 2021",Have lost half of my account since February. Fun,07-14-2021,purity08,15.0,have lost half of my account since february fun,negative,0.63728404,,False,2021-07-14
68158,"Daily Discussion Thread for July 30, 2021","no longer a spy call shill, now im all in on spy puts expiring monday",07-30-2021,OSRS_Kassadin,8.0,no longer a spy call shill now im all in on spy puts expiring monday,neutral,0.6367431,,False,2021-07-30
62374,"Daily Discussion Thread for July 16, 2021",# did SPY say the N word?,07-16-2021,nosalute,25.0,did spy say the n word,neutral,0.49250066,,False,2021-07-16
58835,"Daily Discussion Thread for July 07, 2021",Not a fun day to be holding pltr and nio,07-07-2021,magichead17,11.0,not a fun day to be holding pltr and nio,negative,0.91181034,,False,2021-07-07
59024,"Daily Discussion Thread for July 07, 2021",Did I fuckin stutter? Itâ€™s BULL SEASON LIL BIH,07-07-2021,DamascusWaygu,9.0,did i fuckin stutter its bull season lil bih,negative,0.92427725,,False,2021-07-07
62400,"Daily Discussion Thread for July 16, 2021",Turns out my gains were transitory.,07-16-2021,MacroHard_0,20.0,turns out my gains were transitory,neutral,0.630645,,False,2021-07-16
60584,"Daily Discussion Thread for July 12, 2021",Spce bagholders in disbelief,07-12-2021,dumidiot69,16.0,spce bagholders in disbelief,neutral,0.67509615,,False,2021-07-12
59861,"Daily Discussion Thread for July 09, 2021",thx whoever suggested vodka in the coffee and just running with the bulls today,07-09-2021,pat-nasty,10.0,thx whoever suggested vodka in the coffee and just running with the bulls today,neutral,0.6146435,,False,2021-07-09
61450,"Daily Discussion Thread for July 14, 2021","Damn, feel bad for this rich ass politician bagholding lumber",07-14-2021,bigtexas91,18.0,damn feel bad for this rich ass politician bagholding lumber,negative,0.9667364,,False,2021-07-14
58248,"Daily Discussion Thread for July 06, 2021","TIM APPLE, GET IN THE FUCKING ICAR âš¡ï¸ðŸš˜ðŸðŸ‚ðŸ“ˆðŸš€ðŸš€ðŸš€ðŸš€ðŸš€ðŸš€ðŸš€ðŸš€ðŸš€ðŸš€ðŸš€ðŸš€ðŸš€ðŸŒ™",07-06-2021,sxiom,13.0,tim apple get in the fucking icar,negative,0.91504145,,False,2021-07-06
65515,"Daily Discussion Thread for July 23, 2021",You guys ever talk to your screen while refreshing the page a bunch while saying motivating things for the stock?,07-23-2021,I_RAPE_WITH_CATS,7.0,you guys ever talk to your screen while refreshing the page a bunch while saying motivating things for the stock,neutral,0.7547741,,False,2021-07-23
63319,"Daily Discussion Thread for July 19, 2021","Sometime soon this week: ""Wallstreet brushes off delta fears as DOW, NASDAQ, S&P recapture losses""",07-19-2021,fixie321,22.0,sometime soon this week wallstreet brushes off delta fears as dow nasdaq s p recapture losses,neutral,0.83434623,,False,2021-07-19
57843,"Weekend Discussion Thread for the Weekend of July 02, 2021","Itâ€™s hot out, I could really use a dip in the fresh and cool water of the Leibodong level three hydro power station ðŸ¥µ",07-03-2021,RaktaginoDad,8.0,its hot out i could really use a dip in the fresh and cool water of the leibodong level three hydro power station,neutral,0.56566477,,False,2021-07-03
58198,"Daily Discussion Thread for July 06, 2021",Trading SPY options has destroyed my sex drive. This casino on my phone is all I care about,07-06-2021,RickyFrench007,16.0,trading spy options has destroyed my sex drive this casino on my phone is all i care about,negative,0.9149861,,False,2021-07-06
64115,"Daily Discussion Thread for July 20, 2021",$SPY as reliable as a double barrel shotgun.,07-20-2021,JoanOfSnarke,9.0,spy as reliable as a double barrel shotgun,neutral,0.7657558,,False,2021-07-20
60305,"Weekend Discussion Thread for the Weekend of July 09, 2021",Whereâ€™s Chad money!!,07-12-2021,CatonHotSand,12.0,wheres chad money,neutral,0.73740906,,False,2021-07-12
63801,"Daily Discussion Thread for July 20, 2021",Daily reminder and final chance to sign the petition banning Bezos from re-entering Earth.,07-20-2021,Shifty_P9,64.0,daily reminder and final chance to sign the petition banning bezos from re entering earth,neutral,0.8418411,,False,2021-07-20
65524,"Daily Discussion Thread for July 23, 2021","ya'll ever get that feeling that it's hot outside.

then u go outside and you're like: ""damn it's hot outside""",07-23-2021,MemoryProof,6.0,yall ever get that feeling that its hot outside then u go outside and youre like damn its hot outside,neutral,0.50495046,,False,2021-07-23
61149,"Daily Discussion Thread for July 13, 2021",Ok cool we got our fake CPI numbers. Can we stop with the fake dump and go back to the fake moon?,07-13-2021,slawre89,12.0,ok cool we got our fake cpi numbers can we stop with the fake dump and go back to the fake moon,negative,0.6638302,,False,2021-07-13
61066,"Daily Discussion Thread for July 13, 2021","As long as cardboard boxes ðŸ“¦ donâ€™t experience inflation, the housing situation for WSB should remain stable.",07-13-2021,JpowYellen3some,14.0,as long as cardboard boxes dont experience inflation the housing situation for wsb should remain stable,neutral,0.52414566,,False,2021-07-13
59405,"Daily Discussion Thread for July 08, 2021",i wanna buy the dip but im scared to login,07-08-2021,yushey__,12.0,i wanna buy the dip but im scared to login,negative,0.6724171,,False,2021-07-08
64256,"Daily Discussion Thread for July 21, 2021",Cramer called the bottom on SOFI saying itll drop to 14. Shits going to 100.,07-21-2021,RamboWarFace,14.0,cramer called the bottom on sofi saying itll drop to 14 shits going to 100,negative,0.5808012,,False,2021-07-21
63750,"Daily Discussion Thread for July 20, 2021","French people are burning down vaccine centers apparently.  Is this bullish or bearish news?

Bulls say it means shutdowns are cancelled.  Bears say it means more pandemic and possible lead in to open revolt against a 1st world government.

If we had Napoleon 2.0 what stocks would go up?",07-20-2021,PatrickSebast,18.0,french people are burning down vaccine centers apparently is this bullish or bearish news bulls say it means shutdowns are cancelled bears say it means more pandemic and possible lead in to open revolt against a 1st world government if we had napoleon 2 0 what stocks would go up,negative,0.57922274,,False,2021-07-20
65704,"Weekend Discussion Thread for the Weekend of July 23, 2021","My friend told me everyone thinks Iâ€™m gay cause of my face

â€¦ I apparently have a gay face",07-24-2021,ApolloFirstBestCAG,11.0,my friend told me everyone thinks im gay cause of my face i apparently have a gay face,negative,0.7631442,,False,2021-07-24
61213,"Daily Discussion Thread for July 13, 2021",Virgin Galactic took a lot of ppls anal virginity yesterday,07-13-2021,LuckLovesVirtue,34.0,virgin galactic took a lot of ppls anal virginity yesterday,neutral,0.5692417,,False,2021-07-13
58395,"Daily Discussion Thread for July 06, 2021","100% of the time when the market goes straight up, it also goes straight down.",07-06-2021,bagtf3,8.0,100 of the time when the market goes straight up it also goes straight down,neutral,0.5312687,,False,2021-07-06
