,Submission Title,Comment,Date Posted,Author,Score,ProcessedComments,SentimentLabel,SentimentProb,HumanSentiment,StockSearch,Topic,Name,Date
48017,"Daily Discussion Thread for June 18, 2021",Looks like Iâ€™ll be buying $10 plastic vodka handles instead of grey goose for the pre-games this weekend,06-18-2021,AeroEngineer56,11.0,looks like ill be buying 10 plastic vodka handles instead of grey goose for the pre games this weekend,neutral,0.5959082,,,19,19_drunk_drinking_hangover_hungover,2021-06-18
42225,"Daily Discussion Thread for June 03, 2021",The minute i bought BB it Dip,06-03-2021,hahahssss,32.0,the minute i bought bb it dip,neutral,0.6078649,,bb,2,2_dips_dipping_dip_dipped,2021-06-03
51769,"Daily Discussion Thread for June 29, 2021",Good call on sofi guys. Fuck. Not trusting you retards again at least until tomorrow morning,06-29-2021,KCpaintguy,26.0,good call on sofi guys fuck not trusting you retards again at least until tomorrow morning,negative,0.8664635,,,30,30_sofi_fa_charter_sos,2021-06-29
51197,"Weekend Discussion Thread for the Weekend of June 25, 2021","Looking at SOFI after todayâ€™s dump. A few execs can sell some shares? Who cares, gimme discount please",06-25-2021,FreshAquariums,8.0,looking at sofi after todays dump a few execs can sell some shares who cares gimme discount please,neutral,0.7907841,,,9,9_0dte_sold_expiring_loss,2021-06-25
42759,"Daily Discussion Thread for June 04, 2021",Red days were due. BB to the moon next week....along with amc and GME,06-04-2021,Beneficial_Guava_747,61.0,red days were due bb to the moon next week along with amc and gme,neutral,0.9139494,,bb,308,308_ads_youtube_commercials_hulu,2021-06-04
48055,"Daily Discussion Thread for June 18, 2021",Wish got a green dildo,06-18-2021,jez827,9.0,wish got a green dildo,neutral,0.66948044,,,105,105_dildo_dildos_giant_massive,2021-06-18
43647,"Daily Discussion Thread for June 07, 2021",CLNE ğŸ„ ğŸ’¨,06-07-2021,kdawg_thetruth,16.0,clne,neutral,0.54826427,,,-1,-1_spce_000_price_bags,2021-06-07
45421,"Daily Discussion Thread for June 11, 2021",Jim Cramer rides a horse with both legs on one side,06-11-2021,randy_lahey0,13.0,jim cramer rides a horse with both legs on one side,neutral,0.8889114,,,37,37_cramer_jim_cramers_faber,2021-06-11
44345,"Daily Discussion Thread for June 09, 2021",Come on WISH!,06-09-2021,strugglebus72,24.0,come on wish,neutral,0.72556,,,17,17_wishing_wishes_wishy_foundation,2021-06-09
44712,"Daily Discussion Thread for June 10, 2021",ORPH plz avoid guys. This shit doesnâ€™t seem right at all,06-10-2021,RapsPlug,18.0,orph plz avoid guys this shit doesnt seem right at all,negative,0.9758832,,,161,161_orph_orning_eekend_ears,2021-06-10
45955,"Weekend Discussion Thread for the Weekend of June 11, 2021",Anyone buying call options for clf and crsr,06-13-2021,lordAize-n,11.0,anyone buying call options for clf and crsr,neutral,0.8667026,,,-1,-1_spce_000_price_bags,2021-06-13
41914,"Daily Discussion Thread for June 03, 2021",Attack BB full strength you fucking retards holy shit Iâ€™m about to send out horse blinders,06-03-2021,tchwelve12,54.0,attack bb full strength you fucking retards holy shit im about to send out horse blinders,negative,0.9629447,,bb,153,153_holding_hold_bbags_momentum,2021-06-03
41137,"Daily Discussion Thread for June 01, 2021",This battle at 32 for AMC is fun to watch,06-01-2021,DependentHot1829,22.0,this battle at 32 for amc is fun to watch,positive,0.95796305,,amc,-1,-1_spce_000_price_bags,2021-06-01
43869,"Daily Discussion Thread for June 08, 2021",CLNE comming back,06-08-2021,arthas_98,21.0,clne comming back,neutral,0.8626523,,,3,3_clne_clov_clovtards_poppin,2021-06-08
41480,"Daily Discussion Thread for June 02, 2021","Amc either opening at 40 or 100 tomorrow, your guess is as good as mine",06-02-2021,AdministrativeOne495,35.0,amc either opening at 40 or 100 tomorrow your guess is as good as mine,positive,0.59872496,,amc,14,14_25_30_38_break,2021-06-02
49062,"Daily Discussion Thread for June 22, 2021",Jumped back into CLOV at 12.32 letâ€™s get it ğŸ¦ğŸ¦ğŸ—ğŸ—,06-22-2021,tutah,31.0,jumped back into clov at 12 32 lets get it,neutral,0.7396688,,,10,10_12_11_break_hit,2021-06-22
47855,"Daily Discussion Thread for June 18, 2021",i picked the wrong week to stop sniffing glue,06-18-2021,OhNoMoFomo,15.0,i picked the wrong week to stop sniffing glue,negative,0.8733881,,,548,548_glue_sniffing_picked_huffing,2021-06-18
51624,"Daily Discussion Thread for June 28, 2021",Workhorse you so silly.,06-28-2021,DrSeuss19,31.0,workhorse you so silly,negative,0.90076935,,workhorse,293,293_horse_workhorse_horses_yelling,2021-06-28
43092,"Weekend Discussion Thread for the Weekend of June 04, 2021",Collecting lots of profit but left a lot on the table with BB and AMC by not getting out fast enough. Can only learn from here. Next week we start again ğŸ“ˆğŸ“ˆğŸ“ˆ,06-04-2021,tallpaulpaultall,11.0,collecting lots of profit but left a lot on the table with bb and amc by not getting out fast enough can only learn from here next week we start again,neutral,0.46189472,,bb,184,184_momentum_amcc_ganggg_breakaway,2021-06-04
48460,"Weekend Discussion Thread for the Weekend of June 18, 2021","Well time to grow 3k back into 95,000 lmao",06-19-2021,Stanley-Stingray,12.0,well time to grow 3k back into 95 000 lmao,neutral,0.78809386,,,40,40_5k_20k_30k_3k,2021-06-19
45987,"Daily Discussion Thread for June 14, 2021",CLNE hitting 12$ rn,06-14-2021,WorkingHyena,27.0,clne hitting 12 rn,neutral,0.9108721,,,10,10_12_11_break_hit,2021-06-14
48444,"Weekend Discussion Thread for the Weekend of June 18, 2021","Monday is not a holiday, so at least thereâ€™s that.",06-18-2021,ShopBitter,12.0,monday is not a holiday so at least theres that,neutral,0.6061274,,,46,46_weekends_weekend_friday_monday,2021-06-18
45570,"Weekend Discussion Thread for the Weekend of June 11, 2021",At least I can write off 3k for the next 23 years.,06-11-2021,cryptooakmont,182.0,at least i can write off 3k for the next 23 years,neutral,0.62284845,,,-1,-1_spce_000_price_bags,2021-06-11
42626,"Daily Discussion Thread for June 04, 2021",25 shares of bb! Let's gooo,06-04-2021,TheLolacaust,22.0,25 shares of bb lets gooo,neutral,0.50789505,,bb,92,92_shares_200_share_500,2021-06-04
49879,"Daily Discussion Thread for June 23, 2021",like TSLA stock,06-23-2021,UNISEXBET,8.0,like tsla stock,neutral,0.7482724,,tsla,201,201_tsla_upgrade_tailwinds_downgrade,2021-06-23
45812,"Weekend Discussion Thread for the Weekend of June 11, 2021","Fuck I hate you people, yet, here I am",06-12-2021,Catheter_Trader,11.0,fuck i hate you people yet here i am,negative,0.98038214,,,275,275_hate_liked_mo_hates,2021-06-12
51668,"Daily Discussion Thread for June 28, 2021",CLOV is in a war for pennies right now.. I wonder why ğŸ¤·ğŸ¼â€â™‚ï¸. ğŸ€ğŸš€ğŸ˜,06-28-2021,dvdr1029,10.0,clov is in a war for pennies right now i wonder why,neutral,0.51430327,,,3,3_clne_clov_clovtards_poppin,2021-06-28
49733,"Daily Discussion Thread for June 23, 2021",I would love to see the overall P/L for this sub,06-23-2021,StonkGoUp,11.0,i would love to see the overall p l for this sub,positive,0.9118707,,,161,161_orph_orning_eekend_ears,2021-06-23
48196,"Daily Discussion Thread for June 18, 2021",Aaaannndd with that final GUHHH my FDs are officially dead. Fuck you SPY,06-18-2021,HellsCmingWthMe,8.0,aaaannndd with that final guhhh my fds are officially dead fuck you spy,negative,0.9733687,,,-1,-1_spce_000_price_bags,2021-06-18
45389,"Daily Discussion Thread for June 11, 2021",Is WKHS bouncing now?,06-11-2021,artimus711,14.0,is wkhs bouncing now,neutral,0.8417135,,,16,16_wkhs_wsb_wsbs_crew,2021-06-11
47801,"Daily Discussion Thread for June 18, 2021",market rotation into wish,06-18-2021,Jhh94,23.0,market rotation into wish,neutral,0.8440937,,,-1,-1_spce_000_price_bags,2021-06-18
49837,"Daily Discussion Thread for June 23, 2021",$CLNE $TLRY ğŸ’ğŸ’ğŸ“ˆğŸ“ˆğŸ’ªğŸ’ªğŸš€ğŸš€,06-23-2021,No_Yogurtcloset_9013,9.0,clne tlry,neutral,0.6365534,,,3,3_clne_clov_clovtards_poppin,2021-06-23
47645,"Daily Discussion Thread for June 17, 2021",NVDA literally only buys,06-17-2021,IoPieroK,9.0,nvda literally only buys,neutral,0.62388134,,,109,109_nvda_split_200_amd,2021-06-17
44520,"Daily Discussion Thread for June 09, 2021","I WISH you a diamond hand, i WISH you a super rocket, i WISH you a merry moon and happy to the moonğŸš€ğŸ’ğŸ™ŒğŸš€ğŸ’ğŸ™ŒğŸš€ğŸ’ğŸ™ŒğŸš€ğŸ’ğŸ™ŒğŸš€ğŸ’ğŸ™ŒğŸš€ğŸ’ğŸ™ŒğŸš€ğŸ’ğŸ™ŒğŸš€ğŸ’ğŸ™ŒğŸš€ğŸ’ğŸ™ŒğŸš€ğŸ’ğŸ™Œ",06-09-2021,WallBayStreet,20.0,i wish you a diamond hand i wish you a super rocket i wish you a merry moon and happy to the moon,positive,0.97439665,,,165,165_moon_mooning_moonnnnnnnn_moononnnnnn,2021-06-09
42628,"Daily Discussion Thread for June 04, 2021",BB 20 end of next week?,06-04-2021,Cookiiiiiii,24.0,bb 20 end of next week,neutral,0.89517814,,bb,10,10_12_11_break_hit,2021-06-04
50233,"Daily Discussion Thread for June 24, 2021",PM for CLOV looking solid so far! ğŸ€ğŸ’ªğŸ€,06-24-2021,Sc0ttyMinz,38.0,pm for clov looking solid so far,positive,0.8871113,,,-1,-1_spce_000_price_bags,2021-06-24
52071,"Daily Discussion Thread for June 29, 2021",Clover giving me a boner,06-29-2021,CoVLifter,11.0,clover giving me a boner,neutral,0.4322167,,,373,373_clover_clovers_rover_cloverfeild,2021-06-29
42090,"Daily Discussion Thread for June 03, 2021",Come on BlackBerry we believe ğŸ™,06-03-2021,TendiesForTheBoys,35.0,come on blackberry we believe,positive,0.5669175,,blackberry,127,127_blackberry_blackberrys_phones_qnx,2021-06-03
44357,"Daily Discussion Thread for June 09, 2021","WISH is moving back on up, what a fucking ride",06-09-2021,Nathanasad,24.0,wish is moving back on up what a fucking ride,negative,0.81762934,,,17,17_wishing_wishes_wishy_foundation,2021-06-09
42318,"Daily Discussion Thread for June 03, 2021",Ah fuck it whatever I just bought more BB,06-03-2021,sweatynready6969,35.0,ah fuck it whatever i just bought more bb,negative,0.56608653,,bb,1,1_priced_sale_discount_price,2021-06-03
45698,"Weekend Discussion Thread for the Weekend of June 11, 2021",love late night wsb,06-13-2021,wsb926728,14.0,love late night wsb,positive,0.88015485,,,16,16_wkhs_wsb_wsbs_crew,2021-06-13
46044,"Daily Discussion Thread for June 14, 2021","CLNE for the real play, WOOF just for fun. ![gif](emote|free_emotes_pack|give_upvote)",06-14-2021,KateCrash87,24.0,clne for the real play woof just for fun gif emote free_emotes_pack give_upvote,positive,0.5616926,,,94,94_gif_freeemotespack_emote_moneyface,2021-06-14
51603,"Daily Discussion Thread for June 28, 2021",$WKHS THRICE $WKHS!,06-28-2021,Td1513,13.0,wkhs thrice wkhs,neutral,0.8289087,,,16,16_wkhs_wsb_wsbs_crew,2021-06-28
52427,"Daily Discussion Thread for June 30, 2021",$CLNE is so cheap it is almost criminal!,06-30-2021,kirinoke,8.0,clne is so cheap it is almost criminal,negative,0.8470112,,,1,1_priced_sale_discount_price,2021-06-30
45565,"Weekend Discussion Thread for the Weekend of June 11, 2021","the best move i did this week was inverse everything [this guy](https://reddit.com/user/me) did, it was a really good decision i plan on repeating next week ğŸ˜Š",06-11-2021,sogerr,345.0,the best move i did this week was inverse everything this guy https reddit com user me did it was a really good decision i plan on repeating next week,positive,0.9796693,,,-1,-1_spce_000_price_bags,2021-06-11
42061,"Daily Discussion Thread for June 03, 2021",BB BOUTTA GO BRRRRR,06-03-2021,Gumpstahh,39.0,bb boutta go brrrrr,neutral,0.71677417,,bb,424,424_greeeennn_brrrrr_boutta_brrr,2021-06-03
49171,"Daily Discussion Thread for June 22, 2021",Iâ€™m a fucking clown.,06-22-2021,egrose38,16.0,im a fucking clown,negative,0.97657233,,,381,381_clown_honks_loudest_clowns,2021-06-22
43099,"Weekend Discussion Thread for the Weekend of June 04, 2021",CATHIE BUYIN' DAT TSLA DIPPPPPPPPP,06-05-2021,FrankCarmody,12.0,cathie buyin dat tsla dippppppppp,neutral,0.75168097,,tsla,-1,-1_spce_000_price_bags,2021-06-05
48535,"Weekend Discussion Thread for the Weekend of June 18, 2021","Did you know: if you buy an FD everytime spy dips, you can lose a lot of money very quickly.  
Crazy",06-18-2021,larsdragl,9.0,did you know if you buy an fd everytime spy dips you can lose a lot of money very quickly crazy,negative,0.85715324,,,-1,-1_spce_000_price_bags,2021-06-18
46703,"Daily Discussion Thread for June 15, 2021",Doubled down on GOEV after the dip and  right before lift off. LFG ğŸ”¥,06-15-2021,Bdonn_88,13.0,doubled down on goev after the dip and right before lift off lfg,neutral,0.88143235,,,82,82_goev_gourd_gourds_ornamental,2021-06-15
44174,"Daily Discussion Thread for June 09, 2021",We still buying WISH??,06-09-2021,NateDogg5o5,37.0,we still buying wish,neutral,0.81261027,,,1,1_priced_sale_discount_price,2021-06-09
42001,"Daily Discussion Thread for June 03, 2021",BB is on sale. Buyin' more.,06-03-2021,too_techie,42.0,bb is on sale buyin more,neutral,0.7881426,,bb,1,1_priced_sale_discount_price,2021-06-03
50300,"Daily Discussion Thread for June 24, 2021",TSLA bulls eating sushi tonight,06-24-2021,ListerineInMyPeehole,12.0,tsla bulls eating sushi tonight,neutral,0.8340567,,tsla,-1,-1_spce_000_price_bags,2021-06-24
41965,"Daily Discussion Thread for June 03, 2021","                       ğŸš€BB                                                                             
                   ğŸš€ğŸ–•ğŸ–•                                                                            
                ğŸš€ğŸ–•ğŸ–•ğŸ–•                                                                           
             ğŸš€ğŸ–•ğŸ–•ğŸ–•ğŸ–•                                                                             
          ğŸš€ğŸ–•ğŸ–•ğŸ–•ğŸ–•ğŸ–•                                                                            
        ğŸš€ğŸ–•ğŸ–•ğŸ–•ğŸ–•ğŸ–•ğŸ–•                                                                            
      ğŸš€ğŸ–•ğŸ–•ğŸ–•ğŸ–•ğŸ–•ğŸ–•ğŸ–•
    ğŸš€ ğŸ–•ğŸ–•ğŸ–•ğŸ–•ğŸ–•ğŸ–•ğŸ–•ğŸ–•",06-03-2021,GayCptTonyStark,44.0,bb,neutral,0.5110977,,bb,79,79_uh_psth_yep_gimme,2021-06-03
51826,"Daily Discussion Thread for June 29, 2021",Holy shit CLOV just went higher,06-29-2021,Double-Ad5247,20.0,holy shit clov just went higher,positive,0.75140816,,,3,3_clne_clov_clovtards_poppin,2021-06-29
46223,"Daily Discussion Thread for June 14, 2021","I know that CLNE stands for Clean Energy, but I keep calling it ""Cline"" like it's my mate from high school.",06-14-2021,eddanja,20.0,i know that clne stands for clean energy but i keep calling it cline like its my mate from high school,neutral,0.6247575,,,3,3_clne_clov_clovtards_poppin,2021-06-14
43440,"Daily Discussion Thread for June 07, 2021",CLOVğŸ™ŒğŸ»,06-07-2021,BlueChilly,19.0,clov,neutral,0.6095793,,,-1,-1_spce_000_price_bags,2021-06-07
50037,"Daily Discussion Thread for June 24, 2021",TLRY will be back over $20 soon,06-24-2021,Andymilez,17.0,tlry will be back over 20 soon,positive,0.5262309,,,128,128_tlry_142_19_heading,2021-06-24
46490,"Daily Discussion Thread for June 15, 2021",DKNG was at this price like 2 weeks ago before the ape army even descended ğŸ¦ fuck the Hindenburg!! ğŸš€ğŸš€,06-15-2021,33chainz,19.0,dkng was at this price like 2 weeks ago before the ape army even descended fuck the hindenburg,negative,0.81865364,,,443,443_hindenburg_hindenburgs_hindenberg_goose,2021-06-15
51753,"Daily Discussion Thread for June 29, 2021","$CLOV | Ortex (11am EDT):  
SI Change: +9.87%  
Current Shares Short: 40.34m  
Short Interest % of Float: 35.9%  
Cost to Borrow % (Avg): 263.94%  

Donâ€™t sleep on CLOV. Shorts under pressure and numbers/momentum look favorable.",06-29-2021,O2ION,26.0,clov ortex 11am edt si change 9 87 current shares short 40 34m short interest of float 35 9 cost to borrow avg 263 94 dont sleep on clov shorts under pressure and numbers momentum look favorable,neutral,0.5692664,,,309,309_borrow_fee_shorts_iborrowdesk,2021-06-29
43913,"Daily Discussion Thread for June 08, 2021",WISH is the way,06-08-2021,ZeroFox09,19.0,wish is the way,neutral,0.6847823,,,17,17_wishing_wishes_wishy_foundation,2021-06-08
42442,"Daily Discussion Thread for June 04, 2021",Best time to get in on BB,06-04-2021,Sosacane,27.0,best time to get in on bb,positive,0.65429485,,bb,-1,-1_spce_000_price_bags,2021-06-04
44963,"Daily Discussion Thread for June 10, 2021",**WISH** FOR THE WIN !,06-10-2021,PlandomeProwler,14.0,wish for the win,positive,0.6960101,,,17,17_wishing_wishes_wishy_foundation,2021-06-10
51116,"Weekend Discussion Thread for the Weekend of June 25, 2021","Got my cardboard AC all ready boys. Cut some triangle holes near the bottom on the sides of a cardboard box - put a frozen water jug or 2 Liter in there, put fan on top pointed down. 

Gonna live in my basement like a basement dwelling millenial next few days",06-26-2021,GoBeaversOSU,11.0,got my cardboard ac all ready boys cut some triangle holes near the bottom on the sides of a cardboard box put a frozen water jug or 2 liter in there put fan on top pointed down gonna live in my basement like a basement dwelling millenial next few days,neutral,0.8663368,,,-1,-1_spce_000_price_bags,2021-06-26
44713,"Daily Discussion Thread for June 10, 2021","you fucking people.  ORPH is up 1,000% for the day and people are like ""ohmygod nows the time to buy""",06-10-2021,bitterbrew,18.0,you fucking people orph is up 1 000 for the day and people are like ohmygod nows the time to buy,negative,0.8725661,,,161,161_orph_orning_eekend_ears,2021-06-10
42205,"Daily Discussion Thread for June 03, 2021",I love how BB is just bubbling with that volume,06-03-2021,kaboom987,32.0,i love how bb is just bubbling with that volume,positive,0.95020086,,bb,60,60_volume_volumes_200m_avg,2021-06-03
42600,"Daily Discussion Thread for June 04, 2021",I donâ€™t care what anyone says. I find it really suspicious that both amc and bb are being held right under the strikes that would make most of the options be in the money,06-04-2021,tplee,24.0,i dont care what anyone says i find it really suspicious that both amc and bb are being held right under the strikes that would make most of the options be in the money,negative,0.79673856,,amc,-1,-1_spce_000_price_bags,2021-06-04
44051,"Daily Discussion Thread for June 08, 2021",WKHS chart very bullish rn,06-08-2021,andyesandyes,17.0,wkhs chart very bullish rn,positive,0.8460263,,,16,16_wkhs_wsb_wsbs_crew,2021-06-08
47394,"Daily Discussion Thread for June 17, 2021",I didnâ€™t know UWMC options were so cheap....fuck...bout to make a bad decision,06-17-2021,che5568,14.0,i didnt know uwmc options were so cheap fuck bout to make a bad decision,negative,0.8933288,,uwm,15,15_uwmc_uwm_marines_10c,2021-06-17
41334,"Daily Discussion Thread for June 01, 2021",AMC volume passing 120 million.,06-01-2021,bullsteak3000,17.0,amc volume passing 120 million,neutral,0.8029751,,amc,60,60_volume_volumes_200m_avg,2021-06-01
51083,"Weekend Discussion Thread for the Weekend of June 25, 2021","Four years ago, I could not spell â€œEngineer.â€

&#x200B;

Today, I are one.",06-27-2021,UnrelentingSarcasm,10.0,four years ago i could not spell engineer x200b today i are one,negative,0.5127628,,,-1,-1_spce_000_price_bags,2021-06-27
49590,"Daily Discussion Thread for June 23, 2021",Fuck sakes CLOV figure it out.,06-23-2021,GangreneMachine,14.0,fuck sakes clov figure it out,negative,0.9198798,,,3,3_clne_clov_clovtards_poppin,2021-06-23
45285,"Daily Discussion Thread for June 11, 2021",SENS SENS SENS. Take me the fuck away,06-11-2021,repos39,15.0,sens sens sens take me the fuck away,negative,0.9235032,,,151,151_sens_volume_kicking_flying,2021-06-11
52405,"Daily Discussion Thread for June 30, 2021",A lot of good news about TLRY. Letâ€™s gooooo,06-30-2021,KostyaTK,8.0,a lot of good news about tlry lets gooooo,positive,0.98471665,,,31,31_tlry_moving_awakens_tlghey,2021-06-30
49262,"Daily Discussion Thread for June 22, 2021",If you are in WISH expect a war with wallstreet chads today. It will be fun.,06-22-2021,YOLOPLAYALLDAY,13.0,if you are in wish expect a war with wallstreet chads today it will be fun,positive,0.9435466,,,17,17_wishing_wishes_wishy_foundation,2021-06-22
44980,"Daily Discussion Thread for June 10, 2021",The only thing keeping ORPH from crashing is the fact that I havenâ€™t bought yet. Be thankful.,06-10-2021,NaiveDare7532,13.0,the only thing keeping orph from crashing is the fact that i havent bought yet be thankful,positive,0.50204766,,,161,161_orph_orning_eekend_ears,2021-06-10
49851,"Daily Discussion Thread for June 23, 2021","I WILL NOT FOMO AND GET CAUGHT HOLDING THE BAG THIS TIME, I WILL NOT FOMO AND GET CAUGHT HOLDING THE BAG THIS TIME. AHHHH FUCK IT",06-23-2021,ElectronicAsparagus8,29.0,i will not fomo and get caught holding the bag this time i will not fomo and get caught holding the bag this time ahhhh fuck it,negative,0.90152675,,,101,101_fomo_fds_obliteration_death,2021-06-23
51873,"Daily Discussion Thread for June 29, 2021",Clov turning things around slightly ğŸš€ğŸ€,06-29-2021,ceejwhich,16.0,clov turning things around slightly,neutral,0.8212486,,,3,3_clne_clov_clovtards_poppin,2021-06-29
47104,"Daily Discussion Thread for June 16, 2021","Translation of Powell. ""The ship will sink but the base case is not until after I leave""",06-16-2021,TJMBeav,15.0,translation of powell the ship will sink but the base case is not until after i leave,neutral,0.6876445,,,129,129_powell_powells_sip_banking,2021-06-16
48786,"Daily Discussion Thread for June 21, 2021","WISH, TLRY, WKHS, UWMC

my account is going to 0",06-21-2021,KapoMusic,17.0,wish tlry wkhs uwmc my account is going to 0,negative,0.70902497,,uwm,-1,-1_spce_000_price_bags,2021-06-21
42230,"Daily Discussion Thread for June 03, 2021",I believe in you BB!!!! âœŠâœŠâœŠ Diamonds are forever ğŸ˜†,06-03-2021,Gauparte,28.0,i believe in you bb diamonds are forever,positive,0.9214343,,bb,-1,-1_spce_000_price_bags,2021-06-03
48893,"Daily Discussion Thread for June 21, 2021",Guess Iâ€™m going long on CLNE now ğŸ˜¢,06-21-2021,money2feedmadaughter,13.0,guess im going long on clne now,neutral,0.85138816,,,-1,-1_spce_000_price_bags,2021-06-21
46915,"Daily Discussion Thread for June 16, 2021",JPOW STOP TALKING HOLY FUCK,06-16-2021,Optionsfuckup,26.0,jpow stop talking holy fuck,negative,0.97067463,,,96,96_jpow_speaks_speech_speak,2021-06-16
42304,"Daily Discussion Thread for June 03, 2021","BB at like an $85 discount right now just sayin

 ğŸ¤·â€â™‚ï¸",06-03-2021,CMac681,37.0,bb at like an 85 discount right now just sayin,neutral,0.8656339,,bb,1,1_priced_sale_discount_price,2021-06-03
49712,"Daily Discussion Thread for June 23, 2021","DKNG easily above 50 as expected, now to 60!",06-23-2021,eLdiego30,12.0,dkng easily above 50 as expected now to 60,neutral,0.62185067,,,132,132_dkng_mob_nfl_vices,2021-06-23
42636,"Daily Discussion Thread for June 04, 2021","BB is being shorted, just hold
check here: https://iborrowdesk.com/report/BB",06-04-2021,Elysum,22.0,bb is being shorted just hold check here https iborrowdesk com report bb,neutral,0.6243647,,bb,-1,-1_spce_000_price_bags,2021-06-04
42450,"Daily Discussion Thread for June 04, 2021",come on BB we need you to hit $25 by the end of the day baby,06-04-2021,chahmanjuschillen,29.0,come on bb we need you to hit 25 by the end of the day baby,positive,0.49322787,,bb,10,10_12_11_break_hit,2021-06-04
46548,"Daily Discussion Thread for June 15, 2021",Vzio any one or did I but they high agin ?,06-15-2021,Idkhow2trade,16.0,vzio any one or did i but they high agin,neutral,0.8073718,,,-1,-1_spce_000_price_bags,2021-06-15
45913,"Weekend Discussion Thread for the Weekend of June 11, 2021",So I lost 25% of my portfolio on a meme stock then put it all in safe investments. Iâ€™m now realizing it is gonna take 10 years to get even. What meme stock am I yoloing now?,06-12-2021,reddituser1234566789,10.0,so i lost 25 of my portfolio on a meme stock then put it all in safe investments im now realizing it is gonna take 10 years to get even what meme stock am i yoloing now,negative,0.81294054,,,24,24_meme_memes_boomer_memestock,2021-06-12
43045,"Weekend Discussion Thread for the Weekend of June 04, 2021",I love how Meme Stocks is a legitimate industry term now,06-04-2021,I_am_not_a_murderer,13.0,i love how meme stocks is a legitimate industry term now,positive,0.9532928,,,24,24_meme_memes_boomer_memestock,2021-06-04
42765,"Daily Discussion Thread for June 04, 2021",Who needs a girlfriend when you have BBy !,06-04-2021,Embarrassed-End4105,20.0,who needs a girlfriend when you have bby,neutral,0.6886067,,bb,-1,-1_spce_000_price_bags,2021-06-04
49436,"Daily Discussion Thread for June 22, 2021","""It's a good question"" = for Christ's sake you are fucking stupid",06-22-2021,iwangotamarjo,11.0,its a good question for christs sake you are fucking stupid,negative,0.8471116,,,-1,-1_spce_000_price_bags,2021-06-22
42053,"Daily Discussion Thread for June 03, 2021",BB RESURGENCE!!,06-03-2021,TheDovahofSkyrim,38.0,bb resurgence,neutral,0.65986454,,bb,81,81_climb_daq_undertaker_coffin,2021-06-03
46257,"Daily Discussion Thread for June 14, 2021",WHY IS CLNE BEING SUCH A BULLY,06-14-2021,Queasy_Vegetable5725,17.0,why is clne being such a bully,negative,0.9666297,,,3,3_clne_clov_clovtards_poppin,2021-06-14
50039,"Daily Discussion Thread for June 24, 2021",Imagine doubting WISH ğŸ¤¦â€â™‚ï¸,06-24-2021,Twoverybigwords00,17.0,imagine doubting wish,neutral,0.5745376,,,17,17_wishing_wishes_wishy_foundation,2021-06-24
52370,"Daily Discussion Thread for June 30, 2021","Some of yâ€™all are tripping! If a stock doesnâ€™t go up the next day, youâ€™re pissed and sell. RELAX!! If you canâ€™t afford it, donâ€™t gamble. Patience pays in the stock market.",06-30-2021,Mr_Wright_Now,10.0,some of yall are tripping if a stock doesnt go up the next day youre pissed and sell relax if you cant afford it dont gamble patience pays in the stock market,negative,0.79712504,,ford,4,4_investor_growth_investing_invest,2021-06-30
49517,"Daily Discussion Thread for June 23, 2021","*Pokes stick with stick*

CLOV something..",06-23-2021,tallpaulpaultall,17.0,pokes stick with stick clov something,neutral,0.84871244,,,-1,-1_spce_000_price_bags,2021-06-23
44494,"Daily Discussion Thread for June 09, 2021",Wish upon a star,06-09-2021,Turbulent-Sort2964,21.0,wish upon a star,neutral,0.6654181,,,478,478_star_stars_jiminy_sang,2021-06-09
50172,"Daily Discussion Thread for June 24, 2021",Clovtard here holding strong,06-24-2021,breezly12,11.0,clovtard here holding strong,positive,0.4994171,,,-1,-1_spce_000_price_bags,2021-06-24
42871,"Weekend Discussion Thread for the Weekend of June 04, 2021","$CLNE has a majority of my portfolio, I have Calls on CLOV

Don't sleep on TSLA and NVDA, both have made me a ton of money by buying their dips and they're gonna go further. 

Thank you to this community though because honestly this can be life changing for the good if done smartly. I've paid off credit cards, other debt, and am almost debt free thanks to you apes ğŸ¦ğŸ¦ğŸ¦ğŸ’ğŸ’ğŸ’âœ‹âœ‹ğŸš€ğŸš€ğŸš€ğŸš€ğŸš€ğŸš€ğŸš€",06-06-2021,StonkeyAndShrek,23.0,clne has a majority of my portfolio i have calls on clov dont sleep on tsla and nvda both have made me a ton of money by buying their dips and theyre gonna go further thank you to this community though because honestly this can be life changing for the good if done smartly ive paid off credit cards other debt and am almost debt free thanks to you apes,positive,0.97330886,,tsla,-1,-1_spce_000_price_bags,2021-06-06
41370,"Daily Discussion Thread for June 01, 2021",NIO will be back to $60 by the end of June,06-01-2021,Andymilez,16.0,nio will be back to 60 by the end of june,neutral,0.8198347,,nio,14,14_25_30_38_break,2021-06-01
52088,"Daily Discussion Thread for June 29, 2021",CLNE if you could just stop going down thatâ€™d be greaaaat thanks,06-29-2021,Concerned_Dennizen,9.0,clne if you could just stop going down thatd be greaaaat thanks,positive,0.71764505,,,3,3_clne_clov_clovtards_poppin,2021-06-29
41167,"Daily Discussion Thread for June 01, 2021",Huge volumes in BB and AmC,06-01-2021,Recent_Flower1377,22.0,huge volumes in bb and amc,neutral,0.7875383,,bb,60,60_volume_volumes_200m_avg,2021-06-01
46004,"Daily Discussion Thread for June 14, 2021",We can make WISH go back to over $14 if we stick to WISH. Who agrees? ğŸš€ğŸš€,06-14-2021,TundiTough,29.0,we can make wish go back to over 14 if we stick to wish who agrees,neutral,0.75187373,,,10,10_12_11_break_hit,2021-06-14
41842,"Daily Discussion Thread for June 02, 2021",I'm not gonna make the same mistake I did in AMC with BB.. Not getting off this rocket this time. See you in the moon AMC apes! BB apes are on the way ![gif](emote|free_emotes_pack|money_face),06-02-2021,throwawayonafriday_,29.0,im not gonna make the same mistake i did in amc with bb not getting off this rocket this time see you in the moon amc apes bb apes are on the way gif emote free_emotes_pack money_face,negative,0.5004668,,amc,94,94_gif_freeemotespack_emote_moneyface,2021-06-02
42127,"Daily Discussion Thread for June 03, 2021",Hold BB. Stop selling. Weâ€™re hitting 25 soon,06-03-2021,mikeskeezer31,33.0,hold bb stop selling were hitting 25 soon,neutral,0.7617358,,bb,1,1_priced_sale_discount_price,2021-06-03
45197,"Daily Discussion Thread for June 11, 2021","1,000 CLNE",06-11-2021,hallett21,18.0,1 000 clne,neutral,0.7112169,,,3,3_clne_clov_clovtards_poppin,2021-06-11
41422,"Daily Discussion Thread for June 02, 2021",This BB gap up is going to be wild,06-02-2021,TheGhostofBillHwang,50.0,this bb gap up is going to be wild,positive,0.56620914,,bb,-1,-1_spce_000_price_bags,2021-06-02
47291,"Daily Discussion Thread for June 16, 2021",WKHS IS GOING TO TEST THE RESISTANCE AGAIN.,06-16-2021,Apprehensive-Box-107,10.0,wkhs is going to test the resistance again,neutral,0.83587664,,,-1,-1_spce_000_price_bags,2021-06-16
45825,"Weekend Discussion Thread for the Weekend of June 11, 2021",WKHS in the stables preparing for a big run monday,06-12-2021,thestonkinator,12.0,wkhs in the stables preparing for a big run monday,neutral,0.8231563,,,-1,-1_spce_000_price_bags,2021-06-12
45935,"Weekend Discussion Thread for the Weekend of June 11, 2021",This thread making me feel like my Corsair covered calls are fucked,06-13-2021,Premier_Legacy,11.0,this thread making me feel like my corsair covered calls are fucked,negative,0.9635184,,corsair,278,278_corsair_gaming_pcs_e3,2021-06-13
47097,"Daily Discussion Thread for June 16, 2021","NO RATE CHANGE

STILL ""TRANSITORY INFLATION"" 

INCREASED FORECAST FOR INFLATION TO 3.4% FROM 2.4%",06-16-2021,bamasmith,14.0,no rate change still transitory inflation increased forecast for inflation to 3 4 from 2 4,neutral,0.8430745,,,54,54_inflation_cpi_prices_higher,2021-06-16
46832,"Daily Discussion Thread for June 15, 2021",Wish is still green today somehow,06-15-2021,shroomlord6969,12.0,wish is still green today somehow,neutral,0.5037006,,,11,11_red_color_reds_jpow,2021-06-15
45884,"Weekend Discussion Thread for the Weekend of June 11, 2021",Brothers Bachelor party in SD. Puts on my liver.,06-12-2021,Bindi93,10.0,brothers bachelor party in sd puts on my liver,negative,0.7939332,,,569,569_liver_livers_aa_punish,2021-06-12
45669,"Weekend Discussion Thread for the Weekend of June 11, 2021",Cramer plugging UWM,06-11-2021,Icy-Ad6136,14.0,cramer plugging uwm,neutral,0.8062836,,uwm,37,37_cramer_jim_cramers_faber,2021-06-11
44061,"Daily Discussion Thread for June 08, 2021",TLRY with that healthy growth,06-08-2021,grossbard,15.0,tlry with that healthy growth,neutral,0.5154946,,,31,31_tlry_moving_awakens_tlghey,2021-06-08
49097,"Daily Discussion Thread for June 22, 2021",CLOVs volume is taking off!!!,06-22-2021,LevelSail1482,22.0,clovs volume is taking off,positive,0.77865744,,,60,60_volume_volumes_200m_avg,2021-06-22
48612,"Weekend Discussion Thread for the Weekend of June 18, 2021",Back into CRSR. Oversold and gonna reverse next week.,06-18-2021,justforin,10.0,back into crsr oversold and gonna reverse next week,neutral,0.62393475,,,-1,-1_spce_000_price_bags,2021-06-18
43866,"Daily Discussion Thread for June 08, 2021",I WISH we would pump and hold,06-08-2021,Elibro19,20.0,i wish we would pump and hold,neutral,0.71256155,,,58,58_pump_dump_dumps_pumping,2021-06-08
46860,"Daily Discussion Thread for June 15, 2021",Tatooed chef ready for takeoff whose in ? ğŸ¤ŒğŸ¼ğŸš€,06-15-2021,ws_pharmer,12.0,tatooed chef ready for takeoff whose in,neutral,0.8571336,,,123,123_rocket_rockets_rocketship_takeoff,2021-06-15
47867,"Daily Discussion Thread for June 18, 2021","Alright ready for this green day for TLRY


Time for 0DTE $60 calls",06-18-2021,jjlleskoja,15.0,alright ready for this green day for tlry time for 0dte 60 calls,neutral,0.57552445,,,178,178_reddest_plums_happier_singles,2021-06-18
51689,"Daily Discussion Thread for June 28, 2021",Why canâ€™t wish break  $15 and keep going up!,06-28-2021,Affectionate-Bee9914,11.0,why cant wish break 15 and keep going up,neutral,0.6314915,,,10,10_12_11_break_hit,2021-06-28
46725,"Daily Discussion Thread for June 15, 2021",Holy shit the movement for wish is insaneee,06-15-2021,Flolife2,11.0,holy shit the movement for wish is insaneee,neutral,0.4317839,,,17,17_wishing_wishes_wishy_foundation,2021-06-15
51014,"Weekend Discussion Thread for the Weekend of June 25, 2021","My friend/barber went a long way. He was renting a tiny storage space cutting hair out of there, putting in hours. Heâ€™s a cool sociable guy so he has a sizeable clientele where heâ€™s booked all the time. Now after many years like weâ€™re 30 heâ€™s been doing this out of HS. He has his own salon has two people working. Each cut is like $35, avg 2 cuts an hour for maybe 9-10 hours. 

All the customers are chill they shoot the shit and the other barber is also a cool guy so itâ€™s like heâ€™s chilling with friends and making money at the same time. I wanna do something like that Iâ€™m still wandering life. I need a skill set and make a biz with it. Itâ€™s inspiring thatâ€™s what I mean.",06-26-2021,rawnaldo,12.0,my friend barber went a long way he was renting a tiny storage space cutting hair out of there putting in hours hes a cool sociable guy so he has a sizeable clientele where hes booked all the time now after many years like were 30 hes been doing this out of hs he has his own salon has two people working each cut is like 35 avg 2 cuts an hour for maybe 9 10 hours all the customers are chill they shoot the shit and the other barber is also a cool guy so its like hes chilling with friends and making money at the same time i wanna do something like that im still wandering life i need a skill set and make a biz with it its inspiring thats what i mean,positive,0.8232513,,,232,232_hair_haircut_shaving_shaved,2021-06-26
42540,"Daily Discussion Thread for June 04, 2021",BB BBetter BBe BBullish,06-04-2021,Maximized_Rs,25.0,bb bbetter bbe bbullish,neutral,0.62703305,,bb,287,287_pop_bubble_bbbbbbbbbb_shark,2021-06-04
49813,"Daily Discussion Thread for June 23, 2021",TSLA was always the true meme play,06-23-2021,stonksupnoob,11.0,tsla was always the true meme play,neutral,0.71256435,,tsla,29,29_tsla_tslas_autopilot_og,2021-06-23
44270,"Daily Discussion Thread for June 09, 2021",Stay strong WISH APES,06-09-2021,limits21,26.0,stay strong wish apes,positive,0.8580699,,,50,50_apes_ape_gorilla_gorillas,2021-06-09
41760,"Daily Discussion Thread for June 02, 2021","BB to $50 by end of next week, you heard it here first.",06-02-2021,2014hondaaccord,24.0,bb to 50 by end of next week you heard it here first,neutral,0.8749963,,bb,10,10_12_11_break_hit,2021-06-02
44341,"Daily Discussion Thread for June 09, 2021",buy more WISH,06-09-2021,KapoMusic,25.0,buy more wish,neutral,0.6888466,,,1,1_priced_sale_discount_price,2021-06-09
51749,"Daily Discussion Thread for June 29, 2021",CLOV IS GONE BRO LIFTOFF LETS FUCKING GO,06-29-2021,thelundyy,30.0,clov is gone bro liftoff lets fucking go,negative,0.67251796,,,3,3_clne_clov_clovtards_poppin,2021-06-29
50574,"Daily Discussion Thread for June 25, 2021",Daily reminder Cathie sold the literal bottom on SPCE,06-25-2021,WallStreetRetardd,41.0,daily reminder cathie sold the literal bottom on spce,negative,0.71872467,,,-1,-1_spce_000_price_bags,2021-06-25
45850,"Weekend Discussion Thread for the Weekend of June 11, 2021",Stoned eating fruit loops. I forgot how fucking excellent these things taste.,06-13-2021,MayCauseInsomnia,11.0,stoned eating fruit loops i forgot how fucking excellent these things taste,positive,0.6001679,,,-1,-1_spce_000_price_bags,2021-06-13
47533,"Daily Discussion Thread for June 17, 2021","I know NVDA is an amazing stock, but I always find a way to buy the top ğŸ¤¡",06-17-2021,I_am_not_a_murderer,10.0,i know nvda is an amazing stock but i always find a way to buy the top,positive,0.9314778,,,109,109_nvda_split_200_amd,2021-06-17
48474,"Weekend Discussion Thread for the Weekend of June 18, 2021","Is there any central Florida girls in here having Daddy issues ??
      I'm in my forties, Dad bod and live by the beach... My wife says it's okay ğŸ‘",06-20-2021,Duffbeers71,12.0,is there any central florida girls in here having daddy issues im in my forties dad bod and live by the beach my wife says its okay,neutral,0.6455996,,,-1,-1_spce_000_price_bags,2021-06-20
48586,"Weekend Discussion Thread for the Weekend of June 18, 2021",BB gonna moon. buy BB till the rocket fucking lands.,06-20-2021,OG_KRIPTIK,11.0,bb gonna moon buy bb till the rocket fucking lands,negative,0.54439735,,bb,25,25_mooning_moon_mission_pluto,2021-06-20
46072,"Daily Discussion Thread for June 14, 2021",HOLY SHIT I JUST WOKE UP MY CRSR CALLS ABOUT TO FUCKING PRINT,06-14-2021,CaptainPlatano,21.0,holy shit i just woke up my crsr calls about to fucking print,negative,0.71806824,,,84,84_printing_print_printer_printed,2021-06-14
41112,"Daily Discussion Thread for June 01, 2021",$BBBBBBBBBBBBBBBBBBBBBBBBBBB,06-01-2021,Temporary_Ad9687,25.0,bbbbbbbbbbbbbbbbbbbbbbbbbbb,neutral,0.50352275,,bb,287,287_pop_bubble_bbbbbbbbbb_shark,2021-06-01
47470,"Daily Discussion Thread for June 17, 2021",Got a good feelin in my balls about CLOV,06-17-2021,performx92,12.0,got a good feelin in my balls about clov,positive,0.87456,,,-1,-1_spce_000_price_bags,2021-06-17
44003,"Daily Discussion Thread for June 08, 2021",$wish volume went up by double under 1 hour,06-08-2021,Manster420,16.0,wish volume went up by double under 1 hour,neutral,0.70412856,,,60,60_volume_volumes_200m_avg,2021-06-08
49255,"Daily Discussion Thread for June 22, 2021","So many meme stonks beginning with C

CLF CLOV CLNE 

My smooth brain struggling",06-22-2021,Im_Blind_And_Deaf,13.0,so many meme stonks beginning with c clf clov clne my smooth brain struggling,negative,0.5289189,,,-1,-1_spce_000_price_bags,2021-06-22
51745,"Daily Discussion Thread for June 29, 2021",All the action in $CLOV today ğŸ¤‘ğŸš€ğŸ€,06-29-2021,Leannepit,29.0,all the action in clov today,neutral,0.8456496,,,3,3_clne_clov_clovtards_poppin,2021-06-29
51390,"Daily Discussion Thread for June 28, 2021",$SOFI is printing ape dollars,06-28-2021,JuanAponaTime,17.0,sofi is printing ape dollars,neutral,0.7306111,,,30,30_sofi_fa_charter_sos,2021-06-28
50086,"Daily Discussion Thread for June 24, 2021",CLOV with the regular scheduled 3 o'clock run?,06-24-2021,tallpaulpaultall,15.0,clov with the regular scheduled 3 oclock run,neutral,0.91571325,,,3,3_clne_clov_clovtards_poppin,2021-06-24
50155,"Daily Discussion Thread for June 24, 2021",TSLA $700 by lunch!! ğŸš€ğŸš€ğŸš€ğŸš€,06-24-2021,jnkrumah96,13.0,tsla 700 by lunch,neutral,0.832668,,tsla,36,36_700_900_800_690,2021-06-24
49433,"Daily Discussion Thread for June 22, 2021",selling law runes 1k ea,06-22-2021,n64stRk,12.0,selling law runes 1k ea,neutral,0.81409043,,,-1,-1_spce_000_price_bags,2021-06-22
44880,"Daily Discussion Thread for June 10, 2021",WISH in the green now,06-10-2021,freeworldFA,14.0,wish in the green now,neutral,0.811639,,,11,11_red_color_reds_jpow,2021-06-10
43396,"Daily Discussion Thread for June 07, 2021","I was thinking 15-20 by EOW on CLOV, but it's looking like 15-20 tomorrow is a possibility.",06-07-2021,weaverswonders6,22.0,i was thinking 15 20 by eow on clov but its looking like 15 20 tomorrow is a possibility,neutral,0.7553241,,,67,67_eod_eow_15_eom,2021-06-07
50329,"Daily Discussion Thread for June 24, 2021",Why CLNE no pumpy?,06-24-2021,hipokampa,12.0,why clne no pumpy,neutral,0.6777496,,,-1,-1_spce_000_price_bags,2021-06-24
46003,"Daily Discussion Thread for June 14, 2021",WISH TO THE MOON,06-14-2021,WormSquirmSir,29.0,wish to the moon,neutral,0.6847397,,,165,165_moon_mooning_moonnnnnnnn_moononnnnnn,2021-06-14
48595,"Weekend Discussion Thread for the Weekend of June 18, 2021",I sold TSLA at 300 pre split ğŸ’€,06-20-2021,reddituser1234566789,11.0,i sold tsla at 300 pre split,neutral,0.82483405,,tsla,-1,-1_spce_000_price_bags,2021-06-20
41223,"Daily Discussion Thread for June 01, 2021",Been 5 minutes and people already acting like the day is overğŸ˜‚ğŸ˜‚ğŸ˜‚,06-01-2021,Temporary_Ad9687,20.0,been 5 minutes and people already acting like the day is over,negative,0.79885924,,,-1,-1_spce_000_price_bags,2021-06-01
45134,"Daily Discussion Thread for June 11, 2021","Hey, my brothers. I hope you're doing okay. If something's wrong, you're lonely, afraid, sad, depressed, PTSD, etc. please take the weekend to talk to someone about it. You are not a burden or a waste of someone's time. Doesn't matter what happened or how.  
  
If you need someone, feel free to message me. I am happy to talk to you. Market related or not. :)",06-11-2021,dwdsquared2,24.0,hey my brothers i hope youre doing okay if somethings wrong youre lonely afraid sad depressed ptsd etc please take the weekend to talk to someone about it you are not a burden or a waste of someones time doesnt matter what happened or how if you need someone feel free to message me i am happy to talk to you market related or not,positive,0.6973264,,,-1,-1_spce_000_price_bags,2021-06-11
49422,"Daily Discussion Thread for June 22, 2021","Holding my CLNE her. Looks like it has stabilized, and hopefully going to turn up verry soon ğŸ˜€ğŸ‘",06-22-2021,Similar-Emergency338,13.0,holding my clne her looks like it has stabilized and hopefully going to turn up verry soon,positive,0.8799144,,,1,1_priced_sale_discount_price,2021-06-22
44559,"Daily Discussion Thread for June 09, 2021","Jesus fucking christ, the pre market volume for WISH is insane. more than 22 million and still 1 hour of pre market to go. This is like as much (maybe even a tad more) than AMC was having last week when it was mooning. I dont know if I should buy in or not. fucking hell",06-09-2021,Diamondhands4dagainz,20.0,jesus fucking christ the pre market volume for wish is insane more than 22 million and still 1 hour of pre market to go this is like as much maybe even a tad more than amc was having last week when it was mooning i dont know if i should buy in or not fucking hell,negative,0.8380498,,amc,1,1_priced_sale_discount_price,2021-06-09
47666,"Daily Discussion Thread for June 17, 2021","NVDA has gone mad?  
He thinks he's a mÃ¨me !?",06-17-2021,Cool-Intention9207,10.0,nvda has gone mad he thinks hes a mÃ¨me,negative,0.7549872,,,109,109_nvda_split_200_amd,2021-06-17
51704,"Daily Discussion Thread for June 28, 2021",CLOV to $20+,06-28-2021,alredopie,11.0,clov to 20,neutral,0.78661144,,,10,10_12_11_break_hit,2021-06-28
49736,"Daily Discussion Thread for June 23, 2021",RKT BOUTTA EXPLODE!,06-23-2021,ThatTapDancingGinger,10.0,rkt boutta explode,neutral,0.65658283,,,87,87_rkt_solar_blasting_flys,2021-06-23
45868,"Weekend Discussion Thread for the Weekend of June 11, 2021","I can tell you one thing...

Battlefield 2042 is gonna be lit",06-13-2021,Im_Blind_And_Deaf,11.0,i can tell you one thing battlefield 2042 is gonna be lit,positive,0.64251465,,,174,174_420_420s_420c_fulfilled,2021-06-13
42940,"Weekend Discussion Thread for the Weekend of June 04, 2021","Iâ€™m here to make money and be retarded.

^And ^Iâ€™m ^all ^out ^of ^money",06-04-2021,DJBarber89,16.0,im here to make money and be retarded and im all out of money,negative,0.7624334,,,-1,-1_spce_000_price_bags,2021-06-04
45147,"Daily Discussion Thread for June 11, 2021",wkhs popping off,06-11-2021,aldoowner,22.0,wkhs popping off,neutral,0.7163947,,,16,16_wkhs_wsb_wsbs_crew,2021-06-11
42091,"Daily Discussion Thread for June 03, 2021","BB going up, and up! Tomorrow itâ€™s $25 dollars easy!!! ğŸš€ğŸš€ğŸš€ğŸŒ•ğŸŒ•ğŸŒ•ğŸ’ğŸ¤²ğŸ»",06-03-2021,Cryptoaddict141,39.0,bb going up and up tomorrow its 25 dollars easy,positive,0.6837186,,bb,-1,-1_spce_000_price_bags,2021-06-03
46805,"Daily Discussion Thread for June 15, 2021",Nothing but good news about $CLF so of course it's a red day,06-15-2021,on_duh_pooper,12.0,nothing but good news about clf so of course its a red day,positive,0.95064586,,,83,83_clf_clfs_clne_boing,2021-06-15
47851,"Daily Discussion Thread for June 18, 2021",11h11 Make a $WISH,06-18-2021,Captain_French,16.0,11h11 make a wish,neutral,0.8010623,,,10,10_12_11_break_hit,2021-06-18
43630,"Daily Discussion Thread for June 07, 2021",BB Short Squeeze at USD 22,06-07-2021,Buero129,14.0,bb short squeeze at usd 22,neutral,0.8828209,,bb,1,1_priced_sale_discount_price,2021-06-07
45822,"Weekend Discussion Thread for the Weekend of June 11, 2021",Just lost 3k in roulette betting 1/3 of the numbers. After 30 rolls and never hitting a number i was done and left. Gf is big mad,06-12-2021,Prodegen,11.0,just lost 3k in roulette betting 1 3 of the numbers after 30 rolls and never hitting a number i was done and left gf is big mad,negative,0.8920722,,,40,40_5k_20k_30k_3k,2021-06-12
45539,"Daily Discussion Thread for June 11, 2021",Just ripped bong and doubled down my TLRY and MSOS positions,06-11-2021,RadicalMeatBeater,13.0,just ripped bong and doubled down my tlry and msos positions,negative,0.5257361,,,31,31_tlry_moving_awakens_tlghey,2021-06-11
47612,"Daily Discussion Thread for June 17, 2021",CLOV GREEN DAY PLS GOD ğŸ€,06-17-2021,nguyenad,9.0,clov green day pls god,neutral,0.60713005,,,105,105_dildo_dildos_giant_massive,2021-06-17
43281,"Daily Discussion Thread for June 07, 2021",ğŸŒ±Weed Stonks. TLRY. Get ready to blast off.,06-07-2021,Emergency-Narwhal-28,29.0,weed stonks tlry get ready to blast off,neutral,0.7412973,,,39,39_weed_smoked_cannabis_legalization,2021-06-07
49217,"Daily Discussion Thread for June 22, 2021",Ya boy just slammed $900 into CLOV OTM options. Back to even here I come!!!,06-22-2021,dvdr1029,16.0,ya boy just slammed 900 into clov otm options back to even here i come,neutral,0.4811595,,,75,75_clov_medicare_grabbed_upgraded,2021-06-22
50702,"Daily Discussion Thread for June 25, 2021",palantards doing da thing,06-25-2021,im_priced_in,13.0,palantards doing da thing,neutral,0.7003566,,,66,66_palantir_palantards_palantard_ashes,2021-06-25
41603,"Daily Discussion Thread for June 02, 2021",I really got in BB at 16$ğŸ¤¡,06-02-2021,austindpaige,32.0,i really got in bb at 16,neutral,0.7577826,,bb,10,10_12_11_break_hit,2021-06-02
43353,"Daily Discussion Thread for June 07, 2021",CLOV and CLNE the CC-pack for your moon journey,06-07-2021,fickdichdock,23.0,clov and clne the cc pack for your moon journey,neutral,0.8686794,,,25,25_mooning_moon_mission_pluto,2021-06-07
52477,"Daily Discussion Thread for June 30, 2021",-8.5% on DIDI. Maybe I made the wrong move buying 1000 at 15.98 ğŸ˜ğŸ˜ğŸ˜,06-30-2021,FearlessTrader,8.0,8 5 on didi maybe i made the wrong move buying 1000 at 15 98,negative,0.62033314,,,-1,-1_spce_000_price_bags,2021-06-30
44108,"Daily Discussion Thread for June 08, 2021",Trying to get some tickets for the CLNE party. LetÂ´s see if I am too late.,06-08-2021,Autumla,15.0,trying to get some tickets for the clne party let s see if i am too late,neutral,0.7073034,,,-1,-1_spce_000_price_bags,2021-06-08
48888,"Daily Discussion Thread for June 21, 2021","Now that CLNE was removed from most popular, no one is putting into it now lol...",06-21-2021,Ice_Wallowpis,13.0,now that clne was removed from most popular no one is putting into it now lol,neutral,0.4706262,,,3,3_clne_clov_clovtards_poppin,2021-06-21
51076,"Weekend Discussion Thread for the Weekend of June 25, 2021",Weekend thread is extra level retard.,06-26-2021,False-Box2223,10.0,weekend thread is extra level retard,negative,0.7775322,,,46,46_weekends_weekend_friday_monday,2021-06-26
46305,"Daily Discussion Thread for June 14, 2021",CLNE didnâ€™t hear no bell,06-14-2021,hallett21,20.0,clne didnt hear no bell,neutral,0.64846104,,,324,324_bell_ring_ringing_heard,2021-06-14
49474,"Daily Discussion Thread for June 22, 2021",Clov can go to 15 by end of day easy,06-22-2021,disruptivecowman,9.0,clov can go to 15 by end of day easy,positive,0.5443111,,,-1,-1_spce_000_price_bags,2021-06-22
49893,"Daily Discussion Thread for June 23, 2021",$CLNE Will CRUSH earnings in August.  We will see a melt up into earnings.  I used to work for a company that does the exact same thing as CLNE.  That market is EXPLODING!,06-23-2021,ArachnidBeneficial61,10.0,clne will crush earnings in august we will see a melt up into earnings i used to work for a company that does the exact same thing as clne that market is exploding,negative,0.5127882,,,106,106_clne_million_shares_share,2021-06-23
51746,"Daily Discussion Thread for June 29, 2021","BB, CLNE, and AMC are the plays of the day. Youâ€™re welcome",06-29-2021,andrewbutter5,28.0,bb clne and amc are the plays of the day youre welcome,positive,0.9714148,,bb,184,184_momentum_amcc_ganggg_breakaway,2021-06-29
42418,"Daily Discussion Thread for June 04, 2021",Diamond Hands $BB letâ€™s go!!! ğŸ’ğŸ¤²ğŸ»ğŸš€ğŸš€ğŸš€ğŸŒ•ğŸŒ•ğŸŒ•,06-04-2021,Cryptoaddict141,29.0,diamond hands bb lets go,neutral,0.5831519,,bb,136,136_diamond_hands_hand_handing,2021-06-04
46639,"Daily Discussion Thread for June 15, 2021",LMFAO GOEV printing as a expected,06-15-2021,oldfagbtw,15.0,lmfao goev printing as a expected,neutral,0.57837033,,,82,82_goev_gourd_gourds_ornamental,2021-06-15
46105,"Daily Discussion Thread for June 14, 2021",GET ON WISH IM IN HEAVY,06-14-2021,negativenetworths,23.0,get on wish im in heavy,neutral,0.7191532,,,17,17_wishing_wishes_wishy_foundation,2021-06-14
41043,"Daily Discussion Thread for June 01, 2021",$BB bb ğŸš€ğŸš€ğŸš€ğŸš€ğŸš€ğŸš€,06-01-2021,BullishBearishBiz,24.0,bb bb,neutral,0.59049946,,bb,287,287_pop_bubble_bbbbbbbbbb_shark,2021-06-01
47026,"Daily Discussion Thread for June 16, 2021",Who else is scared to look at their portfolio ğŸ’€,06-16-2021,Real-Kryometric,15.0,who else is scared to look at their portfolio,negative,0.6975989,,,7,7_portfolio_portfolios_ruin_bleed,2021-06-16
49504,"Daily Discussion Thread for June 23, 2021",Yâ€™all remember when CLOV was 20. Good times,06-23-2021,betaraywill,18.0,yall remember when clov was 20 good times,positive,0.537525,,,-1,-1_spce_000_price_bags,2021-06-23
45071,"Daily Discussion Thread for June 10, 2021",sens the new move?,06-10-2021,CalCalCha,12.0,sens the new move,neutral,0.773187,,,151,151_sens_volume_kicking_flying,2021-06-10
45140,"Daily Discussion Thread for June 11, 2021",WKHS just popping,06-11-2021,Cold_Goose_4242,24.0,wkhs just popping,neutral,0.71705246,,,16,16_wkhs_wsb_wsbs_crew,2021-06-11
45537,"Daily Discussion Thread for June 11, 2021",Com On TLRY - I know you have it in you !!!!   ğŸ™ğŸš€ğŸš€ğŸš€ğŸš€ğŸš€ğŸ˜,06-11-2021,PoPz1963,13.0,com on tlry i know you have it in you,neutral,0.52727526,,,31,31_tlry_moving_awakens_tlghey,2021-06-11
50353,"Daily Discussion Thread for June 24, 2021",WKHS lookin good this morning! ğŸš€,06-24-2021,Shooter0331,9.0,wkhs lookin good this morning,positive,0.9651068,,,-1,-1_spce_000_price_bags,2021-06-24
44170,"Daily Discussion Thread for June 09, 2021",$WISH $20 EOD,06-09-2021,dudebuddie,34.0,wish 20 eod,neutral,0.8167559,,,67,67_eod_eow_15_eom,2021-06-09
41471,"Daily Discussion Thread for June 02, 2021","Finally boarded the BB train, we out",06-02-2021,jamdivi,35.0,finally boarded the bb train we out,neutral,0.7835289,,bb,-1,-1_spce_000_price_bags,2021-06-02
42853,"Weekend Discussion Thread for the Weekend of June 04, 2021","Countless times this year, Iâ€™ve won thousands of dollars gambling on apps. Countless times I was also drunk and ended up giving it all back, and then some. I put myself in a rough spot, so Iâ€™m liquidating probably my whole portfolio tomorrow to try and get out of the hole Iâ€™m in.

Then Iâ€™m quitting drinking. Itâ€™s been a net negative on my life for a while. Having to sell everything will be the cherry on top of my struggles with addiction. Lesson learned and Iâ€™m going to get better. Iâ€™m going to be better.

I canâ€™t tell my family or friends, so you all get to hear my problems. Good luck this week!",06-06-2021,L_Bron_Hovered,28.0,countless times this year ive won thousands of dollars gambling on apps countless times i was also drunk and ended up giving it all back and then some i put myself in a rough spot so im liquidating probably my whole portfolio tomorrow to try and get out of the hole im in then im quitting drinking its been a net negative on my life for a while having to sell everything will be the cherry on top of my struggles with addiction lesson learned and im going to get better im going to be better i cant tell my family or friends so you all get to hear my problems good luck this week,positive,0.513357,,,21,21_casino_gambling_addiction_gamble,2021-06-06
44329,"Daily Discussion Thread for June 09, 2021",cow farts never smelt so good,06-09-2021,salty_fishguts,24.0,cow farts never smelt so good,positive,0.63272744,,,189,189_farts_cow_fart_farted,2021-06-09
40994,"Daily Discussion Thread for June 01, 2021",Bb is the coolest,06-01-2021,DashTrash4life,33.0,bb is the coolest,positive,0.9694054,,bb,-1,-1_spce_000_price_bags,2021-06-01
44000,"Daily Discussion Thread for June 08, 2021",This WISH power hour is about to be insane,06-08-2021,vslash9,16.0,this wish power hour is about to be insane,positive,0.4665415,,,76,76_power_pow_energy_lit,2021-06-08
46083,"Daily Discussion Thread for June 14, 2021",I love waking up in a $CLNE bed ğŸ“ˆ,06-14-2021,_Moltac,21.0,i love waking up in a clne bed,positive,0.9783211,,,-1,-1_spce_000_price_bags,2021-06-14
41393,"Daily Discussion Thread for June 02, 2021",WHAT ARE YOU DOING STEP **BB**RO?,06-02-2021,South_Onion,244.0,what are you doing step bb ro,neutral,0.904232,,bb,-1,-1_spce_000_price_bags,2021-06-02
42474,"Daily Discussion Thread for June 04, 2021",You're not losing money on BB until you sell. HODL,06-04-2021,frankieholmes447,27.0,youre not losing money on bb until you sell hodl,neutral,0.6707537,,bb,1,1_priced_sale_discount_price,2021-06-04
42371,"Daily Discussion Thread for June 04, 2021",BB is ready for take off!ğŸš€ğŸš€ğŸš€ğŸš€ğŸŒ•ğŸŒ•ğŸŒ•ğŸŒ•,06-04-2021,Grand-Concentrate-56,30.0,bb is ready for take off,neutral,0.7185719,,bb,123,123_rocket_rockets_rocketship_takeoff,2021-06-04
50589,"Daily Discussion Thread for June 25, 2021","Looking back, my biggest regrets were selling when I was scared. Iâ€™m not selling CLOV",06-25-2021,CreepyBet8062,13.0,looking back my biggest regrets were selling when i was scared im not selling clov,negative,0.8401146,,,75,75_clov_medicare_grabbed_upgraded,2021-06-25
42263,"Daily Discussion Thread for June 03, 2021","Trust the plan, BB will prevail before the days end. Donâ€™t give in to the fear. We will win.",06-03-2021,wizardweed420hexesit,30.0,trust the plan bb will prevail before the days end dont give in to the fear we will win,positive,0.5672372,,bb,-1,-1_spce_000_price_bags,2021-06-03
52290,"Daily Discussion Thread for June 30, 2021",NIO 55 EOD / TSLA 700 EOD. LEt's go,06-30-2021,Apprehensive-Box-107,10.0,nio 55 eod tsla 700 eod lets go,neutral,0.7572934,,nio,-1,-1_spce_000_price_bags,2021-06-30
41459,"Daily Discussion Thread for June 02, 2021",Hold BB too much volume and its increasing,06-02-2021,VictoryLane704,38.0,hold bb too much volume and its increasing,neutral,0.7261391,,bb,60,60_volume_volumes_200m_avg,2021-06-02
52078,"Daily Discussion Thread for June 29, 2021",Well I guess itâ€™s SOFI today ğŸ¤·â€â™€ï¸ in at 19.18. Wish me luck.,06-29-2021,Betty_White_23,11.0,well i guess its sofi today in at 19 18 wish me luck,positive,0.7716509,,,30,30_sofi_fa_charter_sos,2021-06-29
50003,"Daily Discussion Thread for June 24, 2021",Puff puff pass...thank you TLRY,06-24-2021,Andymilez,19.0,puff puff pass thank you tlry,positive,0.8991102,,,-1,-1_spce_000_price_bags,2021-06-24
42156,"Daily Discussion Thread for June 03, 2021","Imagine BB hitting $50 today...canâ€™t believe Iâ€™m becoming an ape, but buy and hold",06-03-2021,order_66_man,32.0,imagine bb hitting 50 today cant believe im becoming an ape but buy and hold,neutral,0.5640596,,bb,-1,-1_spce_000_price_bags,2021-06-03
42575,"Daily Discussion Thread for June 04, 2021",ğŸ™ğŸ™ BB NO MORNING DIP TODAY PLEASE,06-04-2021,likewhythough,24.0,bb no morning dip today please,neutral,0.69490206,,bb,2,2_dips_dipping_dip_dipped,2021-06-04
41150,"Daily Discussion Thread for June 01, 2021",BB,06-01-2021,jj302,23.0,bb,neutral,0.5110977,,bb,79,79_uh_psth_yep_gimme,2021-06-01
45024,"Daily Discussion Thread for June 10, 2021",UWMC lookin juicy,06-10-2021,itzbranman,12.0,uwmc lookin juicy,neutral,0.50464517,,uwm,15,15_uwmc_uwm_marines_10c,2021-06-10
41718,"Daily Discussion Thread for June 02, 2021","I see you ğŸ…±ï¸ğŸ…±ï¸, 
Shakinâ€™ dat ass,
Shakinâ€™ dat ass!",06-02-2021,Nelz16,27.0,i see you shakin dat ass shakin dat ass,negative,0.47701117,,,533,533_shakin_slap_dat_scratch,2021-06-02
45293,"Daily Discussion Thread for June 11, 2021",Guess Iâ€™m going to buy some SENS WISH calls at open ğŸ–•,06-11-2021,scottt1112,14.0,guess im going to buy some sens wish calls at open,neutral,0.86076957,,,0,0_expire_expiring_call_expired,2021-06-11
45413,"Daily Discussion Thread for June 11, 2021",Time to invest in solar!!! The sun just came out and said itâ€™s not leaving anytime soon. Wow! Holy cow thatâ€™s bullish.,06-11-2021,Small_Guava_8545,13.0,time to invest in solar the sun just came out and said its not leaving anytime soon wow holy cow thats bullish,positive,0.9495249,,,-1,-1_spce_000_price_bags,2021-06-11
48838,"Daily Discussion Thread for June 21, 2021","Just give the WISHers their own thread at this point, they deserve it",06-21-2021,heinous-hippo,15.0,just give the wishers their own thread at this point they deserve it,neutral,0.61390305,,,17,17_wishing_wishes_wishy_foundation,2021-06-21
41773,"Daily Discussion Thread for June 02, 2021",AMC...AMC...AMC ONWARD TO $100,06-02-2021,JRod_Canes,27.0,amc amc amc onward to 100,neutral,0.7909457,,amc,416,416_bang_scaring_deepfuckingvalue_attack,2021-06-02
47888,"Daily Discussion Thread for June 18, 2021",Has my WISH ğŸš€ finally arrived? ğŸ¤·ğŸ»â€â™‚ï¸,06-18-2021,Cozy_Coconuts,42.0,has my wish finally arrived,positive,0.68490434,,,17,17_wishing_wishes_wishy_foundation,2021-06-18
44278,"Daily Discussion Thread for June 09, 2021",TILRAY IS FUCKIN DOING IT,06-09-2021,poopsocknig,29.0,tilray is fuckin doing it,negative,0.6281152,,,122,122_tilray_tilly_tilrays_tilrayyyy,2021-06-09
42235,"Daily Discussion Thread for June 03, 2021","Yâ€™all can give up hope but BB is just getting itâ€™s rockets ready rn, Iâ€™m HODL!!!! LETS GOOOOO BB ğŸš€ WE GOING TO THE MOON",06-03-2021,DatWolf07,27.0,yall can give up hope but bb is just getting its rockets ready rn im hodl lets gooooo bb we going to the moon,positive,0.69704586,,bb,25,25_mooning_moon_mission_pluto,2021-06-03
51732,"Daily Discussion Thread for June 29, 2021","Legally, CLOV can only fuck the shorts if sheâ€™s $18.",06-29-2021,dvdr1029,37.0,legally clov can only fuck the shorts if shes 18,negative,0.9268708,,,135,135_shorts_cover_covered_sweating,2021-06-29
52349,"Daily Discussion Thread for June 30, 2021","Sofi volume returning to normal levels. Lock up expiration shares finally sold out, dip absorbed really well. Now we consolodate and ğŸš€",06-30-2021,Degenerated_dreamer,9.0,sofi volume returning to normal levels lock up expiration shares finally sold out dip absorbed really well now we consolodate and,positive,0.63307685,,,9,9_0dte_sold_expiring_loss,2021-06-30
51308,"Daily Discussion Thread for June 28, 2021",A lot of SoFi shilling after SoFi complaints this morning. ğŸ¤·â€â™‚ï¸,06-28-2021,-bjorn,18.0,a lot of sofi shilling after sofi complaints this morning,negative,0.6205702,,,30,30_sofi_fa_charter_sos,2021-06-28
44127,"Daily Discussion Thread for June 08, 2021","Corporate sponsored spam of the day...WISH. 

96% owned by institutions. Good job hedgies you fooled some apes.",06-08-2021,DLew13,15.0,corporate sponsored spam of the day wish 96 owned by institutions good job hedgies you fooled some apes,negative,0.73213756,,,-1,-1_spce_000_price_bags,2021-06-08
45867,"Weekend Discussion Thread for the Weekend of June 11, 2021",Fairly sad story. We had warm weather and then a freeze in the spring. Our tulips ğŸŒ· never bloomed this year.,06-13-2021,toydan,11.0,fairly sad story we had warm weather and then a freeze in the spring our tulips never bloomed this year,negative,0.81935745,,,180,180_hurricane_coast_texas_weather,2021-06-13
49774,"Daily Discussion Thread for June 23, 2021",$PLTR breaking out of a right range. Buying weeklies.,06-23-2021,BeernerdoMazzeroli,10.0,pltr breaking out of a right range buying weeklies,neutral,0.79605496,,,-1,-1_spce_000_price_bags,2021-06-23
43309,"Daily Discussion Thread for June 07, 2021",# CLNE,06-07-2021,TendieRoosevelt,24.0,clne,neutral,0.54826427,,,-1,-1_spce_000_price_bags,2021-06-07
47513,"Daily Discussion Thread for June 17, 2021",CLOV NATION TONIGHT WE DINE IN HELL,06-17-2021,banana_lau,10.0,clov nation tonight we dine in hell,negative,0.7662579,,,3,3_clne_clov_clovtards_poppin,2021-06-17
52089,"Daily Discussion Thread for June 29, 2021",$WISH printing,06-29-2021,reactbooter,11.0,wish printing,neutral,0.77138513,,,17,17_wishing_wishes_wishy_foundation,2021-06-29
42673,"Daily Discussion Thread for June 04, 2021",Great buying opportunity for BB,06-04-2021,frankieholmes447,21.0,great buying opportunity for bb,positive,0.9395318,,bb,1,1_priced_sale_discount_price,2021-06-04
50815,"Daily Discussion Thread for June 25, 2021",I sold almost all of my SPCE 7/9 40c the other day for â€œonlyâ€ 104% profit. Canâ€™t wait to see the remaining 5 contracts today!,06-25-2021,Safeword_is_more,10.0,i sold almost all of my spce 7 9 40c the other day for only 104 profit cant wait to see the remaining 5 contracts today,positive,0.8302846,,,-1,-1_spce_000_price_bags,2021-06-25
48190,"Daily Discussion Thread for June 18, 2021","On a day like this I hold on to my losses and sell the few that have been up. Some positions I've even added to.  I'm predicting Monday to be a down day too, but by Tuesday and Wednesday things to balance out and go back up. I'm not trained at trading or a professional just been playing around and managing my own portfolio for about a decade. In it for the long game and only invest what I don't need today.",06-18-2021,DHSCowboy,10.0,on a day like this i hold on to my losses and sell the few that have been up some positions ive even added to im predicting monday to be a down day too but by tuesday and wednesday things to balance out and go back up im not trained at trading or a professional just been playing around and managing my own portfolio for about a decade in it for the long game and only invest what i dont need today,neutral,0.5061272,,,-1,-1_spce_000_price_bags,2021-06-18
44592,"Daily Discussion Thread for June 09, 2021","I got 1k shares of WISH loaded up, cost basis $9.20",06-09-2021,GuwopGOAT,19.0,i got 1k shares of wish loaded up cost basis 9 20,neutral,0.90882194,,,1,1_priced_sale_discount_price,2021-06-09
42861,"Weekend Discussion Thread for the Weekend of June 04, 2021",ğŸ…±ï¸angğŸ…±ï¸ros,06-06-2021,LonelySwinger,24.0,ang ros,neutral,0.66726863,,,161,161_orph_orning_eekend_ears,2021-06-06
41146,"Daily Discussion Thread for June 01, 2021",I just had the biggest fart and AMC went up .15 cents immediately afterwards. BRB gotta hit up Taco Bell real quick ğŸš€,06-01-2021,Kindly_Media_2528,23.0,i just had the biggest fart and amc went up 15 cents immediately afterwards brb gotta hit up taco bell real quick,negative,0.57270783,,amc,-1,-1_spce_000_price_bags,2021-06-01
43921,"Daily Discussion Thread for June 08, 2021",Better get into WISH now before the AH's launch....,06-08-2021,ConversationCapable6,18.0,better get into wish now before the ahs launch,neutral,0.8275211,,,17,17_wishing_wishes_wishy_foundation,2021-06-08
51800,"Daily Discussion Thread for June 29, 2021",Realist PT for CLOV: $65,06-29-2021,your-local-austist,20.0,realist pt for clov 65,neutral,0.86340535,,,3,3_clne_clov_clovtards_poppin,2021-06-29
47776,"Daily Discussion Thread for June 18, 2021",Volume picking up on WISH letâ€™s feast ğŸ¦ğŸ¦,06-18-2021,reggiekushx420,37.0,volume picking up on wish lets feast,positive,0.5700632,,,60,60_volume_volumes_200m_avg,2021-06-18
44122,"Daily Discussion Thread for June 08, 2021",$clne seems to be the play. Only thing not on a rocket ship right now,06-08-2021,sloshed_up,17.0,clne seems to be the play only thing not on a rocket ship right now,neutral,0.7210176,,,-1,-1_spce_000_price_bags,2021-06-08
41697,"Daily Discussion Thread for June 02, 2021","To all the January Diamond Hand BB holders, we're coming for you",06-02-2021,Ok_Leadership2956,27.0,to all the january diamond hand bb holders were coming for you,neutral,0.8521299,,bb,136,136_diamond_hands_hand_handing,2021-06-02
51158,"Weekend Discussion Thread for the Weekend of June 25, 2021","401ks piss me off so much. People act like its the only way to retire. You cant touch the money until your ready to die. Sure take the free money, but how about save your self and have some actual buying power for opportunity. Look for passive income. Donâ€™t be a slave to the system. Have a brain with your money. Take the free money, but be weary the system is designed to keep you working.",06-27-2021,wooderboy1,8.0,401ks piss me off so much people act like its the only way to retire you cant touch the money until your ready to die sure take the free money but how about save your self and have some actual buying power for opportunity look for passive income dont be a slave to the system have a brain with your money take the free money but be weary the system is designed to keep you working,negative,0.82685727,,stem,206,206_401k_retire_retirement_retiring,2021-06-27
48029,"Daily Discussion Thread for June 18, 2021",Palantards drooling â™¿ï¸â™¿ï¸â™¿ï¸,06-18-2021,gooZisdope,10.0,palantards drooling,neutral,0.5066963,,,66,66_palantir_palantards_palantard_ashes,2021-06-18
44222,"Daily Discussion Thread for June 09, 2021",Buying up WISH on this mini dip! Let's get that 20 bread,06-09-2021,iosappsrock,29.0,buying up wish on this mini dip lets get that 20 bread,neutral,0.73091555,,,302,302_seventy_forty_sixs_six,2021-06-09
48127,"Daily Discussion Thread for June 18, 2021",UWMC 10c hanging in the balance who needs sports itâ€™s always been green v red,06-18-2021,Bindi93,10.0,uwmc 10c hanging in the balance who needs sports its always been green v red,neutral,0.8176089,,uwm,15,15_uwmc_uwm_marines_10c,2021-06-18
45376,"Daily Discussion Thread for June 11, 2021",UWM looking bullish AF!,06-11-2021,tallpaulpaultall,14.0,uwm looking bullish af,positive,0.8014484,,uwm,15,15_uwmc_uwm_marines_10c,2021-06-11
46797,"Daily Discussion Thread for June 15, 2021",Whoâ€™s buying DKNG calls?,06-15-2021,summitrock,13.0,whos buying dkng calls,neutral,0.81876546,,,132,132_dkng_mob_nfl_vices,2021-06-15
51962,"Daily Discussion Thread for June 29, 2021",SoFLY me to the moonğŸš€ğŸ¦ğŸŒ™,06-29-2021,ccampzz35,14.0,sofly me to the moon,neutral,0.5370198,,,159,159_moon_mooning_saturn_blue,2021-06-29
51131,"Weekend Discussion Thread for the Weekend of June 25, 2021","Bout to eat crayons, sniff glue and order a fleshlight off the $wish app",06-26-2021,GypsyRikes,10.0,bout to eat crayons sniff glue and order a fleshlight off the wish app,neutral,0.5134014,,,282,282_crayons_pencils_crayon_helmet,2021-06-26
43394,"Daily Discussion Thread for June 07, 2021",CLNE all day!!! Mr oohhhhh soo CLNE,06-07-2021,Hotrickz,22.0,clne all day mr oohhhhh soo clne,neutral,0.72157276,,,3,3_clne_clov_clovtards_poppin,2021-06-07
50203,"Daily Discussion Thread for June 24, 2021",PLTR may legit have a gamma squeeze tomorrow.  So many calls ITM now compared to Monday.  Open interest on FD's is between 10k and 25k for strikes 25-30.  With 28 at 70k volume today.  If this moves another dollar tomorrow all hell breaks loose.,06-24-2021,Raspilito,11.0,pltr may legit have a gamma squeeze tomorrow so many calls itm now compared to monday open interest on fds is between 10k and 25k for strikes 25 30 with 28 at 70k volume today if this moves another dollar tomorrow all hell breaks loose,negative,0.5361269,,,-1,-1_spce_000_price_bags,2021-06-24
50703,"Daily Discussion Thread for June 25, 2021",Pltr stuck at 27 stilll??? Holy fuck this is a war not a battle ladies,06-25-2021,Wididy,12.0,pltr stuck at 27 stilll holy fuck this is a war not a battle ladies,negative,0.9586041,,,14,14_25_30_38_break,2021-06-25
43484,"Daily Discussion Thread for June 07, 2021",CLNE and SPCE doing the lords work on my portfolio. FROM THE ASHES APES.,06-07-2021,R154,18.0,clne and spce doing the lords work on my portfolio from the ashes apes,neutral,0.6545632,,,-1,-1_spce_000_price_bags,2021-06-07
56331,"Daily Discussion Thread for July 12, 2021",Bezos furiously masturbating right now,07-12-2021,lavishcoat,37.0,bezos furiously masturbating right now,negative,0.5946535,,,231,231_cum_lube_vasectomy_vaseline,2021-07-12
60039,"Daily Discussion Thread for July 22, 2021",I can feel APPL silently judging the rest of my portfolio,07-22-2021,OpusL,16.0,i can feel appl silently judging the rest of my portfolio,neutral,0.5520364,,,7,7_portfolio_portfolios_ruin_bleed,2021-07-22
54572,"Daily Discussion Thread for July 07, 2021","NEGG: *rips 100% and goes deep out of the call chain*

NEGG: hyuck Iâ€™ll fuckin do it again",07-07-2021,walter1021,10.0,negg rips 100 and goes deep out of the call chain negg hyuck ill fuckin do it again,neutral,0.42483008,,,169,169_negg_79_fomo_holders,2021-07-07
62859,"Daily Discussion Thread for July 29, 2021",Imagine investing in NKLA. My brain is leaking from my ears after reading tards try to spin the news to be bullish.,07-29-2021,thebumfuzzle98,10.0,imagine investing in nkla my brain is leaking from my ears after reading tards try to spin the news to be bullish,negative,0.8434572,,,325,325_nkla_nke_revenue_tards,2021-07-29
55900,"Weekend Discussion Thread for the Weekend of July 09, 2021",Theta gang are gonna be the winners on SPCE this week,07-11-2021,Kwpthrowaway,13.0,theta gang are gonna be the winners on spce this week,positive,0.8378063,,,62,62_theta_gang_wins_thetagang,2021-07-11
55787,"Weekend Discussion Thread for the Weekend of July 09, 2021","Hahaha suck it, England",07-11-2021,Stonky69McStonkface,15.0,hahaha suck it england,negative,0.8528857,,,33,33_china_chinese_chinas_usa,2021-07-11
58303,"Daily Discussion Thread for July 16, 2021",Ok SPY let's go green now,07-16-2021,Cold_Goose_4242,8.0,ok spy lets go green now,neutral,0.5930124,,,119,119_closes_ends_finishes_end,2021-07-16
60143,"Daily Discussion Thread for July 22, 2021","Company gave me a 1k bonus but no raise, might be time to jump ship",07-22-2021,Pizanch,9.0,company gave me a 1k bonus but no raise might be time to jump ship,neutral,0.5099264,,,-1,-1_spce_000_price_bags,2021-07-22
58446,"Weekend Discussion Thread for the Weekend of July 16, 2021","got my ass eaten, balls and dick sucked at the same time by 3 asian hookers cuz i had puts this week. am i gay cuz i like my asshole tickled? just asking for a friend",07-17-2021,Rokine,12.0,got my ass eaten balls and dick sucked at the same time by 3 asian hookers cuz i had puts this week am i gay cuz i like my asshole tickled just asking for a friend,negative,0.9138587,,,-1,-1_spce_000_price_bags,2021-07-17
62450,"Daily Discussion Thread for July 28, 2021","a TLRY suspension, maybe?",07-28-2021,felipelives,11.0,a tlry suspension maybe,neutral,0.76164305,,,31,31_tlry_moving_awakens_tlghey,2021-07-28
62435,"Daily Discussion Thread for July 28, 2021",Sentiment in here is wildly bullish. Does this mean we tank at open?,07-28-2021,CaptTriage,11.0,sentiment in here is wildly bullish does this mean we tank at open,neutral,0.60352933,,,268,268_bullish_bearish_sentiment_uncertainties,2021-07-28
63631,"Weekend Discussion Thread for the Weekend of July 30, 2021",I've been shitting in my gas tank and it's not working. All this clean energy methane shit is fucking fake.,07-31-2021,HookersForDahl2017,12.0,ive been shitting in my gas tank and its not working all this clean energy methane shit is fucking fake,negative,0.9817631,,,357,357_rally_gas_bamboozle_silverado,2021-07-31
52641,"Daily Discussion Thread for July 01, 2021",Sofi getting morning wood,07-01-2021,Psyched4this,15.0,sofi getting morning wood,neutral,0.8090636,,,30,30_sofi_fa_charter_sos,2021-07-01
57244,"Daily Discussion Thread for July 14, 2021",Turns out the N shaped recovery my portfolio was following is actually an M shaped bag formation,07-14-2021,ItsManBearPig22,11.0,turns out the n shaped recovery my portfolio was following is actually an m shaped bag formation,neutral,0.80740285,,,7,7_portfolio_portfolios_ruin_bleed,2021-07-14
61974,"Daily Discussion Thread for July 27, 2021",pretty gay day tbh,07-27-2021,eyuuuuu,10.0,pretty gay day tbh,negative,0.6113217,,,-1,-1_spce_000_price_bags,2021-07-27
56621,"Daily Discussion Thread for July 13, 2021",NOK NOK NOK-ing on heaven's door,07-13-2021,mexicanjker,49.0,nok nok nok ing on heavens door,neutral,0.73037577,,,126,126_nok_5g_nokkin_nok2021,2021-07-13
54766,"Daily Discussion Thread for July 08, 2021",Bro. How is premarket down only 1.5% it feels like -20%,07-08-2021,JohnnyAutist,71.0,bro how is premarket down only 1 5 it feels like 20,neutral,0.5112233,,,146,146_premarket_premarkets_trust_led,2021-07-08
57106,"Daily Discussion Thread for July 14, 2021",Iâ€™m 97% leveraged into SPY 436 puts expiring today,07-14-2021,notrly_ty,12.0,im 97 leveraged into spy 436 puts expiring today,neutral,0.8713915,,,9,9_0dte_sold_expiring_loss,2021-07-14
55378,"Daily Discussion Thread for July 09, 2021",SPY calls printing today,07-09-2021,HippyWawa,10.0,spy calls printing today,neutral,0.894277,,,84,84_printing_print_printer_printed,2021-07-09
62983,"Daily Discussion Thread for July 29, 2021","We're not here to let the hood get robbed, we are here to rob the hood.",07-29-2021,wickedmen030,10.0,were not here to let the hood get robbed we are here to rob the hood,negative,0.54120225,,bb,34,34_hood_ipo_rob_retail,2021-07-29
54668,"Daily Discussion Thread for July 07, 2021",Nothing like instantly melting a paycheck on some fds so itâ€™s like u didnâ€™t work the past two weeks ğŸ˜µâ€ğŸ’«,07-07-2021,aqjingson,9.0,nothing like instantly melting a paycheck on some fds so its like u didnt work the past two weeks,negative,0.63184834,,,235,235_salary_raise_paycheque_pay,2021-07-07
56591,"Daily Discussion Thread for July 13, 2021",You feeling it now mr. krabs??? NOK2021,07-13-2021,DestinyBreach,15.0,you feeling it now mr krabs nok2021,neutral,0.91039455,,,126,126_nok_5g_nokkin_nok2021,2021-07-13
57646,"Daily Discussion Thread for July 15, 2021","Investing Pro-Tip: Timing the market and time in the market can be equally important. If you hide behind the magazine stand, your local Mini Market's clerk may lock you in while closing shop. All the food is now yours.",07-15-2021,ebfeebfe,12.0,investing pro tip timing the market and time in the market can be equally important if you hide behind the magazine stand your local mini markets clerk may lock you in while closing shop all the food is now yours,neutral,0.6627714,,,-1,-1_spce_000_price_bags,2021-07-15
56425,"Daily Discussion Thread for July 12, 2021",AAPL make my pp tingle,07-12-2021,Ifyouknowyouknow18,10.0,aapl make my pp tingle,neutral,0.6845381,,,-1,-1_spce_000_price_bags,2021-07-12
53091,"Daily Discussion Thread for July 02, 2021",CLOSE THE CASINO!!!!!,07-02-2021,Johnny_Menace,14.0,close the casino,neutral,0.60176986,,,-1,-1_spce_000_price_bags,2021-07-02
62248,"Daily Discussion Thread for July 28, 2021",TLRY making me ğŸ’¦ğŸ’¦ğŸ’¦,07-28-2021,HotStockSlinger,18.0,tlry making me,neutral,0.7128356,,,31,31_tlry_moving_awakens_tlghey,2021-07-28
59432,"Daily Discussion Thread for July 20, 2021","Just got my 1st shot, it was moderna right before MRNA tanked. Puts on my life ğŸ¥²",07-20-2021,Rodrigo87,9.0,just got my 1st shot it was moderna right before mrna tanked puts on my life,neutral,0.70306426,,moderna,103,103_mrna_cure_pricing_mrnas,2021-07-20
53716,"Weekend Discussion Thread for the Weekend of July 02, 2021",So why is it private?,07-03-2021,RedditDani,8.0,so why is it private,neutral,0.72064006,,,-1,-1_spce_000_price_bags,2021-07-03
63673,"Weekend Discussion Thread for the Weekend of July 30, 2021","God, itâ€™s not even the day before the market opens. This is the worst",07-31-2021,godsidea,12.0,god its not even the day before the market opens this is the worst,negative,0.96533763,,,-1,-1_spce_000_price_bags,2021-07-31
60911,"Weekend Discussion Thread for the Weekend of July 23, 2021",I took some Viagra last night for my sunburn. It didn't cure it but it kept the sheets off my legs.,07-24-2021,Duffbeers71,81.0,i took some viagra last night for my sunburn it didnt cure it but it kept the sheets off my legs,neutral,0.594654,,,524,524_viagra_supercuts_hulk_clips,2021-07-24
52763,"Daily Discussion Thread for July 01, 2021",Bye bye memes,07-01-2021,majorhassel,10.0,bye bye memes,negative,0.46095175,,,-1,-1_spce_000_price_bags,2021-07-01
56899,"Daily Discussion Thread for July 13, 2021",Yall ever wake up the next morning like damn I really jacked it to that weird shit last night,07-13-2021,Wedonotbecomeone,30.0,yall ever wake up the next morning like damn i really jacked it to that weird shit last night,negative,0.7766631,,,-1,-1_spce_000_price_bags,2021-07-13
56125,"Daily Discussion Thread for July 12, 2021",Fuck it all in clov if I die I die,07-12-2021,jnkrumah96,21.0,fuck it all in clov if i die i die,negative,0.9595034,,,3,3_clne_clov_clovtards_poppin,2021-07-12
56033,"Weekend Discussion Thread for the Weekend of July 09, 2021","Wife clears out our fridge for her brotherâ€™s family visit and takes out all my beer and puts it in a closet. 

Nothing some ice cubes or mixed drinks canâ€™t cure, but that some messed up shit.",07-10-2021,toydan,10.0,wife clears out our fridge for her brothers family visit and takes out all my beer and puts it in a closet nothing some ice cubes or mixed drinks cant cure but that some messed up shit,negative,0.9583338,,,-1,-1_spce_000_price_bags,2021-07-10
63299,"Daily Discussion Thread for July 30, 2021",Money = gone,07-30-2021,Icommandyou,9.0,money gone,neutral,0.56752723,,,28,28_losing_lose_lost_losses,2021-07-30
59597,"Daily Discussion Thread for July 21, 2021",Just FOMO'ed into CLOV otm calls. Fuck me.,07-21-2021,cow_grass,25.0,just fomoed into clov otm calls fuck me,negative,0.93620723,,,-1,-1_spce_000_price_bags,2021-07-21
58210,"Daily Discussion Thread for July 16, 2021",Michael Burry jacked to the tits right now,07-16-2021,AlmightyCheesusCrust,9.0,michael burry jacked to the tits right now,negative,0.53287816,,,73,73_burry_burrys_twitter_tweets,2021-07-16
59675,"Daily Discussion Thread for July 21, 2021",Fuck a bear CLOV taking off finally,07-21-2021,RandomsDoom,12.0,fuck a bear clov taking off finally,negative,0.78511494,,,3,3_clne_clov_clovtards_poppin,2021-07-21
59904,"Daily Discussion Thread for July 21, 2021","Stop looking at futures/index PM

Apple is red, which means the market is fukk

It's literally that simple",07-21-2021,LovableContrarian,7.0,stop looking at futures index pm apple is red which means the market is fukk its literally that simple,negative,0.71697164,,,-1,-1_spce_000_price_bags,2021-07-21
57655,"Daily Discussion Thread for July 15, 2021",Jim Cramer is so horny for Mark Wahlberg that he is going to ask him naughty questions.,07-15-2021,gimmethemshoes11,10.0,jim cramer is so horny for mark wahlberg that he is going to ask him naughty questions,negative,0.5510246,,,37,37_cramer_jim_cramers_faber,2021-07-15
59893,"Daily Discussion Thread for July 21, 2021",Lol. F to spy bars,07-21-2021,Unitedtendies,8.0,lol f to spy bars,neutral,0.78794336,,,-1,-1_spce_000_price_bags,2021-07-21
53225,"Daily Discussion Thread for July 02, 2021","A guy here said a few days ago if CLNE goes under 10, he would give away his gf.
Well I am here to collect!",07-02-2021,Eclipsia07,10.0,a guy here said a few days ago if clne goes under 10 he would give away his gf well i am here to collect,neutral,0.63273245,,,-1,-1_spce_000_price_bags,2021-07-02
54444,"Daily Discussion Thread for July 07, 2021",Next time I'll take profits,07-07-2021,whatthefiggtyfuck,12.0,next time ill take profits,neutral,0.77929103,,,41,41_profits_profit_greed_earnings,2021-07-07
55125,"Daily Discussion Thread for July 08, 2021",Pltr is the worse stock in history I swear. Nasdaq red she goes down nasdaq green she also goes down,07-08-2021,idanfl8,12.0,pltr is the worse stock in history i swear nasdaq red she goes down nasdaq green she also goes down,negative,0.958918,,,4,4_investor_growth_investing_invest,2021-07-08
60529,"Daily Discussion Thread for July 23, 2021",Stupid bears were so happy Mondayâ€¦stupid bears hate money,07-23-2021,Niceguyy81,11.0,stupid bears were so happy monday stupid bears hate money,negative,0.91841525,,,-1,-1_spce_000_price_bags,2021-07-23
56953,"Daily Discussion Thread for July 13, 2021",I flew a little too close to the sun on SPY it seems lmao,07-13-2021,FistPunch_Vol_4,8.0,i flew a little too close to the sun on spy it seems lmao,neutral,0.5959079,,,-1,-1_spce_000_price_bags,2021-07-13
58915,"Daily Discussion Thread for July 19, 2021",SPCE gone up cos everyone wanting to escape this world,07-19-2021,Walms82,13.0,spce gone up cos everyone wanting to escape this world,neutral,0.61903137,,,104,104_spce_frontier_spice_flight,2021-07-19
54665,"Daily Discussion Thread for July 07, 2021","Hurricane update: Still have wifi, wind feels nice",07-07-2021,o3Zany,9.0,hurricane update still have wifi wind feels nice,positive,0.9308837,,,180,180_hurricane_coast_texas_weather,2021-07-07
58146,"Daily Discussion Thread for July 16, 2021","Got my battery charge to 100% and I'm ready for the day.

Also here's all my options expiring today. http://imgur.com/a/dnmt0hJ",07-16-2021,everlastingdeath,10.0,got my battery charge to 100 and im ready for the day also heres all my options expiring today http imgur com a dnmt0hj,positive,0.6163597,,,-1,-1_spce_000_price_bags,2021-07-16
56580,"Daily Discussion Thread for July 13, 2021",Market correction over. Just rally already so I can forget about my puts.,07-13-2021,Putmycallupyourput,16.0,market correction over just rally already so i can forget about my puts,neutral,0.60297704,,,-1,-1_spce_000_price_bags,2021-07-13
60002,"Daily Discussion Thread for July 21, 2021",Anybody watching CLOV's lil climb? It's nice to see green again.,07-21-2021,reformafinch,18.0,anybody watching clovs lil climb its nice to see green again,positive,0.9565863,,,105,105_dildo_dildos_giant_massive,2021-07-21
61486,"Daily Discussion Thread for July 26, 2021",This is the week--lambos or food stamps...,07-26-2021,Buy-High_Sell_low,9.0,this is the week lambos or food stamps,neutral,0.7708085,,,560,560_stamps_food_stamp_kraft,2021-07-26
60017,"Daily Discussion Thread for July 22, 2021",Aurora Borealis? At this time of year? At this time of day? In this part of the country? Localized entirely within your kitchen?,07-22-2021,CelineHuckleberry,25.0,aurora borealis at this time of year at this time of day in this part of the country localized entirely within your kitchen,neutral,0.904917,,,43,43_closed_opens_opening_monday,2021-07-22
54192,"Daily Discussion Thread for July 06, 2021",NIO KEEP GOING,07-06-2021,Roadhog_rides_again,9.0,nio keep going,positive,0.5934199,,nio,209,209_nio_jellyfish_nipsey_niorway,2021-07-06
53409,"Daily Discussion Thread for July 02, 2021",Made so much money last week just to turn around and lose a majority of my gains this week. Fun.,07-02-2021,thelundyy,8.0,made so much money last week just to turn around and lose a majority of my gains this week fun,positive,0.5562297,,,64,64_gains_gain_gone_erased,2021-07-02
58127,"Daily Discussion Thread for July 16, 2021","In hindsight, buying SPY calls when we were trading at $437 may have been a bad move.",07-16-2021,jamesjay2,10.0,in hindsight buying spy calls when we were trading at 437 may have been a bad move,negative,0.6624099,,,0,0_expire_expiring_call_expired,2021-07-16
55604,"Daily Discussion Thread for July 09, 2021",SOFI MACD and RSI 1 min lines are right at the bottom. THIS IS WHERE WE PUSH FOR A BULL RUN! ğŸ¥‚ğŸ”¥ğŸš€,07-09-2021,StonedTurtle420710,8.0,sofi macd and rsi 1 min lines are right at the bottom this is where we push for a bull run,neutral,0.6644144,,,-1,-1_spce_000_price_bags,2021-07-09
60591,"Daily Discussion Thread for July 23, 2021",SPY call is the ultimate cheat code in this world.,07-23-2021,davidbigham,10.0,spy call is the ultimate cheat code in this world,negative,0.8899332,,,-1,-1_spce_000_price_bags,2021-07-23
60436,"Daily Discussion Thread for July 22, 2021",Drill Team 6 please report to Akamai immediately,07-22-2021,Donkeycow15,6.0,drill team 6 please report to akamai immediately,neutral,0.71634674,,,86,86_drill_drilling_duty_morale,2021-07-22
58356,"Weekend Discussion Thread for the Weekend of July 16, 2021","Weekend over-sharing time: my best friend in high school (RIP) had the biggest weiner I've ever seen in real life or porn to this day. It destroyed my PP confidence for years until I realized he was a freak of nature. Like full cucumber soft!?!?!?

/football locker room before u ask.",07-17-2021,t33po,19.0,weekend over sharing time my best friend in high school rip had the biggest weiner ive ever seen in real life or porn to this day it destroyed my pp confidence for years until i realized he was a freak of nature like full cucumber soft football locker room before u ask,negative,0.8997541,,,-1,-1_spce_000_price_bags,2021-07-17
56710,"Daily Discussion Thread for July 13, 2021","I wasnâ€™t going to buy SPY FDs today, waiting for it to drop. But then it just kept going up, and I thought to myself - man SPY is going to do it again, wtf, Iâ€™m in. Welp, I bought the top today.",07-13-2021,Sprockethead,11.0,i wasnt going to buy spy fds today waiting for it to drop but then it just kept going up and i thought to myself man spy is going to do it again wtf im in welp i bought the top today,neutral,0.46259427,,,-1,-1_spce_000_price_bags,2021-07-13
56797,"Daily Discussion Thread for July 13, 2021","JPOW speaking tomorrow.

You know what that means. $SPY gonna dip before sharply recovering like it always does.",07-13-2021,JoanOfSnarke,9.0,jpow speaking tomorrow you know what that means spy gonna dip before sharply recovering like it always does,neutral,0.700134,,,2,2_dips_dipping_dip_dipped,2021-07-13
57126,"Daily Discussion Thread for July 14, 2021",Jpow just said we should yolo,07-14-2021,Oktay23,12.0,jpow just said we should yolo,neutral,0.7938274,,,237,237_yolo_yolos_yolod_yoloed,2021-07-14
60985,"Weekend Discussion Thread for the Weekend of July 23, 2021","mods:

â£¿â£¿â£¿â£¿â£¿â¢Ÿâ£¯â£µâ£¿â£¿â£·â£¦â£­â£¶â£¶â£¶â£¶â£¤â£€â €â €â € â¡‡â ¹â£¿â£¿â¢¯â£¾â£¿â£¿â£¿â£¿â£¿â£¿â£¿â£¿â£¿â£¿â£¿â£¿â£¿â£¿â£·â¡„â € â¡‡â ¶â¢ˆâ£µâ£¿â£¿â£¿â£¿â£¿â£¿â£¿â£¿â£¿â£¿â£¿â¡Ÿâ¢¿â£¿â£¿â£¿â£¿â£¿â¡„ â££â£¶â£¿â£¿â£¿â£¿â£¿â£¿â£¿â£¿â£¿â£¿â£¿â£¿â£¿â£¿â£¿â£¿â£¿â£¿â£¿â£¿â¡‡ â£¿â£¿â£¿â£¿â£¿â£¿â£¿â£¿â£¿â£¿â£¿â£¿â¡¿â Ÿâ£¡â£¿â£¿â¡Ÿâ£¿â£¿â¡¿â Ÿâ € â£¿â£¿â£¿â£¿â£¿â£¿â£¿â£¿â£¿â£¿â¡¿â â €â¢šâ£¹â£¿â£¿â €â €â£¤â£¤â¡„â € â£¿â£¿â£¿â£¿â£¿â£¿â£¿â Ÿâ ‹â â¢ â €â €â£¼â£¿â£¿â£·â£¿â¡†â¢»â¡¿â €â € â£¿â£¿â£¿â¡¿â Ÿâ ‰â €â €â –â ‚â €â €â£¶â ¹â£¿â£¿â¡¿â ¿â ƒâ¡œâ â €â € â ¿â ›â£¡â£´â£¾â£¿â£¿â£¿â£·â£„â â£¼â£¿â£·â£¦â €â €â °â â €â €â €â € â£´â£¿â£¿â£¿â£¿â£¿â£¿â£¿â£¿â£¿â¡†â¢¿â£¿â¡¿â¢ƒâ£´â£¦â£¤â£€â ‹â €â£€â¡¤ â£¿â£¿â£¿â£¿â£¿â£¿â£¿â£¿â£¿â£¿â¡·â£¶â£¯â£´â£¿â£¿â£¿â£¿â£¿â¡†â €â ˆâ  â£¿â£¿â£¿â£¿â£¿â£¿â£¿â£¿â£¿â£¿â¡â£¿â£¿â¡â£¿â£¿â£¿â£¿â£¿â£·â €â €â € â£¿â£¿â£¿â£¿â£¿â£¿â£¿â£¿â£¿â¡¿â €â£¿â£¿â£€â£Œâ¢¿â£¿â£¿â£¿â£¿â¡€â €â € â£¿â£¿â£¿â£¿â£¿â£¿â£¿â£¿â£¿â ‡â €â£¿â£¿â£¿â£¿â¢ˆâ£¿â£¿â£¿â£¿â¡‡â¢€â € â£¿â£¿â£¿â£¿â£¿â£¿â£¿â£¿â¡¿â €â €â ˆâ ‹â â €â£¼â£¿â£¿â£¿â£¿â¡‡â¢¸â¡„ â£¿â£¿â£¿â£¿â£¿â£¿â£¿â£¿â ƒâ €â¢¸â£¿â£¿â €â¢°â£¿â£¿â£¿â£¿â£¿â â¢¸â¡‡ â£¿â£¿â£¿â£¿â£¿â£¿â£¿â â €â €â£¼â£¿â¡â €â£¼â£¿â£¿â£¿â£¿â£¿â €â¢¸â£‡ â£¿â£¿â£¿â£¿â£¿â£¿â¡Ÿâ €â  â €â£¿â¡¿â €â €â£¿â£¿â£¿â£¿â£¿â£¿â €â¢¸â£‡",07-25-2021,Morsxy,14.0,mods,neutral,0.45606974,,,-1,-1_spce_000_price_bags,2021-07-25
54574,"Daily Discussion Thread for July 07, 2021",20 minutes till market panic?,07-07-2021,Stocomx,10.0,20 minutes till market panic,neutral,0.57304,,,43,43_closed_opens_opening_monday,2021-07-07
55706,"Weekend Discussion Thread for the Weekend of July 09, 2021","(removes pants, enters chatroom)",07-10-2021,Duffbeers71,20.0,removes pants enters chatroom,neutral,0.79789454,,,431,431_pants_unzips_pulls_removes,2021-07-10
56090,"Daily Discussion Thread for July 12, 2021",So CLOV actually gonna do something into power hour?,07-12-2021,UntilNegStayPos,30.0,so clov actually gonna do something into power hour,neutral,0.8684613,,,-1,-1_spce_000_price_bags,2021-07-12
55552,"Daily Discussion Thread for July 09, 2021",Who is thinking to jump in $PUBM???,07-09-2021,Rauf_KB,8.0,who is thinking to jump in pubm,neutral,0.83636534,,,-1,-1_spce_000_price_bags,2021-07-09
53332,"Daily Discussion Thread for July 02, 2021",TSLA up 8 pennies. Iâ€™ll take it,07-02-2021,miketarann,8.0,tsla up 8 pennies ill take it,neutral,0.7346618,,tsla,-1,-1_spce_000_price_bags,2021-07-02
60574,"Daily Discussion Thread for July 23, 2021",Itâ€™s wonderful to see roaring economy and obliterated meme stocks.,07-23-2021,FelixJuggl3r,12.0,its wonderful to see roaring economy and obliterated meme stocks,positive,0.94768023,,,24,24_meme_memes_boomer_memestock,2021-07-23
63877,"Weekend Discussion Thread for the Weekend of July 30, 2021","No wonder Chipotle is at 1900. Motherfuckers increase their prices slightly when it's on deliver mode let alone apply a service fee cause it's ""digitally convenient"" when ordering. $10 order magically turns into $17 in two taps

Giving the small taco shops my dad's money from now on",07-31-2021,RH_Fucked_My_Account,10.0,no wonder chipotle is at 1900 motherfuckers increase their prices slightly when its on deliver mode let alone apply a service fee cause its digitally convenient when ordering 10 order magically turns into 17 in two taps giving the small taco shops my dads money from now on,negative,0.505803,,,-1,-1_spce_000_price_bags,2021-07-31
57167,"Daily Discussion Thread for July 14, 2021",â€œI KNOW ITS NOT YOUR JOB TO COMMENT ON FISCAL POLICY BUT CAN YOU COMMENT ON FISCSL POLICY???â€,07-14-2021,Zurkarak,10.0,i know its not your job to comment on fiscal policy but can you comment on fiscsl policy,neutral,0.6288683,,,-1,-1_spce_000_price_bags,2021-07-14
56289,"Daily Discussion Thread for July 12, 2021",Ok CLOV... Grab your bag we're going on a road trip .,07-12-2021,Mysterious_Hat_1890,10.0,ok clov grab your bag were going on a road trip,neutral,0.84372693,,,-1,-1_spce_000_price_bags,2021-07-12
54700,"Daily Discussion Thread for July 07, 2021",I had an Amazon call that I sold for 500 profit yesterday and today itâ€™s worth 15k ğŸ¦­,07-07-2021,sebas1337g,9.0,i had an amazon call that i sold for 500 profit yesterday and today its worth 15k,positive,0.5102853,,,-1,-1_spce_000_price_bags,2021-07-07
54206,"Daily Discussion Thread for July 06, 2021","Doubled down on my SPY puts, so you're welcome for the V shaped recovery.",07-06-2021,HellsCmingWthMe,8.0,doubled down on my spy puts so youre welcome for the v shaped recovery,positive,0.9003245,,,307,307_shaped_recovery_shape_recoveries,2021-07-06
63096,"Daily Discussion Thread for July 30, 2021","it's so incredibly obvious that we are going green

it's so obvious i'm doubting myself",07-30-2021,Baadllama,26.0,its so incredibly obvious that we are going green its so obvious im doubting myself,negative,0.4584489,,,11,11_red_color_reds_jpow,2021-07-30
54329,"Daily Discussion Thread for July 07, 2021",The bag holding in NEGG is gonna be in the history books,07-07-2021,Gyata97,29.0,the bag holding in negg is gonna be in the history books,neutral,0.6802543,,,169,169_negg_79_fomo_holders,2021-07-07
57929,"Daily Discussion Thread for July 16, 2021",Puts today ?,07-16-2021,applecake89,17.0,puts today,neutral,0.86892146,,,-1,-1_spce_000_price_bags,2021-07-16
58903,"Daily Discussion Thread for July 19, 2021","**The July Space Race:**

Richard's Branson's Virgin Galactic

Jeff Bezos's Blue Origin

United States' Covid Chart",07-19-2021,Blyadhole,13.0,the july space race richards bransons virgin galactic jeff bezoss blue origin united states covid chart,neutral,0.91405964,,,167,167_bezos_space_rocket_billionaires,2021-07-19
53290,"Daily Discussion Thread for July 02, 2021","I max out my 401k, HSA, and Roth IRA not to be responsible, but solely to make myself feel better about how dog shit I am at trading options.",07-02-2021,seesaw32,9.0,i max out my 401k hsa and roth ira not to be responsible but solely to make myself feel better about how dog shit i am at trading options,negative,0.66563016,,,-1,-1_spce_000_price_bags,2021-07-02
59061,"Daily Discussion Thread for July 19, 2021",This dip will dip further,07-19-2021,lazy_starman,10.0,this dip will dip further,neutral,0.51864934,,,2,2_dips_dipping_dip_dipped,2021-07-19
60356,"Daily Discussion Thread for July 22, 2021",Morning dump while taking a morning dump,07-22-2021,good-times-,7.0,morning dump while taking a morning dump,neutral,0.5316567,,,108,108_dump_dumping_dumps_dumpster,2021-07-22
54248,"Daily Discussion Thread for July 06, 2021",Amazon on its way to $4k by EOY,07-06-2021,RoyalFail6,8.0,amazon on its way to 4k by eoy,neutral,0.5620741,,,240,240_amazon_catalog_etsy_ecomm,2021-07-06
60923,"Weekend Discussion Thread for the Weekend of July 23, 2021","People on Twitter make bold claims with no data

Saw a tweet that had 24k likes that said:

_â€pandemic babiesâ€ are excelling so rapidly b/c parents are actually home to raise and nurture them_

Pandemic babies are like a year old

What are they excelling at? Pooping? Crawling?

Thereâ€™s literally no data to support this",07-24-2021,eyerollingsex,23.0,people on twitter make bold claims with no data saw a tweet that had 24k likes that said _ pandemic babies are excelling so rapidly b c parents are actually home to raise and nurture them_ pandemic babies are like a year old what are they excelling at pooping crawling theres literally no data to support this,negative,0.7575184,,twitter,-1,-1_spce_000_price_bags,2021-07-24
57706,"Daily Discussion Thread for July 15, 2021",Corsair is down almost 30% from its high just one month ago. WOW,07-15-2021,RemarkableScarcity8,9.0,corsair is down almost 30 from its high just one month ago wow,negative,0.4597429,,corsair,278,278_corsair_gaming_pcs_e3,2021-07-15
63128,"Daily Discussion Thread for July 30, 2021",# SPY BACK AT LEVELS HAVEN'T SEEN SINCE YESTERDAY LMFAOOOO,07-30-2021,nosalute,17.0,spy back at levels havent seen since yesterday lmfaoooo,negative,0.5123513,,,-1,-1_spce_000_price_bags,2021-07-30
60088,"Daily Discussion Thread for July 22, 2021","NVDA just ran into the room, opened his trench coat exposing his giant green wang, then left.",07-22-2021,KirbyAWD,12.0,nvda just ran into the room opened his trench coat exposing his giant green wang then left,neutral,0.81765634,,,109,109_nvda_split_200_amd,2021-07-22
57687,"Daily Discussion Thread for July 15, 2021",I will be doing a one man performance of Deepthroat by the Wendy's dumpster on Friday night. General admission will be 1 jr chocolate frosty.,07-15-2021,quarantrader,10.0,i will be doing a one man performance of deepthroat by the wendys dumpster on friday night general admission will be 1 jr chocolate frosty,neutral,0.87423766,,,63,63_wendys_dumpster_mcdonalds_careers,2021-07-15
62766,"Daily Discussion Thread for July 29, 2021",GDP miss? Bullish,07-29-2021,QuickCorner2678,12.0,gdp miss bullish,neutral,0.5314035,,,-1,-1_spce_000_price_bags,2021-07-29
59544,"Daily Discussion Thread for July 20, 2021",I think I actually did something smart. I converted my 7/23 425 calls into an equal amount of 7/23 432 calls and took some nice hefty profits but still ridin the bull,07-20-2021,SuckMyBootyMilk,9.0,i think i actually did something smart i converted my 7 23 425 calls into an equal amount of 7 23 432 calls and took some nice hefty profits but still ridin the bull,positive,0.8604871,,,0,0_expire_expiring_call_expired,2021-07-20
57002,"Daily Discussion Thread for July 14, 2021",holding CLNE thru the pain,07-14-2021,akeasy,21.0,holding clne thru the pain,neutral,0.7874624,,,-1,-1_spce_000_price_bags,2021-07-14
58341,"Weekend Discussion Thread for the Weekend of July 16, 2021","Why do blow up dolls cost so much?

*Inflation.*",07-18-2021,12345charlie,23.0,why do blow up dolls cost so much inflation,negative,0.9050899,,,54,54_inflation_cpi_prices_higher,2021-07-18
55325,"Daily Discussion Thread for July 09, 2021",reeeeee,07-09-2021,zjz,12.0,reeeeee,neutral,0.57041824,,,413,413_reeeeeeeeeeeeeee_reeeeeeeee_reeeeeeeeee_reeeee,2021-07-09
60519,"Daily Discussion Thread for July 23, 2021",Chinese stocks look a little disoriented today,07-23-2021,Chafeynipples,13.0,chinese stocks look a little disoriented today,negative,0.78234696,,,33,33_china_chinese_chinas_usa,2021-07-23
61915,"Daily Discussion Thread for July 27, 2021",Are you guys having fun? I am not,07-27-2021,NotRobotNFL,10.0,are you guys having fun i am not,neutral,0.4390686,,,242,242_fun_boring_entertained_bored,2021-07-27
61638,"Daily Discussion Thread for July 26, 2021",TAL Hope no one fell for that one...yikes,07-26-2021,TheDudeAbidesFarOut,6.0,tal hope no one fell for that one yikes,negative,0.8111603,,,-1,-1_spce_000_price_bags,2021-07-26
62166,"Daily Discussion Thread for July 27, 2021",Is spy recovering or is it drill team 6? Light the beacon!!!!! Jpow please save us,07-27-2021,SPICYLEMONBUM69,6.0,is spy recovering or is it drill team 6 light the beacon jpow please save us,neutral,0.7936578,,,-1,-1_spce_000_price_bags,2021-07-27
55033,"Daily Discussion Thread for July 08, 2021",Spy calls are literally free money right now,07-08-2021,CoronavirusWithLime,12.0,spy calls are literally free money right now,neutral,0.5393483,,,0,0_expire_expiring_call_expired,2021-07-08
54685,"Daily Discussion Thread for July 07, 2021",Bought SPY puts in case the minutes are bad.,07-07-2021,HippyWawa,11.0,bought spy puts in case the minutes are bad,neutral,0.59119815,,,9,9_0dte_sold_expiring_loss,2021-07-07
61589,"Daily Discussion Thread for July 26, 2021","Weed gang, I love you guys and I'm holding with you, but damn does it hurt being weed gang right now lol",07-26-2021,min-tea-rose,9.0,weed gang i love you guys and im holding with you but damn does it hurt being weed gang right now lol,positive,0.7377211,,,39,39_weed_smoked_cannabis_legalization,2021-07-26
