,Submission Title,Comment,Date Posted,Author,Score,ProcessedComments,SentimentLabel,SentimentProb,HumanSentiment,StockSearch,Topic,Name,Date
74997,"Daily Discussion Thread for August 31, 2021",How is it possible for 2 weeks straight I have done nothing but buy the top of everything,08-31-2021,LouisGrip,8.0,how is it possible for 2 weeks straight i have done nothing but buy the top of everything,negative,0.45434287,,,-1,-1_spce_000_price_bags,2021-08-31
68225,"Daily Discussion Thread for August 13, 2021",WISH loss porn shouldn’t be posted until after the open flush. Lmao,08-13-2021,boobalube,17.0,wish loss porn shouldnt be posted until after the open flush lmao,negative,0.6636858,,,74,74_porn_pornhub_content_hentai,2021-08-13
70651,"Daily Discussion Thread for August 19, 2021",Ah yes the classic “Fuck everyone in the asshole” pattern,08-19-2021,JpowYellen3some,9.0,ah yes the classic fuck everyone in the asshole pattern,negative,0.9483154,,,-1,-1_spce_000_price_bags,2021-08-19
73216,"Daily Discussion Thread for August 26, 2021",Just wanted to point out that the CEO of SPY was not at Kabul airport.,08-26-2021,basicbish55,8.0,just wanted to point out that the ceo of spy was not at kabul airport,neutral,0.8201339,,,93,93_taliban_afghanistan_kabul_afghan,2021-08-26
66940,"Daily Discussion Thread for August 10, 2021","Only one way to stop this dump, 0DTE puts are a sacrifice I’m willing to make",08-10-2021,DestroyerOfToilets,13.0,only one way to stop this dump 0dte puts are a sacrifice im willing to make,negative,0.5215227,,,78,78_ebay_snap_sacrifice_profit,2021-08-10
71886,"Daily Discussion Thread for August 23, 2021",Amd calls so easy...,08-23-2021,captainlumbo,7.0,amd calls so easy,positive,0.80502576,,,48,48_amd_intel_ryzen_83,2021-08-23
73191,"Daily Discussion Thread for August 26, 2021","Is SPY healing ❤️‍🩹 

Or a bull trap 🪤",08-26-2021,redcedar53,7.0,is spy healing or a bull trap,neutral,0.6829295,,,90,90_trap_bull_bear_traps,2021-08-26
64831,"Daily Discussion Thread for August 04, 2021",How is Hood not in the popular ticker thread? Are mods trolling us?,08-04-2021,EatMeatPeeps,49.0,how is hood not in the popular ticker thread are mods trolling us,negative,0.64899147,,,34,34_hood_ipo_rob_retail,2021-08-04
69105,"Daily Discussion Thread for August 16, 2021",Taliban going to make everyone wear sheets again.  Calls on BBBY.,08-16-2021,spinxter,14.0,taliban going to make everyone wear sheets again calls on bbby,neutral,0.7102687,,bb,93,93_taliban_afghanistan_kabul_afghan,2021-08-16
66745,"Daily Discussion Thread for August 09, 2021","Damn.. HOOD gave up 10% gain. If that bitch goes red, she’s taking the express way to $40 

-Fellow put holder",08-09-2021,Hector3603,7.0,damn hood gave up 10 gain if that bitch goes red shes taking the express way to 40 fellow put holder,negative,0.84539014,,,34,34_hood_ipo_rob_retail,2021-08-09
74451,"Daily Discussion Thread for August 30, 2021",Retard retailer investors back in school that’s why there’s 0 volume.,08-30-2021,Fit-Mycologist-6951,10.0,retard retailer investors back in school thats why theres 0 volume,negative,0.48602232,,,-1,-1_spce_000_price_bags,2021-08-30
67147,"Daily Discussion Thread for August 10, 2021",Cow farts go THPPTPHTPHPHHPH,08-10-2021,bigassrobots,7.0,cow farts go thpptphtphphhph,negative,0.77927506,,,189,189_farts_cow_fart_farted,2021-08-10
67057,"Daily Discussion Thread for August 10, 2021",Wait CLOV go back up,08-10-2021,Kant_touch,23.0,wait clov go back up,neutral,0.7733402,,,3,3_clne_clov_clovtards_poppin,2021-08-10
74710,"Daily Discussion Thread for August 31, 2021",About time CRSR does something,08-31-2021,JennaTollwarts,17.0,about time crsr does something,neutral,0.71409696,,,69,69_crsr_censored_earnings_analyst,2021-08-31
65698,"Daily Discussion Thread for August 06, 2021",$500 to $11k to zero on two occasions. Am I doing this right?,08-06-2021,Unitedtendies,17.0,500 to 11k to zero on two occasions am i doing this right,neutral,0.72315645,,,40,40_5k_20k_30k_3k,2021-08-06
72198,"Daily Discussion Thread for August 24, 2021","I have a diversified portfolio of the blue chips GME AMC and CLOV, I'm all set",08-24-2021,SKT_T1_eSports,14.0,i have a diversified portfolio of the blue chips gme amc and clov im all set,positive,0.8492523,,gme,-1,-1_spce_000_price_bags,2021-08-24
64047,"Daily Discussion Thread for August 02, 2021",CEO of SPY said the N-word yet again,08-02-2021,SlothyPotato,9.0,ceo of spy said the n word yet again,negative,0.8102855,,,-1,-1_spce_000_price_bags,2021-08-02
66453,"Weekend Discussion Thread for the Weekend of August 06, 2021",when will they create penis enlargement? I need it desperately as I am a 4 incher.,08-08-2021,tyloner,7.0,when will they create penis enlargement i need it desperately as i am a 4 incher,neutral,0.4900595,,,158,158_penis_dick_cock_enlargement,2021-08-08
73714,"Daily Discussion Thread for August 27, 2021",CLNE is slowly waking up.,08-27-2021,COWIRSHING,8.0,clne is slowly waking up,neutral,0.6357277,,,3,3_clne_clov_clovtards_poppin,2021-08-27
74502,"Daily Discussion Thread for August 30, 2021",I would like to welcome all of the new ROOT bagholders. Cookies and punch are over there ------->,08-30-2021,ihpsdm,10.0,i would like to welcome all of the new root bagholders cookies and punch are over there,positive,0.9623156,,,-1,-1_spce_000_price_bags,2021-08-30
68047,"Daily Discussion Thread for August 12, 2021",Only fools buy eBay at the Buy It Now price.  Put in a low bid and see what happens.,08-12-2021,spinxter66,9.0,only fools buy ebay at the buy it now price put in a low bid and see what happens,negative,0.6207729,,,240,240_amazon_catalog_etsy_ecomm,2021-08-12
67134,"Daily Discussion Thread for August 10, 2021",Citadel short laddering the whole market? 😂,08-10-2021,chimp-to-the-moon,7.0,citadel short laddering the whole market,neutral,0.7487324,,,254,254_ladder_attack_attacks_ladders,2021-08-10
69291,"Daily Discussion Thread for August 16, 2021","What do you use for market analysis? 

Me: RH Gold and Reddit Premium",08-16-2021,PanickyLemur,10.0,what do you use for market analysis me rh gold and reddit premium,neutral,0.89925635,,,-1,-1_spce_000_price_bags,2021-08-16
67499,"Daily Discussion Thread for August 11, 2021",lol when you make $79 and feel like thats an appropriate stopping point for the day.,08-11-2021,jenzos,10.0,lol when you make 79 and feel like thats an appropriate stopping point for the day,neutral,0.55833536,,,-1,-1_spce_000_price_bags,2021-08-11
73696,"Daily Discussion Thread for August 27, 2021","Y'all know SPY? Pretty cool dude, he is.",08-27-2021,kjkenney,8.0,yall know spy pretty cool dude he is,positive,0.9583137,,,5,5_forming_spys_pattern_sideways,2021-08-27
65367,"Daily Discussion Thread for August 05, 2021",I bought SOFI again guys so im sorry it went down,08-05-2021,iamthetimby,9.0,i bought sofi again guys so im sorry it went down,negative,0.89193904,,,30,30_sofi_fa_charter_sos,2021-08-05
67888,"Daily Discussion Thread for August 12, 2021",Oh wow PPI numbers are worse Holy shit,08-12-2021,LouisGrip,11.0,oh wow ppi numbers are worse holy shit,negative,0.9703012,,,359,359_pp_ppi_measure_precise,2021-08-12
64350,"Daily Discussion Thread for August 03, 2021",is it possible to evict tenants living rent free in my head?,08-03-2021,Unemployable1593,31.0,is it possible to evict tenants living rent free in my head,neutral,0.592656,,,85,85_housing_rent_homeless_landlord,2021-08-03
70952,"Daily Discussion Thread for August 20, 2021",500k loss guy is a retard,08-20-2021,bluen,30.0,500k loss guy is a retard,negative,0.9698305,,,-1,-1_spce_000_price_bags,2021-08-20
72329,"Daily Discussion Thread for August 24, 2021",Next GME dip hopefully all the retards in denial buy more .,08-24-2021,Productpusher,11.0,next gme dip hopefully all the retards in denial buy more,negative,0.6022024,,gme,2,2_dips_dipping_dip_dipped,2021-08-24
68039,"Daily Discussion Thread for August 12, 2021",Aaand... everyone is dead.,08-12-2021,dasgrmn,9.0,aaand everyone is dead,negative,0.85594976,,,272,272_dead_die_thy_alive,2021-08-12
71339,"Weekend Discussion Thread for the Weekend of August 20, 2021",Pleas open market 🥺,08-21-2021,JpowYellen3some,12.0,pleas open market,neutral,0.7539535,,,43,43_closed_opens_opening_monday,2021-08-21
72349,"Daily Discussion Thread for August 24, 2021","Y’all ever be chillin, and think... damn, I’d be retired if I wasn’t so fkn stupid?",08-24-2021,pervsensei11,11.0,yall ever be chillin and think damn id be retired if i wasnt so fkn stupid,negative,0.8168153,,,206,206_401k_retire_retirement_retiring,2021-08-24
70759,"Daily Discussion Thread for August 19, 2021","People who bought pokemon cards +86% YTD

People who bought stocks: -33% YTD

Go figure",08-19-2021,Fit-Mycologist-6951,9.0,people who bought pokemon cards 86 ytd people who bought stocks 33 ytd go figure,neutral,0.8470182,,,534,534_cards_pokemon_pokmon_gift,2021-08-19
66483,"Daily Discussion Thread for August 09, 2021",PLTR moon now!,08-09-2021,Dicfore,19.0,pltr moon now,neutral,0.8414559,,,25,25_mooning_moon_mission_pluto,2021-08-09
66560,"Daily Discussion Thread for August 09, 2021","MRNA was a $20 stocks right before pandemic 

Lol",08-09-2021,MLGameOver,11.0,mrna was a 20 stocks right before pandemic lol,neutral,0.7513063,,,103,103_mrna_cure_pricing_mrnas,2021-08-09
74612,"Daily Discussion Thread for August 30, 2021","holy fk, today SPY chart is basically vertical. Lmao",08-30-2021,davidbigham,9.0,holy fk today spy chart is basically vertical lmao,negative,0.60823816,,,225,225_chart_charts_astrology_zoom,2021-08-30
65156,"Daily Discussion Thread for August 04, 2021",Lmfao HOOD I’m too much of a bitch to touch that shit right now,08-04-2021,RalinVorn,7.0,lmfao hood im too much of a bitch to touch that shit right now,negative,0.9558178,,,34,34_hood_ipo_rob_retail,2021-08-04
67922,"Daily Discussion Thread for August 12, 2021",So we all just bought spy puts at the same time lol,08-12-2021,SoullessArt,13.0,so we all just bought spy puts at the same time lol,neutral,0.71628714,,,9,9_0dte_sold_expiring_loss,2021-08-12
68804,"Weekend Discussion Thread for the Weekend of August 13, 2021",UWMC Monday morning pre market 🚀,08-13-2021,SmoothBrain_Canuck,10.0,uwmc monday morning pre market,neutral,0.88162374,,uwm,15,15_uwmc_uwm_marines_10c,2021-08-13
70829,"Daily Discussion Thread for August 20, 2021",I am 100% confident I have no idea what I’m doing,08-20-2021,aSneakybutton,25.0,i am 100 confident i have no idea what im doing,positive,0.5591927,,,329,329_idea_game_runescape_understanding,2021-08-20
64057,"Daily Discussion Thread for August 02, 2021",I looked up unusual whale activity and it linked me to a picture of your mom at the grocery store.,08-02-2021,BootyOptions,10.0,i looked up unusual whale activity and it linked me to a picture of your mom at the grocery store,neutral,0.7583848,,,188,188_whale_seaworld_boat_yacht,2021-08-02
70814,"Daily Discussion Thread for August 20, 2021",A good amount of wsb soldiers have been wiped out it seems,08-20-2021,Impossible_Job_4547,66.0,a good amount of wsb soldiers have been wiped out it seems,negative,0.5464569,,,16,16_wkhs_wsb_wsbs_crew,2021-08-20
68508,"Daily Discussion Thread for August 13, 2021","Market is green but my port is down 4%+


BLOOD",08-13-2021,PoloNewt,8.0,market is green but my port is down 4 blood,neutral,0.63206244,,,-1,-1_spce_000_price_bags,2021-08-13
69311,"Daily Discussion Thread for August 16, 2021",Fuck yeah. Dead V Cat Shaped Bounce Recovery. Technically pulling my head and shoulders out a dark pool via short ladder to salute a bull flag.,08-16-2021,noddegamra,10.0,fuck yeah dead v cat shaped bounce recovery technically pulling my head and shoulders out a dark pool via short ladder to salute a bull flag,negative,0.66756994,,,219,219_cat_bounce_cats_bouncing,2021-08-16
68846,"Weekend Discussion Thread for the Weekend of August 13, 2021",Real men bottle up their tears and then periodically overcry at random movie scenes.,08-15-2021,CapnCurt81,11.0,real men bottle up their tears and then periodically overcry at random movie scenes,negative,0.7451411,,,355,355_crying_tears_cry_acne,2021-08-15
67784,"Daily Discussion Thread for August 12, 2021","Did anything new come out of John Chen's ($BB CEO) presentation yesterday? Some idiot bought 8/13 calls thinking there'd be bullish news... Plot twist, it was me.",08-12-2021,RadiantRoach,20.0,did anything new come out of john chens bb ceo presentation yesterday some idiot bought 8 13 calls thinking thered be bullish news plot twist it was me,negative,0.57906985,,bb,-1,-1_spce_000_price_bags,2021-08-12
70239,"Daily Discussion Thread for August 18, 2021",Nice Inverse bear hug forming on SPY,08-18-2021,AromaticFarmer,7.0,nice inverse bear hug forming on spy,positive,0.7346864,,,32,32_bear_bears_bull_bulls,2021-08-18
71434,"Weekend Discussion Thread for the Weekend of August 20, 2021",Calls on horse dewormer manufacturers,08-22-2021,Lacq42,9.0,calls on horse dewormer manufacturers,neutral,0.66133577,,,181,181_lambo_lambos_lamborghini_rabbits,2021-08-22
73419,"Daily Discussion Thread for August 27, 2021",I can see clearly now the bags are gone,08-27-2021,LossStunning239,18.0,i can see clearly now the bags are gone,neutral,0.6290438,,,12,12_bag_bagholders_bags_bagger,2021-08-27
69975,"Daily Discussion Thread for August 18, 2021","*Dear Michael Burry, I wrote you but still ain’t calling. I shorted and bought puts on ARK right at the bottom…*",08-18-2021,DancepantsX,15.0,dear michael burry i wrote you but still aint calling i shorted and bought puts on ark right at the bottom,neutral,0.5268795,,,107,107_inverse_buys_switch_lose,2021-08-18
64369,"Daily Discussion Thread for August 03, 2021",Sounds like HOOD naysayers are letting their emotions get the best of them. Just fucking make some money.,08-03-2021,grigsbie,20.0,sounds like hood naysayers are letting their emotions get the best of them just fucking make some money,negative,0.9317499,,,34,34_hood_ipo_rob_retail,2021-08-03
71626,"Daily Discussion Thread for August 23, 2021","robinhood gave me an $800 credit for a ""Margin Call or Margin Call Warning we erroneously sent to you in the past that may have mistakenly prompted you to take action""",08-23-2021,AmericanHerstoryX,48.0,robinhood gave me an 800 credit for a margin call or margin call warning we erroneously sent to you in the past that may have mistakenly prompted you to take action,negative,0.5325166,,robinhood,-1,-1_spce_000_price_bags,2021-08-23
68490,"Daily Discussion Thread for August 13, 2021","My biggest red day ever. I’m not even mad, I’m impressed.",08-13-2021,NotChristina,7.0,my biggest red day ever im not even mad im impressed,positive,0.9216142,,,11,11_red_color_reds_jpow,2021-08-13
68830,"Weekend Discussion Thread for the Weekend of August 13, 2021","Meth, hookers, sneks, booze ahhh I love the weekend",08-14-2021,EatMeatPeeps,9.0,meth hookers sneks booze ahhh i love the weekend,positive,0.9669192,,,-1,-1_spce_000_price_bags,2021-08-14
72659,"Daily Discussion Thread for August 25, 2021",Only Fans reversed the decision. They will allow porn after all. Calls on SPY,08-25-2021,Icommandyou,9.0,only fans reversed the decision they will allow porn after all calls on spy,neutral,0.5791343,,,0,0_expire_expiring_call_expired,2021-08-25
67405,"Daily Discussion Thread for August 11, 2021",I am beginning to think I am not very good at this.,08-11-2021,_Jellyfisher,12.0,i am beginning to think i am not very good at this,negative,0.9264504,,,168,168_worst_sucked_suck_worse,2021-08-11
72178,"Daily Discussion Thread for August 24, 2021",yeah sry I bought GME @ 169,08-24-2021,op_spiff,13.0,yeah sry i bought gme 169,negative,0.7469255,,gme,239,239_350_250_400_285c,2021-08-24
69666,"Daily Discussion Thread for August 17, 2021",Getting margin called sucks,08-17-2021,deductiveSleuth,10.0,getting margin called sucks,negative,0.94005364,,,91,91_margin_called_call_calling,2021-08-17
71516,"Weekend Discussion Thread for the Weekend of August 20, 2021",Why the fuck did I buy puts on Fri close? I hate holding puts over a weekend.,08-22-2021,JpowYellen3some,9.0,why the fuck did i buy puts on fri close i hate holding puts over a weekend,negative,0.97689277,,,-1,-1_spce_000_price_bags,2021-08-22
69368,"Daily Discussion Thread for August 16, 2021","bears too busy cumming everywhere, they don't see jpow behind them loading up the money printer",08-16-2021,JustinianIV,8.0,bears too busy cumming everywhere they dont see jpow behind them loading up the money printer,negative,0.5480088,,,-1,-1_spce_000_price_bags,2021-08-16
72879,"Daily Discussion Thread for August 25, 2021",Doubled down on my GME calls. TAKE ME TO THE PROMISE LAND,08-25-2021,LA-Navigate,7.0,doubled down on my gme calls take me to the promise land,neutral,0.7412896,,gme,-1,-1_spce_000_price_bags,2021-08-25
74072,"Weekend Discussion Thread for the Weekend of August 27, 2021",How yall still have wives and gfs after being here all the time,08-28-2021,Trex_in_F16,30.0,how yall still have wives and gfs after being here all the time,neutral,0.537144,,,-1,-1_spce_000_price_bags,2021-08-28
71153,"Daily Discussion Thread for August 20, 2021","IQ test: If you were offered guaranteed 0.1% performance each day for the rest of your life but you couldnt leverage it, would you take it?",08-20-2021,Cygopat,8.0,iq test if you were offered guaranteed 0 1 performance each day for the rest of your life but you couldnt leverage it would you take it,negative,0.5413114,,,-1,-1_spce_000_price_bags,2021-08-20
69023,"Daily Discussion Thread for August 16, 2021",I basically worked for free this year 🤡,08-16-2021,Ilasper,40.0,i basically worked for free this year,neutral,0.6329015,,,-1,-1_spce_000_price_bags,2021-08-16
66656,"Daily Discussion Thread for August 09, 2021",Morderna is already 75% of Pfizer market cap. 😦,08-09-2021,chimp-to-the-moon,8.0,morderna is already 75 of pfizer market cap,neutral,0.847787,,,452,452_cap_billion_dash_50b,2021-08-09
65567,"Daily Discussion Thread for August 05, 2021",There is an endemic lack of fundamental understanding of how market cap works in this sub... holy hell,08-05-2021,soccerstar93,8.0,there is an endemic lack of fundamental understanding of how market cap works in this sub holy hell,negative,0.9591866,,,452,452_cap_billion_dash_50b,2021-08-05
69988,"Daily Discussion Thread for August 18, 2021",Tilray it is!!,08-18-2021,takevitamin,12.0,tilray it is,neutral,0.7405721,,,122,122_tilray_tilly_tilrays_tilrayyyy,2021-08-18
74678,"Daily Discussion Thread for August 31, 2021","I don’t get why the Wallstreet fat cats need all those monitors and supercomputers to trade milliseconds faster.. I’m a good investor and I can do it from a 4 inch phone screen with one thumb. 

Seems like they’re overcompensating for something to me",08-31-2021,VacationLover1,20.0,i dont get why the wallstreet fat cats need all those monitors and supercomputers to trade milliseconds faster im a good investor and i can do it from a 4 inch phone screen with one thumb seems like theyre overcompensating for something to me,negative,0.6412692,,,-1,-1_spce_000_price_bags,2021-08-31
64717,"Daily Discussion Thread for August 03, 2021",How can I profit off dead people in Florida?,08-03-2021,HotStockSlinger,7.0,how can i profit off dead people in florida,negative,0.87283105,,,41,41_profits_profit_greed_earnings,2021-08-03
70817,"Daily Discussion Thread for August 20, 2021","Bought HOOD yesterday at $45, sold HOOD today at $42 😎",08-20-2021,sycophantasy,48.0,bought hood yesterday at 45 sold hood today at 42,neutral,0.90343904,,,34,34_hood_ipo_rob_retail,2021-08-20
71481,"Weekend Discussion Thread for the Weekend of August 20, 2021","Chinese stocks == risky

Options == risky

Guy who lost $500k on BABA options: hey, that's a terrific idea, let's combine the 2!",08-21-2021,ToCommit,10.0,chinese stocks risky options risky guy who lost 500k on baba options hey thats a terrific idea lets combine the 2,neutral,0.44145793,,,33,33_china_chinese_chinas_usa,2021-08-21
64300,"Daily Discussion Thread for August 02, 2021",I had so many calls in TSLA and I sold them all off last week. I’m such an idiot,08-02-2021,Contextual-Investor,7.0,i had so many calls in tsla and i sold them all off last week im such an idiot,negative,0.92077345,,tsla,36,36_700_900_800_690,2021-08-02
65835,"Daily Discussion Thread for August 06, 2021",SPY woke up and chose violence.,08-06-2021,grigsbie,9.0,spy woke up and chose violence,negative,0.83342,,,-1,-1_spce_000_price_bags,2021-08-06
65673,"Daily Discussion Thread for August 06, 2021",Imagine betting against the stock of a company that can stop stocks from trading.,08-06-2021,uNBANABLE1111111,20.0,imagine betting against the stock of a company that can stop stocks from trading,neutral,0.5065352,,,4,4_investor_growth_investing_invest,2021-08-06
67097,"Daily Discussion Thread for August 10, 2021",Ocgn to the 🌙 15$ again soon?,08-10-2021,IBUYDUMPSTERFIRES,8.0,ocgn to the 15 again soon,neutral,0.9140108,,,204,204_ocgn_ocugen_covaxin_flying,2021-08-10
74883,"Daily Discussion Thread for August 31, 2021",Hopefully CRSR goes up like that one day GME did earlier this year. I’m talking like 40% type shit,08-31-2021,ligmah91,9.0,hopefully crsr goes up like that one day gme did earlier this year im talking like 40 type shit,neutral,0.5032128,,gme,-1,-1_spce_000_price_bags,2021-08-31
67453,"Daily Discussion Thread for August 11, 2021",Guys I think I may have gotten a tad greedy,08-11-2021,redd2007,11.0,guys i think i may have gotten a tad greedy,negative,0.6925446,,,-1,-1_spce_000_price_bags,2021-08-11
64778,"Daily Discussion Thread for August 04, 2021","When journalists have contacted WSB in the past they always reach out with IRL credentials and contacts (I do my best to troll them).

We know people are being contacted about ""a book opportunity"".  It happens, I get Onlyfans invites and offers to help me ""invest in Crypto"" all the time.  I just block and forget (most of them...)

WSB can't stop random Reddit accounts from DM-ing you.  Just report and block.

 ##Click on links at your own risk 

And please, stop forwarding us the message as a modmail.",08-04-2021,Dan_inKuwait,1.0,when journalists have contacted wsb in the past they always reach out with irl credentials and contacts i do my best to troll them we know people are being contacted about a book opportunity it happens i get onlyfans invites and offers to help me invest in crypto all the time i just block and forget most of them wsb cant stop random reddit accounts from dm ing you just report and block click on links at your own risk and please stop forwarding us the message as a modmail,neutral,0.4796644,,,-1,-1_spce_000_price_bags,2021-08-04
64459,"Daily Discussion Thread for August 03, 2021",Now I get why people like boomer stocks.  They are quietly up 18% while my meme positions are down -234%,08-03-2021,follow-spy,11.0,now i get why people like boomer stocks they are quietly up 18 while my meme positions are down 234,neutral,0.5640835,,,24,24_meme_memes_boomer_memestock,2021-08-03
70095,"Daily Discussion Thread for August 18, 2021",yolo’d 20k into spy calls wish my dumbass luck,08-18-2021,qbfinest1,10.0,yolod 20k into spy calls wish my dumbass luck,negative,0.853864,,,237,237_yolo_yolos_yolod_yoloed,2021-08-18
67408,"Daily Discussion Thread for August 11, 2021",Fake numbers in 25  minutes,08-11-2021,academicpergatory,13.0,fake numbers in 25 minutes,neutral,0.5533625,,,185,185_minutes_hours_mins_futures,2021-08-11
74825,"Daily Discussion Thread for August 31, 2021",Sold my SPY puts for +20%,08-31-2021,Delanorix,11.0,sold my spy puts for 20,neutral,0.7321179,,,9,9_0dte_sold_expiring_loss,2021-08-31
70789,"Daily Discussion Thread for August 19, 2021",My TGT calls fukt again today,08-19-2021,Ghost_nut,7.0,my tgt calls fukt again today,negative,0.9511637,,,0,0_expire_expiring_call_expired,2021-08-19
65359,"Daily Discussion Thread for August 05, 2021",SOFI AND GM 🚀🚀,08-05-2021,Oxy30sloveme,9.0,sofi and gm,neutral,0.7497422,,,30,30_sofi_fa_charter_sos,2021-08-05
69602,"Daily Discussion Thread for August 17, 2021","NKLA is still green. 

No cars, No crashes.",08-17-2021,SrAccident,12.0,nkla is still green no cars no crashes,neutral,0.61070937,,,325,325_nkla_nke_revenue_tards,2021-08-17
73825,"Weekend Discussion Thread for the Weekend of August 27, 2021","I still think it’s a missed opportunity that you can’t send a little motivational message to the person who buys the position you just sold. Like right when it executes it pops up on their screen.

Something uplifting like: enjoy my bags b*tch or something like that 


*I’d pay extra for this service*",08-29-2021,VacationLover1,52.0,i still think its a missed opportunity that you cant send a little motivational message to the person who buys the position you just sold like right when it executes it pops up on their screen something uplifting like enjoy my bags b tch or something like that id pay extra for this service,neutral,0.42178148,,,-1,-1_spce_000_price_bags,2021-08-29
69214,"Daily Discussion Thread for August 16, 2021",Here to remind everyone how much of a crackhead spy is. Wtf,08-16-2021,mikeydtd,11.0,here to remind everyone how much of a crackhead spy is wtf,negative,0.91469294,,,5,5_forming_spys_pattern_sideways,2021-08-16
69230,"Daily Discussion Thread for August 16, 2021",Someone choke me unconscious and wake me up when it is friday please. Thanks.,08-16-2021,ThisLineLooksCool,10.0,someone choke me unconscious and wake me up when it is friday please thanks,negative,0.5666711,,,116,116_goodnight_wake_slept_woke,2021-08-16
74907,"Daily Discussion Thread for August 31, 2021",Whenever tsla acts like this there’s usually a 5% up day in the mix,08-31-2021,WhiteWhenWrong,7.0,whenever tsla acts like this theres usually a 5 up day in the mix,neutral,0.72262734,,tsla,29,29_tsla_tslas_autopilot_og,2021-08-31
67787,"Daily Discussion Thread for August 12, 2021","imagine if we announce taper and the market rallies

how mad would the bear be ? 😏",08-12-2021,clarence_worley90,19.0,imagine if we announce taper and the market rallies how mad would the bear be,neutral,0.52145237,,,175,175_taper_tapering_fed_tantrum,2021-08-12
74252,"Daily Discussion Thread for August 30, 2021",Does anyone else buy first then do research later,08-30-2021,Apprehensive-Mud4133,20.0,does anyone else buy first then do research later,neutral,0.84624416,,,-1,-1_spce_000_price_bags,2021-08-30
69808,"Daily Discussion Thread for August 17, 2021","Out of everything I have, WISH is really the only green huh?",08-17-2021,BrizFrost,8.0,out of everything i have wish is really the only green huh,neutral,0.6890773,,,11,11_red_color_reds_jpow,2021-08-17
63747,"Weekend Discussion Thread for the Weekend of July 30, 2021",Just went through a $8 car wash in my POS behind a 2020 GT3 RS. I want my FDs to make me enough money so I don't care about taking a $200k car through the scratch-o-matic. Life goals.,08-01-2021,t33po,10.0,just went through a 8 car wash in my pos behind a 2020 gt3 rs i want my fds to make me enough money so i dont care about taking a 200k car through the scratch o matic life goals,negative,0.48180744,,,274,274_car_civic_tire_cars,2021-08-01
73754,"Daily Discussion Thread for August 27, 2021",$ROOT$BBIG pls daddy,08-27-2021,psychcloud,8.0,root bbig pls daddy,neutral,0.74105257,,bb,337,337_root_balls_deep_dental,2021-08-27
71198,"Daily Discussion Thread for August 20, 2021","Predictions for today: everything seems to crash and eventually AAPL, MSFT, NFLX and NVDA start pumping to get spy back to flat. Everything else continues the journey to the dumpster fire.",08-20-2021,JustMowingTheLawn,6.0,predictions for today everything seems to crash and eventually aapl msft nflx and nvda start pumping to get spy back to flat everything else continues the journey to the dumpster fire,negative,0.6207988,,,-1,-1_spce_000_price_bags,2021-08-20
67107,"Daily Discussion Thread for August 10, 2021",PFE calls going brrrrrrrrrr,08-10-2021,HailBlue22,7.0,pfe calls going brrrrrrrrrr,neutral,0.8328817,,,-1,-1_spce_000_price_bags,2021-08-10
68676,"Weekend Discussion Thread for the Weekend of August 13, 2021","Be safe out there and remember, whatever you are doing tonight, someone somewhere has died doing exactly the same thing.",08-15-2021,PanickyLemur,15.0,be safe out there and remember whatever you are doing tonight someone somewhere has died doing exactly the same thing,negative,0.5159965,,,-1,-1_spce_000_price_bags,2021-08-15
72578,"Daily Discussion Thread for August 25, 2021","I was going to take a sick day, but I think I will just go in to work, stare at the wall, maybe wander around aimlessly. No need to arouse suspicion by taking time off.",08-25-2021,yeti_man82,12.0,i was going to take a sick day but i think i will just go in to work stare at the wall maybe wander around aimlessly no need to arouse suspicion by taking time off,neutral,0.5550818,,,-1,-1_spce_000_price_bags,2021-08-25
69659,"Daily Discussion Thread for August 17, 2021","Its that time of the month boys


www.homelessshelterdirectory.org/

https://www.uscourts.gov/forms/bankruptcy-forms

www.wendys-careers.com",08-17-2021,777FADEC,9.0,its that time of the month boys www homelessshelterdirectory org https www uscourts gov forms bankruptcy forms www wendys careers com,neutral,0.8623508,,,-1,-1_spce_000_price_bags,2021-08-17
64068,"Daily Discussion Thread for August 02, 2021",Spys been so fucking gay,08-02-2021,LostLifeSavingsOnGME,9.0,spys been so fucking gay,negative,0.9712439,,,-1,-1_spce_000_price_bags,2021-08-02
71178,"Daily Discussion Thread for August 20, 2021",I think I just heard the Theta Gang ride into town,08-20-2021,No-Stuff-4060,8.0,i think i just heard the theta gang ride into town,neutral,0.8595062,,,62,62_theta_gang_wins_thetagang,2021-08-20
65569,"Daily Discussion Thread for August 05, 2021",MCFE special dividend. Remember RKT?,08-05-2021,Unemployed_Barnacle,8.0,mcfe special dividend remember rkt,neutral,0.85436773,,,234,234_dividends_dividend_mcfe_reinvest,2021-08-05
70155,"Daily Discussion Thread for August 18, 2021","Well, I have dug myself a deep hole indeed",08-18-2021,regarding_your_cat,9.0,well i have dug myself a deep hole indeed,negative,0.89582336,,,-1,-1_spce_000_price_bags,2021-08-18
64125,"Daily Discussion Thread for August 02, 2021","You could not live with your own failure. 

And where did that bring you?

Back to $HOOD.",08-02-2021,Skulldrey,9.0,you could not live with your own failure and where did that bring you back to hood,negative,0.9279664,,,34,34_hood_ipo_rob_retail,2021-08-02
67690,"Daily Discussion Thread for August 11, 2021",SPY is like a clogged toilet right now. Just flush already.,08-11-2021,MickolasJae,7.0,spy is like a clogged toilet right now just flush already,negative,0.91802686,,,-1,-1_spce_000_price_bags,2021-08-11
66715,"Daily Discussion Thread for August 09, 2021","Saw a dude coughing his lungs out over everyone in a crowded ShopRite.

Calls on MRNA?",08-09-2021,actuarythrowaway445,8.0,saw a dude coughing his lungs out over everyone in a crowded shoprite calls on mrna,negative,0.8499414,,,103,103_mrna_cure_pricing_mrnas,2021-08-09
71876,"Daily Discussion Thread for August 23, 2021",AMD.,08-23-2021,saladsparklingwater,6.0,amd,neutral,0.52396804,,,48,48_amd_intel_ryzen_83,2021-08-23
69765,"Daily Discussion Thread for August 17, 2021",I will laugh so hard if spy closes at ath,08-17-2021,MayCauseInsomnia,9.0,i will laugh so hard if spy closes at ath,positive,0.62541157,,,100,100_ath_aths_atl_hit,2021-08-17
63834,"Weekend Discussion Thread for the Weekend of July 30, 2021",My SQ calls were printing. Then Amazon caught fire and burned anything consumer related to the ground. Is there no length Bezos won’t go to to fuck me?,08-01-2021,krzen,9.0,my sq calls were printing then amazon caught fire and burned anything consumer related to the ground is there no length bezos wont go to to fuck me,negative,0.94889164,,,167,167_bezos_space_rocket_billionaires,2021-08-01
64586,"Daily Discussion Thread for August 03, 2021","Da fuck is the deal with the SPY/QQQ?

Has the Fed been backstopping and pumping money into the SPY/QQQ in the last 40 minutes?",08-03-2021,VotedOut,9.0,da fuck is the deal with the spy qqq has the fed been backstopping and pumping money into the spy qqq in the last 40 minutes,negative,0.81235504,,,224,224_qqq_tqqq_qs_crowd,2021-08-03
67622,"Daily Discussion Thread for August 11, 2021",Wife just came back from sbux. Said some weirdos kept talking about robinhood and spying,08-11-2021,darksoulsrolls,7.0,wife just came back from sbux said some weirdos kept talking about robinhood and spying,negative,0.86657834,,robinhood,35,35_robinhood_ipo_robinhoods_robin,2021-08-11
72526,"Daily Discussion Thread for August 25, 2021","I’m so hurt. Was up 95%, didn’t sell, now I’m down 50%",08-25-2021,NaiveDare7532,17.0,im so hurt was up 95 didnt sell now im down 50,negative,0.9229927,,,-1,-1_spce_000_price_bags,2021-08-25
71656,"Daily Discussion Thread for August 23, 2021","I don't know about you guys, but I'm pretty sure the entire economy is at least 2.3% better than it was Thursday morning. I see no reason why the entire economy can't double in another 40 days, or so.",08-23-2021,Bad_Prophet,20.0,i dont know about you guys but im pretty sure the entire economy is at least 2 3 better than it was thursday morning i see no reason why the entire economy cant double in another 40 days or so,positive,0.653343,,,121,121_recession_cancelled_canceled_recessions,2021-08-23
70845,"Daily Discussion Thread for August 20, 2021",Fucking fuck the market is so strong today. My puts are FUCKING BLEEDING OUT THEIR ASS,08-20-2021,Pr333n,18.0,fucking fuck the market is so strong today my puts are fucking bleeding out their ass,negative,0.9719956,,,-1,-1_spce_000_price_bags,2021-08-20
65868,"Daily Discussion Thread for August 06, 2021","1. open robinhood

2. cry

3. call ex's mom

Great day!",08-06-2021,highsocietyshtonks,9.0,1 open robinhood 2 cry 3 call exs mom great day,positive,0.9319463,,robinhood,-1,-1_spce_000_price_bags,2021-08-06
71012,"Daily Discussion Thread for August 20, 2021",Alright. Deleted the app now.,08-20-2021,Pr333n,9.0,alright deleted the app now,negative,0.6317588,,,114,114_brokerage_broker_apps_brokers,2021-08-20
72449,"Daily Discussion Thread for August 24, 2021",Episode 3 return of the meme stocks,08-24-2021,Orithegreat,10.0,episode 3 return of the meme stocks,neutral,0.87143147,,,24,24_meme_memes_boomer_memestock,2021-08-24
70769,"Daily Discussion Thread for August 19, 2021",Anyone else look at the market today and said “fuuuuuck thiiiiiis”,08-19-2021,JServant,9.0,anyone else look at the market today and said fuuuuuck thiiiiiis,negative,0.8448685,,,45,45_markets_sense_bullshit_hilarious,2021-08-19
74608,"Daily Discussion Thread for August 30, 2021","Spy only ever does this after a dip and there was no dip, big dip incoming 🤡👀",08-30-2021,NexusLevi1,9.0,spy only ever does this after a dip and there was no dip big dip incoming,neutral,0.64383334,,,2,2_dips_dipping_dip_dipped,2021-08-30
74391,"Daily Discussion Thread for August 30, 2021",My options investments are up 150% over the last month. Literally only AAPL and SPY calls bought on the dips.,08-30-2021,OptFire,10.0,my options investments are up 150 over the last month literally only aapl and spy calls bought on the dips,neutral,0.562224,,,47,47_aapl_earnings_total_pile,2021-08-30
74641,"Daily Discussion Thread for August 30, 2021","Bears be like September is going to be bloody. 

""Buys puts with 2 days left in August"" 

🤡",08-30-2021,aunitpls,8.0,bears be like september is going to be bloody buys puts with 2 days left in august,neutral,0.51780504,,,1,1_priced_sale_discount_price,2021-08-30
65913,"Daily Discussion Thread for August 06, 2021",Tesla summary: slow bleed slow bleed slow bleed slow bleed MOONSHOT slow bleed slow bleed slow bleed,08-06-2021,yaboigoat53,7.0,tesla summary slow bleed slow bleed slow bleed slow bleed moonshot slow bleed slow bleed slow bleed,negative,0.50788796,,tesla,179,179_bleed_bleeding_blood_bloodbath,2021-08-06
73669,"Daily Discussion Thread for August 27, 2021",You know what’s funny?  Buying one of the cheapest chrome books available and then losing a Mac book worth of options value in a day,08-27-2021,RadiantAnus,8.0,you know whats funny buying one of the cheapest chrome books available and then losing a mac book worth of options value in a day,negative,0.46239057,,,-1,-1_spce_000_price_bags,2021-08-27
64070,"Daily Discussion Thread for August 02, 2021",Fed Reserve Governor: Taper as soon as September. “Taper early and taper fast”,08-02-2021,Contextual-Investor,11.0,fed reserve governor taper as soon as september taper early and taper fast,neutral,0.90287584,,,175,175_taper_tapering_fed_tantrum,2021-08-02
72532,"Daily Discussion Thread for August 25, 2021","powell doesnt even need to mention ""tapering"". as soon as he says ""t--"" the algos will start dumping everything

 spy 440p",08-25-2021,EducatorLazy2876,17.0,powell doesnt even need to mention tapering as soon as he says t the algos will start dumping everything spy 440p,negative,0.5632834,,,129,129_powell_powells_sip_banking,2021-08-25
71438,"Weekend Discussion Thread for the Weekend of August 20, 2021",Drunk gang,08-22-2021,rnel8475,9.0,drunk gang,neutral,0.6497557,,,171,171_gang_checking_wheres_paranoia,2021-08-22
68305,"Daily Discussion Thread for August 13, 2021",Everything i touch dies,08-13-2021,Special_Pizza3889,12.0,everything i touch dies,negative,0.93079627,,,125,125_handed_doll_hands_touched,2021-08-13
68620,"Weekend Discussion Thread for the Weekend of August 13, 2021","Throws $25,000 into some calls and puts every other week.

Buys Walmart brand lunch meat because it’s $0.61 cheaper than Oscar Mayer.",08-13-2021,brbcripwalking,96.0,throws 25 000 into some calls and puts every other week buys walmart brand lunch meat because its 0 61 cheaper than oscar mayer,neutral,0.6838778,,,-1,-1_spce_000_price_bags,2021-08-13
64777,"Daily Discussion Thread for August 03, 2021",Out of CRSR at a $2000 loss but feel $1m lighter,08-03-2021,Tersiv,7.0,out of crsr at a 2000 loss but feel 1m lighter,neutral,0.71545523,,,69,69_crsr_censored_earnings_analyst,2021-08-03
70390,"Daily Discussion Thread for August 19, 2021","got some SPY $443 calls yesterday right at the beginning of the crash. 

Feeling very confident rn about losing all that money.",08-19-2021,bamblys,21.0,got some spy 443 calls yesterday right at the beginning of the crash feeling very confident rn about losing all that money,neutral,0.56597745,,,0,0_expire_expiring_call_expired,2021-08-19
72316,"Daily Discussion Thread for August 24, 2021",Uh oh GME going for a third run?!?!?,08-24-2021,TitaniumTacos,11.0,uh oh gme going for a third run,neutral,0.8769579,,gme,-1,-1_spce_000_price_bags,2021-08-24
66611,"Daily Discussion Thread for August 09, 2021",Wow I got fucked today see you guys tomorrow,08-09-2021,eyuuuuu,10.0,wow i got fucked today see you guys tomorrow,negative,0.96783525,,,-1,-1_spce_000_price_bags,2021-08-09
73856,"Weekend Discussion Thread for the Weekend of August 27, 2021","Told my boss to shove it in our team meeting today.

By shove it I mean delicately explained that I have been progressing in my work diligently and their expectations may be a slight bit high given the egregious state in which things were found so close to our fiscal year end.",08-28-2021,Nohcri,19.0,told my boss to shove it in our team meeting today by shove it i mean delicately explained that i have been progressing in my work diligently and their expectations may be a slight bit high given the egregious state in which things were found so close to our fiscal year end,neutral,0.5143615,,,18,18_jobs_unemployment_boss_jobless,2021-08-28
68653,"Weekend Discussion Thread for the Weekend of August 13, 2021",We were in Afghanistan for nearly 20 years. They had enough time to join the modern world. But too many of them prefer the 8th century.,08-15-2021,jerky-,17.0,we were in afghanistan for nearly 20 years they had enough time to join the modern world but too many of them prefer the 8th century,neutral,0.51909035,,,93,93_taliban_afghanistan_kabul_afghan,2021-08-15
71092,"Daily Discussion Thread for August 20, 2021","Watch your portfolio disintegrate, your house that you just bought by out bidding everybody starting to lose value, your wife's bf saying goodbye, your boss demanding more effort from you in your dead end job and you are doing DD on the boy from Bulgaria and his Master from Shitadel. 
This is further out in your future, not today, relax.",08-20-2021,Revolutionary-Win485,23.0,watch your portfolio disintegrate your house that you just bought by out bidding everybody starting to lose value your wifes bf saying goodbye your boss demanding more effort from you in your dead end job and you are doing dd on the boy from bulgaria and his master from shitadel this is further out in your future not today relax,negative,0.87600386,,,7,7_portfolio_portfolios_ruin_bleed,2021-08-20
70328,"Daily Discussion Thread for August 18, 2021",Small CAPS rise!,08-18-2021,billyd1984texas,7.0,small caps rise,neutral,0.621143,,,22,22_cnbc_nasdaq_headline_ceo,2021-08-18
73996,"Weekend Discussion Thread for the Weekend of August 27, 2021","When brokerage apps ask me what my investing goals are I have to choose ""building wealth"" because ""dominating power structures enough to force the US government into denuclearization"" is never listed as an option by these narc ass fed-connected apps",08-28-2021,PlsDontNuke,9.0,when brokerage apps ask me what my investing goals are i have to choose building wealth because dominating power structures enough to force the us government into denuclearization is never listed as an option by these narc ass fed connected apps,negative,0.81977856,,,114,114_brokerage_broker_apps_brokers,2021-08-28
64475,"Daily Discussion Thread for August 03, 2021",the 5Y chart on HOOD lookin crazy rn,08-03-2021,__________nah,11.0,the 5y chart on hood lookin crazy rn,neutral,0.6192363,,,34,34_hood_ipo_rob_retail,2021-08-03
69213,"Daily Discussion Thread for August 16, 2021","War, priced in✔️

COVID, priced in✔️

Economic collapse, priced in✔️

SPY ATH?",08-16-2021,nosalute,11.0,war priced in covid priced in economic collapse priced in spy ath,neutral,0.55148923,,,-1,-1_spce_000_price_bags,2021-08-16
64446,"Daily Discussion Thread for August 03, 2021","Even before the meme craze everyone here said CRSR was a great value play.

I'm starting to think y'all might be retarded.",08-03-2021,EvaUnit343,12.0,even before the meme craze everyone here said crsr was a great value play im starting to think yall might be retarded,negative,0.8753809,,,69,69_crsr_censored_earnings_analyst,2021-08-03
70025,"Daily Discussion Thread for August 18, 2021",PLTR is finally 10 cents above my cost average,08-18-2021,YurpleLunch,13.0,pltr is finally 10 cents above my cost average,positive,0.65388423,,,-1,-1_spce_000_price_bags,2021-08-18
72593,"Daily Discussion Thread for August 25, 2021",I have lost 90% of my savings since May. Everything I buy goes the opposite way. I am truly a retard 🤡,08-25-2021,Screamdaditty,12.0,i have lost 90 of my savings since may everything i buy goes the opposite way i am truly a retard,negative,0.9698532,,,-1,-1_spce_000_price_bags,2021-08-25
65242,"Daily Discussion Thread for August 05, 2021",Those HOOD premiums are insane,08-05-2021,iv2892,16.0,those hood premiums are insane,negative,0.733368,,,34,34_hood_ipo_rob_retail,2021-08-05
74359,"Daily Discussion Thread for August 30, 2021",Bears praying for another pandemic at this point,08-30-2021,CommanderInTweet,11.0,bears praying for another pandemic at this point,negative,0.59697956,,,-1,-1_spce_000_price_bags,2021-08-30
72563,"Daily Discussion Thread for August 25, 2021",It’s not over with GME can’t stop won’t stop,08-25-2021,No_Adhesiveness_9468,13.0,its not over with gme cant stop wont stop,neutral,0.44003147,,gme,51,51_03ncnwxrm64_king_deploy_saga,2021-08-25
67099,"Daily Discussion Thread for August 10, 2021",Pfe was lagging now it's shooting up to the MOON 🚀🚀🚀,08-10-2021,DraftLopsided,7.0,pfe was lagging now its shooting up to the moon,neutral,0.50713456,,,-1,-1_spce_000_price_bags,2021-08-10
68757,"Weekend Discussion Thread for the Weekend of August 13, 2021","If you liked SPY at 445, you’re going to LOVE it at $380",08-13-2021,Leviticus_Albrecht,52.0,if you liked spy at 445 youre going to love it at 380,positive,0.8459268,,,6,6_440_445_444_453,2021-08-13
75103,"Daily Discussion Thread for August 31, 2021",Baba loading up,08-31-2021,vilester1,7.0,baba loading up,neutral,0.70354134,,,49,49_baba_bob_bankrupt_ban,2021-08-31
68555,"Daily Discussion Thread for August 13, 2021",Bought the top of MRNA. Welp. Some more bags.,08-13-2021,Clambucket1,7.0,bought the top of mrna welp some more bags,neutral,0.861048,,,103,103_mrna_cure_pricing_mrnas,2021-08-13
71145,"Daily Discussion Thread for August 20, 2021",HEY I'M CRAMER! BUY AMAZON!,08-20-2021,chikenbeer,8.0,hey im cramer buy amazon,neutral,0.64688325,,,-1,-1_spce_000_price_bags,2021-08-20
72775,"Daily Discussion Thread for August 25, 2021",Hey assholes if it's good enough to screenshot it's good enough to take profits. Paper gains aren't real gains. This is financial advice,08-25-2021,Zachjsrf,35.0,hey assholes if its good enough to screenshot its good enough to take profits paper gains arent real gains this is financial advice,negative,0.7161788,,,-1,-1_spce_000_price_bags,2021-08-25
66703,"Daily Discussion Thread for August 09, 2021",Yes Cathie please keep buying $COIN 😩😩,08-09-2021,Fiddli,8.0,yes cathie please keep buying coin,neutral,0.5371417,,,113,113_cathie_her_cathies_shes,2021-08-09
66517,"Daily Discussion Thread for August 09, 2021",From $650 to $110 today my account ain’t shit just come kill me already,08-09-2021,DoggyFrench,12.0,from 650 to 110 today my account aint shit just come kill me already,negative,0.91448945,,,72,72_account_blew_blown_blow,2021-08-09
74731,"Daily Discussion Thread for August 31, 2021","Its happening again.  The basket of PLTR, AMC, BB, GME all on a run...",08-31-2021,caughtatcustoms69,16.0,its happening again the basket of pltr amc bb gme all on a run,neutral,0.84804374,,amc,27,27_nok_silver_line_charts,2021-08-31
67351,"Daily Discussion Thread for August 11, 2021",They are lying but who cares.,08-11-2021,realister,18.0,they are lying but who cares,negative,0.89303786,,,388,388_fool_tennessee_fooled_thrice,2021-08-11
64698,"Daily Discussion Thread for August 03, 2021","In at $36 out at $47.

Cheers for the easy flip HOOD!",08-03-2021,assuasivedamian,8.0,in at 36 out at 47 cheers for the easy flip hood,positive,0.86518586,,,34,34_hood_ipo_rob_retail,2021-08-03
66090,"Weekend Discussion Thread for the Weekend of August 06, 2021","Drunk watching the Yankees celebrating being +$12k on my AMD options which I sold at peak $122 on Wednesday. Saved myself $9k. 

The vibes are so much better than what they could have been. TAKE YOUR PROFITS.",08-07-2021,Bambam60,35.0,drunk watching the yankees celebrating being 12k on my amd options which i sold at peak 122 on wednesday saved myself 9k the vibes are so much better than what they could have been take your profits,positive,0.94219106,,,-1,-1_spce_000_price_bags,2021-08-07
71986,"Daily Discussion Thread for August 23, 2021",I kinda feel sad and bad for GrAY bears,08-23-2021,csklmf,6.0,i kinda feel sad and bad for gray bears,negative,0.9266452,,,53,53_bears_fuk_fukin_fukd,2021-08-23
66980,"Daily Discussion Thread for August 10, 2021",Options have taught me that even 10% profit Is good cause you can be down 40% the next minute,08-10-2021,PaulNwal,11.0,options have taught me that even 10 profit is good cause you can be down 40 the next minute,positive,0.5110706,,,-1,-1_spce_000_price_bags,2021-08-10
68795,"Weekend Discussion Thread for the Weekend of August 13, 2021","There should be a second chance drawing on expired options. If your options expire worthless at the end of the week they go into a pool and someone wins $1 million.

*seems like a missed opportunity*",08-15-2021,VacationLover1,12.0,there should be a second chance drawing on expired options if your options expire worthless at the end of the week they go into a pool and someone wins 1 million seems like a missed opportunity,neutral,0.46618557,,,0,0_expire_expiring_call_expired,2021-08-15
66304,"Weekend Discussion Thread for the Weekend of August 06, 2021","Holy shit, I figured out why I love WSB so much..

It’s investing e-sports. 

Riding along with sir jack a lot with MVST was a highlight of my week",08-07-2021,captain_blabbin,8.0,holy shit i figured out why i love wsb so much its investing e sports riding along with sir jack a lot with mvst was a highlight of my week,positive,0.9841233,,,16,16_wkhs_wsb_wsbs_crew,2021-08-07
72531,"Daily Discussion Thread for August 25, 2021",The pltr news is a nothing burger if you actually read it.,08-25-2021,apronstrings07,15.0,the pltr news is a nothing burger if you actually read it,negative,0.539146,,,38,38_kid_dreaming_disappointment_foundry,2021-08-25
74251,"Daily Discussion Thread for August 30, 2021",Y'all ever just be holding 300 shares of something and have no idea what the ticker does?,08-30-2021,buttchomper,57.0,yall ever just be holding 300 shares of something and have no idea what the ticker does,neutral,0.51317096,,,57,57_ticker_tickers_spam_daily,2021-08-30
70996,"Daily Discussion Thread for August 20, 2021",So turns out most young women are prostitutes. Had no idea.,08-20-2021,Slut_Spoiler,8.0,so turns out most young women are prostitutes had no idea,negative,0.79079235,,,298,298_hookers_escorts_craigslist_encounters,2021-08-20
66174,"Weekend Discussion Thread for the Weekend of August 06, 2021","4 days alcohol free, and my dreams have been insane. I’m going to make it to at least a month, may even go longer than that. Maybe some of you retards wouldn’t lose as much money, if you reduced your alcohol",08-08-2021,Antheo94,12.0,4 days alcohol free and my dreams have been insane im going to make it to at least a month may even go longer than that maybe some of you retards wouldnt lose as much money if you reduced your alcohol,positive,0.5130681,,,19,19_drunk_drinking_hangover_hungover,2021-08-08
68211,"Daily Discussion Thread for August 13, 2021","I was gonna link a search on wish.com for ""Rope"" to help a brother out finding his next necktie, but you need an account to even browse.

No wonder these guys are about to go bankrupt.",08-13-2021,Duke_Shambles,25.0,i was gonna link a search on wish com for rope to help a brother out finding his next necktie but you need an account to even browse no wonder these guys are about to go bankrupt,negative,0.6810762,,,299,299_rope_shortage_inventory_whiplash,2021-08-13
68589,"Daily Discussion Thread for August 13, 2021",I was waiting for DIS to go back to $190 to sell it. I guess I should have settled for $187... Welp,08-13-2021,PM_ME_ROBOTS,8.0,i was waiting for dis to go back to 190 to sell it i guess i should have settled for 187 welp,neutral,0.58112735,,,163,163_aapl_135_130_125,2021-08-13
69142,"Daily Discussion Thread for August 16, 2021",Did the Talibans storm wall street too? wtf is this,08-16-2021,arlalanzily,11.0,did the talibans storm wall street too wtf is this,neutral,0.576971,,,93,93_taliban_afghanistan_kabul_afghan,2021-08-16
74187,"Weekend Discussion Thread for the Weekend of August 27, 2021","So if you're Jpow... you put your stuff in a blind trust I'm assuming.  But would you be able to keep your mouth shut?  Or just before your speech would you pick up a burner at Walmart and make a 2 second call to your broker ""BUY!  \*click\*""?",08-28-2021,Smirkydarkdude,8.0,so if youre jpow you put your stuff in a blind trust im assuming but would you be able to keep your mouth shut or just before your speech would you pick up a burner at walmart and make a 2 second call to your broker buy click,neutral,0.7439759,,,114,114_brokerage_broker_apps_brokers,2021-08-28
67970,"Daily Discussion Thread for August 12, 2021",NIO running today?,08-12-2021,Soldacki,9.0,nio running today,neutral,0.90203756,,nio,209,209_nio_jellyfish_nipsey_niorway,2021-08-12
70370,"Daily Discussion Thread for August 19, 2021",I’m in my mid 20s so technically time is my hedge against everything except total societal collapse,08-19-2021,NervousTumbleweed,36.0,im in my mid 20s so technically time is my hedge against everything except total societal collapse,neutral,0.7463129,,,341,341_olds_politics_history_political,2021-08-19
63566,"Weekend Discussion Thread for the Weekend of July 30, 2021","According to a new survey, the average age of WSB participants has decreased from 30 to 9.",08-01-2021,prisonsexx,17.0,according to a new survey the average age of wsb participants has decreased from 30 to 9,neutral,0.7484562,,,16,16_wkhs_wsb_wsbs_crew,2021-08-01
63678,"Weekend Discussion Thread for the Weekend of July 30, 2021",There will be a variant for every letter of the greek alphabet. Can't wait to collect em all!,08-01-2021,GruvisMalt,12.0,there will be a variant for every letter of the greek alphabet cant wait to collect em all,positive,0.89367706,,,161,161_orph_orning_eekend_ears,2021-08-01
73730,"Daily Discussion Thread for August 27, 2021",What the fuck is this man. No one is even trading. Just buy like fucking maniacs the first 30 min then algos the rest of the day,08-27-2021,Tarek394,9.0,what the fuck is this man no one is even trading just buy like fucking maniacs the first 30 min then algos the rest of the day,negative,0.9764825,,,-1,-1_spce_000_price_bags,2021-08-27
71764,"Daily Discussion Thread for August 23, 2021",Imagine not making money this morning,08-23-2021,ninkorn,8.0,imagine not making money this morning,negative,0.73637915,,,-1,-1_spce_000_price_bags,2021-08-23
74227,"Daily Discussion Thread for August 30, 2021",The amount of escorts traveling around the world on Instagram are too damn high,08-30-2021,EatMaTesticles,35.0,the amount of escorts traveling around the world on instagram are too damn high,negative,0.719674,,,298,298_hookers_escorts_craigslist_encounters,2021-08-30
63581,"Weekend Discussion Thread for the Weekend of July 30, 2021","What doesn't kill you, mutates and tries again.",08-01-2021,Street_Tone,16.0,what doesnt kill you mutates and tries again,negative,0.53599674,,,103,103_mrna_cure_pricing_mrnas,2021-08-01
63921,"Daily Discussion Thread for August 02, 2021","The year is 2040, I’ve just blown up my account for the 600th time on SPY puts telling myself this bubble can’t possibly continue. Everyone tells me to seek help but I know I’m secretly right and deposit money into Robinhood again. SPY moons",08-02-2021,Kant_touch,45.0,the year is 2040 ive just blown up my account for the 600th time on spy puts telling myself this bubble cant possibly continue everyone tells me to seek help but i know im secretly right and deposit money into robinhood again spy moons,negative,0.6204696,,bb,-1,-1_spce_000_price_bags,2021-08-02
74369,"Daily Discussion Thread for August 30, 2021",Fuck it I'll jump on the CRSR hyper train for end of the month,08-30-2021,gamblingman777,12.0,fuck it ill jump on the crsr hyper train for end of the month,negative,0.822116,,,69,69_crsr_censored_earnings_analyst,2021-08-30
66734,"Daily Discussion Thread for August 09, 2021",Mrna is gonna open well over 500 tomorrow and i still wont have any positions,08-09-2021,nubface1001,8.0,mrna is gonna open well over 500 tomorrow and i still wont have any positions,neutral,0.65196764,,,103,103_mrna_cure_pricing_mrnas,2021-08-09
70285,"Daily Discussion Thread for August 18, 2021",PLTR giving no fuks,08-18-2021,yungdanz,9.0,pltr giving no fuks,negative,0.7434013,,,-1,-1_spce_000_price_bags,2021-08-18
69719,"Daily Discussion Thread for August 17, 2021",SOFI = SO FUCKED,08-17-2021,r0adrun3r,9.0,sofi so fucked,negative,0.9650578,,,30,30_sofi_fa_charter_sos,2021-08-17
65153,"Daily Discussion Thread for August 04, 2021",HOOD IV 300% 😂😂😂😂😂,08-04-2021,trackrecord330,8.0,hood iv 300,neutral,0.7870723,,,34,34_hood_ipo_rob_retail,2021-08-04
74450,"Daily Discussion Thread for August 30, 2021","Pltr has breached 26, we have officially hit the top of the market",08-30-2021,Appropriate_Tap_7045,10.0,pltr has breached 26 we have officially hit the top of the market,positive,0.85491884,,,14,14_25_30_38_break,2021-08-30
73290,"Daily Discussion Thread for August 26, 2021",I am up 1 dollar today boys. $3 more for a 4 for 4 from Wendy's. Fuck yeah,08-26-2021,bigdaddi69420,6.0,i am up 1 dollar today boys 3 more for a 4 for 4 from wendys fuck yeah,positive,0.5258831,,,63,63_wendys_dumpster_mcdonalds_careers,2021-08-26
73769,"Daily Discussion Thread for August 27, 2021",Need GME to hit 300 today,08-27-2021,Joshvir262,8.0,need gme to hit 300 today,neutral,0.7176993,,gme,56,56_300_200_250_210,2021-08-27
74077,"Weekend Discussion Thread for the Weekend of August 27, 2021",let’s all drink one tonight for all the bears who got fuk today.. rip,08-27-2021,yachtykek,10.0,lets all drink one tonight for all the bears who got fuk today rip,negative,0.6285448,,,-1,-1_spce_000_price_bags,2021-08-27
65883,"Daily Discussion Thread for August 06, 2021",MCFE with big dick crazy energy. Big John is pumping from the grave for what I’m sure is an insane estate. LOL! Let’s GO dividend head fakers 🚀,08-06-2021,UnderB0SS,8.0,mcfe with big dick crazy energy big john is pumping from the grave for what im sure is an insane estate lol lets go dividend head fakers,negative,0.6277094,,,133,133_psfe_pfe_mcfe_mcafee,2021-08-06
69631,"Daily Discussion Thread for August 17, 2021",Fucking MVST,08-17-2021,bluen,11.0,fucking mvst,negative,0.9563567,,,8,8_mvis_mvst_lidar_buyout,2021-08-17
72107,"Daily Discussion Thread for August 24, 2021",Bought now at 193 lolllzzzzz,08-24-2021,Electrical-Path-9618,19.0,bought now at 193 lolllzzzzz,neutral,0.7065884,,,163,163_aapl_135_130_125,2021-08-24
68443,"Daily Discussion Thread for August 13, 2021","Jesus, poor WISH stans",08-13-2021,InspectorDabbit87,9.0,jesus poor wish stans,negative,0.8438977,,,17,17_wishing_wishes_wishy_foundation,2021-08-13
68264,"Daily Discussion Thread for August 13, 2021",MVST is back baby,08-13-2021,BoulderBoulder16,14.0,mvst is back baby,positive,0.8108119,,,8,8_mvis_mvst_lidar_buyout,2021-08-13
69080,"Daily Discussion Thread for August 16, 2021","Taliban, China and corona won",08-16-2021,PutsOnYourWife,16.0,taliban china and corona won,neutral,0.57710797,,,93,93_taliban_afghanistan_kabul_afghan,2021-08-16
66315,"Weekend Discussion Thread for the Weekend of August 06, 2021","No, save your money and get water instead of overpriced soda at restaurant.

Goes on to lose hundreds on one call.",08-07-2021,samofny,10.0,no save your money and get water instead of overpriced soda at restaurant goes on to lose hundreds on one call,negative,0.86508584,,,-1,-1_spce_000_price_bags,2021-08-07
67568,"Daily Discussion Thread for August 11, 2021","PLTR holders are the funniest people in this sub I swear. They just get on their trading app, see red, come shit post in here then go back to bed. I respect their ability to not give a fuck.",08-11-2021,Xzlk,8.0,pltr holders are the funniest people in this sub i swear they just get on their trading app see red come shit post in here then go back to bed i respect their ability to not give a fuck,positive,0.44689107,,,-1,-1_spce_000_price_bags,2021-08-11
64445,"Daily Discussion Thread for August 03, 2021",NKLA beats earnings estimates due to someone finding a nickel on the ground last minute,08-03-2021,BootyOptions,13.0,nkla beats earnings estimates due to someone finding a nickel on the ground last minute,positive,0.5322063,,,325,325_nkla_nke_revenue_tards,2021-08-03
68436,"Daily Discussion Thread for August 13, 2021",Did. Not. See. That. Ending. Coming.,08-13-2021,PanickyLemur,7.0,did not see that ending coming,negative,0.8688051,,,-1,-1_spce_000_price_bags,2021-08-13
72576,"Daily Discussion Thread for August 25, 2021","Fuck, I just woke up from one of those horrible nightmares where you realize it's a dream but you can't wake up. Im fucking shook and afraid to go back to sleep. I didn't even start to worry about my stock options yet 😂",08-25-2021,DeadMoney313,11.0,fuck i just woke up from one of those horrible nightmares where you realize its a dream but you cant wake up im fucking shook and afraid to go back to sleep i didnt even start to worry about my stock options yet,negative,0.9742096,,,403,403_dream_nightmare_woke_nightmares,2021-08-25
67042,"Daily Discussion Thread for August 10, 2021",Infrastructure bill doing wonders for LAC. My calls are going off,08-10-2021,ShermStickUser,9.0,infrastructure bill doing wonders for lac my calls are going off,positive,0.8500687,,,397,397_infrastructure_mcconnell_bill_schumer,2021-08-10
72971,"Daily Discussion Thread for August 26, 2021","Just checking, you can do unlimited day trades above 25K in total account value right?",08-26-2021,Psyched4this,12.0,just checking you can do unlimited day trades above 25k in total account value right,neutral,0.7133403,,,-1,-1_spce_000_price_bags,2021-08-26
72751,"Daily Discussion Thread for August 25, 2021",So GME is goin passed 220???,08-25-2021,Thepotatochamp,9.0,so gme is goin passed 220,neutral,0.8580736,,gme,56,56_300_200_250_210,2021-08-25
71403,"Weekend Discussion Thread for the Weekend of August 20, 2021",it's the weekend already? :( But I wanted to lose more money this week,08-20-2021,itsleis,44.0,its the weekend already but i wanted to lose more money this week,negative,0.69630265,,,28,28_losing_lose_lost_losses,2021-08-20
64257,"Daily Discussion Thread for August 02, 2021",Only power half hour can save us now,08-02-2021,Even-Function,7.0,only power half hour can save us now,neutral,0.633447,,,76,76_power_pow_energy_lit,2021-08-02
72678,"Daily Discussion Thread for August 25, 2021",Are we about to witness a rally like we did yesterday? Fuel the rockets,08-25-2021,StopTheBan420,11.0,are we about to witness a rally like we did yesterday fuel the rockets,neutral,0.7021999,,,357,357_rally_gas_bamboozle_silverado,2021-08-25
71429,"Weekend Discussion Thread for the Weekend of August 20, 2021","All this 6 figure loss porn makes me so happy I took my gains and bought shit with it

I absolutely would've given it all back if I kept trading the way I was",08-21-2021,pm_ur_wifes_tendies,11.0,all this 6 figure loss porn makes me so happy i took my gains and bought shit with it i absolutely wouldve given it all back if i kept trading the way i was,positive,0.46496755,,,74,74_porn_pornhub_content_hentai,2021-08-21
75061,"Daily Discussion Thread for August 31, 2021","I had my fat fingers over ZM puts yesterday, but I bought SPY calls. Fuck me harder daddy.",08-31-2021,CuckModsWorkForFree,7.0,i had my fat fingers over zm puts yesterday but i bought spy calls fuck me harder daddy,negative,0.89082503,,,9,9_0dte_sold_expiring_loss,2021-08-31
70454,"Daily Discussion Thread for August 19, 2021",Just aren't enough stocks rallying to sustain today's moves imo,08-19-2021,claytondpark,14.0,just arent enough stocks rallying to sustain todays moves imo,neutral,0.49971047,,,-1,-1_spce_000_price_bags,2021-08-19
72697,"Daily Discussion Thread for August 25, 2021",GME to $300,08-25-2021,jiantoi,29.0,gme to 300,neutral,0.79930466,,gme,56,56_300_200_250_210,2021-08-25
70282,"Daily Discussion Thread for August 18, 2021",see you all in the bread line...,08-18-2021,Buy-High_Sell_low,8.0,see you all in the bread line,neutral,0.747285,,,68,68_eggs_ketchup_pizza_dinner,2021-08-18
72655,"Daily Discussion Thread for August 25, 2021",It’s 9:50 chill the fuck out,08-25-2021,nanner481,9.0,its 9 50 chill the fuck out,negative,0.81964916,,,14,14_25_30_38_break,2021-08-25
65908,"Daily Discussion Thread for August 06, 2021",MCFE coming back to life....lessssss gooooo!!!!!,08-06-2021,space_dadddy,9.0,mcfe coming back to life lessssss gooooo,neutral,0.5234553,,,133,133_psfe_pfe_mcfe_mcafee,2021-08-06
73827,"Weekend Discussion Thread for the Weekend of August 27, 2021",My girl got that fire hydrant pussy... in that it’s a public utility paid for and maintained by the community,08-28-2021,BackThatThangUp,48.0,my girl got that fire hydrant pussy in that its a public utility paid for and maintained by the community,neutral,0.5903712,,,-1,-1_spce_000_price_bags,2021-08-28
74427,"Daily Discussion Thread for August 30, 2021",This is stupid. It literally is just buy SPY calls,08-30-2021,necarpenter417,10.0,this is stupid it literally is just buy spy calls,negative,0.95906085,,,0,0_expire_expiring_call_expired,2021-08-30
71500,"Weekend Discussion Thread for the Weekend of August 20, 2021",Seeing so many people who are banking on SPY to dump on Monday makes me feel extremely uncertain about going all in on puts,08-21-2021,tallpaulpaultall,8.0,seeing so many people who are banking on spy to dump on monday makes me feel extremely uncertain about going all in on puts,negative,0.80093944,,,9,9_0dte_sold_expiring_loss,2021-08-21
74435,"Daily Discussion Thread for August 30, 2021",VIX rising alongside SPY right now… 🤔,08-30-2021,steve09119,10.0,vix rising alongside spy right now,neutral,0.7957419,,,134,134_vix_vxrt_vxx_spx,2021-08-30
71257,"Weekend Discussion Thread for the Weekend of August 20, 2021","Dear women,

Thicc isn't a replacement word for fat.",08-21-2021,BHD01,21.0,dear women thicc isnt a replacement word for fat,negative,0.77582574,,,-1,-1_spce_000_price_bags,2021-08-21
71984,"Daily Discussion Thread for August 23, 2021","GOEV puts were the obvious move.  


So I bought calls because this market do be like that.",08-23-2021,CapnCurt81,9.0,goev puts were the obvious move so i bought calls because this market do be like that,neutral,0.68149173,,,82,82_goev_gourd_gourds_ornamental,2021-08-23
69382,"Daily Discussion Thread for August 16, 2021","Market was anticipating two months of Paramount+ expansion into Afghanistan. Now with the accelerated takeover, that isn’t happening and VIAC is down.",08-16-2021,SPACsabbath,8.0,market was anticipating two months of paramount expansion into afghanistan now with the accelerated takeover that isnt happening and viac is down,negative,0.4972359,,,93,93_taliban_afghanistan_kabul_afghan,2021-08-16
74657,"Daily Discussion Thread for August 30, 2021",$CRSR's big Shrek dildo,08-30-2021,CocktailznDreams,7.0,crsrs big shrek dildo,negative,0.56020916,,,315,315_shrek_shreks_cock_cocks,2021-08-30
69020,"Daily Discussion Thread for August 16, 2021",The daily popular tickers thread should just be called the Bagholders thread.,08-16-2021,ORCA_OF_WALLST,47.0,the daily popular tickers thread should just be called the bagholders thread,neutral,0.80226666,,,57,57_ticker_tickers_spam_daily,2021-08-16
73722,"Daily Discussion Thread for August 27, 2021",J Powell was getting a BJ during meeting this morning,08-27-2021,Soldacki,8.0,j powell was getting a bj during meeting this morning,neutral,0.9053245,,,129,129_powell_powells_sip_banking,2021-08-27
73963,"Weekend Discussion Thread for the Weekend of August 27, 2021","I've made a huge mistake.   

I'm in mid city New Orleans right now",08-29-2021,get_MEAN_yall,12.0,ive made a huge mistake im in mid city new orleans right now,negative,0.8454119,,,454,454_mistakes_mistake_lesson_lessons,2021-08-29
67814,"Daily Discussion Thread for August 12, 2021",This is the quarter where you find out if wsb marketing worked for sofi.,08-12-2021,Always_Excited,15.0,this is the quarter where you find out if wsb marketing worked for sofi,neutral,0.80284786,,,16,16_wkhs_wsb_wsbs_crew,2021-08-12
71239,"Weekend Discussion Thread for the Weekend of August 20, 2021",I was so happy to make 10k last week I decided to donate 11k to the poor hedge fund guy this week.,08-21-2021,lives4pizza,39.0,i was so happy to make 10k last week i decided to donate 11k to the poor hedge fund guy this week,positive,0.9365081,,,-1,-1_spce_000_price_bags,2021-08-21
70207,"Daily Discussion Thread for August 18, 2021","bulls talkin shit, bears talkin shit, meanwhile I am 99% sure theta is gonna win today",08-18-2021,LovableContrarian,22.0,bulls talkin shit bears talkin shit meanwhile i am 99 sure theta is gonna win today,negative,0.60961515,,,62,62_theta_gang_wins_thetagang,2021-08-18
74144,"Weekend Discussion Thread for the Weekend of August 27, 2021",Manchester United is an actual publicly traded company that you can buy stock on RH? Wtffff 💀💀💀,08-27-2021,PokeTheMadBro,8.0,manchester united is an actual publicly traded company that you can buy stock on rh wtffff,neutral,0.6149291,,,117,117_mnmd_nndm_trippin_shrooms,2021-08-27
74707,"Daily Discussion Thread for August 31, 2021","Oh yeah BABA
Jack Ma balls",08-31-2021,StandardCord18,15.0,oh yeah baba jack ma balls,neutral,0.5253792,,,-1,-1_spce_000_price_bags,2021-08-31
66622,"Daily Discussion Thread for August 09, 2021","Invest in air conditioning companies.

Can't go tits up.",08-09-2021,hshamza,8.0,invest in air conditioning companies cant go tits up,negative,0.68844885,,,-1,-1_spce_000_price_bags,2021-08-09
74988,"Daily Discussion Thread for August 31, 2021","If everyone is expecting a SPY drop in September, wouldn't that be priced in?

With that said, 15OCT 481c. More than 30 days to move up 7% for 0.20.",08-31-2021,ClamPaste,8.0,if everyone is expecting a spy drop in september wouldnt that be priced in with that said 15oct 481c more than 30 days to move up 7 for 0 20,neutral,0.80792654,,,-1,-1_spce_000_price_bags,2021-08-31
71593,"Weekend Discussion Thread for the Weekend of August 20, 2021","Way too many people are talking about a bubble pop or a crash, for one to actually happen. The crash is a sneaky snek and it likes to catch people off guard, and it likes to do it by a means nobody is widely discussing… My bet is the next crash is caused by zombies

Edit: zombie sneks",08-21-2021,ShopBitter,9.0,way too many people are talking about a bubble pop or a crash for one to actually happen the crash is a sneaky snek and it likes to catch people off guard and it likes to do it by a means nobody is widely discussing my bet is the next crash is caused by zombies edit zombie sneks,negative,0.63982755,,bb,287,287_pop_bubble_bbbbbbbbbb_shark,2021-08-21
64959,"Daily Discussion Thread for August 04, 2021",SOFI decided to make some money today.  What a change!,08-04-2021,Stonks4sport,11.0,sofi decided to make some money today what a change,positive,0.5838066,,,30,30_sofi_fa_charter_sos,2021-08-04
71386,"Weekend Discussion Thread for the Weekend of August 20, 2021",Did an hour on the treadmill. Haven't missed a day in awhile but usually only do 30 minutes. Feel like an athlete. 😜,08-22-2021,wrex619,10.0,did an hour on the treadmill havent missed a day in awhile but usually only do 30 minutes feel like an athlete,positive,0.61246675,,,141,141_gym_treadmill_lululemon_leggings,2021-08-22
73332,"Daily Discussion Thread for August 26, 2021",First time I took a 100% profit in a long time instead of getting greedy. Feels good tbh. I'm a changed man.,08-26-2021,dsubpo,7.0,first time i took a 100 profit in a long time instead of getting greedy feels good tbh im a changed man,positive,0.9141806,,,41,41_profits_profit_greed_earnings,2021-08-26
71120,"Daily Discussion Thread for August 20, 2021",Any PSFE bulls in the house?,08-20-2021,HerrIggy,7.0,any psfe bulls in the house,neutral,0.85142815,,,42,42_bulls_bull_bears_bear,2021-08-20
65311,"Daily Discussion Thread for August 05, 2021",Bought FSLY FD 40c expiring tomorrow for 9$ sold now for 240$,08-05-2021,PutsOnYourWife,10.0,bought fsly fd 40c expiring tomorrow for 9 sold now for 240,neutral,0.9281906,,,-1,-1_spce_000_price_bags,2021-08-05
70764,"Daily Discussion Thread for August 19, 2021",The market has given bulls and bears multiple opportunities to make money today and the majority of us have still probably lost.,08-19-2021,DermaFlerp,10.0,the market has given bulls and bears multiple opportunities to make money today and the majority of us have still probably lost,negative,0.6499514,,,32,32_bear_bears_bull_bulls,2021-08-19
73596,"Daily Discussion Thread for August 27, 2021",What a stupid market how does everything pump to the sun in the space of 10 minutes,08-27-2021,SKT_T1_eSports,9.0,what a stupid market how does everything pump to the sun in the space of 10 minutes,negative,0.89792854,,,58,58_pump_dump_dumps_pumping,2021-08-27
73809,"Daily Discussion Thread for August 27, 2021",Why he keep swallowing and clearing his throat so much??,08-27-2021,Fiddli,8.0,why he keep swallowing and clearing his throat so much,neutral,0.5759167,,,318,318_zoom_mic_mute_microphone,2021-08-27
73344,"Daily Discussion Thread for August 26, 2021",well after losing 7k last 2 weeks. I will take a win of $350 today and stay cashgang till maybe close,08-26-2021,icedwhitemocha_,7.0,well after losing 7k last 2 weeks i will take a win of 350 today and stay cashgang till maybe close,neutral,0.5838424,,,40,40_5k_20k_30k_3k,2021-08-26
73530,"Daily Discussion Thread for August 27, 2021",Recession cancelled pt 69,08-27-2021,sebach22,9.0,recession cancelled pt 69,negative,0.5147045,,,121,121_recession_cancelled_canceled_recessions,2021-08-27
64281,"Daily Discussion Thread for August 02, 2021","i’m retarded. i just move to a state that’s MST, not PST… was wondering why the market wasn’t opening just now",08-02-2021,SaltyKrew,7.0,im retarded i just move to a state thats mst not pst was wondering why the market wasnt opening just now,negative,0.77318794,,,43,43_closed_opens_opening_monday,2021-08-02
67889,"Daily Discussion Thread for August 12, 2021",We've now hit wonderful that time of the day where Cramer just randomly strings words together for an hour straight.,08-12-2021,hakan_loob44,11.0,weve now hit wonderful that time of the day where cramer just randomly strings words together for an hour straight,neutral,0.46589455,,,37,37_cramer_jim_cramers_faber,2021-08-12
72722,"Daily Discussion Thread for August 25, 2021","✅ Margin reenabled

✅ Tits totally jacked

✅ Retard on full",08-25-2021,anonkraken,8.0,margin reenabled tits totally jacked retard on full,negative,0.917332,,,289,289_jacked_tits_jacking_jack,2021-08-25
69388,"Daily Discussion Thread for August 16, 2021",my puts are printing! so -75% for my account since last week instead of completely broke! excitement!,08-16-2021,robohydrate,7.0,my puts are printing so 75 for my account since last week instead of completely broke excitement,neutral,0.50662506,,,-1,-1_spce_000_price_bags,2021-08-16
74617,"Daily Discussion Thread for August 30, 2021",BABA guy pumping BABA so he doesn't get banned?,08-30-2021,okLetsgo311,8.0,baba guy pumping baba so he doesnt get banned,neutral,0.6566177,,,49,49_baba_bob_bankrupt_ban,2021-08-30
70106,"Daily Discussion Thread for August 18, 2021","Bears, you better sell those puts if you want to eat this month.",08-18-2021,SrAccident,10.0,bears you better sell those puts if you want to eat this month,neutral,0.62294555,,,1,1_priced_sale_discount_price,2021-08-18
68392,"Daily Discussion Thread for August 13, 2021","Sold my aapl puts at 0 loss that’s a win for me today 

Fcking low bar",08-13-2021,curatingFDs,9.0,sold my aapl puts at 0 loss thats a win for me today fcking low bar,positive,0.41367102,,,47,47_aapl_earnings_total_pile,2021-08-13
72783,"Daily Discussion Thread for August 25, 2021","OnlyFans back to allowing tiddys 🤤🤤

SPY $500",08-25-2021,VacationLover1,22.0,onlyfans back to allowing tiddys spy 500,neutral,0.74635816,,,6,6_440_445_444_453,2021-08-25
70905,"Daily Discussion Thread for August 20, 2021","I feel like I should start trading off Apple almost like an Index. I didn't know where the bottom for SPY was, but I knew $145 was a good entry point for AAPL. Fuck",08-20-2021,lktransfer,11.0,i feel like i should start trading off apple almost like an index i didnt know where the bottom for spy was but i knew 145 was a good entry point for aapl fuck,negative,0.7006348,,,-1,-1_spce_000_price_bags,2021-08-20
83176,"Daily Discussion Thread for September 23, 2021","Holy shit, the random TLRY calls I bought yesterday for nothing might actually print",09-23-2021,federal_prism,10.0,holy shit the random tlry calls i bought yesterday for nothing might actually print,neutral,0.43533215,,,84,84_printing_print_printer_printed,2021-09-23
84000,"Weekend Discussion Thread for the Weekend of September 24, 2021",Puts on Grimes.,09-26-2021,LiveInLayers,7.0,puts on grimes,neutral,0.64126676,,,419,419_servers_reddit_bonnaroo_communism,2021-09-26
77579,"Daily Discussion Thread for September 08, 2021",I'm bullish on Clov I just grabbed 93 shares at 9.86 come on clovvvv,09-08-2021,Valuable-Ad7006,7.0,im bullish on clov i just grabbed 93 shares at 9 86 come on clovvvv,positive,0.79990727,,bb,75,75_clov_medicare_grabbed_upgraded,2021-09-08
83544,"Daily Discussion Thread for September 24, 2021","Willingness to take risks ☑️

Being wrong about it every single damn time ☑️",09-24-2021,Vegas2414,11.0,willingness to take risks being wrong about it every single damn time,negative,0.8573476,,,508,508_risk_math_management_tolerance,2021-09-24
79077,"Daily Discussion Thread for September 13, 2021","If you cant stay green with a 0.7% gap up, nothing is gonna keep us green. Bulls you might as well just sell all your shit and step out of the market for a couple months",09-13-2021,Tarek3994,10.0,if you cant stay green with a 0 7 gap up nothing is gonna keep us green bulls you might as well just sell all your shit and step out of the market for a couple months,negative,0.8312185,,,-1,-1_spce_000_price_bags,2021-09-13
83891,"Weekend Discussion Thread for the Weekend of September 24, 2021","If you think about it we're all really slaves, just with better pay",09-26-2021,Thick-Acanthaceae-59,11.0,if you think about it were all really slaves just with better pay,neutral,0.5378211,,,-1,-1_spce_000_price_bags,2021-09-26
80882,"Daily Discussion Thread for September 17, 2021",SDC do that thing where you jump 80% in a day..,09-17-2021,jbro12345,11.0,sdc do that thing where you jump 80 in a day,neutral,0.8254039,,,98,98_sdc_7c_patent_bananas,2021-09-17
82053,"Daily Discussion Thread for September 21, 2021",Good thing I didn’t buy calls at SPY 430 and then inversed myself and bought puts at close 🤡🤡🤡,09-21-2021,cptphoto,23.0,good thing i didnt buy calls at spy 430 and then inversed myself and bought puts at close,positive,0.45892572,,,9,9_0dte_sold_expiring_loss,2021-09-21
83898,"Weekend Discussion Thread for the Weekend of September 24, 2021",Technically isn’t going long SPY always a guaranteed bag?,09-26-2021,colateraldamnage,10.0,technically isnt going long spy always a guaranteed bag,neutral,0.7183052,,,-1,-1_spce_000_price_bags,2021-09-26
81442,"Weekend Discussion Thread for the Weekend of September 17, 2021","Wife and I hit a Creole place we love but rarely visit, had the best frog legs I’ve had in my entire existence. Chicken wishes it tasted like frog legs.",09-18-2021,forthetorino,7.0,wife and i hit a creole place we love but rarely visit had the best frog legs ive had in my entire existence chicken wishes it tasted like frog legs,positive,0.96423626,,,68,68_eggs_ketchup_pizza_dinner,2021-09-18
82927,"Daily Discussion Thread for September 22, 2021",Ate a whole box of fiber bars last night. Already took 3 shits this AM. Bullish.,09-22-2021,AromaticFarmer,24.0,ate a whole box of fiber bars last night already took 3 shits this am bullish,neutral,0.55553687,,,-1,-1_spce_000_price_bags,2021-09-22
83552,"Daily Discussion Thread for September 24, 2021","Holding GOEV at a cost basis of $19.5/share and seeing it go up 20% now and not even tickling my initial really makes a guy think. 


Think about quitting trading that is.",09-24-2021,StylinDinosaur,9.0,holding goev at a cost basis of 19 5 share and seeing it go up 20 now and not even tickling my initial really makes a guy think think about quitting trading that is,neutral,0.48740056,,,82,82_goev_gourd_gourds_ornamental,2021-09-24
78357,"Daily Discussion Thread for September 10, 2021",I deposited 84 dollars this morning and now I’m at 770. This will never happen again.,09-10-2021,Codyskank,8.0,i deposited 84 dollars this morning and now im at 770 this will never happen again,negative,0.6339496,,,376,376_deposited_deposit_account_transferring,2021-09-10
80338,"Daily Discussion Thread for September 16, 2021",I want to jump off a bridge fuck my life,09-16-2021,fufm,16.0,i want to jump off a bridge fuck my life,negative,0.97243905,,,-1,-1_spce_000_price_bags,2021-09-16
76889,"Daily Discussion Thread for September 07, 2021",Fuck this I’m buying the dip,09-07-2021,JustaNetherHero,12.0,fuck this im buying the dip,negative,0.92742455,,,2,2_dips_dipping_dip_dipped,2021-09-07
81071,"Daily Discussion Thread for September 17, 2021","BERS hand over ur stonks and no one gets hurt

🐻🔫🥸",09-17-2021,hftrobo9285,9.0,bers hand over ur stonks and no one gets hurt,neutral,0.6369043,,,115,115_stonks_stonk_boots_winter,2021-09-17
77361,"Daily Discussion Thread for September 08, 2021",SPY hasn't hit ATH since 9/2. Gonna be breaking $454 tomorrow because we know the market can't go a whole week without an ATH,09-08-2021,mediocre-referee,11.0,spy hasnt hit ath since 9 2 gonna be breaking 454 tomorrow because we know the market cant go a whole week without an ath,neutral,0.65197015,,,100,100_ath_aths_atl_hit,2021-09-08
85106,"Daily Discussion Thread for September 29, 2021","Back in FEB, we had \~700K WSB members online every freakin day...Now it's just \~30K lol",09-29-2021,hello_hack0r,89.0,back in feb we had 700k wsb members online every freakin day now its just 30k lol,neutral,0.4779988,,,-1,-1_spce_000_price_bags,2021-09-29
85773,"Daily Discussion Thread for September 30, 2021",Kicked the can down the road!!! USA USA!!! 🇺🇸 🦅,09-30-2021,Tbonepermabull,9.0,kicked the can down the road usa usa,neutral,0.77809995,,,33,33_china_chinese_chinas_usa,2021-09-30
82205,"Daily Discussion Thread for September 21, 2021",Fuck it I’m holding my calls today 🥵,09-21-2021,mamadidntraiseabitch,11.0,fuck it im holding my calls today,negative,0.94075114,,,0,0_expire_expiring_call_expired,2021-09-21
84367,"Daily Discussion Thread for September 27, 2021","“Gonna try to not make any trades before 11am today”

*trades already*",09-27-2021,Psyched4this,9.0,gonna try to not make any trades before 11am today trades already,neutral,0.77705353,,,61,61_trade_trades_trading_trader,2021-09-27
81469,"Weekend Discussion Thread for the Weekend of September 17, 2021","I’ve learned 2 things in the 5 years since graduating college:

1. Don’t buy puts

2. Chips Ahoy gives me acid reflux",09-18-2021,CMac681,7.0,ive learned 2 things in the 5 years since graduating college 1 dont buy puts 2 chips ahoy gives me acid reflux,negative,0.60476637,,,342,342_shrooms_mushrooms_mushroom_margarine,2021-09-18
77049,"Daily Discussion Thread for September 07, 2021",More power to the MVST gang 🍾🙌🏻🚀🚀🚀🚀,09-07-2021,travelndleisure,8.0,more power to the mvst gang,positive,0.9190895,,,-1,-1_spce_000_price_bags,2021-09-07
80414,"Daily Discussion Thread for September 16, 2021",Opad paying my rent the next 2 months,09-16-2021,AmeriMan2,11.0,opad paying my rent the next 2 months,neutral,0.8471867,,,85,85_housing_rent_homeless_landlord,2021-09-16
76736,"Weekend Discussion Thread for the Weekend of September 03, 2021",Literally put all my money on Spy calls. God please. Fuk,09-04-2021,Unitedtendies,8.0,literally put all my money on spy calls god please fuk,negative,0.95716923,,,0,0_expire_expiring_call_expired,2021-09-04
80349,"Daily Discussion Thread for September 16, 2021","Wow risked $500 to make $25.

Im good at trading.",09-16-2021,bbq-ribs,14.0,wow risked 500 to make 25 im good at trading,positive,0.68460536,,,-1,-1_spce_000_price_bags,2021-09-16
77529,"Daily Discussion Thread for September 08, 2021",What’s happening with $ROOT?? Is it the squeeze baby,09-08-2021,MakingBigBank,8.0,whats happening with root is it the squeeze baby,neutral,0.794243,,,337,337_root_balls_deep_dental,2021-09-08
76929,"Daily Discussion Thread for September 07, 2021",Can you even comprehend the pain of losing it all but not being able to post loss porn because you're so broke it's not even impressive?,09-07-2021,PM_ME_EVIL_CURSES,11.0,can you even comprehend the pain of losing it all but not being able to post loss porn because youre so broke its not even impressive,negative,0.9527827,,,74,74_porn_pornhub_content_hentai,2021-09-07
80621,"Daily Discussion Thread for September 16, 2021",I lost 20k in 2 days with PLTR. I knew god didn’t love me but this is too much to handle at once,09-16-2021,Phantom_Journey,8.0,i lost 20k in 2 days with pltr i knew god didnt love me but this is too much to handle at once,negative,0.96050614,,,40,40_5k_20k_30k_3k,2021-09-16
78330,"Daily Discussion Thread for September 10, 2021",#totally organic spy moves,09-10-2021,ignig,7.0,totally organic spy moves,neutral,0.8171244,,,-1,-1_spce_000_price_bags,2021-09-10
81878,"Daily Discussion Thread for September 20, 2021","# I bought the dip.

25 dips ago",09-20-2021,nosalute,13.0,i bought the dip 25 dips ago,neutral,0.7802796,,,2,2_dips_dipping_dip_dipped,2021-09-20
79977,"Daily Discussion Thread for September 15, 2021",Friendly reminder NKLA is up 5% this month while most of you are down 50%+,09-15-2021,mannequit,9.0,friendly reminder nkla is up 5 this month while most of you are down 50,neutral,0.77456796,,,325,325_nkla_nke_revenue_tards,2021-09-15
82013,"Daily Discussion Thread for September 20, 2021",May your portfolio turn green by magic,09-20-2021,cosmicweiners,12.0,may your portfolio turn green by magic,positive,0.7793266,,,11,11_red_color_reds_jpow,2021-09-20
78398,"Daily Discussion Thread for September 10, 2021",The drilling will continue until morale improves.,09-10-2021,eternalrefuge86,8.0,the drilling will continue until morale improves,neutral,0.74625415,,,86,86_drill_drilling_duty_morale,2021-09-10
82737,"Daily Discussion Thread for September 22, 2021",JPOW is the GOAT federal reserve chairman,09-22-2021,Anymeans6,11.0,jpow is the goat federal reserve chairman,neutral,0.55307674,,,-1,-1_spce_000_price_bags,2021-09-22
83274,"Daily Discussion Thread for September 23, 2021",My manager at my new job that I will be starting next week just sent me my first day email with the wrong name at the top. Bad way to start off,09-23-2021,CSMATHENGR,10.0,my manager at my new job that i will be starting next week just sent me my first day email with the wrong name at the top bad way to start off,negative,0.89254916,,,18,18_jobs_unemployment_boss_jobless,2021-09-23
77185,"Daily Discussion Thread for September 07, 2021",Something lovely just happened to CRSR.,09-07-2021,Oxianas,8.0,something lovely just happened to crsr,positive,0.94436944,,,69,69_crsr_censored_earnings_analyst,2021-09-07
82744,"Daily Discussion Thread for September 22, 2021",JPOW tapering live on Snapchat right now,09-22-2021,EatMaTesticles,9.0,jpow tapering live on snapchat right now,neutral,0.90228534,,,-1,-1_spce_000_price_bags,2021-09-22
84312,"Daily Discussion Thread for September 27, 2021",![img](emote|t5_2th52|4271)![img](emote|t5_2th52|4272),09-27-2021,NoTransportation2899,10.0,img emote t5_2th52 4271 img emote t5_2th52 4272,neutral,0.8904481,,,70,70_t52th52_emote_4260_4266,2021-09-27
78162,"Daily Discussion Thread for September 10, 2021",AMC having a day,09-10-2021,noobiepoobie2,12.0,amc having a day,neutral,0.6687806,,amc,13,13_netflix_movie_movies_push,2021-09-10
83684,"Daily Discussion Thread for September 24, 2021","Don't worry commies, 130 will surely be the bottom for BABA 🤡",09-24-2021,Spitzly,9.0,dont worry commies 130 will surely be the bottom for baba,neutral,0.6409914,,,49,49_baba_bob_bankrupt_ban,2021-09-24
77212,"Daily Discussion Thread for September 07, 2021","DKNG is the way...and CHPT, NVDA.",09-07-2021,Aubiepolo,7.0,dkng is the way and chpt nvda,neutral,0.70297015,,,132,132_dkng_mob_nfl_vices,2021-09-07
82439,"Daily Discussion Thread for September 21, 2021",OPEN THE CASINO,09-21-2021,WagieInTheCagie,8.0,open the casino,neutral,0.71974677,,,21,21_casino_gambling_addiction_gamble,2021-09-21
78054,"Daily Discussion Thread for September 09, 2021",![img](emote|t5_2th52|4267)![img](emote|t5_2th52|4276),09-09-2021,imsilver4fukyou,7.0,img emote t5_2th52 4267 img emote t5_2th52 4276,neutral,0.8981038,,,70,70_t52th52_emote_4260_4266,2021-09-09
82089,"Daily Discussion Thread for September 21, 2021","Yesterday: OMG, SELL ALL THE THINGS!

Today: OMG, BUY ALL THE THINGS!

The Retarded Hokey Pokey.",09-21-2021,ChaoticPantser,76.0,yesterday omg sell all the things today omg buy all the things the retarded hokey pokey,negative,0.6359243,,,-1,-1_spce_000_price_bags,2021-09-21
81827,"Daily Discussion Thread for September 20, 2021",and just like that I became a long term investor,09-20-2021,prehistoriclurker,14.0,and just like that i became a long term investor,neutral,0.61754835,,,4,4_investor_growth_investing_invest,2021-09-20
83142,"Daily Discussion Thread for September 23, 2021",SPY gap up to 1000 tomorrow morning,09-23-2021,lalfred,11.0,spy gap up to 1000 tomorrow morning,neutral,0.87079465,,,-1,-1_spce_000_price_bags,2021-09-23
76669,"Weekend Discussion Thread for the Weekend of September 03, 2021","Went to a night market and see so many people fall for those carnival games… yep, gambling problems are deep inside all of us",09-05-2021,margin_call_rep,8.0,went to a night market and see so many people fall for those carnival games yep gambling problems are deep inside all of us,negative,0.94179535,,,21,21_casino_gambling_addiction_gamble,2021-09-05
78635,"Weekend Discussion Thread for the Weekend of September 10, 2021",🤔covid has increased the amount of fatties roaming the earth,09-12-2021,Impossible_Job_4547,14.0,covid has increased the amount of fatties roaming the earth,neutral,0.5569509,,,249,249_covid_pandemic_deaths_argentina,2021-09-12
76222,"Daily Discussion Thread for September 03, 2021","RKLB cant stop, wont stop!!! FUCK YEAH!!!! OHHHHHHHHHHH!!!!",09-03-2021,zeushercinvest,8.0,rklb cant stop wont stop fuck yeah ohhhhhhhhhhh,negative,0.5349069,,,148,148_lab_gevo_mars_booooyyyyz,2021-09-03
84965,"Daily Discussion Thread for September 28, 2021","Christ if you are a bull and sell today you are a retard maximum. At least wait until the GOP caves and raises the debt ceiling like they always do when this shot happens, and you’ll make some of your money back",09-28-2021,ProBenji,9.0,christ if you are a bull and sell today you are a retard maximum at least wait until the gop caves and raises the debt ceiling like they always do when this shot happens and youll make some of your money back,negative,0.76658684,,,-1,-1_spce_000_price_bags,2021-09-28
84443,"Daily Discussion Thread for September 27, 2021",This SPY chart is cancerous,09-27-2021,HippyWawa,9.0,this spy chart is cancerous,negative,0.95580417,,,225,225_chart_charts_astrology_zoom,2021-09-27
80568,"Daily Discussion Thread for September 16, 2021",Where the guy that said he’s going to suck his sister toes if spy goes green?,09-16-2021,ev01ution,9.0,where the guy that said hes going to suck his sister toes if spy goes green,negative,0.78724045,,,119,119_closes_ends_finishes_end,2021-09-16
85173,"Daily Discussion Thread for September 29, 2021",Picked a bad time to quit my job...,09-29-2021,SilverSpirit7,12.0,picked a bad time to quit my job,negative,0.81995386,,,18,18_jobs_unemployment_boss_jobless,2021-09-29
75552,"Daily Discussion Thread for September 01, 2021",Amd needs to step it up,09-01-2021,beepboopbop65,6.0,amd needs to step it up,neutral,0.5664059,,,48,48_amd_intel_ryzen_83,2021-09-01
85613,"Daily Discussion Thread for September 30, 2021","Remember u wanted to be rich 

That was cool 🤓",09-30-2021,KOBA-fight-4-Ape,13.0,remember u wanted to be rich that was cool,positive,0.7233226,,,196,196_rich_wealthy_become_lizard,2021-09-30
79877,"Daily Discussion Thread for September 15, 2021","will we proceed to bleed, let bears breed, feed, and succeed? or will bulls intercede, stampede, and speed to supersede?",09-15-2021,diggin-the-doge,18.0,will we proceed to bleed let bears breed feed and succeed or will bulls intercede stampede and speed to supersede,neutral,0.8546926,,,-1,-1_spce_000_price_bags,2021-09-15
85566,"Daily Discussion Thread for September 30, 2021",Octobull tomorrow!!!,09-30-2021,Tbonepermabull,14.0,octobull tomorrow,neutral,0.7688712,,,512,512_octobull_septembear_octobrrrr_octobear,2021-09-30
79364,"Daily Discussion Thread for September 13, 2021","Wake up $CCJ, I need you",09-13-2021,krismasstercant,6.0,wake up ccj i need you,neutral,0.68837327,,,166,166_ccj_cciv_cc_remembers,2021-09-13
77555,"Daily Discussion Thread for September 08, 2021",Why doesn't any financial site show the value of an option over its lifetime?,09-08-2021,CSMATHENGR,7.0,why doesnt any financial site show the value of an option over its lifetime,negative,0.58465546,,,0,0_expire_expiring_call_expired,2021-09-08
76748,"Weekend Discussion Thread for the Weekend of September 03, 2021",Hadn't posted anything to Facebook since 2016 decided to take a look and noped tf outta there. Yall are my real friends lol,09-05-2021,Zachjsrf,8.0,hadnt posted anything to facebook since 2016 decided to take a look and noped tf outta there yall are my real friends lol,neutral,0.54659986,,facebook,118,118_facebook_fb_whistleblower_zuckerberg,2021-09-05
78918,"Weekend Discussion Thread for the Weekend of September 10, 2021","Gonna start drinking my sorrow away gents, cheers.",09-10-2021,Windforce,7.0,gonna start drinking my sorrow away gents cheers,neutral,0.45377907,,,19,19_drunk_drinking_hangover_hungover,2021-09-10
84454,"Daily Discussion Thread for September 27, 2021",TSLA 850’end of the month 📈,09-27-2021,gertje69-420,8.0,tsla 850end of the month,neutral,0.78663826,,tsla,36,36_700_900_800_690,2021-09-27
81536,"Weekend Discussion Thread for the Weekend of September 17, 2021",This Saints game is just fucking depressing.  Kamara dragging down my fantasy team,09-19-2021,papasmurftp,7.0,this saints game is just fucking depressing kamara dragging down my fantasy team,negative,0.9816379,,,-1,-1_spce_000_price_bags,2021-09-19
84811,"Daily Discussion Thread for September 28, 2021","Ford will be 40% electric in 2030

Lmao who gives a fuck",09-28-2021,lijijil,12.0,ford will be 40 electric in 2030 lmao who gives a fuck,negative,0.7657872,,ford,227,227_ev_evs_ford_cars,2021-09-28
80161,"Daily Discussion Thread for September 15, 2021","Stages of the trading week, Make a lot of money, Think I'm Warren buffet, Fucking lose everything. I love it.",09-15-2021,5or3n,9.0,stages of the trading week make a lot of money think im warren buffet fucking lose everything i love it,positive,0.4352044,,,214,214_warren_buffet_buffett_buffetts,2021-09-15
76905,"Daily Discussion Thread for September 07, 2021",2nd duce already this morning.  I may have over done it a little yesterday,09-07-2021,Roidsandinsecurity,10.0,2nd duce already this morning i may have over done it a little yesterday,neutral,0.58547294,,,-1,-1_spce_000_price_bags,2021-09-07
83005,"Daily Discussion Thread for September 23, 2021",China is going to cap this evergrande shit by basically announcing public executions of the entire management team 3 levels down and sell attendance tickets worth $300B.,09-23-2021,oby_was_taken,46.0,china is going to cap this evergrande shit by basically announcing public executions of the entire management team 3 levels down and sell attendance tickets worth 300b,negative,0.7073934,,,33,33_china_chinese_chinas_usa,2021-09-23
75353,"Daily Discussion Thread for September 01, 2021",Lmao this is twice today that SPY has eaten shit moments after I buy calls. It was funnier this time though,09-01-2021,regarding_your_cat,7.0,lmao this is twice today that spy has eaten shit moments after i buy calls it was funnier this time though,negative,0.41547334,,,0,0_expire_expiring_call_expired,2021-09-01
84066,"Weekend Discussion Thread for the Weekend of September 24, 2021","Ortega is so pumped his dick is rock hard, always bet on the fighter with the hard dick.",09-26-2021,HotStockSlinger,6.0,ortega is so pumped his dick is rock hard always bet on the fighter with the hard dick,positive,0.5267229,,,167,167_bezos_space_rocket_billionaires,2021-09-26
75266,"Daily Discussion Thread for September 01, 2021",Premarket up to kill puts then flat all day to kill both calls and puts. SPY is a hoe.,09-01-2021,mrscrewup,9.0,premarket up to kill puts then flat all day to kill both calls and puts spy is a hoe,negative,0.85629475,,,9,9_0dte_sold_expiring_loss,2021-09-01
75321,"Daily Discussion Thread for September 01, 2021",BB gunna be a good day,09-01-2021,Jumpy_Ad5487,8.0,bb gunna be a good day,positive,0.9635069,,bb,81,81_climb_daq_undertaker_coffin,2021-09-01
83912,"Weekend Discussion Thread for the Weekend of September 24, 2021",Expecting my first kiddo next year. Calls on BBBY March 2022,09-26-2021,wooshock,10.0,expecting my first kiddo next year calls on bbby march 2022,neutral,0.76963,,bb,88,88_gang_bbby_shambos_lambos,2021-09-26
80508,"Daily Discussion Thread for September 16, 2021",Drill Team 6 deployed. back-up arriving,09-16-2021,Dave_7879,9.0,drill team 6 deployed back up arriving,neutral,0.9304963,,,86,86_drill_drilling_duty_morale,2021-09-16
82834,"Daily Discussion Thread for September 22, 2021",Glad I went all into SOFI yesterday 🤘,09-22-2021,nethermal,9.0,glad i went all into sofi yesterday,positive,0.8640319,,,30,30_sofi_fa_charter_sos,2021-09-22
75914,"Daily Discussion Thread for September 02, 2021","Big Brian CLOV... if every shareholder is a Bagholder, it simply cannot go down",09-02-2021,Whats_Up_Joe,6.0,big brian clov if every shareholder is a bagholder it simply cannot go down,neutral,0.56443894,,,-1,-1_spce_000_price_bags,2021-09-02
83022,"Daily Discussion Thread for September 23, 2021",SDC = Suckin’ Dick Club,09-23-2021,mikeydtd,14.0,sdc suckin dick club,negative,0.90847987,,,-1,-1_spce_000_price_bags,2021-09-23
77284,"Daily Discussion Thread for September 08, 2021",If SPY would just go back to daily moon missions I would be so happy.,09-08-2021,spinxter66,15.0,if spy would just go back to daily moon missions i would be so happy,positive,0.9413374,,,25,25_mooning_moon_mission_pluto,2021-09-08
76269,"Daily Discussion Thread for September 03, 2021","umm IRNT, what in gods name are you doing??  Should have held, lol",09-03-2021,fridaysaturday72,9.0,umm irnt what in gods name are you doing should have held lol,negative,0.5171532,,,252,252_holdamc_togetherstrong_hold_held,2021-09-03
80976,"Daily Discussion Thread for September 17, 2021",meme sector rotation into SDC,09-17-2021,gbrad13,10.0,meme sector rotation into sdc,neutral,0.87204635,,,-1,-1_spce_000_price_bags,2021-09-17
85134,"Daily Discussion Thread for September 29, 2021","S&P : Up 0.5%

Me : Down 10%",09-29-2021,the_beast93112,16.0,s p up 0 5 me down 10,neutral,0.8207868,,,26,26_sndl_appl_trending_tlry,2021-09-29
