,Submission Title,Comment,Date Posted,Author,Score,ProcessedComments,SentimentLabel,SentimentProb,HumanSentiment,StockSearch,Topic,Name,Date
1088,"Daily Discussion Thread for January 06, 2021",Thank you Robinhood Iâ€™m fully aware that everything I own is down 5% today,01-06-2021,247drip1,27.0,thank you robinhood im fully aware that everything i own is down 5 today,neutral,0.5053775,,robinhood,35,35_robinhood_ipo_robinhoods_robin,2021-01-06
3921,"Weekend Discussion Thread for the Weekend of January 15, 2021",You guys played yourselves by diverting your focus into BB / GME split. Shouldve worked together bros.,01-15-2021,never_lucky_eh,48.0,you guys played yourselves by diverting your focus into bb gme split shouldve worked together bros,negative,0.6944096,,bb,228,228_bbi_brotherhood_weeeek_logi,2021-01-15
4259,"Daily Discussion Thread for January 18, 2021",The decision to ban CCI.V from here has deprived some wsbers who aren't millionaires of being millionaires,01-18-2021,ScouseEmmaRoberts,15.0,the decision to ban cci v from here has deprived some wsbers who arent millionaires of being millionaires,negative,0.6277726,,,198,198_ban_banned_unbanned_banbets,2021-01-18
3434,"Daily Discussion Thread for January 15, 2021",So many anti GME comments all of a sudden today really makes you wonder ğŸ¤”ğŸ¤”ğŸ¤”,01-15-2021,pineapplekiwipen,170.0,so many anti gme comments all of a sudden today really makes you wonder,negative,0.7770412,,gme,-1,-1_spce_000_price_bags,2021-01-15
5037,"Daily Discussion Thread for January 20, 2021",WHEN IS HE GOING TO SAY GREEN ENERGY?,01-20-2021,felmo,17.0,when is he going to say green energy,neutral,0.87266904,,,-1,-1_spce_000_price_bags,2021-01-20
3595,"Daily Discussion Thread for January 15, 2021",Buying another $700-800 more of GME at this price if enough autists on board with me. Who wants to join the tendies train?,01-15-2021,AdministrativeRub235,21.0,buying another 700 800 more of gme at this price if enough autists on board with me who wants to join the tendies train,neutral,0.7983581,,gme,173,173_autism_autists_autist_autistic,2021-01-15
610,"Weekend Discussion Thread for the Weekend of January 01, 2021","How is my power outage detection map gonna show : âš ï¸ 1  Customer Affected

**Bitch you mean just me!?!?**",01-02-2021,Zephyr101,12.0,how is my power outage detection map gonna show 1 customer affected bitch you mean just me,negative,0.79793525,,,33,33_china_chinese_chinas_usa,2021-01-02
2361,"Daily Discussion Thread for January 11, 2021",Options only reward those willing to YOLO at the risk of becoming homeless. Change my mind,01-11-2021,TAWS,37.0,options only reward those willing to yolo at the risk of becoming homeless change my mind,neutral,0.5499757,,,85,85_housing_rent_homeless_landlord,2021-01-11
5928,"Weekend Discussion Thread for the Weekend of January 22, 2021",Thinking of buying a couple of GME puts so I can be labeled legally retarded and be eligible to get the COVID vaccine.,01-24-2021,dudz23,28.0,thinking of buying a couple of gme puts so i can be labeled legally retarded and be eligible to get the covid vaccine,negative,0.5586779,,gme,-1,-1_spce_000_price_bags,2021-01-24
3273,"Daily Discussion Thread for January 14, 2021","We are not even close to finishing 

GME ğŸš€

https://i.imgur.com/tq8EVSp.jpg",01-14-2021,optionsCone,19.0,we are not even close to finishing gme https i imgur com tq8evsp jpg,negative,0.4692983,,gme,51,51_03ncnwxrm64_king_deploy_saga,2021-01-14
1241,"Daily Discussion Thread for January 06, 2021","Everything on my watchlist is up premarket.


Everything I own is down",01-06-2021,FakeAre,12.0,everything on my watchlist is up premarket everything i own is down,neutral,0.5979906,,,-1,-1_spce_000_price_bags,2021-01-06
3159,"Daily Discussion Thread for January 14, 2021","**Ticker mentions as of 8:50AM**

BABA: 67

TSLA: 71

PLUG: 56

GME: 805

LMFAO",01-14-2021,fellow_clown,21.0,ticker mentions as of 8 50am baba 67 tsla 71 plug 56 gme 805 lmfao,neutral,0.75138694,,tsla,-1,-1_spce_000_price_bags,2021-01-14
1312,"Daily Discussion Thread for January 06, 2021","clean energy is so tight, good job WSB we got one right",01-06-2021,-NardDog,12.0,clean energy is so tight good job wsb we got one right,positive,0.94880545,,,76,76_power_pow_energy_lit,2021-01-06
2093,"Daily Discussion Thread for January 08, 2021","as a person who flies in airplanes, I kind of wish that Boeing had been fined more than 2.5 billion dollars for a criminal conspiracy to cover up, and conceal information that pertained to the 737 max crashes.",01-08-2021,Bachbro,12.0,as a person who flies in airplanes i kind of wish that boeing had been fined more than 2 5 billion dollars for a criminal conspiracy to cover up and conceal information that pertained to the 737 max crashes,negative,0.7481689,,,346,346_airlines_boeing_flight_airline,2021-01-08
5462,"Daily Discussion Thread for January 22, 2021",PLTR and BB ğŸš€ğŸš€ğŸš€ can't wait next week.,01-22-2021,Bradylorian,17.0,pltr and bb cant wait next week,positive,0.94527453,,bb,-1,-1_spce_000_price_bags,2021-01-22
5109,"Daily Discussion Thread for January 20, 2021","Alright boys holding BB, Tesla and AG calls. Lets goooo",01-20-2021,atomicgarrison,13.0,alright boys holding bb tesla and ag calls lets goooo,neutral,0.5200851,,bb,20,20_tesla_700_900_teslas,2021-01-20
2940,"Daily Discussion Thread for January 12, 2021",If you're getting upset at short term dips in ICLN it was never meant for you,01-12-2021,warmturtle5758,12.0,if youre getting upset at short term dips in icln it was never meant for you,negative,0.8894127,,,-1,-1_spce_000_price_bags,2021-01-12
3792,"Daily Discussion Thread for January 15, 2021",Melvin if it makes you feel better you can write off your Capital loss for the next 18300 years,01-15-2021,StarSwitch,20.0,melvin if it makes you feel better you can write off your capital loss for the next 18300 years,neutral,0.54548407,,,223,223_melvin_capital_melvins_melvincapital,2021-01-15
3006,"Daily Discussion Thread for January 12, 2021",This is the first time in a year Iâ€™ve had most of my money tied up in shares. Thereâ€™s...nothing to do. Just. Wait? Is this what r/investing is like all the time?,01-12-2021,FacedByHollywood,10.0,this is the first time in a year ive had most of my money tied up in shares theres nothing to do just wait is this what r investing is like all the time,neutral,0.5188026,,,-1,-1_spce_000_price_bags,2021-01-12
5677,"Daily Discussion Thread for January 22, 2021",I really think mods should temporarily make wsb private for while until all the media attention goes away,01-22-2021,ImAnonymous135,13.0,i really think mods should temporarily make wsb private for while until all the media attention goes away,neutral,0.64663035,,,16,16_wkhs_wsb_wsbs_crew,2021-01-22
3564,"Daily Discussion Thread for January 15, 2021",GME ğŸš€ğŸš€ğŸš€ğŸš€ğŸš€ just bought 260 shares letâ€™s go ğŸš€ğŸš€ğŸš€ğŸš€,01-15-2021,Tangelooo,29.0,gme just bought 260 shares lets go,neutral,0.7500198,,gme,59,59_share_shares_1000_gmes,2021-01-15
4617,"Daily Discussion Thread for January 19, 2021",When you buy the dip but she keeps dippin ğŸ˜± ğŸ˜© ğŸ’¦,01-19-2021,perpendosi,14.0,when you buy the dip but she keeps dippin,negative,0.57612264,,,2,2_dips_dipping_dip_dipped,2021-01-19
5952,"Weekend Discussion Thread for the Weekend of January 22, 2021",To the new motherfuckers here today after seeing us on the news. Welcome. You fucking pieces of shit! Shits different here. Be greedy and fuck you!,01-23-2021,StonksTrader420,24.0,to the new motherfuckers here today after seeing us on the news welcome you fucking pieces of shit shits different here be greedy and fuck you,negative,0.97936404,,,405,405_news_client_breaking_hospitalizations,2021-01-23
5558,"Daily Discussion Thread for January 22, 2021",HOLY SHIT today will go down in WSB history,01-22-2021,kriegkopf,15.0,holy shit today will go down in wsb history,negative,0.6353572,,,16,16_wkhs_wsb_wsbs_crew,2021-01-22
6810,"Daily Discussion Thread for January 26, 2021",BB CMON LEST GO,01-26-2021,kykova,23.0,bb cmon lest go,neutral,0.57707906,,bb,576,576_cmon_cmonnnn_sustain_squirt,2021-01-26
2113,"Daily Discussion Thread for January 08, 2021","Nice, TSLA gained another 0.2 Toyotas today.

Just measure TSLA's gain each day in number of Toyota market caps, makes it easier to visualize.",01-08-2021,imsohonky,12.0,nice tsla gained another 0 2 toyotas today just measure tslas gain each day in number of toyota market caps makes it easier to visualize,positive,0.775307,,tsla,-1,-1_spce_000_price_bags,2021-01-08
3096,"Daily Discussion Thread for January 14, 2021",Gme was a good boy today good boy gme,01-14-2021,Instaraider,25.0,gme was a good boy today good boy gme,positive,0.9833505,,gme,51,51_03ncnwxrm64_king_deploy_saga,2021-01-14
1767,"Daily Discussion Thread for January 07, 2021",I hope papa Elon announces a 100 to 1 stock split soon. I'd totally buy in at $7 a share. And then bid it all the way up to $700 again.,01-07-2021,Mondrayish,11.0,i hope papa elon announces a 100 to 1 stock split soon id totally buy in at 7 a share and then bid it all the way up to 700 again,positive,0.7836205,,,-1,-1_spce_000_price_bags,2021-01-07
3728,"Daily Discussion Thread for January 15, 2021","WSB logic :

Saying: XXX is mooning ğŸš€ğŸš€ğŸš€ 

Actual: XXX is up 0.24%

Saying: XXX is drilling!! ğŸ’£ğŸ’£

Actual: XXX is down 0.09%",01-15-2021,qwertyaas,19.0,wsb logic saying xxx is mooning actual xxx is up 0 24 saying xxx is drilling actual xxx is down 0 09,neutral,0.8383993,,,25,25_mooning_moon_mission_pluto,2021-01-15
1738,"Daily Discussion Thread for January 07, 2021",Alright PLTR get in there and grab that contract to data track everyone that raided the capital. I need you to fucking moon.,01-07-2021,Viewtastic,10.0,alright pltr get in there and grab that contract to data track everyone that raided the capital i need you to fucking moon,negative,0.82430017,,,25,25_mooning_moon_mission_pluto,2021-01-07
5951,"Weekend Discussion Thread for the Weekend of January 22, 2021",BB up at $15 after hours,01-23-2021,smcl1997,23.0,bb up at 15 after hours,neutral,0.7896836,,bb,-1,-1_spce_000_price_bags,2021-01-23
7029,"Daily Discussion Thread for January 29, 2021","Just a reminder, Kings. Have some water beside you and try to walk around a little today. Letâ€™s get these bags. EDIT: AND Queens! We werenâ€™t too used to that 5 million members ago...",01-29-2021,FacedByHollywood,65.0,just a reminder kings have some water beside you and try to walk around a little today lets get these bags edit and queens we werent too used to that 5 million members ago,neutral,0.6082313,,,12,12_bag_bagholders_bags_bagger,2021-01-29
1999,"Daily Discussion Thread for January 08, 2021","I have been paper trading for a just over a month now to learn how options work. My first real money trade was two ICLN $32 contracts at .67 each, I know itâ€™s not much but it makes me feel good knowing that I took my time, figured it out, and made a bet on something I was very confident about :)",01-08-2021,CampbellinniWarrior,14.0,i have been paper trading for a just over a month now to learn how options work my first real money trade was two icln 32 contracts at 67 each i know its not much but it makes me feel good knowing that i took my time figured it out and made a bet on something i was very confident about,positive,0.9338132,,,55,55_options_option_trading_learn,2021-01-08
6380,"Daily Discussion Thread for January 25, 2021","the day the 9k i had hit my account I threw it on GME at open... that day was friday

sometimes you get lucky. 

sometimes you actually think god may be real

see you on the moon boys",01-25-2021,mannequit,63.0,the day the 9k i had hit my account i threw it on gme at open that day was friday sometimes you get lucky sometimes you actually think god may be real see you on the moon boys,positive,0.7840776,,gme,-1,-1_spce_000_price_bags,2021-01-25
1756,"Daily Discussion Thread for January 07, 2021",Jeff who? Oh you mean the poor,01-07-2021,realister,10.0,jeff who oh you mean the poor,negative,0.6647797,,,279,279_epstein_bezos_jeffrey_divorce,2021-01-07
3746,"Daily Discussion Thread for January 15, 2021",GME GANG STAY STRONG,01-15-2021,epicoliver3,19.0,gme gang stay strong,positive,0.73839206,,gme,475,475_gang_4life_padlocks_chimps,2021-01-15
6302,"Daily Discussion Thread for January 25, 2021","NOK, NOK, NOK-ing on heaven's door.",01-25-2021,GruntledEx,28.0,nok nok nok ing on heavens door,neutral,0.73037577,,,126,126_nok_5g_nokkin_nok2021,2021-01-25
6619,"Daily Discussion Thread for January 26, 2021","BB to $100, only 500M shares outstanding.",01-26-2021,EngHH,28.0,bb to 100 only 500m shares outstanding,neutral,0.8711643,,bb,92,92_shares_200_share_500,2021-01-26
3176,"Daily Discussion Thread for January 14, 2021","GME just keeps coiling beautifully and seeing amazing price action. Higher highs, higher lows. Itâ€™s getting ready to rip.",01-14-2021,Tangelooo,20.0,gme just keeps coiling beautifully and seeing amazing price action higher highs higher lows its getting ready to rip,positive,0.9096216,,gme,-1,-1_spce_000_price_bags,2021-01-14
6723,"Daily Discussion Thread for January 26, 2021",Quit selling BB retards,01-26-2021,foreverawalrus,22.0,quit selling bb retards,negative,0.8169682,,bb,1,1_priced_sale_discount_price,2021-01-26
5780,"Weekend Discussion Thread for the Weekend of January 22, 2021",Everybody like this so the mods will give us a BB thread Monday morning.,01-23-2021,The_Hype_Mobile,56.0,everybody like this so the mods will give us a bb thread monday morning,neutral,0.5481296,,bb,212,212_mods_gay_mod_nongmeers,2021-01-23
3906,"Weekend Discussion Thread for the Weekend of January 15, 2021",I wish I could complain about paying taxes from my 2020 profits.  Instead im excited about writing off 3k from my mountain of failures from 2020. ğŸ¤¡,01-16-2021,FredMc,22.0,i wish i could complain about paying taxes from my 2020 profits instead im excited about writing off 3k from my mountain of failures from 2020,negative,0.39432478,,,71,71_tax_taxes_irs_gains,2021-01-16
4501,"Daily Discussion Thread for January 19, 2021",Whoever bought BB today at 10.60.... I salute you,01-19-2021,gobiman8,29.0,whoever bought bb today at 10 60 i salute you,positive,0.9037724,,bb,1,1_priced_sale_discount_price,2021-01-19
5216,"Daily Discussion Thread for January 20, 2021",You fuckers cursed ICLN. The bitch was beautiful until January,01-20-2021,Koolherc777,14.0,you fuckers cursed icln the bitch was beautiful until january,negative,0.9496838,,,144,144_icln_plug_bidens_rtardes,2021-01-20
4536,"Daily Discussion Thread for January 19, 2021","Average WSBer: BIG DICK ENERGYYY YEAHH!

\*buys 3.4 shares\*",01-19-2021,MicrosoftOfficeSuite,19.0,average wsber big dick energyyy yeahh buys 3 4 shares,neutral,0.71987844,,,92,92_shares_200_share_500,2021-01-19
2163,"Daily Discussion Thread for January 08, 2021",I lost all my gains from yesterday today lmao wtf,01-08-2021,tylr_woodsworth,11.0,i lost all my gains from yesterday today lmao wtf,negative,0.8950503,,,64,64_gains_gain_gone_erased,2021-01-08
5509,"Daily Discussion Thread for January 22, 2021",HOLY SHIT BB MOONING,01-22-2021,gobiman8,15.0,holy shit bb mooning,positive,0.47467196,,bb,25,25_mooning_moon_mission_pluto,2021-01-22
5965,"Weekend Discussion Thread for the Weekend of January 22, 2021","If you aren't smart enough to type your stupid questions into Google, you don't belong here.",01-24-2021,StayAtHomeAstronaut,24.0,if you arent smart enough to type your stupid questions into google you dont belong here,negative,0.96714395,,,52,52_retarded_retard_retards_iq,2021-01-24
2764,"Daily Discussion Thread for January 12, 2021",Honestly DASH being at 200 is a bigger bubble than TSLA,01-12-2021,victoryboii,14.0,honestly dash being at 200 is a bigger bubble than tsla,neutral,0.57363266,,bb,-1,-1_spce_000_price_bags,2021-01-12
5102,"Daily Discussion Thread for January 20, 2021",Get onto the BB rocket ship before takeoff tomorrow ğŸš€ğŸš€ğŸš€ğŸš€ğŸš€ğŸš€ğŸš€ğŸš€ğŸš€ğŸš€ğŸš€ğŸš€ğŸš€,01-20-2021,kingxlos,16.0,get onto the bb rocket ship before takeoff tomorrow,neutral,0.8871168,,bb,123,123_rocket_rockets_rocketship_takeoff,2021-01-20
5105,"Daily Discussion Thread for January 20, 2021",Bb needs a pump into close. They did the same shit on Friday. Jump and then down all day until close,01-20-2021,Bakerfish1717,15.0,bb needs a pump into close they did the same shit on friday jump and then down all day until close,negative,0.75089335,,bb,-1,-1_spce_000_price_bags,2021-01-20
4451,"Daily Discussion Thread for January 18, 2021",GME up almost 17% in Europe. LFG!!,01-18-2021,Aye_Barboza,9.0,gme up almost 17 in europe lfg,neutral,0.83878094,,gme,-1,-1_spce_000_price_bags,2021-01-18
4806,"Daily Discussion Thread for January 19, 2021",PLTR is frustrating as shit,01-19-2021,anonymous_eddy,11.0,pltr is frustrating as shit,negative,0.9774613,,,38,38_kid_dreaming_disappointment_foundry,2021-01-19
6040,"Weekend Discussion Thread for the Weekend of January 22, 2021","lmao this idiot bought $20,000 worth of GME puts and already lost $5,000 in a day. Hahahaha

(its not me) https://youtu.be/0U4AOt80Bec",01-24-2021,realister,22.0,lmao this idiot bought 20 000 worth of gme puts and already lost 5 000 in a day hahahaha its not me https youtu be 0u4aot80bec,negative,0.8611868,,gme,-1,-1_spce_000_price_bags,2021-01-24
4306,"Daily Discussion Thread for January 18, 2021",Gourd Gang. Stand back and stand by.,01-18-2021,UpperclassmanKuno,13.0,gourd gang stand back and stand by,neutral,0.7185139,,,-1,-1_spce_000_price_bags,2021-01-18
7100,"Daily Discussion Thread for January 29, 2021","im not fucking leaving, i dont even care anymore about the money i put in. let it go to 0. fuck hedge funds playing with us around",01-29-2021,Baskarb,59.0,im not fucking leaving i dont even care anymore about the money i put in let it go to 0 fuck hedge funds playing with us around,negative,0.965024,,,-1,-1_spce_000_price_bags,2021-01-29
1673,"Daily Discussion Thread for January 07, 2021",Nio 53 is the floor now,01-07-2021,justawaterisfine,12.0,nio 53 is the floor now,neutral,0.8393172,,nio,14,14_25_30_38_break,2021-01-07
4517,"Daily Discussion Thread for January 19, 2021",release the BB memes! ğŸš€ğŸš€ğŸš€ğŸš€ğŸ’ğŸ™Œ,01-19-2021,reiys123,21.0,release the bb memes,neutral,0.76431686,,bb,24,24_meme_memes_boomer_memestock,2021-01-19
3817,"Weekend Discussion Thread for the Weekend of January 15, 2021","Liquidated most of my stocks and deposited the last of my savings into my broker to buy as much GME stock as I can today. Upped my cost average by like $10 but I can't stand to see this fucked up market manipulation and I hope the shorts get destroyed. 

&#x200B;

Fuck melvin. fuck the shorts

~~Wakanda~~  GME forever",01-15-2021,itsleis,58.0,liquidated most of my stocks and deposited the last of my savings into my broker to buy as much gme stock as i can today upped my cost average by like 10 but i cant stand to see this fucked up market manipulation and i hope the shorts get destroyed x200b fuck melvin fuck the shorts wakanda gme forever,negative,0.9740445,,gme,-1,-1_spce_000_price_bags,2021-01-15
1081,"Daily Discussion Thread for January 06, 2021","Is the fact that clean energy is skyrocketing a sign that:

1. A Dem win was not priced in
2. Everything I add to my watchlist and not add to my portfolio is a bull indicator
1. All of the above",01-06-2021,FakeAre,54.0,is the fact that clean energy is skyrocketing a sign that 1 a dem win was not priced in 2 everything i add to my watchlist and not add to my portfolio is a bull indicator 1 all of the above,neutral,0.54945916,,,-1,-1_spce_000_price_bags,2021-01-06
7003,"Daily Discussion Thread for January 29, 2021","Let me just say Iâ€™m so happy and proud to be apart of this community, fuck those elites that are trying to keep us down!!!! 

ğŸ¦ğŸ¦ğŸ¦ğŸ¦ğŸ¦ğŸ¦ğŸ¦ğŸ¦ğŸ¦ğŸ¦ğŸ¦ğŸ¦",01-29-2021,DifferentKindaHigh,85.0,let me just say im so happy and proud to be apart of this community fuck those elites that are trying to keep us down,positive,0.8639007,,,-1,-1_spce_000_price_bags,2021-01-29
1733,"Daily Discussion Thread for January 07, 2021","Coups are great for the economy, actually.",01-07-2021,kc-dc-19,10.0,coups are great for the economy actually,positive,0.9632657,,,280,280_rates_interest_raise_economy,2021-01-07
2512,"Daily Discussion Thread for January 11, 2021",Cohen gonna mooon all day! Lets goooo,01-11-2021,Zurkarak,13.0,cohen gonna mooon all day lets goooo,positive,0.71823454,,,445,445_cohen_ryan_cohens_tweet,2021-01-11
6170,"Daily Discussion Thread for January 25, 2021",$BB.legally has to say that shit about not knowing whats going on.,01-25-2021,Jackprot69,32.0,bb legally has to say that shit about not knowing whats going on,negative,0.80904037,,bb,81,81_climb_daq_undertaker_coffin,2021-01-25
3164,"Daily Discussion Thread for January 14, 2021","WSB is literally taking on a multibillion dollar hedge fund and fucking winning.  


BUY MORE YOU FUCKING AUTISTS, LET'S BANKRUPT THEM",01-14-2021,Child_of_Khorne,20.0,wsb is literally taking on a multibillion dollar hedge fund and fucking winning buy more you fucking autists lets bankrupt them,negative,0.939541,,,-1,-1_spce_000_price_bags,2021-01-14
6341,"Daily Discussion Thread for January 25, 2021",BB come on boys ğŸš€ğŸ“ˆ,01-25-2021,Civil_Description_94,22.0,bb come on boys,neutral,0.5471745,,bb,88,88_gang_bbby_shambos_lambos,2021-01-25
4953,"Daily Discussion Thread for January 20, 2021",BB did this same shit yesterday and it turned into a beautiful 25% V shaped ğŸš€ğŸš€ğŸš€ğŸš€ğŸš€ğŸš€ğŸš€,01-20-2021,ChargeisKill,20.0,bb did this same shit yesterday and it turned into a beautiful 25 v shaped,negative,0.42174056,,bb,10,10_12_11_break_hit,2021-01-20
2765,"Daily Discussion Thread for January 12, 2021","TSLA CALLS STILL ON SALE
2 HOURS LEFT IF U WANNA BE RICH WHEN U WAKE UP ğŸš€ğŸš€ğŸš€ğŸš€ğŸš€ğŸš€ğŸš€ğŸš€ğŸš€ğŸš€ğŸš€",01-12-2021,OhHayabusa,14.0,tsla calls still on sale 2 hours left if u wanna be rich when u wake up,neutral,0.5020102,,tsla,36,36_700_900_800_690,2021-01-12
6541,"Daily Discussion Thread for January 26, 2021",$BB looks good and these people tried to short it again,01-26-2021,Karrot_TheDemon,32.0,bb looks good and these people tried to short it again,neutral,0.41959444,,bb,-1,-1_spce_000_price_bags,2021-01-26
7158,"Daily Discussion Thread for January 29, 2021",Donâ€™t forget about NOK and AMC! Show em some love! Screw the hedgies!,01-29-2021,TygreWolf,70.0,dont forget about nok and amc show em some love screw the hedgies,neutral,0.4611012,,amc,184,184_momentum_amcc_ganggg_breakaway,2021-01-29
694,"Daily Discussion Thread for January 04, 2021",Whereâ€™s the asshole that told my son to buy NIO. I need to thank him,01-04-2021,cclem0013,31.0,wheres the asshole that told my son to buy nio i need to thank him,negative,0.85994077,,nio,-1,-1_spce_000_price_bags,2021-01-04
3316,"Daily Discussion Thread for January 14, 2021",Up 30 fucking percent today. Blackberry is my god,01-14-2021,FireHamilton,18.0,up 30 fucking percent today blackberry is my god,positive,0.5113385,,blackberry,127,127_blackberry_blackberrys_phones_qnx,2021-01-14
3430,"Daily Discussion Thread for January 15, 2021","If anyone else lost money today, upvotes pls",01-15-2021,RedditReader365,44.0,if anyone else lost money today upvotes pls,negative,0.58043414,,,28,28_losing_lose_lost_losses,2021-01-15
6365,"Daily Discussion Thread for January 25, 2021",AMC cleared for launch,01-25-2021,mattdamon_69420,23.0,amc cleared for launch,neutral,0.68557036,,amc,13,13_netflix_movie_movies_push,2021-01-25
897,"Daily Discussion Thread for January 04, 2021",Quick PLTR - sneak back to $25 while everyone is distracted,01-04-2021,Investinwaffl3s,12.0,quick pltr sneak back to 25 while everyone is distracted,neutral,0.6659233,,,14,14_25_30_38_break,2021-01-04
4758,"Daily Discussion Thread for January 19, 2021",Bb gonna continue tomorrow âœˆï¸âœˆï¸,01-19-2021,grito94,12.0,bb gonna continue tomorrow,neutral,0.85330194,,bb,-1,-1_spce_000_price_bags,2021-01-19
708,"Daily Discussion Thread for January 04, 2021",Damn I actually am pretty bad at trading,01-04-2021,biglettucee,25.0,damn i actually am pretty bad at trading,negative,0.956499,,,61,61_trade_trades_trading_trader,2021-01-04
5236,"Daily Discussion Thread for January 20, 2021",ICLN canâ€™t have a red day when Biden is inaugurated. That would be Unamerican ğŸ˜¡,01-20-2021,-GregTheGreat-,13.0,icln cant have a red day when biden is inaugurated that would be unamerican,negative,0.80176145,,,-1,-1_spce_000_price_bags,2021-01-20
6313,"Daily Discussion Thread for January 25, 2021",bb is up 17% right now and people are acting like it died. lolol,01-25-2021,chichiokurikuri,24.0,bb is up 17 right now and people are acting like it died lolol,negative,0.49571764,,bb,10,10_12_11_break_hit,2021-01-25
4616,"Daily Discussion Thread for January 19, 2021",Bb 12 today,01-19-2021,Mountain_Succotash_5,14.0,bb 12 today,neutral,0.8363791,,bb,10,10_12_11_break_hit,2021-01-19
3855,"Weekend Discussion Thread for the Weekend of January 15, 2021",Gonna pop 12 Xanax tonight so I can sleep and jump to Tuesday . God bless,01-15-2021,WSBmodsCANsmd,32.0,gonna pop 12 xanax tonight so i can sleep and jump to tuesday god bless,positive,0.8910842,,,-1,-1_spce_000_price_bags,2021-01-15
3506,"Daily Discussion Thread for January 15, 2021",Shorts trying to bring GME down not realizing they just advertised a Black Friday sale. ğŸ’ğŸ‘‹ğŸ¼ğŸ˜,01-15-2021,Taking_a_Shit,29.0,shorts trying to bring gme down not realizing they just advertised a black friday sale,negative,0.5184433,,gme,-1,-1_spce_000_price_bags,2021-01-15
794,"Daily Discussion Thread for January 04, 2021",I'm not crying...it's just raining on my face,01-04-2021,CarminSanFrancisco,15.0,im not crying its just raining on my face,neutral,0.50149035,,,355,355_crying_tears_cry_acne,2021-01-04
4118,"Daily Discussion Thread for January 18, 2021","I have a dream

Where my children will not be judged by the content of their fundamentals

But by the quantity of rockets in their DD",01-18-2021,YoungJebediah,180.0,i have a dream where my children will not be judged by the content of their fundamentals but by the quantity of rockets in their dd,neutral,0.6123213,,,-1,-1_spce_000_price_bags,2021-01-18
2741,"Daily Discussion Thread for January 12, 2021","Pssstttt ICLN boys!!


https://twitter.com/KamalaHarris/status/1349006983379214338?s=19",01-12-2021,st00rx,15.0,pssstttt icln boys https twitter com kamalaharris status 1349006983379214338 s 19,neutral,0.9224854,,twitter,265,265_twitter_status_tweet_elon,2021-01-12
2383,"Daily Discussion Thread for January 11, 2021","Starting to finally try and make some safe plays, got in on a Tesla 1/15 $1,160 call",01-11-2021,Prestigious69Link69,16.0,starting to finally try and make some safe plays got in on a tesla 1 15 1 160 call,neutral,0.73433274,,tesla,20,20_tesla_700_900_teslas,2021-01-11
2574,"Daily Discussion Thread for January 11, 2021","Me: *â€I really wanna be margin freeâ€*


&nbsp;


Also me: *â€Oooh! Look! Available margin!â€*",01-11-2021,6r1n3i19,13.0,me i really wanna be margin free nbsp also me oooh look available margin,positive,0.5514522,,,91,91_margin_called_call_calling,2021-01-11
1882,"Daily Discussion Thread for January 08, 2021",TSLAâ€™s market cap is just shy of 1% of global GDP at this point.,01-08-2021,Street-Badger,37.0,tslas market cap is just shy of 1 of global gdp at this point,neutral,0.66512114,,tsla,-1,-1_spce_000_price_bags,2021-01-08
4213,"Daily Discussion Thread for January 18, 2021",Because.. I can't help myself [https://imgur.com/a/xpbhbGH](https://imgur.com/a/xpbhbGH),01-18-2021,leahish,17.0,because i cant help myself https imgur com a xpbhbgh https imgur com a xpbhbgh,negative,0.4642027,,,164,164_imgur_remy_jpg_png,2021-01-18
3395,"Daily Discussion Thread for January 15, 2021","Gme retards, hold the fucking line do not sell let the gay shorts suffer",01-15-2021,mindlessx55,92.0,gme retards hold the fucking line do not sell let the gay shorts suffer,negative,0.9706765,,gme,135,135_shorts_cover_covered_sweating,2021-01-15
4652,"Daily Discussion Thread for January 19, 2021",If BB goes under $11 I'm selling my MT stocks and going all in bb. I've finally decided that I like actually making money.,01-19-2021,SkyrimBelongToNords,14.0,if bb goes under 11 im selling my mt stocks and going all in bb ive finally decided that i like actually making money,positive,0.5915874,,bb,-1,-1_spce_000_price_bags,2021-01-19
2701,"Daily Discussion Thread for January 12, 2021",ICLN preparing thrusters...,01-12-2021,WillNeighbor,17.0,icln preparing thrusters,neutral,0.81716144,,,144,144_icln_plug_bidens_rtardes,2021-01-12
668,"Daily Discussion Thread for January 04, 2021",Deploy Palantir to find Ma.,01-04-2021,EasternBearPower,201.0,deploy palantir to find ma,neutral,0.81738466,,palantir,66,66_palantir_palantards_palantard_ashes,2021-01-04
5901,"Weekend Discussion Thread for the Weekend of January 22, 2021","I thought that this place was retarded, then I went to twitter ğŸ¤¡

There are full time traders taking massive losses by buying puts and shorting GME. Now they call wsb illegal and pure gambling ğŸ˜‚ğŸ˜‚ğŸ˜‚

They are so pissed ğŸ˜‚ğŸ˜‚ğŸ˜‚ğŸ˜‚",01-23-2021,000Kurpitsa000,27.0,i thought that this place was retarded then i went to twitter there are full time traders taking massive losses by buying puts and shorting gme now they call wsb illegal and pure gambling they are so pissed,negative,0.9675236,,twitter,-1,-1_spce_000_price_bags,2021-01-23
6333,"Daily Discussion Thread for January 25, 2021",BB babyyyyy ğŸš€ğŸš€ğŸš€ğŸš€,01-25-2021,futballer,23.0,bb babyyyyy,positive,0.5244888,,bb,-1,-1_spce_000_price_bags,2021-01-25
3072,"Daily Discussion Thread for January 14, 2021",Just give up Melvin... it's gme over.,01-14-2021,KryoAnura,28.0,just give up melvin its gme over,negative,0.6540277,,gme,223,223_melvin_capital_melvins_melvincapital,2021-01-14
1856,"Daily Discussion Thread for January 08, 2021",PLTR mooned as soon as it is no longer topical on WSB ğŸ¤£,01-08-2021,Huey_Long_Schong,93.0,pltr mooned as soon as it is no longer topical on wsb,neutral,0.677701,,,25,25_mooning_moon_mission_pluto,2021-01-08
2861,"Daily Discussion Thread for January 12, 2021",$CCIV or bust. Life savings. Not religious but I feel this one in my spirit ğŸš€ğŸš€ğŸš€ğŸš€,01-12-2021,hachatata,12.0,cciv or bust life savings not religious but i feel this one in my spirit,neutral,0.7749359,,,-1,-1_spce_000_price_bags,2021-01-12
3277,"Daily Discussion Thread for January 14, 2021",Buying an internet pass on my flight today just to watch GME bears burn,01-14-2021,JGWentworth-,19.0,buying an internet pass on my flight today just to watch gme bears burn,neutral,0.4845842,,gme,1,1_priced_sale_discount_price,2021-01-14
5001,"Daily Discussion Thread for January 20, 2021",Damn I really thought Biden was going to talk about his favorite ETF $ICLN and go through the list of their holdings one by one talking about how great they are for the future of this great country,01-20-2021,Knozis,17.0,damn i really thought biden was going to talk about his favorite etf icln and go through the list of their holdings one by one talking about how great they are for the future of this great country,positive,0.81721824,,,97,97_biden_bidens_speech_putin,2021-01-20
4657,"Daily Discussion Thread for January 19, 2021","WSB being mentioned for stock movements more and more, will not end well for us",01-19-2021,Haha-100,14.0,wsb being mentioned for stock movements more and more will not end well for us,negative,0.9353712,,,49,49_baba_bob_bankrupt_ban,2021-01-19
6788,"Daily Discussion Thread for January 26, 2021","BB is infested by fucking paper hands motherfuckers - this isn't 'Breaking News: Boomer Buys Pepsi' The stock is gonna go up, down, and then fucking ğŸš€ğŸš€ğŸš€ğŸš€ Grow a sack, buy the dip, then put your tendies in your new sack",01-26-2021,yoda_mcfly,22.0,bb is infested by fucking paper hands motherfuckers this isnt breaking news boomer buys pepsi the stock is gonna go up down and then fucking grow a sack buy the dip then put your tendies in your new sack,negative,0.97189087,,bb,2,2_dips_dipping_dip_dipped,2021-01-26
605,"Weekend Discussion Thread for the Weekend of January 01, 2021","Alright, last call. Who wants awards?",01-02-2021,6r1n3i19,11.0,alright last call who wants awards,neutral,0.84069765,,,441,441_awards_award_reddit_bukakke,2021-01-02
1362,"Daily Discussion Thread for January 06, 2021",Manifesting this: aapl green Eod,01-06-2021,hezeldez,25.0,manifesting this aapl green eod,neutral,0.8520645,,,502,502_aapl_dookie_timmy_angry,2021-01-06
1429,"Daily Discussion Thread for January 06, 2021",Apple go up or Iâ€™ll beat the shit out of you,01-06-2021,GirthIgnorer,11.0,apple go up or ill beat the shit out of you,negative,0.8559357,,,44,44_apple_iphone_ipad_event,2021-01-06
7039,"Daily Discussion Thread for January 29, 2021","Buy GME NOK AMC. Call it diversification, I guess.",01-29-2021,j_flameIV,86.0,buy gme nok amc call it diversification i guess,neutral,0.8351697,,gme,27,27_nok_silver_line_charts,2021-01-29
3249,"Daily Discussion Thread for January 14, 2021",Just bought 1 GME. Where do I go to collect my lambo,01-14-2021,strangerx03c,19.0,just bought 1 gme where do i go to collect my lambo,neutral,0.8251846,,gme,181,181_lambo_lambos_lamborghini_rabbits,2021-01-14
3747,"Daily Discussion Thread for January 15, 2021",BBBBBBBBUY GME ğŸš€ğŸš€ğŸš€ğŸš€ğŸš€,01-15-2021,thunderbt16,21.0,bbbbbbbbuy gme,neutral,0.65754604,,bb,-1,-1_spce_000_price_bags,2021-01-15
2355,"Daily Discussion Thread for January 11, 2021","https://www.state.gov/biographies/donald-j-trump/

??",01-11-2021,shanksid,18.0,https www state gov biographies donald j trump,neutral,0.8779404,,,-1,-1_spce_000_price_bags,2021-01-11
2211,"Daily Discussion Thread for January 08, 2021",I just want PLTR at $30 one more time. Thatâ€™s all ğŸ˜‚,01-08-2021,passablepiano,11.0,i just want pltr at 30 one more time thats all,neutral,0.62117916,,,14,14_25_30_38_break,2021-01-08
6853,"Daily Discussion Thread for January 26, 2021",Buy BB on sale rn,01-26-2021,Sweeeeeeesh,22.0,buy bb on sale rn,neutral,0.85734403,,bb,1,1_priced_sale_discount_price,2021-01-26
2504,"Daily Discussion Thread for January 11, 2021",Gme soldier reporting in,01-11-2021,powerbuffcurls,13.0,gme soldier reporting in,neutral,0.81148106,,gme,51,51_03ncnwxrm64_king_deploy_saga,2021-01-11
3756,"Daily Discussion Thread for January 15, 2021",BB IS GOING TO EX FUCKING PLODE,01-15-2021,Rygarrrrr,21.0,bb is going to ex fucking plode,negative,0.86217946,,bb,-1,-1_spce_000_price_bags,2021-01-15
1037,"Daily Discussion Thread for January 04, 2021","I left AMZN. Honestly whenever that POS starts going up again, whoever fucking held you fucking deserve to make money.


7 months of fucking torture.",01-04-2021,Itsmeyourdad,10.0,i left amzn honestly whenever that pos starts going up again whoever fucking held you fucking deserve to make money 7 months of fucking torture,negative,0.9799683,,,-1,-1_spce_000_price_bags,2021-01-04
4007,"Weekend Discussion Thread for the Weekend of January 15, 2021",OPEN THE MARKETS ALREADY F  ğŸ¥µ  ğŸ¥µ  ğŸ¥µ  ğŸ¥µ  ğŸ¥µ  ğŸ¥µ  ğŸ¥µ,01-16-2021,Golddigger2500,17.0,open the markets already f,neutral,0.7029068,,,43,43_closed_opens_opening_monday,2021-01-16
1833,"Daily Discussion Thread for January 07, 2021",Gme gonna be knocking on the door of $20 today,01-07-2021,PM_ME_TENDIEZ,11.0,gme gonna be knocking on the door of 20 today,neutral,0.8847072,,gme,51,51_03ncnwxrm64_king_deploy_saga,2021-01-07
1872,"Daily Discussion Thread for January 08, 2021","If my PLTR leaps ever hit it big, shown below:

https://imgur.com/a/PTGWqlI

Iâ€™ve made a pledge that Iâ€™ll find someone here whoâ€™s down ~$2,500-$3,000 all time (will require proof) and Iâ€™ll Venmo the money to bail them out. Such a shit feeling being down when everyone else is up. Nobody should feel that way. 

Thatâ€™s my pledge. Mark it. 

(Disclaimer: Of course I have to be up nicely on these leaps, which is in question at the moment)",01-08-2021,just_lick_my_ass,52.0,if my pltr leaps ever hit it big shown below https imgur com a ptgwqli ive made a pledge that ill find someone here whos down 2 500 3 000 all time will require proof and ill venmo the money to bail them out such a shit feeling being down when everyone else is up nobody should feel that way thats my pledge mark it disclaimer of course i have to be up nicely on these leaps which is in question at the moment,negative,0.50418156,,,-1,-1_spce_000_price_bags,2021-01-08
5896,"Weekend Discussion Thread for the Weekend of January 22, 2021",WSB is seriously one of the nicest communities on reddit. This place is love!!,01-23-2021,CallNPut,26.0,wsb is seriously one of the nicest communities on reddit this place is love,positive,0.9894849,,,16,16_wkhs_wsb_wsbs_crew,2021-01-23
3737,"Daily Discussion Thread for January 15, 2021","GME dipped exactly like this at this exact time yesterday, BTFD retards",01-15-2021,LukePainter,20.0,gme dipped exactly like this at this exact time yesterday btfd retards,negative,0.5318551,,gme,2,2_dips_dipping_dip_dipped,2021-01-15
6275,"Daily Discussion Thread for January 25, 2021",AMC and BB ğŸš€ğŸš€,01-25-2021,JRBeanz,23.0,amc and bb,neutral,0.71325177,,amc,184,184_momentum_amcc_ganggg_breakaway,2021-01-25
4348,"Daily Discussion Thread for January 18, 2021","Google translate from the german wsb 8min ago:  
""BUY EVEN MORE YOU RETARDED AUTISTE ASSHOLEğŸš€ğŸš€ğŸš€ğŸš€""",01-18-2021,Ordinary-Fox9986,11.0,google translate from the german wsb 8min ago buy even more you retarded autiste asshole,negative,0.9446804,,,173,173_autism_autists_autist_autistic,2021-01-18
5818,"Weekend Discussion Thread for the Weekend of January 22, 2021",If DeepFuckingValue reaches 100 Milly he'll be classified as an institutional investor by law and have to file reports with the SEC. Hopefully he lobbies on our behalf,01-23-2021,spyaintnobitch,40.0,if deepfuckingvalue reaches 100 milly hell be classified as an institutional investor by law and have to file reports with the sec hopefully he lobbies on our behalf,negative,0.7669267,,bb,383,383_deepfuckingvalue_deep_value_ffuuuuuuuuuuucccccccckkkkkkkk,2021-01-23
3923,"Weekend Discussion Thread for the Weekend of January 15, 2021",IF GME HITS 100 I will get â€œgmeâ€ tattooed on me somewhere,01-15-2021,TadpoleCreative,43.0,if gme hits 100 i will get gme tattooed on me somewhere,neutral,0.6345439,,gme,500,500_tattoo_tattooed_srm_800,2021-01-15
5138,"Daily Discussion Thread for January 20, 2021",BB easily worth 20 ğŸš€ğŸš€ğŸš€ğŸš€ğŸš€ğŸš€ğŸš€ğŸš€,01-20-2021,kingxlos,15.0,bb easily worth 20,neutral,0.5246402,,bb,10,10_12_11_break_hit,2021-01-20
518,"Weekend Discussion Thread for the Weekend of January 01, 2021",Retards literally spent their stimmy handing out stickers on Reddit,01-02-2021,ASuag,14.0,retards literally spent their stimmy handing out stickers on reddit,negative,0.80525464,,,-1,-1_spce_000_price_bags,2021-01-02
5864,"Weekend Discussion Thread for the Weekend of January 22, 2021","My loser ex wife never texted me back after i told her I set up a 25k trust fund for our daughter for college, an got health an dental for her. She works at motel. Should of paid the extra 5k to get full custody. Calls on me getting my daughter back!!

Edit: my daughter is 3.5 y/o",01-24-2021,AngloWaxson,33.0,my loser ex wife never texted me back after i told her i set up a 25k trust fund for our daughter for college an got health an dental for her she works at motel should of paid the extra 5k to get full custody calls on me getting my daughter back edit my daughter is 3 5 y o,negative,0.8083386,,,23,23_wife_tinder_married_girlfriend,2021-01-24
5983,"Weekend Discussion Thread for the Weekend of January 22, 2021","Whoâ€™s buying GME shares Monday at open?

#ğŸ‘†ğŸ¼ This guy",01-24-2021,l0gicgate,21.0,whos buying gme shares monday at open this guy,neutral,0.9090629,,gme,-1,-1_spce_000_price_bags,2021-01-24
2856,"Daily Discussion Thread for January 12, 2021",Is robinhood glitching for anyone else? All my stonks are red,01-12-2021,jukitoyo,12.0,is robinhood glitching for anyone else all my stonks are red,negative,0.5817271,,robinhood,-1,-1_spce_000_price_bags,2021-01-12
3735,"Daily Discussion Thread for January 15, 2021",I KNOW $45 LOOKS NICE $50 LOOKS NICE BUT DONT FUCKING SELL YOUR GME UNLESS ITS FOR $500 YOU SHITS. DONT LEAVE THE REST OF US OUT TO DRY. WERE IN THIS TOGETHER SO HOLD.,01-15-2021,Slavijo,20.0,i know 45 looks nice 50 looks nice but dont fucking sell your gme unless its for 500 you shits dont leave the rest of us out to dry were in this together so hold,negative,0.7923712,,gme,-1,-1_spce_000_price_bags,2021-01-15
4230,"Daily Discussion Thread for January 18, 2021","been on a home run tear with home cooked meals and I'm gonna try spicy fried chicken sandwiches for the first time tonight wish me luck u fucking tards also pls give tips if u got em

gonna fry in a few inches of peanut oil in my cast iron skillet and top with an apple/mayo/cabbage slaw. Using boneless/skinless chicken thighs and gonna butter up some store bought brioche buns and toast them via broiler",01-18-2021,burrowed_greentext,16.0,been on a home run tear with home cooked meals and im gonna try spicy fried chicken sandwiches for the first time tonight wish me luck u fucking tards also pls give tips if u got em gonna fry in a few inches of peanut oil in my cast iron skillet and top with an apple mayo cabbage slaw using boneless skinless chicken thighs and gonna butter up some store bought brioche buns and toast them via broiler,negative,0.44625047,,bb,68,68_eggs_ketchup_pizza_dinner,2021-01-18
2184,"Daily Discussion Thread for January 08, 2021",Tesla cannot be real,01-08-2021,lamb1200,11.0,tesla cannot be real,negative,0.7493564,,tesla,20,20_tesla_700_900_teslas,2021-01-08
6101,"Daily Discussion Thread for January 25, 2021",BB TO THE FUCKING MOON,01-25-2021,Svenn-M,43.0,bb to the fucking moon,negative,0.8363413,,bb,25,25_mooning_moon_mission_pluto,2021-01-25
856,"Daily Discussion Thread for January 04, 2021",I waited three days for this?,01-04-2021,WR810,12.0,i waited three days for this,negative,0.5592671,,,-1,-1_spce_000_price_bags,2021-01-04
4399,"Daily Discussion Thread for January 18, 2021",WSB had come full circle: 'JuSt BuY sHaRes',01-18-2021,AnOddvacado,12.0,wsb had come full circle just buy shares,neutral,0.6967024,,,-1,-1_spce_000_price_bags,2021-01-18
5479,"Daily Discussion Thread for January 22, 2021",BB $20 eod?,01-22-2021,Ill_Truck,15.0,bb 20 eod,neutral,0.66143054,,bb,67,67_eod_eow_15_eom,2021-01-22
2961,"Daily Discussion Thread for January 12, 2021",Rotation out of TSLA back into TSLA at the dip,01-12-2021,iTradeStalks,11.0,rotation out of tsla back into tsla at the dip,neutral,0.86561763,,tsla,29,29_tsla_tslas_autopilot_og,2021-01-12
1534,"Daily Discussion Thread for January 07, 2021",I'm so sorry guys for todays Tesla crash. I just put everything into it yesterday at close.,01-07-2021,shmavee,16.0,im so sorry guys for todays tesla crash i just put everything into it yesterday at close,negative,0.7319485,,tesla,20,20_tesla_700_900_teslas,2021-01-07
6759,"Daily Discussion Thread for January 26, 2021",BB and GME should be the only memes on your watch list. NOK is a disinformation psyop to spread us thin. We won't fall for it!!,01-26-2021,LuxGang,22.0,bb and gme should be the only memes on your watch list nok is a disinformation psyop to spread us thin we wont fall for it,negative,0.59061176,,bb,24,24_meme_memes_boomer_memestock,2021-01-26
2425,"Daily Discussion Thread for January 11, 2021","stop playing weeklies boys, patience will take you far",01-11-2021,bardisviable,13.0,stop playing weeklies boys patience will take you far,neutral,0.56990206,,,-1,-1_spce_000_price_bags,2021-01-11
1149,"Daily Discussion Thread for January 06, 2021",All the boomers that sold cuz of blue win are big mad. Everyone else mad gains. ğŸš€ğŸš€ğŸš€,01-06-2021,DangerousRide7,17.0,all the boomers that sold cuz of blue win are big mad everyone else mad gains,negative,0.7329626,,,139,139_boomers_boomer_millenials_401k,2021-01-06
6992,"Daily Discussion Thread for January 29, 2021",I can't afford Game stop but I just threw down money on Nokia and AMC! LETS RIDE!,01-29-2021,Galacticat3000,100.0,i cant afford game stop but i just threw down money on nokia and amc lets ride,negative,0.7855751,,ford,-1,-1_spce_000_price_bags,2021-01-29
3186,"Daily Discussion Thread for January 14, 2021",Tomorrow is GMEâ€™s day,01-14-2021,CKatz5257,20.0,tomorrow is gmes day,neutral,0.83570826,,gme,-1,-1_spce_000_price_bags,2021-01-14
1450,"Daily Discussion Thread for January 06, 2021",Holy fucking christ..... is it too fucking much to think that the goddamn government can secure their own fucking capital so as to not fuck off all of my fucking tendies??? Isn't PLTR supposed to have fucking files on everyone?  How fucking hard is it to keep some fucking semblance of order? ğŸ˜ ,01-06-2021,COBOCG,10.0,holy fucking christ is it too fucking much to think that the goddamn government can secure their own fucking capital so as to not fuck off all of my fucking tendies isnt pltr supposed to have fucking files on everyone how fucking hard is it to keep some fucking semblance of order,negative,0.9730327,,,-1,-1_spce_000_price_bags,2021-01-06
3607,"Daily Discussion Thread for January 15, 2021","I donâ€™t even care about GME as a company, I care about fuking the shorts and fuking Melvin ğŸš€ğŸ’ğŸ¤š",01-15-2021,Godmode92,23.0,i dont even care about gme as a company i care about fuking the shorts and fuking melvin,negative,0.9439649,,gme,-1,-1_spce_000_price_bags,2021-01-15
3107,"Daily Discussion Thread for January 14, 2021",GME ON CNBCğŸ’âœ‹ğŸ»,01-14-2021,Totallystoked1,24.0,gme on cnbc,neutral,0.8110742,,gme,22,22_cnbc_nasdaq_headline_ceo,2021-01-14
4161,"Daily Discussion Thread for January 18, 2021",I can't believe I am throwing the account at GME at open on Tuesday because of a fuckin hype vid,01-18-2021,coldhamm,27.0,i cant believe i am throwing the account at gme at open on tuesday because of a fuckin hype vid,negative,0.9346166,,gme,-1,-1_spce_000_price_bags,2021-01-18
6028,"Weekend Discussion Thread for the Weekend of January 22, 2021","Mods need to take some action with all these noobs coming here asking us to pump stocks. That's how this sub is gonna get shut down by the SEC. No warnings, straight ban",01-24-2021,TheShorterShortBus,22.0,mods need to take some action with all these noobs coming here asking us to pump stocks thats how this sub is gonna get shut down by the sec no warnings straight ban,negative,0.89797413,,,-1,-1_spce_000_price_bags,2021-01-24
6411,"Daily Discussion Thread for January 25, 2021",BB and AMC goin for EOW pushhhhh,01-25-2021,Bald-guy1,21.0,bb and amc goin for eow pushhhhh,neutral,0.7678512,,bb,184,184_momentum_amcc_ganggg_breakaway,2021-01-25
6985,"Daily Discussion Thread for January 29, 2021",We are seeing 750+ arenâ€™t we,01-29-2021,Zrob,81.0,we are seeing 750 arent we,neutral,0.7918047,,,-1,-1_spce_000_price_bags,2021-01-29
894,"Daily Discussion Thread for January 04, 2021",Anytime I say itâ€™s to late to buy Tesla it goes up another $30... fml,01-04-2021,Stonk_Collector,11.0,anytime i say its to late to buy tesla it goes up another 30 fml,negative,0.7166548,,tesla,20,20_tesla_700_900_teslas,2021-01-04
6704,"Daily Discussion Thread for January 26, 2021",Selling everything in my portfolio and putting in gme and bb. To the moon we go retards ğŸš€ğŸš€ğŸš€ğŸš€ğŸš€,01-26-2021,Tryptz66x,29.0,selling everything in my portfolio and putting in gme and bb to the moon we go retards,neutral,0.75778943,,gme,-1,-1_spce_000_price_bags,2021-01-26
2485,"Daily Discussion Thread for January 11, 2021",People who have had 100% gains in one day. What did you do,01-11-2021,itskelvinn,13.0,people who have had 100 gains in one day what did you do,neutral,0.8065515,,,64,64_gains_gain_gone_erased,2021-01-11
4856,"Daily Discussion Thread for January 19, 2021","Three day weekends are like needing to piss  while driving home, the closer you get to your house the harder you have to go...right now Iâ€™m pee pee dancing and fumbling with my keys at the front door. 

Damn you 9:30, daaaammmnnn yoooouuuu!!!",01-19-2021,tomismoney,25.0,three day weekends are like needing to piss while driving home the closer you get to your house the harder you have to go right now im pee pee dancing and fumbling with my keys at the front door damn you 9 30 daaaammmnnn yoooouuuu,negative,0.91629153,,,46,46_weekends_weekend_friday_monday,2021-01-19
1542,"Daily Discussion Thread for January 07, 2021",TSLA gaps up like every fuckin day lol. Insane,01-07-2021,br0botic,16.0,tsla gaps up like every fuckin day lol insane,negative,0.78064257,,tsla,29,29_tsla_tslas_autopilot_og,2021-01-07
3865,"Weekend Discussion Thread for the Weekend of January 15, 2021",my stupid ass girlfriend just paid $90 for an over the phone psychic reading and the bitch said someones keeping a harmful secret from her. i know im gonna have to hear about this shit for weeks smfh. girls are stupid as shit she couldve put that $90 in to gme or something,01-18-2021,StaticSxhock,29.0,my stupid ass girlfriend just paid 90 for an over the phone psychic reading and the bitch said someones keeping a harmful secret from her i know im gonna have to hear about this shit for weeks smfh girls are stupid as shit she couldve put that 90 in to gme or something,negative,0.98126143,,gme,23,23_wife_tinder_married_girlfriend,2021-01-18
1521,"Daily Discussion Thread for January 07, 2021",TSLA isn't a car company or tech company. It's a stonk company.,01-07-2021,br0botic,22.0,tsla isnt a car company or tech company its a stonk company,neutral,0.58946824,,tsla,-1,-1_spce_000_price_bags,2021-01-07
6328,"Daily Discussion Thread for January 25, 2021",shorts are getting squeeeeeeze. BB $25,01-25-2021,innerLimits,26.0,shorts are getting squeeeeeeze bb 25,neutral,0.6971821,,bb,135,135_shorts_cover_covered_sweating,2021-01-25
7287,"Daily Discussion Thread for January 29, 2021",GME and AMC will fly ğŸš€ 1000 and 30 on monday,01-29-2021,Matecsa,168.0,gme and amc will fly 1000 and 30 on monday,neutral,0.84210753,,gme,27,27_nok_silver_line_charts,2021-01-29
972,"Daily Discussion Thread for January 04, 2021",Tim cook is touching me in my no no places.,01-04-2021,UBERto100,10.0,tim cook is touching me in my no no places,negative,0.65815777,,,-1,-1_spce_000_price_bags,2021-01-04
3398,"Daily Discussion Thread for January 15, 2021","Yo wtf I posted about just having bought another 1,000 GME shares and somebody reported me to Reddit for being suicidal so they reached out to me in order to help me.
All I can say is that Iâ€˜m feeling damn well and ready to fly to the motherfucking moon!!!! ğŸš€ğŸš€ğŸš€",01-15-2021,d-mnk,72.0,yo wtf i posted about just having bought another 1 000 gme shares and somebody reported me to reddit for being suicidal so they reached out to me in order to help me all i can say is that i m feeling damn well and ready to fly to the motherfucking moon,neutral,0.41936153,,gme,59,59_share_shares_1000_gmes,2021-01-15
5813,"Weekend Discussion Thread for the Weekend of January 22, 2021",God monday is gonna be hilarious.,01-22-2021,GaudExMachina,36.0,god monday is gonna be hilarious,positive,0.96899295,,,46,46_weekends_weekend_friday_monday,2021-01-22
4581,"Daily Discussion Thread for January 19, 2021",Thank you BB god for pulling through for me I love you.,01-19-2021,apersonwhoisherenow,15.0,thank you bb god for pulling through for me i love you,positive,0.9841444,,bb,-1,-1_spce_000_price_bags,2021-01-19
6377,"Daily Discussion Thread for January 25, 2021","BB, AMCC, and NOK after hours  ğŸš€  ğŸš€",01-25-2021,CompetitiveChain5,23.0,bb amcc and nok after hours,neutral,0.8390714,,bb,184,184_momentum_amcc_ganggg_breakaway,2021-01-25
2021,"Daily Discussion Thread for January 08, 2021","Sold a Tesla call expiring next Friday for 1,000% gain. Literally saved my entire account from the losses of September and shit. Finally broke even and am even up again let's go",01-08-2021,ajfaria,14.0,sold a tesla call expiring next friday for 1 000 gain literally saved my entire account from the losses of september and shit finally broke even and am even up again lets go,positive,0.58374476,,tesla,-1,-1_spce_000_price_bags,2021-01-08
4675,"Daily Discussion Thread for January 19, 2021",Keep this pump going on BB!!,01-19-2021,ItankuI,14.0,keep this pump going on bb,neutral,0.7081347,,bb,-1,-1_spce_000_price_bags,2021-01-19
7032,"Daily Discussion Thread for January 29, 2021",CAN'T STOP WON'T STOP MOTHER FUCKING GAMESTOP,01-29-2021,-Hyre,68.0,cant stop wont stop mother fucking gamestop,negative,0.929138,,gamestop,-1,-1_spce_000_price_bags,2021-01-29
655,"Weekend Discussion Thread for the Weekend of January 01, 2021",Guh how come I only attract divorced women with kids on the dating sites,01-03-2021,TAOW,13.0,guh how come i only attract divorced women with kids on the dating sites,negative,0.5786139,,,23,23_wife_tinder_married_girlfriend,2021-01-03
5948,"Weekend Discussion Thread for the Weekend of January 22, 2021",If you didnâ€™t end green today imma need you to go to the corner of the room,01-22-2021,tal_i_ban,22.0,if you didnt end green today imma need you to go to the corner of the room,negative,0.6304429,,,-1,-1_spce_000_price_bags,2021-01-22
3852,"Weekend Discussion Thread for the Weekend of January 15, 2021",BB BETTER HIT $12 ON TUESDAY I WANT MY 5 BAGGER BACK,01-15-2021,trumpsplug,32.0,bb better hit 12 on tuesday i want my 5 bagger back,neutral,0.60407233,,bb,10,10_12_11_break_hit,2021-01-15
7042,"Daily Discussion Thread for January 29, 2021","ğŸš€ğŸš€ğŸš€ğŸš€BB / NOK / AMC / GME ğŸš€ğŸš€ğŸš€ğŸš€
ğŸ‘¨â€ğŸš€ğŸ‘¨â€ğŸš€ğŸ‘¨â€ğŸš€ğŸ‘¨â€ğŸš€BUCKLE UP FELLOW ASTRONAUTSğŸ‘¨â€ğŸš€ğŸ‘¨â€ğŸš€ğŸ‘¨â€ğŸš€ğŸ‘¨â€ğŸš€",01-29-2021,skidmarkchones,78.0,bb nok amc gme buckle up fellow astronauts,neutral,0.8306412,,bb,27,27_nok_silver_line_charts,2021-01-29
3029,"Daily Discussion Thread for January 14, 2021","Just dropped next semesters tuition on GME, $15K pre-market order set @market. Ready to absolutely sh** myself, but I believe! Aut squad to the moon ğŸŒ•ğŸš€ğŸš€ğŸš€ EDIT: OH MY GOD, the ship has taken off!!!!!!!! Just need a few more AUTS to take this thing a bit farther, going to drop out today and buy a hooker for the next week",01-14-2021,Fancy_Hunter_2956,154.0,just dropped next semesters tuition on gme 15k pre market order set market ready to absolutely sh myself but i believe aut squad to the moon edit oh my god the ship has taken off just need a few more auts to take this thing a bit farther going to drop out today and buy a hooker for the next week,neutral,0.51224023,,gme,-1,-1_spce_000_price_bags,2021-01-14
4532,"Daily Discussion Thread for January 19, 2021",$bb is going to hit $30 you retards. Time to strap in.,01-19-2021,Reduxy,19.0,bb is going to hit 30 you retards time to strap in,neutral,0.738015,,bb,10,10_12_11_break_hit,2021-01-19
6206,"Daily Discussion Thread for January 25, 2021",DeepFuckingValue is a time traveler. Literally no other explanation,01-25-2021,FireHamilton,28.0,deepfuckingvalue is a time traveler literally no other explanation,negative,0.8437118,,,383,383_deepfuckingvalue_deep_value_ffuuuuuuuuuuucccccccckkkkkkkk,2021-01-25
6702,"Daily Discussion Thread for January 26, 2021",I want a BB Buying-Buddy.,01-26-2021,rawnaldo,22.0,i want a bb buying buddy,positive,0.53899044,,bb,1,1_priced_sale_discount_price,2021-01-26
3442,"Daily Discussion Thread for January 15, 2021",Not selling GME as long as Cohen is there.,01-15-2021,jsolaux,34.0,not selling gme as long as cohen is there,neutral,0.65713906,,gme,1,1_priced_sale_discount_price,2021-01-15
2698,"Daily Discussion Thread for January 12, 2021",Got in on ICLN let's gooooo,01-12-2021,watching_nba,18.0,got in on icln lets gooooo,positive,0.7287647,,,144,144_icln_plug_bidens_rtardes,2021-01-12
2737,"Daily Discussion Thread for January 12, 2021",Should I buy TSLA $1000 1/15 today?  Every time Iâ€™ve blown up my account is from weeklies. Youâ€™d think Iâ€™d learn,01-12-2021,Creativeusername833,15.0,should i buy tsla 1000 1 15 today every time ive blown up my account is from weeklies youd think id learn,neutral,0.4812822,,tsla,201,201_tsla_upgrade_tailwinds_downgrade,2021-01-12
840,"Daily Discussion Thread for January 04, 2021","Jack Ma, are you in here? If so, give us a sign",01-04-2021,Antheo94,13.0,jack ma are you in here if so give us a sign,neutral,0.88394874,,,233,233_ma_mas_ccp_jinping,2021-01-04
3526,"Daily Discussion Thread for January 15, 2021",Iâ€™m holding GameStop,01-15-2021,anthonlee,26.0,im holding gamestop,neutral,0.8215003,,gamestop,120,120_gamestop_gamestops_sellers_shorted,2021-01-15
4241,"Daily Discussion Thread for January 18, 2021",Okay Iâ€™m in on bb,01-18-2021,wewereddit,15.0,okay im in on bb,neutral,0.6380615,,bb,-1,-1_spce_000_price_bags,2021-01-18
5348,"Daily Discussion Thread for January 22, 2021",GameStop paying off the remainder of my student loan ğŸ¤£ğŸ¤£ğŸ¤£ wtf even is reality anymore,01-22-2021,whoatethekidsthen,26.0,gamestop paying off the remainder of my student loan wtf even is reality anymore,negative,0.7267609,,gamestop,170,170_loan_financial_loans_forgiveness,2021-01-22
6783,"Daily Discussion Thread for January 26, 2021",BBğŸŒ™,01-26-2021,spark01,24.0,bb,neutral,0.5110977,,bb,79,79_uh_psth_yep_gimme,2021-01-26
1699,"Daily Discussion Thread for January 07, 2021","anyone in here have PLUG $42c 1/8? Up 18,000% today",01-07-2021,oracleofyourmom,12.0,anyone in here have plug 42c 1 8 up 18 000 today,neutral,0.92855513,,,6,6_440_445_444_453,2021-01-07
4275,"Daily Discussion Thread for January 18, 2021",BB up 7.5% in Nigerian market,01-18-2021,jwfox6,14.0,bb up 7 5 in nigerian market,neutral,0.8830538,,bb,1,1_priced_sale_discount_price,2021-01-18
4189,"Daily Discussion Thread for January 18, 2021",If you sell GME you die,01-18-2021,Suspicious11,20.0,if you sell gme you die,negative,0.8690328,,gme,-1,-1_spce_000_price_bags,2021-01-18
1216,"Daily Discussion Thread for January 06, 2021","Expert DD:

ICLN had a 164% gain over the past year.

Theyâ€™ll do that again.

ICLN $81 EOY.

Source: RH app. Calculator app.",01-06-2021,TheFuckboiChronicles,14.0,expert dd icln had a 164 gain over the past year theyll do that again icln 81 eoy source rh app calculator app,neutral,0.66727203,,,-1,-1_spce_000_price_bags,2021-01-06
5665,"Daily Discussion Thread for January 22, 2021",$F on the moon mission,01-22-2021,NachoTacoYo,15.0,f on the moon mission,neutral,0.84115034,,,-1,-1_spce_000_price_bags,2021-01-22
2837,"Daily Discussion Thread for January 12, 2021",Tesla back on track for 1000 bears must be in disbelief hearing them say the bubble has popped yesterday ğŸ¤¡ğŸ¤¡ğŸ¤¡,01-12-2021,Stonk_Collector,12.0,tesla back on track for 1000 bears must be in disbelief hearing them say the bubble has popped yesterday,neutral,0.5230828,,tesla,-1,-1_spce_000_price_bags,2021-01-12
3393,"Daily Discussion Thread for January 15, 2021","If you sell your GME, you're weak, your bloodline is weak. You wont survive the winter.

The fucking rocket is about to hit supersonic. ğŸš€ğŸš€ğŸš€ğŸš€ğŸš€ğŸš€ğŸš€",01-15-2021,Elevatedonut,349.0,if you sell your gme youre weak your bloodline is weak you wont survive the winter the fucking rocket is about to hit supersonic,negative,0.960882,,gme,1,1_priced_sale_discount_price,2021-01-15
7066,"Daily Discussion Thread for January 29, 2021",I'm going full in GME and AMC with my ğŸ’ğŸ§¤,01-29-2021,106473,75.0,im going full in gme and amc with my,neutral,0.81890523,,gme,27,27_nok_silver_line_charts,2021-01-29
2258,"Daily Discussion Thread for January 11, 2021",I can't wait to buy a NIO and let it drive me for a scenic view of the nearest concentration camp,01-11-2021,YoungJebediah,168.0,i cant wait to buy a nio and let it drive me for a scenic view of the nearest concentration camp,positive,0.5692483,,nio,209,209_nio_jellyfish_nipsey_niorway,2021-01-11
1601,"Daily Discussion Thread for January 07, 2021","If ICLN goes to 100$ before EOY, I MAKE 100k ğŸš€ğŸŒš",01-07-2021,empqrer,14.0,if icln goes to 100 before eoy i make 100k,neutral,0.7817007,,,-1,-1_spce_000_price_bags,2021-01-07
2053,"Daily Discussion Thread for January 08, 2021",We all know that the only person who will accurately time the collapse of TSLA is going to be some retard that comes here for the first time and then buys an extremely OTM put weekly then becomes a multimillionaire off of sheer retardation alone,01-08-2021,connerlouis,13.0,we all know that the only person who will accurately time the collapse of tsla is going to be some retard that comes here for the first time and then buys an extremely otm put weekly then becomes a multimillionaire off of sheer retardation alone,negative,0.7673529,,tsla,-1,-1_spce_000_price_bags,2021-01-08
4390,"Daily Discussion Thread for January 18, 2021","I thought you were joking, but most of you actually are retarded.",01-18-2021,Tbonepermabull,12.0,i thought you were joking but most of you actually are retarded,negative,0.9283411,,,52,52_retarded_retard_retards_iq,2021-01-18
7233,"Daily Discussion Thread for January 29, 2021","WE KNOW OTHER STONKS ARE DOING GOOD BUT FOCUS YOU RETARDS FOCUS

HOLD THE LINE

https://www.reddit.com/r/wallstreetbets/comments/l7qahx/gme_squeeze/?utm_source=share&utm_medium=ios_app&utm_name=iossmf

ğŸš€ğŸš€ğŸ’ğŸš€ğŸš€ğŸ’HOLD GMEğŸ’ğŸš€ğŸš€ğŸ’ğŸš€ğŸš€ ğŸš€ğŸš€ğŸ’ğŸš€ğŸš€ğŸ’HOLD GMEğŸ’ğŸš€ğŸš€ğŸ’ğŸš€ğŸš€ ğŸš€ğŸš€ğŸ’ğŸš€ğŸš€ğŸ’HOLD GMEğŸ’ğŸš€ğŸš€ğŸ’ğŸš€ğŸš€ ğŸš€ğŸš€ğŸ’ğŸš€ğŸš€ğŸ’HOLD GMEğŸ’ğŸš€ğŸš€ğŸ’ğŸš€ğŸš€ ğŸš€ğŸš€ğŸ’ğŸš€ğŸš€ğŸ’HOLD GMEğŸ’ğŸš€ğŸš€ğŸ’ğŸš€ğŸš€ ğŸš€ğŸš€ğŸ’ğŸš€ğŸš€ğŸ’HOLD GMEğŸ’ğŸš€ğŸš€ğŸ’ğŸš€ğŸš€ ğŸš€ğŸš€ğŸ’ğŸš€ğŸš€ğŸ’HOLD GMEğŸ’ğŸš€ğŸš€ğŸ’ğŸš€ğŸš€ ğŸš€ğŸš€ğŸ’ğŸš€ğŸš€ğŸ’HOLD GMEğŸ’ğŸš€ğŸš€ğŸ’ğŸš€ğŸš€ ğŸš€ğŸš€ğŸ’ğŸš€ğŸš€ğŸ’HOLD GMEğŸ’ğŸš€ğŸš€ğŸ’ğŸš€ğŸš€",01-29-2021,LKKAndresX,48.0,we know other stonks are doing good but focus you retards focus hold the line https www reddit com r wallstreetbets comments l7qahx gme_squeeze utm_source share utm_medium ios_app utm_name iossmf hold gme hold gme hold gme hold gme hold gme hold gme hold gme hold gme hold gme,neutral,0.51230824,,gme,-1,-1_spce_000_price_bags,2021-01-29
3882,"Weekend Discussion Thread for the Weekend of January 15, 2021","I want to ride with WSB.

I can only afford 14 shares of GME though. Is it worth it?",01-16-2021,xbrownbread,26.0,i want to ride with wsb i can only afford 14 shares of gme though is it worth it,neutral,0.5929367,,ford,-1,-1_spce_000_price_bags,2021-01-16
1591,"Daily Discussion Thread for January 07, 2021","AAPL itâ€™s happening 

130 and boom goes the dynamite",01-07-2021,touchhimwiththejab,15.0,aapl its happening 130 and boom goes the dynamite,neutral,0.65720326,,,163,163_aapl_135_130_125,2021-01-07
6483,"Daily Discussion Thread for January 26, 2021","BB gets a downgrade

BB up ~~8%~~ 10% PM

BB donâ€™t give af about your downgrades dudes",01-26-2021,EnginrA,215.0,bb gets a downgrade bb up 8 10 pm bb dont give af about your downgrades dudes,negative,0.63774496,,bb,-1,-1_spce_000_price_bags,2021-01-26
6459,"Daily Discussion Thread for January 25, 2021",Where my BB people at?!,01-25-2021,its_alle_bruh,21.0,where my bb people at,neutral,0.805209,,bb,88,88_gang_bbby_shambos_lambos,2021-01-25
6854,"Daily Discussion Thread for January 26, 2021","If bb breaks $21 today, I will head to Chinatown for some anal bleaching.",01-26-2021,StayAtHomeAstronaut,23.0,if bb breaks 21 today i will head to chinatown for some anal bleaching,neutral,0.6451282,,bb,10,10_12_11_break_hit,2021-01-26
2265,"Daily Discussion Thread for January 11, 2021",You gamestop autist are insane lmaoo,01-11-2021,Forarolex,33.0,you gamestop autist are insane lmaoo,negative,0.8818886,,gamestop,173,173_autism_autists_autist_autistic,2021-01-11
2200,"Daily Discussion Thread for January 08, 2021","If apple doesnâ€™t pump to 135, Tim is gay af",01-08-2021,iamjpow69,12.0,if apple doesnt pump to 135 tim is gay af,negative,0.78080416,,,-1,-1_spce_000_price_bags,2021-01-08
6312,"Daily Discussion Thread for January 25, 2021",diamond hands bb brothers,01-25-2021,learningaboutstocks,23.0,diamond hands bb brothers,neutral,0.849204,,bb,136,136_diamond_hands_hand_handing,2021-01-25
5220,"Daily Discussion Thread for January 20, 2021",May ICLN fly like Joe Bidenâ€™s hair,01-20-2021,8thSt,12.0,may icln fly like joe bidens hair,neutral,0.83324194,,,144,144_icln_plug_bidens_rtardes,2021-01-20
1900,"Daily Discussion Thread for January 08, 2021","Itâ€™s easy to feel like youâ€™re missing out on profits even being up huge on days like this. There is nothing wrong with playing within your risk tolerance tho. If you canâ€™t stomach the comparable down swings that inevitably come with the degree of gains you are leveraging yourself to get, it is a pointless endeavor because you are going to panic sell the bottom on any little correction and invalidate the upside of the play.

Be happy to be green and donâ€™t over extend yourself.",01-08-2021,247drip1,25.0,its easy to feel like youre missing out on profits even being up huge on days like this there is nothing wrong with playing within your risk tolerance tho if you cant stomach the comparable down swings that inevitably come with the degree of gains you are leveraging yourself to get it is a pointless endeavor because you are going to panic sell the bottom on any little correction and invalidate the upside of the play be happy to be green and dont over extend yourself,negative,0.49471316,,,-1,-1_spce_000_price_bags,2021-01-08
752,"Daily Discussion Thread for January 04, 2021","Now that some time has passed, I can clearly see that my 12/31/20 GME 35C were not a very good move",01-04-2021,catch_420,18.0,now that some time has passed i can clearly see that my 12 31 20 gme 35c were not a very good move,negative,0.8634423,,gme,56,56_300_200_250_210,2021-01-04
5055,"Daily Discussion Thread for January 20, 2021",Buy BB now?,01-20-2021,berto1102,17.0,buy bb now,neutral,0.6752964,,bb,1,1_priced_sale_discount_price,2021-01-20
6289,"Daily Discussion Thread for January 25, 2021","BB is a fighter, strong hold ğŸ“ˆ",01-25-2021,3at,27.0,bb is a fighter strong hold,neutral,0.53859746,,bb,153,153_holding_hold_bbags_momentum,2021-01-25
6451,"Daily Discussion Thread for January 25, 2021",$BB $GME $AMC are the holy trinity,01-25-2021,SinglePomegranate,22.0,bb gme amc are the holy trinity,positive,0.72286177,,bb,27,27_nok_silver_line_charts,2021-01-25
4035,"Weekend Discussion Thread for the Weekend of January 15, 2021",I literally have nothing else to talk about with other people besides meme stocks,01-16-2021,yachtsandthots,16.0,i literally have nothing else to talk about with other people besides meme stocks,negative,0.7049221,,,24,24_meme_memes_boomer_memestock,2021-01-16
1892,"Daily Discussion Thread for January 08, 2021","Anyone else angry that NKLA isnâ€™t single digits by now?

I donâ€™t hold any positions on it.",01-08-2021,wsb_mods_R_gay,24.0,anyone else angry that nkla isnt single digits by now i dont hold any positions on it,neutral,0.5251482,,,325,325_nkla_nke_revenue_tards,2021-01-08
4624,"Daily Discussion Thread for January 19, 2021","BB owns 38,000 Patents

ğŸš€",01-19-2021,Glossyeyes949,14.0,bb owns 38 000 patents,neutral,0.68419206,,bb,-1,-1_spce_000_price_bags,2021-01-19
7313,"Daily Discussion Thread for January 29, 2021","So my friends who are just now asking about GME, do I tell em to jump in now? ğŸ˜‚",01-29-2021,JMSeaTown,41.0,so my friends who are just now asking about gme do i tell em to jump in now,neutral,0.9033515,,gme,51,51_03ncnwxrm64_king_deploy_saga,2021-01-29
5262,"Daily Discussion Thread for January 20, 2021",Setting an Alarm. GME shares at 11:30,01-20-2021,KarmaKill23,13.0,setting an alarm gme shares at 11 30,neutral,0.92041814,,gme,59,59_share_shares_1000_gmes,2021-01-20
4920,"Daily Discussion Thread for January 20, 2021","ICLN pleas, the kids are hungry",01-20-2021,rasterroo,26.0,icln pleas the kids are hungry,negative,0.6533993,,,-1,-1_spce_000_price_bags,2021-01-20
3702,"Daily Discussion Thread for January 15, 2021",Am I retarded for buying GME,01-15-2021,Agile_Effective9051,21.0,am i retarded for buying gme,negative,0.8740666,,gme,1,1_priced_sale_discount_price,2021-01-15
6403,"Daily Discussion Thread for January 25, 2021",BB and AMC DUBS LETS GOOOOO,01-25-2021,DIV_KING12,21.0,bb and amc dubs lets gooooo,positive,0.7356859,,bb,184,184_momentum_amcc_ganggg_breakaway,2021-01-25
1422,"Daily Discussion Thread for January 06, 2021",JPow practicing his â€œfull range of toolsâ€ speech infront of mirror right now,01-06-2021,ASuag,11.0,jpow practicing his full range of tools speech infront of mirror right now,neutral,0.91406506,,,96,96_jpow_speaks_speech_speak,2021-01-06
4863,"Daily Discussion Thread for January 19, 2021",BB stands for Big Ballers Fuckin Bad Bitches on a Big Boat you'd Best Believe.,01-19-2021,ChoppedCheeseNoTmato,23.0,bb stands for big ballers fuckin bad bitches on a big boat youd best believe,negative,0.88067734,,bb,304,304_boobs_titties_boob_boobies,2021-01-19
5139,"Daily Discussion Thread for January 20, 2021",BB 15 EOD,01-20-2021,kingxlos,15.0,bb 15 eod,neutral,0.6688189,,bb,67,67_eod_eow_15_eom,2021-01-20
5217,"Daily Discussion Thread for January 20, 2021",Straight up just going to sleep and leaving my 5x leverage on BB. Why? Because I believe in the BB GANG FAMILY ğŸš€ğŸš€ğŸš€ğŸš€ğŸš€ğŸš€ğŸš€ğŸš€ğŸ’ğŸ™Œ,01-20-2021,reiys123,14.0,straight up just going to sleep and leaving my 5x leverage on bb why because i believe in the bb gang family,neutral,0.5369216,,bb,-1,-1_spce_000_price_bags,2021-01-20
5410,"Daily Discussion Thread for January 22, 2021",Letâ€™s push BB to 15!,01-22-2021,tom6195,20.0,lets push bb to 15,neutral,0.8498643,,bb,10,10_12_11_break_hit,2021-01-22
557,"Weekend Discussion Thread for the Weekend of January 01, 2021",30k baby,01-02-2021,Mr-Cantaloupe,14.0,30k baby,neutral,0.72818005,,,40,40_5k_20k_30k_3k,2021-01-02
3766,"Daily Discussion Thread for January 15, 2021",You maniacs who held $40c expiring today might just pull it off yet...,01-15-2021,PlayFree_Bird,21.0,you maniacs who held 40c expiring today might just pull it off yet,neutral,0.5368785,,,-1,-1_spce_000_price_bags,2021-01-15
5994,"Weekend Discussion Thread for the Weekend of January 22, 2021","BB to the moon. Can you smash this upvote for confirmation bias? And just overall positive vibes for the weekend.

ğŸš€ğŸš€ğŸš€ğŸš€ğŸš€ğŸš€ğŸš€",01-23-2021,Ill_Ad3484,81.0,bb to the moon can you smash this upvote for confirmation bias and just overall positive vibes for the weekend,positive,0.71198094,,bb,25,25_mooning_moon_mission_pluto,2021-01-23
3655,"Daily Discussion Thread for January 15, 2021",gme premarket wednesday was also flat.,01-15-2021,Funny_Story2759,45.0,gme premarket wednesday was also flat,neutral,0.7566921,,gme,-1,-1_spce_000_price_bags,2021-01-15
6478,"Daily Discussion Thread for January 26, 2021","If you bought at 150 and still holding please reply, I want to remember you. Stay strong, we are coming.",01-26-2021,scrunch27,428.0,if you bought at 150 and still holding please reply i want to remember you stay strong we are coming,positive,0.69967055,,,163,163_aapl_135_130_125,2021-01-26
608,"Weekend Discussion Thread for the Weekend of January 01, 2021",Itâ€™d be funny if all of us asking for flairs got a 24hr ban tomorrow,01-02-2021,WoOoOoOoShHhHh,12.0,itd be funny if all of us asking for flairs got a 24hr ban tomorrow,neutral,0.61350965,,,285,285_flair_flairs_mods_ban,2021-01-02
6262,"Daily Discussion Thread for January 25, 2021",looks like BB coming back from the dip a bit. Did you retards finally buy shares instead of calls?,01-25-2021,Sufficient-Ad3118,28.0,looks like bb coming back from the dip a bit did you retards finally buy shares instead of calls,neutral,0.7086422,,bb,92,92_shares_200_share_500,2021-01-25
2642,"Daily Discussion Thread for January 12, 2021",Who else was up at 4:00am for pre-market?,01-12-2021,Gr3gy,61.0,who else was up at 4 00am for pre market,neutral,0.87067544,,,-1,-1_spce_000_price_bags,2021-01-12
7027,"Daily Discussion Thread for January 29, 2021",**OCCUPY GAMESTOP**,01-29-2021,MakerofMarkets,71.0,occupy gamestop,neutral,0.694522,,gamestop,120,120_gamestop_gamestops_sellers_shorted,2021-01-29
3230,"Daily Discussion Thread for January 14, 2021",I wish mods would make a GME daily discussion,01-14-2021,BullfrogBrewing,18.0,i wish mods would make a gme daily discussion,neutral,0.6853263,,gme,183,183_mods_threads_masochists_wallstreetbets,2021-01-14
3459,"Daily Discussion Thread for January 15, 2021",GME is literally going to let me retire 10 years early.,01-15-2021,mwilkens,93.0,gme is literally going to let me retire 10 years early,neutral,0.5963634,,gme,-1,-1_spce_000_price_bags,2021-01-15
4683,"Daily Discussion Thread for January 19, 2021",BB Gang you did well today,01-19-2021,B1rdkid,14.0,bb gang you did well today,positive,0.9578694,,bb,88,88_gang_bbby_shambos_lambos,2021-01-19
5395,"Daily Discussion Thread for January 22, 2021",BB TO $15 today! $20 next week!!!,01-22-2021,NoCriticism5516,22.0,bb to 15 today 20 next week,neutral,0.9055935,,bb,10,10_12_11_break_hit,2021-01-22
3101,"Daily Discussion Thread for January 14, 2021","*Attention Passengers, Flight $GME to The Moon is now boarding. All passengers may now make their way to gate WSB with their shares and calls to board. If you require assistance to board due to a mental disability, one of our attendants will be happy to assist you.*",01-14-2021,Talorex,22.0,attention passengers flight gme to the moon is now boarding all passengers may now make their way to gate wsb with their shares and calls to board if you require assistance to board due to a mental disability one of our attendants will be happy to assist you,positive,0.54858404,,gme,25,25_mooning_moon_mission_pluto,2021-01-14
1837,"Daily Discussion Thread for January 07, 2021","Roblox was supposed to be the next hidden gem, pumped by WSB. At $8B valuation, I saw it doubling easily.

In a matter of months they almost quadrupled the valuation in the upcoming direct listing. $30B lol. Taking full advantage of the Robinhood People here.

Gonna be much harder to double now, RIP",01-07-2021,OogdayAyday,10.0,roblox was supposed to be the next hidden gem pumped by wsb at 8b valuation i saw it doubling easily in a matter of months they almost quadrupled the valuation in the upcoming direct listing 30b lol taking full advantage of the robinhood people here gonna be much harder to double now rip,neutral,0.49907118,,robinhood,326,326_roblox_gameplay_videos_millinoaires,2021-01-07
5769,"Weekend Discussion Thread for the Weekend of January 22, 2021",Imagine shorting a stock and then having pretty much the entire internet decide to buy it,01-24-2021,whammyyy,68.0,imagine shorting a stock and then having pretty much the entire internet decide to buy it,neutral,0.639984,,,4,4_investor_growth_investing_invest,2021-01-24
6124,"Daily Discussion Thread for January 25, 2021",BB next stop: MOON!!!,01-25-2021,therealnumberIX,37.0,bb next stop moon,neutral,0.8105737,,bb,25,25_mooning_moon_mission_pluto,2021-01-25
4588,"Daily Discussion Thread for January 19, 2021",In for 100 shares of $BB!,01-19-2021,HurriCanes1991,15.0,in for 100 shares of bb,neutral,0.84152645,,bb,92,92_shares_200_share_500,2021-01-19
1292,"Daily Discussion Thread for January 06, 2021",PLTR red mornings means no opening dump,01-06-2021,HonestManufacturer1,11.0,pltr red mornings means no opening dump,neutral,0.6498275,,,-1,-1_spce_000_price_bags,2021-01-06
4854,"Daily Discussion Thread for January 19, 2021",A short term put on BB seemed like an ok play when it was already up 23%. That def didnâ€™t work out for me lol,01-19-2021,tplee,13.0,a short term put on bb seemed like an ok play when it was already up 23 that def didnt work out for me lol,neutral,0.50292987,,bb,-1,-1_spce_000_price_bags,2021-01-19
5560,"Daily Discussion Thread for January 22, 2021",PLTR PLTR PLTR PLTR PLTR,01-22-2021,Chiscuit,16.0,pltr pltr pltr pltr pltr,neutral,0.7382727,,,455,455_felonies_faggy_sly_tracks,2021-01-22
6215,"Daily Discussion Thread for January 25, 2021",BUY THE BB DIP AND HOLLLLDDDDDD,01-25-2021,tsarkirboi,26.0,buy the bb dip and holllldddddd,neutral,0.74905694,,bb,2,2_dips_dipping_dip_dipped,2021-01-25
5917,"Weekend Discussion Thread for the Weekend of January 22, 2021",Looking for ICLN warriors but canâ€™t find any. Seems everyone just wants to squeeze some Melvin guys nuts or summ,01-24-2021,jdam4569,25.0,looking for icln warriors but cant find any seems everyone just wants to squeeze some melvin guys nuts or summ,negative,0.65077305,,,144,144_icln_plug_bidens_rtardes,2021-01-24
6373,"Daily Discussion Thread for January 25, 2021",All in on BB ğŸš€ğŸš€,01-25-2021,StrikeTheSun1851,23.0,all in on bb,neutral,0.723876,,bb,450,450_24k_degenerates_literally_,2021-01-25
2774,"Daily Discussion Thread for January 12, 2021","â€œJohn what do you have for usâ€

â€œI think Apple has some more room to go northâ€

â€œOur investors pay us a 3% management fee and 30% of their profits and you want me to tell emâ€™ that weâ€™re buying some fucking Appleâ€. 

â€œIdk man, Iâ€™m just having a hard time seeing the matrix right nowâ€

â€œWell thatâ€™s concerning John as seeing the matrix is your entire fucking job. â€œ",01-12-2021,Lost-Wing,33.0,john what do you have for us i think apple has some more room to go north our investors pay us a 3 management fee and 30 of their profits and you want me to tell em that were buying some fucking apple idk man im just having a hard time seeing the matrix right now well thats concerning john as seeing the matrix is your entire fucking job,negative,0.91923696,,,44,44_apple_iphone_ipad_event,2021-01-12
6090,"Daily Discussion Thread for January 25, 2021","â€œHoW hIgH iS $BB GoInG tO gOâ€

higher than bird pussy. now shut up and buy",01-25-2021,MrsEveryShot,63.0,how high is bb going to go higher than bird pussy now shut up and buy,negative,0.4755257,,bb,-1,-1_spce_000_price_bags,2021-01-25
2516,"Daily Discussion Thread for January 11, 2021",I'm just here to laugh at the GME bears,01-11-2021,buy_the_peaks,12.0,im just here to laugh at the gme bears,neutral,0.50835615,,gme,-1,-1_spce_000_price_bags,2021-01-11
6625,"Daily Discussion Thread for January 26, 2021","BB Rocket cleared for takeoff, $18.25 broken, see you all at my lunar base in my moon lambo",01-26-2021,J4COBY,23.0,bb rocket cleared for takeoff 18 25 broken see you all at my lunar base in my moon lambo,neutral,0.5474145,,bb,25,25_mooning_moon_mission_pluto,2021-01-26
9079,"Daily Discussion Thread for February 10, 2021","Sorry itâ€™s falling guys it was me, I bought shares. I think Iâ€™m a curse",02-10-2021,kronksbonks,35.0,sorry its falling guys it was me i bought shares i think im a curse,negative,0.7254238,,,-1,-1_spce_000_price_bags,2021-02-10
8594,"Daily Discussion Thread for February 09, 2021",Iâ€™m a Melvin bot and Iâ€™m tired of pretending Iâ€™m not.,02-09-2021,tressan,334.0,im a melvin bot and im tired of pretending im not,negative,0.49962974,,,223,223_melvin_capital_melvins_melvincapital,2021-02-09
12379,"Weekend Discussion Thread for the Weekend of February 19, 2021",Holy fuck PLTR inching closer to 30,02-19-2021,bigbosslord,16.0,holy fuck pltr inching closer to 30,negative,0.86371803,,,14,14_25_30_38_break,2021-02-19
10222,"Daily Discussion Thread for February 12, 2021",GivME that Squozen Squeeze,02-12-2021,Kennywise91,14.0,givme that squozen squeeze,neutral,0.6993558,,,155,155_squeeze_squeezes_squozen_mkt,2021-02-12
7928,"Daily Discussion Thread for February 02, 2021",This after-hours work will definitely challenge the resiliency of many first time or relative new retail investors that don't understand the volumes we're speaking to.,02-02-2021,paqua17,33.0,this after hours work will definitely challenge the resiliency of many first time or relative new retail investors that dont understand the volumes were speaking to,negative,0.6778935,,,-1,-1_spce_000_price_bags,2021-02-02
12426,"Weekend Discussion Thread for the Weekend of February 19, 2021",God damn my wife really is a saint for putting up with all this,02-20-2021,firstinitallastname,15.0,god damn my wife really is a saint for putting up with all this,negative,0.55301625,,,23,23_wife_tinder_married_girlfriend,2021-02-20
11198,"Daily Discussion Thread for February 16, 2021",$APHA get in here!,02-16-2021,nugletbuffet,14.0,apha get in here,neutral,0.7274628,,,80,80_apha_aphria_aph_comeback,2021-02-16
13230,"Daily Discussion Thread for February 23, 2021",It smells like bitch in here,02-23-2021,StonkGoUp,17.0,it smells like bitch in here,negative,0.95088506,,,95,95_toilet_smell_poop_smells,2021-02-23
10786,"Daily Discussion Thread for February 15, 2021",I thought George Washington was cancelled.  Why the hell is this old mf who didn't own a single share of Apple closing down the stock market.,02-15-2021,chuck_portis,19.0,i thought george washington was cancelled why the hell is this old mf who didnt own a single share of apple closing down the stock market,negative,0.9697711,,,121,121_recession_cancelled_canceled_recessions,2021-02-15
7565,"Daily Discussion Thread for February 01, 2021","1.) wake up, check memefolio 

2.) buy more GME

3.) take shit while watching GME chart. Donâ€™t wipe.

4.) buy more GME

5.) microwave tendies while watching CNBC meltdown 

6.) buy more GME 

7.) stare at postmarket while my wifeâ€™s boyfriend picks her up 

8.) jerk off to GME gains and shitpost on WSB

9.) sleep, have dreams about AOC breast feeding me in my lambo",02-01-2021,Narrow-Cup-3500,154.0,1 wake up check memefolio 2 buy more gme 3 take shit while watching gme chart dont wipe 4 buy more gme 5 microwave tendies while watching cnbc meltdown 6 buy more gme 7 stare at postmarket while my wifes boyfriend picks her up 8 jerk off to gme gains and shitpost on wsb 9 sleep have dreams about aoc breast feeding me in my lambo,negative,0.7261322,,gme,1,1_priced_sale_discount_price,2021-02-01
12605,"Daily Discussion Thread for February 22, 2021",new PLTR holders will have to learn about the dumps every morning,02-22-2021,Zachflintstone,20.0,new pltr holders will have to learn about the dumps every morning,neutral,0.67764246,,,-1,-1_spce_000_price_bags,2021-02-22
14528,"Daily Discussion Thread for February 26, 2021",I feel like people bought into AMC Networks rather than AMC...,02-26-2021,Javierofhell,12.0,i feel like people bought into amc networks rather than amc,negative,0.7592639,,amc,-1,-1_spce_000_price_bags,2021-02-26
13967,"Daily Discussion Thread for February 25, 2021",I havenâ€™t slept since yesterday. Iâ€™m so fucking tired but I want tendies,02-25-2021,ucaliptastree,20.0,i havent slept since yesterday im so fucking tired but i want tendies,negative,0.9347461,,,89,89_tendies_tendie_rubs_tendieman,2021-02-25
13684,"Daily Discussion Thread for February 24, 2021","And here I am, buying AMC at the peak again...",02-24-2021,ConHerz,15.0,and here i am buying amc at the peak again,positive,0.53272974,,amc,1,1_priced_sale_discount_price,2021-02-24
12921,"Daily Discussion Thread for February 22, 2021",Pltr me please,02-22-2021,sdissa,14.0,pltr me please,neutral,0.7894045,,,-1,-1_spce_000_price_bags,2021-02-22
14742,"Weekend Discussion Thread for the Weekend of February 26, 2021",I'm up -20%,02-28-2021,brianjoseph_,50.0,im up 20,neutral,0.75903964,,,14,14_25_30_38_break,2021-02-28
7700,"Daily Discussion Thread for February 01, 2021",Just buy AMC. Stop selling it please...wtf,02-01-2021,lergmert,32.0,just buy amc stop selling it please wtf,negative,0.7875132,,amc,340,340_selling_abe_mothrrfuckers_boldly,2021-02-01
13426,"Daily Discussion Thread for February 24, 2021","AMC will have -1,000,000,000 net income this quarter

Straight to $100 ğŸš€",02-24-2021,wasabimcdouble,32.0,amc will have 1 000 000 000 net income this quarter straight to 100,neutral,0.78173727,,amc,-1,-1_spce_000_price_bags,2021-02-24
7896,"Daily Discussion Thread for February 02, 2021","Wow, today is the real diamond test, but I'll keep HOLDING ON!",02-02-2021,Nijata,37.0,wow today is the real diamond test but ill keep holding on,positive,0.7887158,,,136,136_diamond_hands_hand_handing,2021-02-02
12050,"Daily Discussion Thread for February 19, 2021","Should I fire my missiles at PLTR @ 29 
I just woke up",02-19-2021,Brewermcbrewface,16.0,should i fire my missiles at pltr 29 i just woke up,neutral,0.7446732,,,14,14_25_30_38_break,2021-02-19
8291,"Daily Discussion Thread for February 03, 2021",Fuck I drooled on my phone and bought AMC,02-03-2021,Glitch5450,48.0,fuck i drooled on my phone and bought amc,negative,0.7869353,,amc,-1,-1_spce_000_price_bags,2021-02-03
9324,"Daily Discussion Thread for February 10, 2021",If SNDL breaks and holds 2.50 we will likely see $4 or more this week,02-10-2021,Pumpty_Dumpty,27.0,if sndl breaks and holds 2 50 we will likely see 4 or more this week,neutral,0.79470634,,,26,26_sndl_appl_trending_tlry,2021-02-10
14972,"Weekend Discussion Thread for the Weekend of February 26, 2021",Canâ€™t wait to lose all my money tomorrow ğŸ¤©,02-28-2021,weedebest,16.0,cant wait to lose all my money tomorrow,negative,0.6767798,,,28,28_losing_lose_lost_losses,2021-02-28
14667,"Daily Discussion Thread for February 26, 2021","I keep doubling down every day and now someone named Marge Inn keeps blowing up my phone every 2 minutes, gonna change my number lmao",02-26-2021,The_Chillosopher,10.0,i keep doubling down every day and now someone named marge inn keeps blowing up my phone every 2 minutes gonna change my number lmao,negative,0.6537605,,,44,44_apple_iphone_ipad_event,2021-02-26
7548,"Daily Discussion Thread for February 01, 2021",$AMC blasting off buyers are taking hold,02-01-2021,Creatorofthistime,79.0,amc blasting off buyers are taking hold,neutral,0.8685304,,amc,-1,-1_spce_000_price_bags,2021-02-01
11202,"Daily Discussion Thread for February 16, 2021",#APHA IS LIFTING UP!!!!ğŸš€ğŸš€ğŸš€ğŸš€ğŸš€ğŸš€ğŸš€ğŸš€ğŸš€ğŸš€ğŸš€ğŸš€,02-16-2021,zero708970,13.0,apha is lifting up,positive,0.61154556,,,80,80_apha_aphria_aph_comeback,2021-02-16
14422,"Daily Discussion Thread for February 26, 2021",Iâ€™m too young to be shaving so many years off my life playing all these options lol,02-26-2021,Suspicious_Host,13.0,im too young to be shaving so many years off my life playing all these options lol,negative,0.64404005,,,232,232_hair_haircut_shaving_shaved,2021-02-26
7340,"Daily Discussion Thread for February 01, 2021",Mods can we get an AMC dedicated thread?,02-01-2021,Huddster99,98.0,mods can we get an amc dedicated thread,neutral,0.84595406,,amc,212,212_mods_gay_mod_nongmeers,2021-02-01
11656,"Daily Discussion Thread for February 18, 2021",Heâ€™s literally joking during a senate hearing lmfao,02-18-2021,AdrianThatGuy,15.0,hes literally joking during a senate hearing lmfao,neutral,0.6270576,,,-1,-1_spce_000_price_bags,2021-02-18
9026,"Daily Discussion Thread for February 09, 2021","Just let me know when you guys are ready for SNDL to take off and I will sell it, works every time",02-09-2021,MyPetKoala,15.0,just let me know when you guys are ready for sndl to take off and i will sell it works every time,positive,0.6919311,,,26,26_sndl_appl_trending_tlry,2021-02-09
10776,"Daily Discussion Thread for February 15, 2021",I heard there is a stock that everyone likes. I think im going to buy that one.,02-15-2021,Recklezzz,23.0,i heard there is a stock that everyone likes i think im going to buy that one,positive,0.8933166,,,39,39_weed_smoked_cannabis_legalization,2021-02-15
13982,"Daily Discussion Thread for February 25, 2021",Anyone else furiously masterbating right now,02-25-2021,ollien25,19.0,anyone else furiously masterbating right now,neutral,0.8326709,,,231,231_cum_lube_vasectomy_vaseline,2021-02-25
8872,"Daily Discussion Thread for February 09, 2021",APHA or TLRY calls? Have $14k buying power right now. Was thinking of doing a a leap on them. Thoughts?,02-09-2021,pleasesolvefory,16.0,apha or tlry calls have 14k buying power right now was thinking of doing a a leap on them thoughts,neutral,0.9043096,,,80,80_apha_aphria_aph_comeback,2021-02-09
13358,"Daily Discussion Thread for February 23, 2021",If I delete my account can I still lose money,02-23-2021,67kg_lifter,14.0,if i delete my account can i still lose money,negative,0.82242423,,,-1,-1_spce_000_price_bags,2021-02-23
13070,"Daily Discussion Thread for February 23, 2021",Today might be the day I ragequit TSLA,02-23-2021,rammstein_koala,22.0,today might be the day i ragequit tsla,neutral,0.50863105,,tsla,29,29_tsla_tslas_autopilot_og,2021-02-23
9216,"Daily Discussion Thread for February 10, 2021",SNDL to the freaking moon guys! ğŸš€ğŸš€,02-10-2021,akichi08,33.0,sndl to the freaking moon guys,neutral,0.46471134,,,263,263_reefer_madness_moon_jupiter,2021-02-10
12274,"Weekend Discussion Thread for the Weekend of February 19, 2021",PLTR only!,02-20-2021,jpneal2,23.0,pltr only,neutral,0.6674724,,,111,111_hon_sheeeeeshh_imposter_greeen,2021-02-20
11105,"Daily Discussion Thread for February 16, 2021",Love palantir because I dont have to pay taxes anymore ğŸ¤—ğŸ¤—,02-16-2021,Sure_Maximum7061,14.0,love palantir because i dont have to pay taxes anymore,positive,0.8793092,,palantir,66,66_palantir_palantards_palantard_ashes,2021-02-16
12434,"Weekend Discussion Thread for the Weekend of February 19, 2021",Wish I bought PLTR calls Friday at close.. I honestly expect ~$40 eow this week. I'm gonna buy as many share as I can Monday at open. Thoughts?,02-21-2021,Balys,15.0,wish i bought pltr calls friday at close i honestly expect 40 eow this week im gonna buy as many share as i can monday at open thoughts,neutral,0.57280034,,,-1,-1_spce_000_price_bags,2021-02-21
12344,"Weekend Discussion Thread for the Weekend of February 19, 2021",Cathie Wood's has never heard a bell ring in her life.,02-20-2021,IgrewAtomato,17.0,cathie woods has never heard a bell ring in her life,negative,0.5222178,,,324,324_bell_ring_ringing_heard,2021-02-20
10035,"Daily Discussion Thread for February 12, 2021",#Look at that Dead cat AMC bounce! ğŸš€ğŸš€ğŸš€,02-12-2021,dogeball40,17.0,look at that dead cat amc bounce,negative,0.7080495,,amc,219,219_cat_bounce_cats_bouncing,2021-02-12
7400,"Daily Discussion Thread for February 01, 2021","FOR FUCK SAKES HOLD AMC, ITS GOING UP RN",02-01-2021,lowkeycowboysfan,59.0,for fuck sakes hold amc its going up rn,negative,0.574319,,amc,13,13_netflix_movie_movies_push,2021-02-01
14724,"Weekend Discussion Thread for the Weekend of February 26, 2021",damn I aged 30 years this week.,02-26-2021,samgarita,71.0,damn i aged 30 years this week,negative,0.8180808,,,400,400_older_20s_30s_superman,2021-02-26
10824,"Daily Discussion Thread for February 15, 2021",I think in honor of Presidents day we should all vote on a president and Yolo our life savings into his initials tomorrow. All in on $LBJ. Can't go tits up,02-15-2021,VascularHotDog,3.0,i think in honor of presidents day we should all vote on a president and yolo our life savings into his initials tomorrow all in on lbj cant go tits up,neutral,0.4999808,,,-1,-1_spce_000_price_bags,2021-02-15
7696,"Daily Discussion Thread for February 01, 2021",THERE HAS BEEN A DIP EVERY DAY FOR THE LAST WEEK AT 9:30! BUY THE DIP AND TRUST THE PROCESS YOU APES ğŸš€ğŸ’ğŸ’ğŸ’ğŸ’ğŸ’ğŸ’ğŸ¦ğŸ¦ğŸ¦ğŸ™ŒğŸ™ŒğŸ™ŒğŸ™ŒğŸ¦ğŸš€ğŸš€ğŸš€ğŸš€ğŸ’ğŸ’ğŸ’ğŸ’,02-01-2021,jewelry,37.0,there has been a dip every day for the last week at 9 30 buy the dip and trust the process you apes,neutral,0.7759082,,,2,2_dips_dipping_dip_dipped,2021-02-01
9628,"Daily Discussion Thread for February 11, 2021",Beating myself for falling for TLRY smdh,02-11-2021,MarsDominus,24.0,beating myself for falling for tlry smdh,negative,0.7075432,,,31,31_tlry_moving_awakens_tlghey,2021-02-11
13977,"Daily Discussion Thread for February 25, 2021",Literally the only green in my account right now is AMC and GME,02-25-2021,PM_ME_ASS_OR_GRASS,21.0,literally the only green in my account right now is amc and gme,neutral,0.6901182,,amc,301,301_hopeshigh_keeping_265_gamble,2021-02-25
12229,"Weekend Discussion Thread for the Weekend of February 19, 2021",I just want a 7 figure portfolio and an obedient but horny Japanese wife #woke,02-20-2021,sinisterskrilla,32.0,i just want a 7 figure portfolio and an obedient but horny japanese wife woke,negative,0.46990308,,,7,7_portfolio_portfolios_ruin_bleed,2021-02-20
13160,"Daily Discussion Thread for February 23, 2021",guys im financially ruined im not even kidding,02-23-2021,VegasHeat,19.0,guys im financially ruined im not even kidding,negative,0.8391744,,,131,131_recover_ruined_broke_recovering,2021-02-23
7647,"Daily Discussion Thread for February 01, 2021",AMC TO 25 TODAY LETS DO IT,02-01-2021,plexico18,32.0,amc to 25 today lets do it,positive,0.65303165,,amc,14,14_25_30_38_break,2021-02-01
7679,"Daily Discussion Thread for February 01, 2021","Donâ€™t be scared by GME price drop itâ€™s a short ladder attack, just look at the volume nobody is selling.",02-01-2021,TheBigChiefsGuy,32.0,dont be scared by gme price drop its a short ladder attack just look at the volume nobody is selling,neutral,0.5040539,,gme,-1,-1_spce_000_price_bags,2021-02-01
8869,"Daily Discussion Thread for February 09, 2021",Anytime a stock is up all the webull comments start talking about how they're squeezing the hedge fundsğŸ¤¦ğŸ»â€â™‚ï¸,02-09-2021,burgerrking,16.0,anytime a stock is up all the webull comments start talking about how theyre squeezing the hedge funds,neutral,0.5740647,,,194,194_hedge_funds_fund_hedgefunds,2021-02-09
12185,"Weekend Discussion Thread for the Weekend of February 19, 2021",If PLTR goes back to 35 next week Iâ€™ll suck my own dick,02-19-2021,platyui,457.0,if pltr goes back to 35 next week ill suck my own dick,negative,0.93880564,,,14,14_25_30_38_break,2021-02-19
10495,"Weekend Discussion Thread for the Weekend of February 12, 2021",# bears anally gapped and their balls are squeezed and they have smol pp,02-15-2021,nosalute,21.0,bears anally gapped and their balls are squeezed and they have smol pp,neutral,0.60606897,,,-1,-1_spce_000_price_bags,2021-02-15
12498,"Weekend Discussion Thread for the Weekend of February 19, 2021",Everything that will ever happen is priced in,02-21-2021,re--it,13.0,everything that will ever happen is priced in,neutral,0.63216436,,,1,1_priced_sale_discount_price,2021-02-21
7389,"Daily Discussion Thread for February 01, 2021",Ok so the best I could do today is 1 gme share and 10 AMC smh at least itâ€™s something,02-01-2021,OliveGardenSalad,51.0,ok so the best i could do today is 1 gme share and 10 amc smh at least its something,neutral,0.4906625,,gme,-1,-1_spce_000_price_bags,2021-02-01
9487,"Daily Discussion Thread for February 11, 2021",Was down like $700 this morning so I figured Iâ€™d throw like $10k into a swing trade for a quick return but now Iâ€™m down $5k fml,02-11-2021,pnutbutterbaconsammy,60.0,was down like 700 this morning so i figured id throw like 10k into a swing trade for a quick return but now im down 5k fml,neutral,0.5079364,,,-1,-1_spce_000_price_bags,2021-02-11
14585,"Daily Discussion Thread for February 26, 2021","They said $gme is too risky a gamble, well $gme is the only green in my portfolio wtf! Fuck you HFs!",02-26-2021,JackMaster762,10.0,they said gme is too risky a gamble well gme is the only green in my portfolio wtf fuck you hfs,negative,0.8424867,,gme,301,301_hopeshigh_keeping_265_gamble,2021-02-26
8242,"Daily Discussion Thread for February 03, 2021","im holding 5 GME, 10 AMC, 5 BB and 1 Nok... i dont have much money and so got what i could but im holding, if i loose it then i loose it. if i win then its bonus, good luck everyone",02-03-2021,CraigC90,51.0,im holding 5 gme 10 amc 5 bb and 1 nok i dont have much money and so got what i could but im holding if i loose it then i loose it if i win then its bonus good luck everyone,positive,0.555185,,gme,-1,-1_spce_000_price_bags,2021-02-03
12888,"Daily Discussion Thread for February 22, 2021","I love you PLTR
Will you marry me",02-22-2021,wonderbrah419,27.0,i love you pltr will you marry me,positive,0.934386,,,-1,-1_spce_000_price_bags,2021-02-22
14339,"Daily Discussion Thread for February 26, 2021",AMC ğŸš€ğŸš€,02-26-2021,RealEcho7245,19.0,amc,neutral,0.5357781,,amc,77,77_hodl_aboard_iamholding_hoooold,2021-02-26
11301,"Daily Discussion Thread for February 16, 2021","Itâ€™s not about earning money, itâ€™s about how to lose less money",02-16-2021,KeDoBro,13.0,its not about earning money its about how to lose less money,neutral,0.54296166,,,28,28_losing_lose_lost_losses,2021-02-16
12653,"Daily Discussion Thread for February 22, 2021",Grabbed 200 shares of PLTR. I'm just going to hold it....,02-22-2021,mugzy442,18.0,grabbed 200 shares of pltr im just going to hold it,neutral,0.83577555,,bb,36,36_700_900_800_690,2021-02-22
12062,"Daily Discussion Thread for February 19, 2021",OH MY GOD I SOLD 1 SECOND BEFORE THE HAULT AT $56 A SHARE,02-19-2021,billiam153,15.0,oh my god i sold 1 second before the hault at 56 a share,negative,0.4853962,,,-1,-1_spce_000_price_bags,2021-02-19
14381,"Daily Discussion Thread for February 26, 2021","It's over, down $20K this week!",02-26-2021,Frenchangeles,14.0,its over down 20k this week,neutral,0.7818801,,,40,40_5k_20k_30k_3k,2021-02-26
11229,"Daily Discussion Thread for February 16, 2021","Stand back and watch me buy these tops, bois.",02-16-2021,Slave_to_the_bets,14.0,stand back and watch me buy these tops bois,neutral,0.7637649,,,143,143_bottom_top_tops_naughty,2021-02-16
9719,"Daily Discussion Thread for February 11, 2021",Are day traders playing Fibonacci shit games? Let it go to SNDL ğŸš€ğŸ˜,02-11-2021,drjj79,22.0,are day traders playing fibonacci shit games let it go to sndl,negative,0.8909146,,,61,61_trade_trades_trading_trader,2021-02-11
7352,"Daily Discussion Thread for February 01, 2021",Jumped in AMC with 1k shares. Let's go !,02-01-2021,KevlarAbs,707.0,jumped in amc with 1k shares lets go,neutral,0.720721,,amc,106,106_clne_million_shares_share,2021-02-01
10518,"Weekend Discussion Thread for the Weekend of February 12, 2021",The world went to hell when Craigslist removed the personals section. Prove me wrong.,02-14-2021,Head_Paleontologist,20.0,the world went to hell when craigslist removed the personals section prove me wrong,negative,0.94565636,,,298,298_hookers_escorts_craigslist_encounters,2021-02-14
8213,"Daily Discussion Thread for February 03, 2021","A lot of restricted brokerages across the world seem to be lifting restrictions and allowing free reign again , this is going to be so exciting **AFTER A BIT OF TECHNICAL DIFFICULTIES, ROCKET ROUTE IS BACK ON TRACK**",02-03-2021,Inside_Valuable_8424,57.0,a lot of restricted brokerages across the world seem to be lifting restrictions and allowing free reign again this is going to be so exciting after a bit of technical difficulties rocket route is back on track,positive,0.9438971,,,114,114_brokerage_broker_apps_brokers,2021-02-03
9181,"Daily Discussion Thread for February 10, 2021",SNDL TAKE OFF,02-10-2021,The_Alpacas,34.0,sndl take off,neutral,0.8420647,,,26,26_sndl_appl_trending_tlry,2021-02-10
14117,"Daily Discussion Thread for February 25, 2021","okay who bought gme at the top, again

