,Submission Title,Comment,Date Posted,Author,Score,ProcessedComments,SentimentLabel,SentimentProb,HumanSentiment,StockSearch,Topic,Name,Date
86154,"Daily Discussion Thread for October 01, 2021",And that’s what I get betting against America.,10-01-2021,therealneurovis,9.0,and thats what i get betting against america,negative,0.72507906,,,262,262_betting_sports_against_bet,2021-10-01
94342,"Weekend Discussion Thread for the Weekend of October 22, 2021",Thank god dwac didn’t have options,10-23-2021,jared153,6.0,thank god dwac didnt have options,neutral,0.447025,,,177,177_dwac_trump_bailed_halt,2021-10-23
93631,"Daily Discussion Thread for October 22, 2021",I’ve never lost so much so fast,10-22-2021,gtastar1,28.0,ive never lost so much so fast,negative,0.71219367,,,28,28_losing_lose_lost_losses,2021-10-22
92683,"Daily Discussion Thread for October 19, 2021",TLRY my goodness,10-19-2021,dvdr1029,8.0,tlry my goodness,neutral,0.5555572,,,31,31_tlry_moving_awakens_tlghey,2021-10-19
92844,"Daily Discussion Thread for October 20, 2021",Last time to buy $WISH under $6 for the year,10-20-2021,kk7766,10.0,last time to buy wish under 6 for the year,neutral,0.88653207,,,1,1_priced_sale_discount_price,2021-10-20
93142,"Daily Discussion Thread for October 20, 2021",Bought some tilray calls cus I’m a fkn retard,10-20-2021,BarackObonga320,8.0,bought some tilray calls cus im a fkn retard,negative,0.8908123,,,122,122_tilray_tilly_tilrays_tilrayyyy,2021-10-20
87826,"Daily Discussion Thread for October 06, 2021",Unemployment numbers should be going back down after today lmao,10-06-2021,HowLongCanIMakeACock,9.0,unemployment numbers should be going back down after today lmao,neutral,0.5643447,,,18,18_jobs_unemployment_boss_jobless,2021-10-06
89991,"Daily Discussion Thread for October 12, 2021",I am only 10 years old and I make more money then your dad,10-12-2021,AAPLx4,9.0,i am only 10 years old and i make more money then your dad,neutral,0.43509707,,,195,195_dad_mom_fathers_father,2021-10-12
87425,"Daily Discussion Thread for October 05, 2021",Crazy how they find that 1:1 buy/sell ratio for hours,10-05-2021,Dmillehee,9.0,crazy how they find that 1 1 buy sell ratio for hours,neutral,0.6537211,,,-1,-1_spce_000_price_bags,2021-10-05
89766,"Daily Discussion Thread for October 11, 2021",FUTES not looking great,10-11-2021,Greg_Virandes,5.0,futes not looking great,negative,0.93337005,,,248,248_fubo_futes_matter_fuboooooo,2021-10-11
89034,"Weekend Discussion Thread for the Weekend of October 08, 2021",Wow ok I just learned sucking dick makes you gay after the first attempt? I thought it was a 3 strike system 🧐,10-09-2021,Hl_IM_MR_MEESEEKS,17.0,wow ok i just learned sucking dick makes you gay after the first attempt i thought it was a 3 strike system,negative,0.8826564,,stem,158,158_penis_dick_cock_enlargement,2021-10-09
93686,"Daily Discussion Thread for October 22, 2021",OPEN THE FUKING CASINO! TURN THE DAMN PRINTERS ON!,10-22-2021,B1gChuckDaddySr,17.0,open the fuking casino turn the damn printers on,negative,0.9673612,,,247,247_printer_printers_jpow_jpows,2021-10-22
86879,"Daily Discussion Thread for October 04, 2021","This is an absolute slaughter, holy fuck",10-04-2021,Unhealing,12.0,this is an absolute slaughter holy fuck,negative,0.97705656,,,-1,-1_spce_000_price_bags,2021-10-04
88418,"Daily Discussion Thread for October 07, 2021",I switched to calls at the right time! LFG HOW HIGH WE GOING BOYS $Spy,10-07-2021,Valuable-Ad7006,8.0,i switched to calls at the right time lfg how high we going boys spy,positive,0.65311754,,,0,0_expire_expiring_call_expired,2021-10-07
90725,"Daily Discussion Thread for October 14, 2021",Paper handed SPY calls yesterday…,10-14-2021,Plechazunga_,11.0,paper handed spy calls yesterday,neutral,0.71811527,,,-1,-1_spce_000_price_bags,2021-10-14
94299,"Weekend Discussion Thread for the Weekend of October 22, 2021",GUYS I just became bamboozled. How many ANAL GoDs are there?!,10-22-2021,Axwe8,6.0,guys i just became bamboozled how many anal gods are there,neutral,0.50375456,,,-1,-1_spce_000_price_bags,2021-10-22
86953,"Daily Discussion Thread for October 04, 2021",Hey the good news is that once we've all lost our shirts we can start helping with the labour shortage. I for one  be starting a career in waste management.,10-04-2021,Oenones,9.0,hey the good news is that once weve all lost our shirts we can start helping with the labour shortage i for one be starting a career in waste management,positive,0.73299634,,,-1,-1_spce_000_price_bags,2021-10-04
86996,"Daily Discussion Thread for October 04, 2021",I've been studying the chart all morning and it looks like we'll open at 9:30.,10-04-2021,Gardenho1,43.0,ive been studying the chart all morning and it looks like well open at 9 30,neutral,0.6683816,,,446,446_1930_dropping_45c_drum,2021-10-04
92036,"Daily Discussion Thread for October 18, 2021","Ya boi's ban bet just printed!!!

COIN 295

Suck on my pp Visualmod",10-18-2021,quarantrader,7.0,ya bois ban bet just printed coin 295 suck on my pp visualmod,negative,0.8723239,,,198,198_ban_banned_unbanned_banbets,2021-10-18
93660,"Daily Discussion Thread for October 22, 2021",🥭 broke the stonk market,10-22-2021,RKTman40,20.0,broke the stonk market,negative,0.552126,,,115,115_stonks_stonk_boots_winter,2021-10-22
87712,"Daily Discussion Thread for October 06, 2021",Rigged market.  All moves happen in premarket when you cant trade then get thetad rest of the day,10-06-2021,EuphoricWizard,16.0,rigged market all moves happen in premarket when you cant trade then get thetad rest of the day,neutral,0.58699435,,,384,384_rigged_game_yahoo_makers,2021-10-06
89808,"Daily Discussion Thread for October 12, 2021",Can the market go up I need to feed my family 😩,10-12-2021,astupidrussian,17.0,can the market go up i need to feed my family,neutral,0.6094366,,,-1,-1_spce_000_price_bags,2021-10-12
86288,"Daily Discussion Thread for October 01, 2021","Futes broke north out of the range we've been stuck in since 9pm

Bears are fucked",10-01-2021,LovableContrarian,7.0,futes broke north out of the range weve been stuck in since 9pm bears are fucked,negative,0.9322563,,,53,53_bears_fuk_fukin_fukd,2021-10-01
88772,"Daily Discussion Thread for October 08, 2021","You guys are retarded AF.

Market doesn’t make sense, technicals are for autists.

Spy to tha 🌙 🚀🚀🚀🚀",10-08-2021,theCramps,8.0,you guys are retarded af market doesnt make sense technicals are for autists spy to tha,negative,0.96121085,,,173,173_autism_autists_autist_autistic,2021-10-08
89651,"Daily Discussion Thread for October 11, 2021","Rivian IPO and earnings at EOM for $F

Jan 15 calls loaded to the tits",10-11-2021,dufusmembrane,8.0,rivian ipo and earnings at eom for f jan 15 calls loaded to the tits,neutral,0.6277806,,,-1,-1_spce_000_price_bags,2021-10-11
88813,"Daily Discussion Thread for October 08, 2021",SPY literally not moving,10-08-2021,aavila1398,9.0,spy literally not moving,negative,0.6847491,,,5,5_forming_spys_pattern_sideways,2021-10-08
92110,"Daily Discussion Thread for October 18, 2021",I'm unfortunately selling all my SPCE shares and buying puts today. I'll probably buy back in when it hits $14-15/share,10-18-2021,Donlorenzo_23,7.0,im unfortunately selling all my spce shares and buying puts today ill probably buy back in when it hits 14 15 share,neutral,0.53606683,,,-1,-1_spce_000_price_bags,2021-10-18
92665,"Daily Discussion Thread for October 19, 2021",BB. Goes Brrrrrr,10-19-2021,Im_Old_In_Town,9.0,bb goes brrrrrr,neutral,0.72030854,,bb,-1,-1_spce_000_price_bags,2021-10-19
91881,"Daily Discussion Thread for October 18, 2021",i get very opinionated on Reddit when avoiding doing work,10-18-2021,partially__derived,12.0,i get very opinionated on reddit when avoiding doing work,neutral,0.5755202,,nio,18,18_jobs_unemployment_boss_jobless,2021-10-18
92943,"Daily Discussion Thread for October 20, 2021",Rotation into deez nuts,10-20-2021,erfarr,8.0,rotation into deez nuts,neutral,0.7070428,,,288,288_dnut_nuts_krispy_nut,2021-10-20
89079,"Weekend Discussion Thread for the Weekend of October 08, 2021",Pretty dumb how the market doesn’t have a return policy 🙄,10-08-2021,apolloandbackk,11.0,pretty dumb how the market doesnt have a return policy,negative,0.8239435,,,52,52_retarded_retard_retards_iq,2021-10-08
91089,"Daily Discussion Thread for October 15, 2021","The bears existence relies entirely on the bulls decision to take profits

Bottom feeders and retards",10-15-2021,Steaklegend,16.0,the bears existence relies entirely on the bulls decision to take profits bottom feeders and retards,neutral,0.60423344,,,42,42_bulls_bull_bears_bear,2021-10-15
93697,"Daily Discussion Thread for October 22, 2021",Very legal very cool,10-22-2021,realister,16.0,very legal very cool,positive,0.9710538,,,-1,-1_spce_000_price_bags,2021-10-22
91433,"Daily Discussion Thread for October 15, 2021",bought 4 447c’s expiring monday because I support bulls 😎,10-15-2021,HeyMyNameIsDylan,8.0,bought 4 447cs expiring monday because i support bulls,positive,0.55270153,,,-1,-1_spce_000_price_bags,2021-10-15
87082,"Daily Discussion Thread for October 04, 2021",Wtf i cant look at ig thots today???,10-04-2021,papichuloya,9.0,wtf i cant look at ig thots today,negative,0.9403616,,,494,494_tiktok_tik_tok_thots,2021-10-04
86272,"Daily Discussion Thread for October 01, 2021",Has wish had a single green day in the past 30 days?,10-01-2021,Muted_Idea,8.0,has wish had a single green day in the past 30 days,neutral,0.6650913,,,178,178_reddest_plums_happier_singles,2021-10-01
87105,"Daily Discussion Thread for October 04, 2021",Thinking of throwing some money on CGC at 52 weeks low or perhaps TLRY,10-04-2021,LengthExact,7.0,thinking of throwing some money on cgc at 52 weeks low or perhaps tlry,neutral,0.84734267,,,-1,-1_spce_000_price_bags,2021-10-04
87210,"Daily Discussion Thread for October 04, 2021","Tesla still green baby 

Elon>Zuckerfuck",10-04-2021,wouldntknowever,7.0,tesla still green baby elon zuckerfuck,negative,0.8940927,,tesla,-1,-1_spce_000_price_bags,2021-10-04
90047,"Daily Discussion Thread for October 12, 2021",bull trap. bear trap. everyone's trapped. trap house.,10-12-2021,Historical-Egg3243,6.0,bull trap bear trap everyones trapped trap house,neutral,0.57129234,,,90,90_trap_bull_bear_traps,2021-10-12
91698,"Weekend Discussion Thread for the Weekend of October 15, 2021","Woke up this morning

Smiled at the rising sun

Three little birds

Perched by my doorstep

Singing sweet songs

A melody pure and true

Singing, ""I want to fly like an eagle""",10-17-2021,PlsDontNuke,8.0,woke up this morning smiled at the rising sun three little birds perched by my doorstep singing sweet songs a melody pure and true singing i want to fly like an eagle,positive,0.9698104,,,116,116_goodnight_wake_slept_woke,2021-10-17
87889,"Daily Discussion Thread for October 06, 2021",Something is telling me to hold on to my 428 spy puts till at least 12 and another thought is telling me to sell at open because spy is going tits up ..... arrrrgh I don't know and I only have 20min to figure It out lmaoooo,10-06-2021,Valuable-Ad7006,10.0,something is telling me to hold on to my 428 spy puts till at least 12 and another thought is telling me to sell at open because spy is going tits up arrrrgh i dont know and i only have 20min to figure it out lmaoooo,negative,0.5199176,,,9,9_0dte_sold_expiring_loss,2021-10-06
94238,"Weekend Discussion Thread for the Weekend of October 22, 2021",I'm up reeee,10-23-2021,zjz,7.0,im up reeee,neutral,0.5448655,,,-1,-1_spce_000_price_bags,2021-10-23
90352,"Daily Discussion Thread for October 13, 2021","I love that you can now say ""Banbet or gtfo"" to the people that come in here and make wild predictions with no reasoning",10-13-2021,Skilledthunder,9.0,i love that you can now say banbet or gtfo to the people that come in here and make wild predictions with no reasoning,positive,0.5691755,,,198,198_ban_banned_unbanned_banbets,2021-10-13
92081,"Daily Discussion Thread for October 18, 2021",All-time closing high was $883.09 for $TSLA. Let's beat that fellow TSLAtards 🚀🚀🚀,10-18-2021,AlmightySnoo,9.0,all time closing high was 883 09 for tsla lets beat that fellow tslatards,neutral,0.6797118,,tsla,36,36_700_900_800_690,2021-10-18
86824,"Daily Discussion Thread for October 04, 2021",Imagine not being fuk,10-04-2021,BagSelect,19.0,imagine not being fuk,negative,0.65037537,,,53,53_bears_fuk_fukin_fukd,2021-10-04
90736,"Daily Discussion Thread for October 14, 2021",Inflation is literally not real if your country is a super power lmao.,10-14-2021,rumblegod,12.0,inflation is literally not real if your country is a super power lmao,negative,0.6123714,,,54,54_inflation_cpi_prices_higher,2021-10-14
86927,"Daily Discussion Thread for October 04, 2021",FACEBOOK DATA BREACH. DUMP IT,10-04-2021,Warren24h,11.0,facebook data breach dump it,negative,0.806825,,facebook,118,118_facebook_fb_whistleblower_zuckerberg,2021-10-04
85988,"Daily Discussion Thread for October 01, 2021",Perhaps it’s not a bull trap or bear trap but it’s always just a degenerate trap,10-01-2021,Geeeyoooo,26.0,perhaps its not a bull trap or bear trap but its always just a degenerate trap,negative,0.8037908,,,90,90_trap_bull_bear_traps,2021-10-01
86789,"Weekend Discussion Thread for the Weekend of October 01, 2021","So there I was getting my cheeks clapped, when all of a sudden, a random man appeared in the open window and screamed ""SLAP THAT ASK"" 👋💥",10-02-2021,fortytree,7.0,so there i was getting my cheeks clapped when all of a sudden a random man appeared in the open window and screamed slap that ask,neutral,0.5496858,,,362,362_clapped_clappening_clapping_fcked,2021-10-02
89713,"Daily Discussion Thread for October 11, 2021",Bulls eating water soup with a side of cock today,10-11-2021,G234567891,6.0,bulls eating water soup with a side of cock today,negative,0.80676246,,,-1,-1_spce_000_price_bags,2021-10-11
93712,"Daily Discussion Thread for October 22, 2021",DWAC is my new term for masturbation.,10-22-2021,D-s-DOG,17.0,dwac is my new term for masturbation,neutral,0.60879314,,,177,177_dwac_trump_bailed_halt,2021-10-22
92704,"Daily Discussion Thread for October 20, 2021","*Surgeons Attached a Pig Kidney to a Human — and It Worked*

I for one welcome our new Pigmen overlords",10-20-2021,GoBeaversOSU,26.0,surgeons attached a pig kidney to a human and it worked i for one welcome our new pigmen overlords,positive,0.90537006,,gme,-1,-1_spce_000_price_bags,2021-10-20
88580,"Daily Discussion Thread for October 08, 2021",Everyday i feel more and more like a sucker for holding a job,10-08-2021,BigBlackAssEater,18.0,everyday i feel more and more like a sucker for holding a job,negative,0.95212823,,,18,18_jobs_unemployment_boss_jobless,2021-10-08
89263,"Weekend Discussion Thread for the Weekend of October 08, 2021","Yeah I'm so clever, I listen to a random guy's DD on Reddit and then lose money on TLRY earnings",10-08-2021,FGNE1282,9.0,yeah im so clever i listen to a random guys dd on reddit and then lose money on tlry earnings,positive,0.5605086,,,197,197_dd_dds_automod_read,2021-10-08
87881,"Daily Discussion Thread for October 06, 2021",Am I seriously gonna have to buy puts to force my calls to make money…,10-06-2021,OSRSkarma,9.0,am i seriously gonna have to buy puts to force my calls to make money,negative,0.7102435,,,107,107_inverse_buys_switch_lose,2021-10-06
88819,"Daily Discussion Thread for October 08, 2021",Well looks like the boomers collected all my premiums this week again,10-08-2021,paultall23,8.0,well looks like the boomers collected all my premiums this week again,neutral,0.48506108,,,139,139_boomers_boomer_millenials_401k,2021-10-08
93599,"Daily Discussion Thread for October 21, 2021",Tesla to the mother freaking moon!,10-21-2021,RichBat4,8.0,tesla to the mother freaking moon,negative,0.5984877,,tesla,-1,-1_spce_000_price_bags,2021-10-21
91440,"Daily Discussion Thread for October 15, 2021",My girlfriend is mad at me and the only thing fking me is the stock market... business as usual,10-15-2021,rawrdawg6,8.0,my girlfriend is mad at me and the only thing fking me is the stock market business as usual,negative,0.9526675,,,23,23_wife_tinder_married_girlfriend,2021-10-15
87144,"Daily Discussion Thread for October 04, 2021",CAPTAIN POWELL WERE TAKIN ON WATER,10-04-2021,tendeeznuts,7.0,captain powell were takin on water,neutral,0.8449069,,,129,129_powell_powells_sip_banking,2021-10-04
86703,"Weekend Discussion Thread for the Weekend of October 01, 2021",Since pee is stored in the balls what would happen if I get them removed 🤔,10-02-2021,Hl_IM_MR_MEESEEKS,8.0,since pee is stored in the balls what would happen if i get them removed,negative,0.50879955,,,-1,-1_spce_000_price_bags,2021-10-02
90154,"Daily Discussion Thread for October 12, 2021",SPY is just like my cat Spy. Just wondering around without a direction.,10-12-2021,Dans2016,6.0,spy is just like my cat spy just wondering around without a direction,negative,0.57716256,,,5,5_forming_spys_pattern_sideways,2021-10-12
90548,"Daily Discussion Thread for October 13, 2021","Fellow BBagholders, is today the day?",10-13-2021,Stonk_Boomer,7.0,fellow bbagholders is today the day,neutral,0.70766234,,bb,-1,-1_spce_000_price_bags,2021-10-13
90899,"Daily Discussion Thread for October 14, 2021","Who would have thought that the day Crammer supports SoFI, the ride would abruptly stop...",10-14-2021,IHaveAllTheWheat,9.0,who would have thought that the day crammer supports sofi the ride would abruptly stop,negative,0.5132397,,,30,30_sofi_fa_charter_sos,2021-10-14
93805,"Daily Discussion Thread for October 22, 2021",Holy fucking shit. 460 by noon,10-22-2021,AxemanFromMA,13.0,holy fucking shit 460 by noon,negative,0.83126354,,,6,6_440_445_444_453,2021-10-22
87408,"Daily Discussion Thread for October 05, 2021","Oh boy Robinhood phone lines are up. Time to call and ask about refunds. 

You guys know how it is when your toddler gets a hold of your phone and just clicks buttons to see what happens right? That little bugger YOLOed it all on SPY 450s for this week a month ago and I just caught it. Kids amiright? Hello? Hello?",10-05-2021,Captain_Yolo_,10.0,oh boy robinhood phone lines are up time to call and ask about refunds you guys know how it is when your toddler gets a hold of your phone and just clicks buttons to see what happens right that little bugger yoloed it all on spy 450s for this week a month ago and i just caught it kids amiright hello hello,negative,0.6710015,,robinhood,0,0_expire_expiring_call_expired,2021-10-05
92317,"Daily Discussion Thread for October 19, 2021",Oh there you are TLRY!,10-19-2021,ehsteve12,17.0,oh there you are tlry,neutral,0.56138563,,,31,31_tlry_moving_awakens_tlghey,2021-10-19
93646,"Daily Discussion Thread for October 22, 2021",If COST hits $480 today I'm taking my kids on a cruise for Xmas,10-22-2021,ClaimsForFame,20.0,if cost hits 480 today im taking my kids on a cruise for xmas,neutral,0.69901663,,,-1,-1_spce_000_price_bags,2021-10-22
90237,"Daily Discussion Thread for October 13, 2021","Reminder to always take profit, don’t be too greedy. Although Loss Porn gets me all jacked up with boner, I don’t wanna see none of you become bag holders like *cough* WisHtArDs *cough*",10-13-2021,UnknownNo0722,13.0,reminder to always take profit dont be too greedy although loss porn gets me all jacked up with boner i dont wanna see none of you become bag holders like cough wishtards cough,negative,0.9170138,,,74,74_porn_pornhub_content_hentai,2021-10-13
89625,"Daily Discussion Thread for October 11, 2021","late at night when allll the bers 

are sleeeping

i stay up and think of you, (FB 355)",10-11-2021,imsilver4fukyou,8.0,late at night when allll the bers are sleeeping i stay up and think of you fb 355,neutral,0.7697946,,,-1,-1_spce_000_price_bags,2021-10-11
89788,"Daily Discussion Thread for October 12, 2021",Imagine staying up all night watching futures when people who sleep until 9 still get to see the only numbers that matter.,10-12-2021,PorkchopSquats,26.0,imagine staying up all night watching futures when people who sleep until 9 still get to see the only numbers that matter,neutral,0.6373421,,,-1,-1_spce_000_price_bags,2021-10-12
90092,"Daily Discussion Thread for October 12, 2021",I'm retired from options. In the poor way,10-12-2021,quarantrader,6.0,im retired from options in the poor way,negative,0.8454786,,,-1,-1_spce_000_price_bags,2021-10-12
87851,"Daily Discussion Thread for October 06, 2021",Imaginary coins carrying me hard af right now.,10-06-2021,ThatMajesticGuy24,11.0,imaginary coins carrying me hard af right now,neutral,0.524904,,,138,138_coin_coins_400_420,2021-10-06
91099,"Daily Discussion Thread for October 15, 2021",Daily reminder that Jim Cramer called the top in oil 3 days ago and it has done nothing but go up since,10-15-2021,coastalpika,45.0,daily reminder that jim cramer called the top in oil 3 days ago and it has done nothing but go up since,neutral,0.5512304,,,-1,-1_spce_000_price_bags,2021-10-15
88792,"Daily Discussion Thread for October 08, 2021",What the hell is going on. Pick one direction,10-08-2021,DesperateCommand655,7.0,what the hell is going on pick one direction,negative,0.88172126,,,-1,-1_spce_000_price_bags,2021-10-08
89741,"Daily Discussion Thread for October 11, 2021","#""GET YOUR HALF OFF SPY CALLS OVER HERE! RIGHT OVER HERE, PLENTY FOR EVERYBODY!""",10-11-2021,Leon2274,7.0,get your half off spy calls over here right over here plenty for everybody,neutral,0.6621946,,,0,0_expire_expiring_call_expired,2021-10-11
88565,"Daily Discussion Thread for October 08, 2021",Which one of you fucks is saying markets are closed Monday? You’re stressing me out,10-08-2021,Impossible_Job_4547,21.0,which one of you fucks is saying markets are closed monday youre stressing me out,negative,0.97169995,,,43,43_closed_opens_opening_monday,2021-10-08
90535,"Daily Discussion Thread for October 13, 2021",It’s extraterrestrial 👽 not alien you insensitive dunce,10-13-2021,TFrank28,7.0,its extraterrestrial not alien you insensitive dunce,negative,0.86241263,,,343,343_aliens_ufo_alien_ufos,2021-10-13
89608,"Daily Discussion Thread for October 11, 2021",Market chose violence today against the bears.,10-11-2021,ThatMajesticGuy24,8.0,market chose violence today against the bears,negative,0.7393699,,,217,217_fighting_morale_beatings_violence,2021-10-11
86136,"Daily Discussion Thread for October 01, 2021",Is $420 a thing today?,10-01-2021,picciona4,10.0,is 420 a thing today,neutral,0.8484005,,,174,174_420_420s_420c_fulfilled,2021-10-01
87264,"Daily Discussion Thread for October 05, 2021",My updated portfolio breakeven point is bankruptcy.,10-05-2021,talm0,16.0,my updated portfolio breakeven point is bankruptcy,neutral,0.7243444,,,7,7_portfolio_portfolios_ruin_bleed,2021-10-05
93946,"Daily Discussion Thread for October 22, 2021",Today has destroyed my portfolio. Kids are crying now. Thanks.,10-22-2021,Plane-Cheesecake-221,12.0,today has destroyed my portfolio kids are crying now thanks,negative,0.9759574,,,7,7_portfolio_portfolios_ruin_bleed,2021-10-22
92550,"Daily Discussion Thread for October 19, 2021","\*Looks at portfolio\* 

&#x200B;

\*sighs\*

&#x200B;

![img](emote|t5_2th52|4266)![img](emote|t5_2th52|4267)",10-19-2021,krismasstercant,12.0,looks at portfolio x200b sighs x200b img emote t5_2th52 4266 img emote t5_2th52 4267,neutral,0.7655726,,,70,70_t52th52_emote_4260_4266,2021-10-19
86826,"Daily Discussion Thread for October 04, 2021",Am I the only one who doesn’t have fb installed on their phone? I dont even use the web app,10-04-2021,lalalaamerica,17.0,am i the only one who doesnt have fb installed on their phone i dont even use the web app,negative,0.62408745,,,118,118_facebook_fb_whistleblower_zuckerberg,2021-10-04
91471,"Weekend Discussion Thread for the Weekend of October 15, 2021",lmao the $300 I threw at the scam coin as a goof is now my largest percentage return.,10-16-2021,realister,24.0,lmao the 300 i threw at the scam coin as a goof is now my largest percentage return,neutral,0.5513966,,,-1,-1_spce_000_price_bags,2021-10-16
93098,"Daily Discussion Thread for October 20, 2021",i always take the contrarian route even though it never pays off because i think im smart. needless to say im a fucking retard and never had any meaningful wins. why the fuck am i the way that i am,10-20-2021,whiskytangofoxtrot08,8.0,i always take the contrarian route even though it never pays off because i think im smart needless to say im a fucking retard and never had any meaningful wins why the fuck am i the way that i am,negative,0.9660802,,,52,52_retarded_retard_retards_iq,2021-10-20
93279,"Daily Discussion Thread for October 21, 2021",Wtf was that at the end. Tomorrow’s gonna be mangos,10-21-2021,LettuceSpirited,38.0,wtf was that at the end tomorrows gonna be mangos,neutral,0.58309525,,,218,218_mango_mangos_fruit_ceos,2021-10-21
91295,"Daily Discussion Thread for October 15, 2021","I bought 442, 443, 445 SPY calls yesterday morning and omg what a blessing that was!",10-15-2021,Gainz4thenight,9.0,i bought 442 443 445 spy calls yesterday morning and omg what a blessing that was,positive,0.97902924,,,-1,-1_spce_000_price_bags,2021-10-15
87906,"Daily Discussion Thread for October 06, 2021",Ah yes this looks like the classic crack pipe formation,10-06-2021,Visible-Knowledge-98,9.0,ah yes this looks like the classic crack pipe formation,positive,0.6433808,,,-1,-1_spce_000_price_bags,2021-10-06
92330,"Daily Discussion Thread for October 19, 2021","Just bought 100 more bb, 350 total shares im in it for the long run 🚀🚀",10-19-2021,jxsh_alexander,16.0,just bought 100 more bb 350 total shares im in it for the long run,positive,0.6657315,,bb,92,92_shares_200_share_500,2021-10-19
91701,"Weekend Discussion Thread for the Weekend of October 15, 2021",Watching third tier American soccer. Wendy's is a sponsor. Bullish. Calls on $SPY,10-17-2021,Either-Antelope-4330,8.0,watching third tier american soccer wendys is a sponsor bullish calls on spy,neutral,0.78670454,,,-1,-1_spce_000_price_bags,2021-10-17
89314,"Weekend Discussion Thread for the Weekend of October 08, 2021",⠄⠄⠄⠄⠄⠄⠄⠄⠄⠄⠄⠄⠄⢀⣀⣀⣀⣀⡀⠄⠄⠄⠄⠄⠄⠄⠄⠄⠄⠄⠄⠄ ⠄⠄⠄⠄⠄⠄⠄⢀⣤⣶⠶⠛⠋⠉⠉⠉⠉⠉⠉⠙⠛⠳⠶⣤⣀⠄⠄⠄⠄⠄⠄⠄ ⠄⠄⠄⠄⠄⣠⣾⠟⠁⠄⠄⠄⠄⠄⠄⠄⠄⠄⠄⠄⠄⠄⠄⠄⠉⠛⣦⠄⠄⠄⠄⠄ ⠄⠄⠄⢀⣼⠟⠄⠄⠄⠄⠄⠄⠄⠄⣀⣀⡀⠄⠄⠄⠄⠄⠄⠄⣀⣤⣈⡳⡄⠄⠄⠄ ⠄⠄⢠⡾⠃⠄⠄⠄⠄⠄⠄⠠⣴⡾⠛⠉⠉⠂⠄⠄⠄⠄⠄⠄⠄⠄⠙⢀⡹⣆⠄⠄ ⠄⠄⡿⠃⠄⠄⠄⠄⠄⠄⠄⠄⠄⠄⠄⠄⠄⠄⠄⠄⠄⠄⠈⠉⢿⡿⠄⠄⠈⢻⡀⠄ ⠄⢸⠇⠄⠄⠄⠄⠄⠄⠄⠄⠄⠄⠄⠄⠄⡀⠄⢠⠄⠄⠄⠄⠄⠄⡇⠄⠄⠰⢎⡇⠄ ⠄⣼⠄⠄⠄⠄⠄⠄⠄⠄⠄⠄⠄⠄⠄⡈⠉⠄⡄⠄⠄⢀⣀⣤⣾⣧⣤⣄⣥⡾⣿⠄ ⠄⢸⠄⠄⠄⠄⠄⠄⠄⠄⠄⠄⠄⠄⠄⠈⠙⠶⠶⠶⠿⠟⠉⠁⠄⠄⠈⡹⠁⠄⣿⠄ ⠄⠈⢇⠄⠄⠄⠄⠄⠄⠄⠄⠄⠄⠄⠄⠄⠄⠄⠄⠄⠄⠄⠄⠄⠄⠄⠄⠄⠄⢠⠇⠄ ⠄⠄⠈⠑⠄⠄⠄⠄⠄⠄⠄⠄⠄⠄⠄⠄⠄⠄⠄⠄⠄⠄⠄⠄⠄⠄⠄⢀⡴⠏⠄⠄ ⠄⠄⠄⠄⠄⠄⠄⡀⠄⠄⠄⠄⠄⠄⠄⠄⠄⠄⠄⠄⠄⠄⠄⠄⠄⣀⣤⠟⠄⠄⠄⠄ ⠄⠄⠄⠄⠄⠄⠄⠄⠁⠒⠄⠤⠄⢀⣀⣀⣀⣀⣀⣤⣤⡤⠶⠞⠛⠉⠄⠄⠄⠄⠄⠄ ⠄⠄⠄⠄⠄⠄⠄⠄⠄⠄⠄⠄⠄⠄⠄⠄⠄⠄⠄⠄⠄⠄⠄⠄⠄⠄⠄⠄⠄⠄⠄⠄⠀⠀⠀,10-10-2021,jsie-iaiqhsi816278,8.0,,neutral,0.45127246,,,79,79_uh_psth_yep_gimme,2021-10-10
86671,"Weekend Discussion Thread for the Weekend of October 01, 2021",Even steel gang is not having a good time. Good thing inflation isnt real.,10-02-2021,giovanny2214,8.0,even steel gang is not having a good time good thing inflation isnt real,negative,0.63815737,,,-1,-1_spce_000_price_bags,2021-10-02
93779,"Daily Discussion Thread for October 22, 2021","If you invested $10,000 in $IBM 10 years ago, you would have $6,826 today 😐",10-22-2021,Minotaur04,43.0,if you invested 10 000 in ibm 10 years ago you would have 6 826 today,neutral,0.7978086,,,-1,-1_spce_000_price_bags,2021-10-22
91536,"Weekend Discussion Thread for the Weekend of October 15, 2021","Asked a girl if she wanted to have dinner with me at the club, bitch left when we rolled up to sams",10-16-2021,650KLR,10.0,asked a girl if she wanted to have dinner with me at the club bitch left when we rolled up to sams,neutral,0.6842697,,,23,23_wife_tinder_married_girlfriend,2021-10-16
94317,"Weekend Discussion Thread for the Weekend of October 22, 2021",This Astros game is wild AF,10-23-2021,PapayaOk8743,6.0,this astros game is wild af,neutral,0.41826788,,,-1,-1_spce_000_price_bags,2021-10-23
92252,"Daily Discussion Thread for October 19, 2021",The only bad part about this SPY rip is that I’m gonna start thinking I know what I’m doing.,10-19-2021,Bonbon676790,36.0,the only bad part about this spy rip is that im gonna start thinking i know what im doing,negative,0.84320307,,,-1,-1_spce_000_price_bags,2021-10-19
86612,"Weekend Discussion Thread for the Weekend of October 01, 2021",I bless the rains down in Africa,10-02-2021,LifeisDankiThink,9.0,i bless the rains down in africa,positive,0.83865047,,,-1,-1_spce_000_price_bags,2021-10-02
90318,"Daily Discussion Thread for October 13, 2021",I can’t believe they going to let us buy Spy calls cheaper . This is great,10-13-2021,TopBuyer777,11.0,i cant believe they going to let us buy spy calls cheaper this is great,positive,0.896059,,,0,0_expire_expiring_call_expired,2021-10-13
88736,"Daily Discussion Thread for October 08, 2021",PLTR was 29 and literally two weeks later is near breaching 23 after signing a new 1B contract. 😂,10-08-2021,DynoJoe27,10.0,pltr was 29 and literally two weeks later is near breaching 23 after signing a new 1b contract,neutral,0.8535725,,,14,14_25_30_38_break,2021-10-08
86506,"Weekend Discussion Thread for the Weekend of October 01, 2021","I'm not a bull or a bear, I'll switch my calls to puts to ride the momentum in a heartbeat.",10-01-2021,pat-nasty,12.0,im not a bull or a bear ill switch my calls to puts to ride the momentum in a heartbeat,neutral,0.7037116,,,-1,-1_spce_000_price_bags,2021-10-01
92039,"Daily Discussion Thread for October 18, 2021","I'm starting to actually make money, I'm scared and unsure what to do with it",10-18-2021,The_Only_Abe,9.0,im starting to actually make money im scared and unsure what to do with it,negative,0.46895757,,,200,200_panic_scared_panicking_sheep,2021-10-18
91535,"Weekend Discussion Thread for the Weekend of October 15, 2021",I think I met a girl who was u/cashflow_’s sister. In unrelated news I need to get all the std and sti tests ever created.,10-16-2021,gonewildpapi,12.0,i think i met a girl who was u cashflow_s sister in unrelated news i need to get all the std and sti tests ever created,neutral,0.656331,,,-1,-1_spce_000_price_bags,2021-10-16
90961,"Daily Discussion Thread for October 14, 2021","Ber gets Trick, Bull gets Treat",10-14-2021,PrincPaco,6.0,ber gets trick bull gets treat,neutral,0.7305184,,,124,124_bers_ber_fuk_fukd,2021-10-14
91614,"Weekend Discussion Thread for the Weekend of October 15, 2021",Everyone wants a full fledge market crash until they are unemployed,10-16-2021,ProfessionalEar9,9.0,everyone wants a full fledge market crash until they are unemployed,negative,0.6531513,,,18,18_jobs_unemployment_boss_jobless,2021-10-16
93732,"Daily Discussion Thread for October 22, 2021",It's been years since we've seen a WSB day like this.,10-22-2021,VladdyGuerreroJr,14.0,its been years since weve seen a wsb day like this,neutral,0.5961516,,,16,16_wkhs_wsb_wsbs_crew,2021-10-22
87878,"Daily Discussion Thread for October 06, 2021","i’m currently

10% SPY
50% Oil and energy
40% Bank

am i fucked",10-06-2021,arbitragemyass,9.0,im currently 10 spy 50 oil and energy 40 bank am i fucked,negative,0.82569605,,,-1,-1_spce_000_price_bags,2021-10-06
87550,"Daily Discussion Thread for October 05, 2021","*U.S., Chinese Officials To Hold High-Level Meeting In Switzerland - BZ Newswire*

oh how i've missed you gina talks going well",10-05-2021,TF_Sally,7.0,u s chinese officials to hold high level meeting in switzerland bz newswire oh how ive missed you gina talks going well,neutral,0.4762666,,,33,33_china_chinese_chinas_usa,2021-10-05
88561,"Daily Discussion Thread for October 08, 2021",194k new jobs - 190k fast food and 4K USPS/FDX/UPS 😏,10-08-2021,GoBeaversOSU,29.0,194k new jobs 190k fast food and 4k usps fdx ups,neutral,0.8272362,,,18,18_jobs_unemployment_boss_jobless,2021-10-08
87727,"Daily Discussion Thread for October 06, 2021",TIL The Simpsons still put on the annual “Treehouse of Horror” Halloween episode. The first one premiered  in 1990. Used to love those episodes this time of year when I was a kid.,10-06-2021,CaptTriage,15.0,til the simpsons still put on the annual treehouse of horror halloween episode the first one premiered in 1990 used to love those episodes this time of year when i was a kid,positive,0.8780989,,,-1,-1_spce_000_price_bags,2021-10-06
88109,"Daily Discussion Thread for October 07, 2021",I just need my positions to go up a million dollars so I'll have a million dollars.,10-07-2021,Eslooie,86.0,i just need my positions to go up a million dollars so ill have a million dollars,neutral,0.5261679,,,172,172_millionaire_millionaires_million_billionaire,2021-10-07
87315,"Daily Discussion Thread for October 05, 2021","So, to the people who bought puts on facebook yesturday at close, congrats retards.",10-05-2021,idontknowanyonehere1,12.0,so to the people who bought puts on facebook yesturday at close congrats retards,positive,0.89772385,,facebook,-1,-1_spce_000_price_bags,2021-10-05
86956,"Daily Discussion Thread for October 04, 2021","BABA ~~300~~ ~~250~~ ~~200~~ ~~175~~ ~~150~~ 140c

By the fucking dip, maggot🤡🤡🤡",10-04-2021,t33po,11.0,baba 300 250 200 175 150 140c by the fucking dip maggot,negative,0.93170524,,,49,49_baba_bob_bankrupt_ban,2021-10-04
92903,"Daily Discussion Thread for October 20, 2021","WISH's price started to rocket up with volume one hour before WISH reported earnings date 1 day earlier than expected.

a) dumb luck (fine I'll take it)

b) good way to spread good rumors

c) someone knows its going to be a good earnings

# I BUY THE RUMOR!

***edit: WISH reported earnings date***",10-20-2021,Spiritual-Prize-4491,8.0,wishs price started to rocket up with volume one hour before wish reported earnings date 1 day earlier than expected a dumb luck fine ill take it b good way to spread good rumors c someone knows its going to be a good earnings i buy the rumor edit wish reported earnings date,positive,0.78808224,,,1,1_priced_sale_discount_price,2021-10-20
89578,"Daily Discussion Thread for October 11, 2021","""mamma miaa! thatsa spicy meatballa""

-Christopher Columbus",10-11-2021,hftrobo9285,7.0,mamma miaa thatsa spicy meatballa christopher columbus,neutral,0.89590704,,,-1,-1_spce_000_price_bags,2021-10-11
91837,"Daily Discussion Thread for October 18, 2021",$TSLA $SOFI $FCEL $50k day baby!!!,10-18-2021,SimplyMe1222,28.0,tsla sofi fcel 50k day baby,neutral,0.78702986,,tsla,-1,-1_spce_000_price_bags,2021-10-18
87552,"Daily Discussion Thread for October 05, 2021",Spy needs to reject here to take us low or it’s calls all day…I have puts so it’s going up guys,10-05-2021,Scnewbie08,6.0,spy needs to reject here to take us low or its calls all day i have puts so its going up guys,neutral,0.5332318,,,9,9_0dte_sold_expiring_loss,2021-10-05
86477,"Weekend Discussion Thread for the Weekend of October 01, 2021",Up all night on coke - bring in the football and bourbon 🥃,10-03-2021,Donkeycow15,15.0,up all night on coke bring in the football and bourbon,neutral,0.7585123,,,-1,-1_spce_000_price_bags,2021-10-03
88578,"Daily Discussion Thread for October 08, 2021",#🔔 WELCOME BACK 🔔,10-08-2021,pr3dato8,16.0,welcome back,positive,0.87702996,,,-1,-1_spce_000_price_bags,2021-10-08
93522,"Daily Discussion Thread for October 21, 2021","It's cute to sell all the excitement over the same ticker, like the good ole days",10-21-2021,quarantrader,7.0,its cute to sell all the excitement over the same ticker like the good ole days,positive,0.7896939,,,57,57_ticker_tickers_spam_daily,2021-10-21
86451,"Weekend Discussion Thread for the Weekend of October 01, 2021",My whole life I’ve wanted to become a musician. My dream is finally coming true. I’m back here behind Wendy’s learning the skin flute.,10-03-2021,Poder5,23.0,my whole life ive wanted to become a musician my dream is finally coming true im back here behind wendys learning the skin flute,positive,0.89263874,,,162,162_lilm_lil_music_kanye,2021-10-03
91537,"Weekend Discussion Thread for the Weekend of October 15, 2021","Wouldn’t be surprised if we start seeing Burry in the comments, he is one of us now.",10-16-2021,Soldacki,12.0,wouldnt be surprised if we start seeing burry in the comments he is one of us now,neutral,0.7703769,,,73,73_burry_burrys_twitter_tweets,2021-10-16
88763,"Daily Discussion Thread for October 08, 2021",Have a feeling I’m going to get bent over by theta again,10-08-2021,Jakimowicz99,8.0,have a feeling im going to get bent over by theta again,negative,0.68607455,,,62,62_theta_gang_wins_thetagang,2021-10-08
94411,"Weekend Discussion Thread for the Weekend of October 22, 2021",Imagine being a BEN3 bag holder.. wtf even is this company lmao,10-22-2021,SpecialistMundane239,5.0,imagine being a ben3 bag holder wtf even is this company lmao,negative,0.7627256,,,12,12_bag_bagholders_bags_bagger,2021-10-22
92528,"Daily Discussion Thread for October 19, 2021",Damn.  I'm gonna make money on both BB and TLRY calls bought **after** the spike.  This is crazy.,10-19-2021,ADynes,12.0,damn im gonna make money on both bb and tlry calls bought after the spike this is crazy,positive,0.53729415,,bb,88,88_gang_bbby_shambos_lambos,2021-10-19
88302,"Daily Discussion Thread for October 07, 2021",SPY gave up its entire rally after the gap up........,10-07-2021,Tarek394,9.0,spy gave up its entire rally after the gap up,neutral,0.5155475,,,-1,-1_spce_000_price_bags,2021-10-07
88572,"Daily Discussion Thread for October 08, 2021",Remember that guy that yolod into LEVI calls expiring a month out because he thought for some reason everybody coming out of lockdown/unemployment would have to buy a new pair of pants.,10-08-2021,Beershitsson,61.0,remember that guy that yolod into levi calls expiring a month out because he thought for some reason everybody coming out of lockdown unemployment would have to buy a new pair of pants,neutral,0.507238,,,18,18_jobs_unemployment_boss_jobless,2021-10-08
91844,"Daily Discussion Thread for October 18, 2021","Proud retard 😎

Portfolio up 66.09% today 

Zoomed out yep down 88.53% all time nvm",10-18-2021,osendze,20.0,proud retard portfolio up 66 09 today zoomed out yep down 88 53 all time nvm,positive,0.7526972,,,7,7_portfolio_portfolios_ruin_bleed,2021-10-18
91154,"Daily Discussion Thread for October 15, 2021","I'm no longer touching options. Me 10 minutes later, YOLO SPY options.",10-15-2021,jobcloud,11.0,im no longer touching options me 10 minutes later yolo spy options,negative,0.5052456,,,-1,-1_spce_000_price_bags,2021-10-15
91311,"Daily Discussion Thread for October 15, 2021",Did u/cashflow_ go broke? He was doing so well,10-15-2021,Codyskank,8.0,did u cashflow_ go broke he was doing so well,neutral,0.5314314,,,65,65_cash_cashflow_gang_cashflows,2021-10-15
86932,"Daily Discussion Thread for October 04, 2021","I'm all in, no cash, and heavily overweight tech growth.

*CRAAAWLINGGGGGGG IIIIIIIIN MYYYYYYY SKIIIIIIIIIIIIN*",10-04-2021,donkeypunchyourmam,11.0,im all in no cash and heavily overweight tech growth craaawlinggggggg iiiiiiiin myyyyyyy skiiiiiiiiiiiin,neutral,0.5585919,,,-1,-1_spce_000_price_bags,2021-10-04
86348,"Daily Discussion Thread for October 01, 2021",TSLA LOSS PORNNN,10-01-2021,hello_hack0r,7.0,tsla loss pornnn,negative,0.50324726,,tsla,29,29_tsla_tslas_autopilot_og,2021-10-01
86396,"Daily Discussion Thread for October 01, 2021",I for one fucking love pumpkin spice lattes fuck off,10-01-2021,unnecessarychaos,7.0,i for one fucking love pumpkin spice lattes fuck off,negative,0.63891083,,,-1,-1_spce_000_price_bags,2021-10-01
88812,"Daily Discussion Thread for October 08, 2021",I wish this shit was easier man,10-08-2021,Dave_7879,9.0,i wish this shit was easier man,negative,0.85703546,,,-1,-1_spce_000_price_bags,2021-10-08
93716,"Daily Discussion Thread for October 22, 2021",lol i sold some of my shares of DWAC and they got filled at $131 lfg,10-22-2021,tfdude28,15.0,lol i sold some of my shares of dwac and they got filled at 131 lfg,neutral,0.80496305,,,177,177_dwac_trump_bailed_halt,2021-10-22
86437,"Weekend Discussion Thread for the Weekend of October 01, 2021","Next year's investment plan: 

Calls in August, puts in September, calls in October.",10-01-2021,bearhunter429,25.0,next years investment plan calls in august puts in september calls in october,neutral,0.93247235,,,107,107_inverse_buys_switch_lose,2021-10-01
93405,"Daily Discussion Thread for October 21, 2021",Imagine buying TSLA puts,10-21-2021,Palmarius784,11.0,imagine buying tsla puts,neutral,0.7542927,,tsla,164,164_imgur_remy_jpg_png,2021-10-21
91324,"Daily Discussion Thread for October 15, 2021",Accidentally bought AAPL Total Landscaping,10-15-2021,hyperdeflation2,8.0,accidentally bought aapl total landscaping,negative,0.5546454,,,47,47_aapl_earnings_total_pile,2021-10-15
92955,"Daily Discussion Thread for October 20, 2021","Today is world CRISPR day. May we have a future of no diseases. ✌️🤞🧬🧬🚀🚀

$CRSP $NTLA $EDIT $BEAM",10-20-2021,TicketsToPluto,7.0,today is world crispr day may we have a future of no diseases crsp ntla edit beam,positive,0.73946106,,,-1,-1_spce_000_price_bags,2021-10-20
91096,"Daily Discussion Thread for October 15, 2021","There is some newbie investor who bought AMZN 0DTEs thinking ""STONKS ONLY GO UP"" and is up 10,000%",10-15-2021,kk7766,14.0,there is some newbie investor who bought amzn 0dtes thinking stonks only go up and is up 10 000,neutral,0.8199699,,,273,273_amzn_split_invested_bezoz,2021-10-15
88059,"Daily Discussion Thread for October 06, 2021",Green by open like the good old days? 🥺,10-06-2021,slymerva,7.0,green by open like the good old days,neutral,0.6601478,,,216,216_blunt_lesssssgoooo_remix_rollin,2021-10-06
94300,"Weekend Discussion Thread for the Weekend of October 22, 2021","Even some of the best traders get wiped out at some point, I'm sure of it.",10-22-2021,13RAH,6.0,even some of the best traders get wiped out at some point im sure of it,negative,0.64860344,,,-1,-1_spce_000_price_bags,2021-10-22
88965,"Daily Discussion Thread for October 08, 2021",I got more bags than zara,10-08-2021,neos933,7.0,i got more bags than zara,neutral,0.68987834,,,12,12_bag_bagholders_bags_bagger,2021-10-08
90716,"Daily Discussion Thread for October 14, 2021",Started trading SPY two weeks ago and went 5 for 5 but with little money. This week I got confident and so put tons more money. This week I am 0 for 1 million,10-14-2021,nicktro1,12.0,started trading spy two weeks ago and went 5 for 5 but with little money this week i got confident and so put tons more money this week i am 0 for 1 million,positive,0.6759609,,,41,41_profits_profit_greed_earnings,2021-10-14
89172,"Weekend Discussion Thread for the Weekend of October 08, 2021","First rule of RH: If your order fills right away, you got a shit deal.",10-08-2021,bearhunter429,57.0,first rule of rh if your order fills right away you got a shit deal,negative,0.7419325,,,-1,-1_spce_000_price_bags,2021-10-08
91561,"Weekend Discussion Thread for the Weekend of October 15, 2021",Tsla and upst gang rise da fck up,10-15-2021,Junesathon,11.0,tsla and upst gang rise da fck up,negative,0.8591079,,tsla,29,29_tsla_tslas_autopilot_og,2021-10-15
86307,"Daily Discussion Thread for October 01, 2021","Lol my spy calls go burr but my individual stocks r fuk. 

I have no idea what’s going on here",10-01-2021,spanish_bull5,7.0,lol my spy calls go burr but my individual stocks r fuk i have no idea whats going on here,negative,0.62624127,,,-1,-1_spce_000_price_bags,2021-10-01
87746,"Daily Discussion Thread for October 06, 2021","Got my third booster shot

Had them shoot it directly into my dick

That’s the best way to slow the spread",10-06-2021,DontBeARentCucc,14.0,got my third booster shot had them shoot it directly into my dick thats the best way to slow the spread,positive,0.47384593,,,-1,-1_spce_000_price_bags,2021-10-06
87267,"Daily Discussion Thread for October 05, 2021",To buy quality companies with excellent balance sheets or buy spec plays with zero revenue 🤔🤔,10-05-2021,heathermyllz,18.0,to buy quality companies with excellent balance sheets or buy spec plays with zero revenue,neutral,0.6625575,,,-1,-1_spce_000_price_bags,2021-10-05
94130,"Weekend Discussion Thread for the Weekend of October 22, 2021","Lmfaooo just heard about the Trump SPAC, hope they choose the ticker symbol MAGA",10-23-2021,tigerkingsam,8.0,lmfaooo just heard about the trump spac hope they choose the ticker symbol maga,negative,0.4820679,,,57,57_ticker_tickers_spam_daily,2021-10-23
92362,"Daily Discussion Thread for October 19, 2021","*Scientists are closely tracking a new variant spreading in the UK that could be 10% more infectious than Delta*

This is the song that never ends, it goes on and on my friends",10-19-2021,GoBeaversOSU,15.0,scientists are closely tracking a new variant spreading in the uk that could be 10 more infectious than delta this is the song that never ends it goes on and on my friends,neutral,0.63026184,,,213,213_delta_variant_variants_airline,2021-10-19
91736,"Weekend Discussion Thread for the Weekend of October 15, 2021","#🅱️IG 🅱️OY 🅱️ENIS 

#🅿️EEKEND 🅿️HREAD",10-15-2021,-C20H24O3,7.0,ig oy enis eekend hread,neutral,0.7685953,,,161,161_orph_orning_eekend_ears,2021-10-15
86481,"Weekend Discussion Thread for the Weekend of October 01, 2021",I survived covid ✊,10-02-2021,Ghost-1969,13.0,i survived covid,positive,0.48711857,,,249,249_covid_pandemic_deaths_argentina,2021-10-02
93131,"Daily Discussion Thread for October 20, 2021",I’ve never been so bored in my fucking life,10-20-2021,DamascusWaygu,8.0,ive never been so bored in my fucking life,negative,0.9521609,,,-1,-1_spce_000_price_bags,2021-10-20
86987,"Daily Discussion Thread for October 04, 2021","“#1 rule is to never lose money”

- Charlie Munger, BABA $226",10-04-2021,arbitragemyass,33.0,1 rule is to never lose money charlie munger baba 226,neutral,0.7856239,,,-1,-1_spce_000_price_bags,2021-10-04
86764,"Weekend Discussion Thread for the Weekend of October 01, 2021",**TESLA QUARTERLY DELIVERIES THIS WEEKEND BOYS**,10-01-2021,IS_JOKE_COMRADE,7.0,tesla quarterly deliveries this weekend boys,neutral,0.9255355,,tesla,-1,-1_spce_000_price_bags,2021-10-01
90204,"Daily Discussion Thread for October 13, 2021","2 years ago I had $300 in my bank account. I was working minimum wage jobs, lived paycheque by paycheque. Life was hard. To make ends meet, I had to go to a food shelter and get anything they could give. Luckily my city had generous donators and I could live off of some canned beans, without the help of my parents.

Then, I learned about the stock market and the compound gains you could earn from just simply investing. 

Today, I have $100 and I am still living paycheque to paycheque.",10-13-2021,Fit-Mycologist-6951,35.0,2 years ago i had 300 in my bank account i was working minimum wage jobs lived paycheque by paycheque life was hard to make ends meet i had to go to a food shelter and get anything they could give luckily my city had generous donators and i could live off of some canned beans without the help of my parents then i learned about the stock market and the compound gains you could earn from just simply investing today i have 100 and i am still living paycheque to paycheque,positive,0.7221907,,,235,235_salary_raise_paycheque_pay,2021-10-13
86713,"Weekend Discussion Thread for the Weekend of October 01, 2021",funny how zucc is socially-awkward yet created one of the largest social media network in the world,10-03-2021,Mr_Objectifier,7.0,funny how zucc is socially awkward yet created one of the largest social media network in the world,neutral,0.46095294,,,312,312_zuck_zjz_zom_zigged,2021-10-03
93521,"Daily Discussion Thread for October 21, 2021",going to 100,10-21-2021,mff353,8.0,going to 100,neutral,0.7280565,,,-1,-1_spce_000_price_bags,2021-10-21
90437,"Daily Discussion Thread for October 13, 2021",why would tech be up more if inflation reads higher,10-13-2021,spx10k,8.0,why would tech be up more if inflation reads higher,neutral,0.72718775,,,54,54_inflation_cpi_prices_higher,2021-10-13
86330,"Daily Discussion Thread for October 01, 2021",New cardboard box who dis?,10-01-2021,ThisLineLooksCool,7.0,new cardboard box who dis,neutral,0.8355245,,,-1,-1_spce_000_price_bags,2021-10-01
86427,"Weekend Discussion Thread for the Weekend of October 01, 2021",I finally shaved the beard today because I thought it was ugly. Turns out the problem wasn't the beard.,10-01-2021,waldenducks,47.0,i finally shaved the beard today because i thought it was ugly turns out the problem wasnt the beard,neutral,0.48156527,,,232,232_hair_haircut_shaving_shaved,2021-10-01
88228,"Daily Discussion Thread for October 07, 2021",Moon me TLRY daddy🤤,10-07-2021,Zachjsrf,10.0,moon me tlry daddy,neutral,0.7182319,,,25,25_mooning_moon_mission_pluto,2021-10-07
93841,"Daily Discussion Thread for October 22, 2021","Hilary just called me, she said she bought DWAC",10-22-2021,Jonnydoo,11.0,hilary just called me she said she bought dwac,neutral,0.8611872,,,177,177_dwac_trump_bailed_halt,2021-10-22
88539,"Daily Discussion Thread for October 07, 2021",just opened 440 calls so it's sure to drill,10-07-2021,pat-nasty,7.0,just opened 440 calls so its sure to drill,neutral,0.75738096,,,-1,-1_spce_000_price_bags,2021-10-07
90641,"Daily Discussion Thread for October 14, 2021","Bers every single day since $SPY was below $300: ""cLaSsIc BuLl TrAp"" 🤡",10-14-2021,AlmightySnoo,34.0,bers every single day since spy was below 300 classic bull trap,neutral,0.58994746,,,-1,-1_spce_000_price_bags,2021-10-14
88474,"Daily Discussion Thread for October 07, 2021",What’s TLRY gonna do tomorrow,10-07-2021,Callthehambalam,8.0,whats tlry gonna do tomorrow,neutral,0.91010886,,,31,31_tlry_moving_awakens_tlghey,2021-10-07
94227,"Weekend Discussion Thread for the Weekend of October 22, 2021",I’m baked,10-23-2021,etphonetrome,6.0,im baked,neutral,0.6968413,,,-1,-1_spce_000_price_bags,2021-10-23
89885,"Daily Discussion Thread for October 12, 2021","Bulls gone silent. In shambles

Can't wait to go back to buying calls once SPY flops",10-12-2021,Dtm333,11.0,bulls gone silent in shambles cant wait to go back to buying calls once spy flops,negative,0.82001466,,,-1,-1_spce_000_price_bags,2021-10-12
89453,"Daily Discussion Thread for October 11, 2021",Bring back Craigslist casual encounters,10-11-2021,kortokrizzle,10.0,bring back craigslist casual encounters,neutral,0.83784795,,,298,298_hookers_escorts_craigslist_encounters,2021-10-11
89613,"Daily Discussion Thread for October 11, 2021",My poots are cumming back 😎,10-11-2021,VacationLover1,8.0,my poots are cumming back,neutral,0.49191907,,,231,231_cum_lube_vasectomy_vaseline,2021-10-11
91830,"Daily Discussion Thread for October 18, 2021","SOFI holy shit TSLA. CHADSDAQ green. World is healing.

Oh I almost forgot the bers, JPOW has a message for you.

![img](emote|t5_2th52|4640)![img](emote|t5_2th52|4271)🖕",10-18-2021,toydan,34.0,sofi holy shit tsla chadsdaq green world is healing oh i almost forgot the bers jpow has a message for you img emote t5_2th52 4640 img emote t5_2th52 4271,positive,0.57417697,,tsla,70,70_t52th52_emote_4260_4266,2021-10-18
93147,"Daily Discussion Thread for October 20, 2021",SOFI at 21 and not a peep. You Apes moved on quick.,10-20-2021,Chiinoe,6.0,sofi at 21 and not a peep you apes moved on quick,neutral,0.6546638,,,30,30_sofi_fa_charter_sos,2021-10-20
86213,"Daily Discussion Thread for October 01, 2021",Down 5k today but I'm up $200 on covered calls I sold so I got that going for me,10-01-2021,WagieInTheCagie,9.0,down 5k today but im up 200 on covered calls i sold so i got that going for me,positive,0.6673222,,,0,0_expire_expiring_call_expired,2021-10-01
88617,"Daily Discussion Thread for October 08, 2021","ah, -99% positions, we meet once again old friend",10-08-2021,buythetulipdips,13.0,ah 99 positions we meet once again old friend,neutral,0.59956414,,,412,412_positions_position_mountains_fetal,2021-10-08
93677,"Daily Discussion Thread for October 22, 2021",I can't wait for the official statement on presidential letterhead regarding the unjust suspension of trading on DWAC today.,10-22-2021,heizenbergbb,17.0,i cant wait for the official statement on presidential letterhead regarding the unjust suspension of trading on dwac today,positive,0.55336833,,,177,177_dwac_trump_bailed_halt,2021-10-22
87017,"Daily Discussion Thread for October 04, 2021",Shouldve just bought some dividend stocks like my momma asked me to,10-04-2021,spyaintnobitch,8.0,shouldve just bought some dividend stocks like my momma asked me to,neutral,0.7859574,,,234,234_dividends_dividend_mcfe_reinvest,2021-10-04
93516,"Daily Discussion Thread for October 21, 2021",Bro i couldve made life changing money if i followed my plan from last night. I wanna cry.,10-21-2021,ieatxan,9.0,bro i couldve made life changing money if i followed my plan from last night i wanna cry,positive,0.4025237,,,-1,-1_spce_000_price_bags,2021-10-21
86600,"Weekend Discussion Thread for the Weekend of October 01, 2021","Peloton is truly an innovative company. 

I remember the days when you had to get out of bed before flinging toddlers across the room.

I’m never going back.",10-02-2021,Kythirius,9.0,peloton is truly an innovative company i remember the days when you had to get out of bed before flinging toddlers across the room im never going back,positive,0.8042927,,,141,141_gym_treadmill_lululemon_leggings,2021-10-02
94111,"Weekend Discussion Thread for the Weekend of October 22, 2021",There's a wedding at the hotel I'm staying at and it's so fucking loud can't sleep. God damn happy people. Celebrating fucking love and shit. Fuck you.,10-23-2021,obiwanjustblowme,10.0,theres a wedding at the hotel im staying at and its so fucking loud cant sleep god damn happy people celebrating fucking love and shit fuck you,negative,0.8574041,,,-1,-1_spce_000_price_bags,2021-10-23
90794,"Daily Discussion Thread for October 14, 2021",Upstart up 209% in the last three months 😭,10-14-2021,zeebee098,8.0,upstart up 209 in the last three months,neutral,0.85199034,,,-1,-1_spce_000_price_bags,2021-10-14
91587,"Weekend Discussion Thread for the Weekend of October 15, 2021",!banbet TSLA 1000 1w,10-17-2021,nami_hoshino,10.0,banbet tsla 1000 1w,neutral,0.8046291,,tsla,549,549_1w_2w_900_3w,2021-10-17
88126,"Daily Discussion Thread for October 07, 2021",“Market rallies on hopes of future rally”,10-07-2021,theysnackinn,20.0,market rallies on hopes of future rally,positive,0.78240013,,,357,357_rally_gas_bamboozle_silverado,2021-10-07
92124,"Daily Discussion Thread for October 18, 2021",Bought SPY calls on the cheap 🚀,10-18-2021,Glassesofwater,7.0,bought spy calls on the cheap,neutral,0.721805,,,0,0_expire_expiring_call_expired,2021-10-18
93772,"Daily Discussion Thread for October 22, 2021","“This stock has recently experienced elevated volatility. Are you sure you wish to buy?”

ABSOFUCKINGLUTELY",10-22-2021,btoned,14.0,this stock has recently experienced elevated volatility are you sure you wish to buy absofuckinglutely,negative,0.8155598,,,4,4_investor_growth_investing_invest,2021-10-22
89061,"Weekend Discussion Thread for the Weekend of October 08, 2021",I sleep better when I'm not in options.,10-10-2021,afroman645,14.0,i sleep better when im not in options,positive,0.63950676,,,116,116_goodnight_wake_slept_woke,2021-10-10
87501,"Daily Discussion Thread for October 05, 2021",Order in for $TSLA 780 Dec puts.,10-05-2021,TJMBeav,7.0,order in for tsla 780 dec puts,neutral,0.80108464,,tsla,-1,-1_spce_000_price_bags,2021-10-05
92006,"Daily Discussion Thread for October 18, 2021",any sofi millionaires now?,10-18-2021,stocksandbonds123,10.0,any sofi millionaires now,neutral,0.831533,,,-1,-1_spce_000_price_bags,2021-10-18
90525,"Daily Discussion Thread for October 13, 2021",Oh no. Step-futes where are you going?,10-13-2021,UnlimitedQE,8.0,oh no step futes where are you going,neutral,0.5671456,,,-1,-1_spce_000_price_bags,2021-10-13
88143,"Daily Discussion Thread for October 07, 2021","Put players, eliminated",10-07-2021,YoungJebediah,16.0,put players eliminated,negative,0.526858,,,-1,-1_spce_000_price_bags,2021-10-07
94385,"Weekend Discussion Thread for the Weekend of October 22, 2021","I'm gonna take a shower and when I get back I'm gonna go down the daily thread and ban anyone who is using mango money printer to be a complete asshole about politics. I don't care which side you're on. Ban.

We don't do that here. We made it through the entire Trump presidency without being like the rest of the internet and getting baited into clubbing eachother over the head and making our corner of the internet shitty. Don't do it here.

EDIT: and if things get really annoying I'll add the political subs to the brigade filter. it'll be like squid game red light green light.",10-23-2021,zjz,27.0,im gonna take a shower and when i get back im gonna go down the daily thread and ban anyone who is using mango money printer to be a complete asshole about politics i dont care which side youre on ban we dont do that here we made it through the entire trump presidency without being like the rest of the internet and getting baited into clubbing eachother over the head and making our corner of the internet shitty dont do it here edit and if things get really annoying ill add the political subs to the brigade filter itll be like squid game red light green light,negative,0.9144343,,bb,-1,-1_spce_000_price_bags,2021-10-23
90444,"Daily Discussion Thread for October 13, 2021",I'm up 2 cents 😎,10-13-2021,RealFuckingGenius,8.0,im up 2 cents,neutral,0.78937817,,,-1,-1_spce_000_price_bags,2021-10-13
93157,"Daily Discussion Thread for October 21, 2021","Schrodinger's valuation, it's both priced in and not priced in at the same time",10-21-2021,CreepingFog,42.0,schrodingers valuation its both priced in and not priced in at the same time,neutral,0.518093,,,1,1_priced_sale_discount_price,2021-10-21
90241,"Daily Discussion Thread for October 13, 2021","Up $7k on the day and I still have the sadz because I'm down $49k from all time high. 

chasing that 🐉",10-13-2021,VictorNiederhoffer,15.0,up 7k on the day and i still have the sadz because im down 49k from all time high chasing that,negative,0.522693,,,40,40_5k_20k_30k_3k,2021-10-13
92926,"Daily Discussion Thread for October 20, 2021",Where’s the Undo button in trading apps guys?,10-20-2021,BackThatThangUp,9.0,wheres the undo button in trading apps guys,neutral,0.7758437,,,114,114_brokerage_broker_apps_brokers,2021-10-20
87430,"Daily Discussion Thread for October 05, 2021","I have alot of regret lately. I sleep ok, but I'd sleep 70% better if I didn't lose most of my fckn money in SeptemBear like a dumbass.",10-05-2021,PrincPaco,9.0,i have alot of regret lately i sleep ok but id sleep 70 better if i didnt lose most of my fckn money in septembear like a dumbass,negative,0.9048994,,,28,28_losing_lose_lost_losses,2021-10-05
86400,"Daily Discussion Thread for October 01, 2021",Just a daily reminder that RIDE is a fraudulent company,10-01-2021,Contextual-Investor,7.0,just a daily reminder that ride is a fraudulent company,negative,0.95505244,,,-1,-1_spce_000_price_bags,2021-10-01
86014,"Daily Discussion Thread for October 01, 2021","Ah, the paper jam was cleared.",10-01-2021,animositisomina35,13.0,ah the paper jam was cleared,neutral,0.6293844,,,125,125_handed_doll_hands_touched,2021-10-01
93877,"Daily Discussion Thread for October 22, 2021",lmao I just paid an expensive tuition in how not to time 🥭 SPAC P&Ds,10-22-2021,allinonworkcalls,12.0,lmao i just paid an expensive tuition in how not to time spac p ds,negative,0.64561325,,,-1,-1_spce_000_price_bags,2021-10-22
91006,"Daily Discussion Thread for October 14, 2021","QQQ: RSI bullish, MACD bullish. Conclusion: Bears fucked! Thanks for listening to my Econ Seminar.",10-14-2021,Emergency-Eye-2165,7.0,qqq rsi bullish macd bullish conclusion bears fucked thanks for listening to my econ seminar,neutral,0.4560593,,,-1,-1_spce_000_price_bags,2021-10-14
88519,"Daily Discussion Thread for October 07, 2021",Experienced a lifetime’s worth of emotions from yesterday morning around this time to this morning,10-07-2021,ayard21,7.0,experienced a lifetimes worth of emotions from yesterday morning around this time to this morning,neutral,0.842514,,,-1,-1_spce_000_price_bags,2021-10-07
93233,"Daily Discussion Thread for October 21, 2021",I need SPY 455 tomorrow or I am ruined,10-21-2021,AnalLeekage,14.0,i need spy 455 tomorrow or i am ruined,negative,0.792056,,,6,6_440_445_444_453,2021-10-21
92421,"Daily Discussion Thread for October 19, 2021",#whats the next blastoff point for BB? 11.4?,10-19-2021,VeganFoodIsYummy,13.0,whats the next blastoff point for bb 11 4,neutral,0.92024547,,bb,123,123_rocket_rockets_rocketship_takeoff,2021-10-19
94131,"Weekend Discussion Thread for the Weekend of October 22, 2021","Can’t believe Adult Swim is 20 years old Jesus, I remember being a kid at my grandparents’ house in summer 2001 seeing the ‘all kids out of the pool’ promo (we didn’t get Cartoon Network in my area until a few years later though). Crazy that it all kinda grew out of Space Ghost Coast to Coast and could’ve been a flop but it’s hard to imagine tv at night without it now",10-23-2021,BackThatThangUp,8.0,cant believe adult swim is 20 years old jesus i remember being a kid at my grandparents house in summer 2001 seeing the all kids out of the pool promo we didnt get cartoon network in my area until a few years later though crazy that it all kinda grew out of space ghost coast to coast and couldve been a flop but its hard to imagine tv at night without it now,neutral,0.44674563,,,-1,-1_spce_000_price_bags,2021-10-23
87405,"Daily Discussion Thread for October 05, 2021",Short spy at 430 seemed good now I'm just gonna have to wait till the top is in...,10-05-2021,ShitFeeder,10.0,short spy at 430 seemed good now im just gonna have to wait till the top is in,neutral,0.5403932,,,6,6_440_445_444_453,2021-10-05
90588,"Daily Discussion Thread for October 13, 2021",How do I change settings to easy mode?,10-13-2021,Will_I_survive_this,8.0,how do i change settings to easy mode,neutral,0.80213565,,,220,220_mode_easy_difficulty_hard,2021-10-13
87163,"Daily Discussion Thread for October 04, 2021","Lmao that micro pump to trick euro-poors into buying then continuing the dump right after their close, nice one mr market.",10-04-2021,BearsGetRekt,8.0,lmao that micro pump to trick euro poors into buying then continuing the dump right after their close nice one mr market,neutral,0.59398013,,,58,58_pump_dump_dumps_pumping,2021-10-04
88265,"Daily Discussion Thread for October 07, 2021",I was promised a rally that would rip my face off. Wen face rip?,10-07-2021,Zachjsrf,10.0,i was promised a rally that would rip my face off wen face rip,negative,0.8194917,,,-1,-1_spce_000_price_bags,2021-10-07
91582,"Weekend Discussion Thread for the Weekend of October 15, 2021",I'm still waiting for genetically engineered foods like strawberry banana,10-17-2021,bluen,9.0,im still waiting for genetically engineered foods like strawberry banana,neutral,0.6039778,,,259,259_berry_berries_banana_bananas,2021-10-17
85977,"Daily Discussion Thread for October 01, 2021",More or less blew up my account over the last week and a half. Went from over 60% up on the year to 77% down. Part of me says cash out and lick my wounds. But I can’t cause I’m a degenerate.,10-01-2021,eternalrefuge86,63.0,more or less blew up my account over the last week and a half went from over 60 up on the year to 77 down part of me says cash out and lick my wounds but i cant cause im a degenerate,negative,0.92021054,,,72,72_account_blew_blown_blow,2021-10-01
94114,"Weekend Discussion Thread for the Weekend of October 22, 2021","Amazing how some people have the uncanny ability to lose 50% of their investment intraday or overnight, *on shares*",10-22-2021,Its_the_dankness,29.0,amazing how some people have the uncanny ability to lose 50 of their investment intraday or overnight on shares,neutral,0.47408003,,,-1,-1_spce_000_price_bags,2021-10-22
92405,"Daily Discussion Thread for October 19, 2021",I have the strongest urge to just sell my whole portfolio and start again,10-19-2021,Endless_road,13.0,i have the strongest urge to just sell my whole portfolio and start again,neutral,0.49889454,,,7,7_portfolio_portfolios_ruin_bleed,2021-10-19
87807,"Daily Discussion Thread for October 06, 2021",Progressive paid out their $0.10 dividend today - standby for a stickied post in r/dividends,10-06-2021,GoBeaversOSU,12.0,progressive paid out their 0 10 dividend today standby for a stickied post in r dividends,neutral,0.88275135,,,234,234_dividends_dividend_mcfe_reinvest,2021-10-06
88695,"Daily Discussion Thread for October 08, 2021","Holy shit, TMC is a penny stock. The most brutal WSB stock beatdown  I’ve seen",10-08-2021,Boss1010,10.0,holy shit tmc is a penny stock the most brutal wsb stock beatdown ive seen,negative,0.7677086,,,-1,-1_spce_000_price_bags,2021-10-08
88033,"Daily Discussion Thread for October 06, 2021",This the kinda market where you gotta lock in gains at 20% or else,10-06-2021,JayRoo83,8.0,this the kinda market where you gotta lock in gains at 20 or else,neutral,0.8091212,,,-1,-1_spce_000_price_bags,2021-10-06
90006,"Daily Discussion Thread for October 12, 2021","going cash gang has been as hard as quitting vaping or drugs or alcohol for me...  
god damn its been hard to sit on the sidelines watching the game play out but now im like fuck i really did yolo into some dumb fucking plays before...  
quality plays are definitely rare but well worth the wait.",10-12-2021,v-shizzle,8.0,going cash gang has been as hard as quitting vaping or drugs or alcohol for me god damn its been hard to sit on the sidelines watching the game play out but now im like fuck i really did yolo into some dumb fucking plays before quality plays are definitely rare but well worth the wait,negative,0.95364875,,,65,65_cash_cashflow_gang_cashflows,2021-10-12
91616,"Weekend Discussion Thread for the Weekend of October 15, 2021",I just groused an elk until he busted right in my yeti tumbler. Guy didn't even wave back.,10-16-2021,bonejohnson8,9.0,i just groused an elk until he busted right in my yeti tumbler guy didnt even wave back,negative,0.8241439,,,-1,-1_spce_000_price_bags,2021-10-16
89710,"Daily Discussion Thread for October 11, 2021",disgusting 4 hr close if it closes like that,10-11-2021,buythetulipdips,7.0,disgusting 4 hr close if it closes like that,negative,0.95855,,,-1,-1_spce_000_price_bags,2021-10-11
85994,"Daily Discussion Thread for October 01, 2021",Recession cancelled easy mode back on?,10-01-2021,Luv2AnalCathieWood,17.0,recession cancelled easy mode back on,neutral,0.6649267,,,121,121_recession_cancelled_canceled_recessions,2021-10-01
87616,"Daily Discussion Thread for October 05, 2021",Did anybody see a commercial for yahoo mail just now? Am I having a stroke?,10-05-2021,eeddeedde,6.0,did anybody see a commercial for yahoo mail just now am i having a stroke,negative,0.6220407,,,308,308_ads_youtube_commercials_hulu,2021-10-05
92437,"Daily Discussion Thread for October 19, 2021",Tesla 1000 🚂,10-19-2021,lasco10,12.0,tesla 1000,neutral,0.67476845,,tesla,20,20_tesla_700_900_teslas,2021-10-19
94139,"Weekend Discussion Thread for the Weekend of October 22, 2021",I went from up 100% to down 30% in 1 day lol,10-22-2021,dablackpantha,25.0,i went from up 100 to down 30 in 1 day lol,neutral,0.64652056,,,14,14_25_30_38_break,2021-10-22
94408,"Weekend Discussion Thread for the Weekend of October 22, 2021",Holding my SPY 449p through The weekend. Fuck me.,10-22-2021,eternalrefuge86,5.0,holding my spy 449p through the weekend fuck me,negative,0.8712478,,,-1,-1_spce_000_price_bags,2021-10-22
90607,"Daily Discussion Thread for October 13, 2021",#T A P E R T A N T R U M,10-13-2021,Fit-Mycologist-6951,7.0,t a p e r t a n t r u m,neutral,0.5935065,,,161,161_orph_orning_eekend_ears,2021-10-13
88507,"Daily Discussion Thread for October 07, 2021","Do bears fuk? No ![img](emote|t5_2th52|4260)

ARE bears fuk? Absolutely ![img](emote|t5_2th52|4276)",10-07-2021,MightyLul,7.0,do bears fuk no img emote t5_2th52 4260 are bears fuk absolutely img emote t5_2th52 4276,neutral,0.7543121,,,70,70_t52th52_emote_4260_4266,2021-10-07
91594,"Weekend Discussion Thread for the Weekend of October 15, 2021","Michael Burry? 

More like Michael Beary.",10-15-2021,bearhunter429,9.0,michael burry more like michael beary,neutral,0.87930906,,,73,73_burry_burrys_twitter_tweets,2021-10-15
88929,"Daily Discussion Thread for October 08, 2021",Wow it can’t even bounce,10-08-2021,cashflow_,8.0,wow it cant even bounce,negative,0.7662892,,,564,564_bounce_foam_airplane_glided,2021-10-08
89431,"Daily Discussion Thread for October 11, 2021","Wow, much VIX. Very fear.",10-11-2021,T41NT,12.0,wow much vix very fear,negative,0.53968894,,,134,134_vix_vxrt_vxx_spx,2021-10-11
88396,"Daily Discussion Thread for October 07, 2021","Bears were certain we weren’t going to break 435, and here we are waking up to 440, tough tough morning for bears",10-07-2021,Jpatrickj,9.0,bears were certain we werent going to break 435 and here we are waking up to 440 tough tough morning for bears,neutral,0.4962631,,,-1,-1_spce_000_price_bags,2021-10-07
93898,"Daily Discussion Thread for October 22, 2021",Intel & snap puts about to bless me in 30 minutes,10-22-2021,Usedillusion7,11.0,intel snap puts about to bless me in 30 minutes,positive,0.9113802,,,48,48_amd_intel_ryzen_83,2021-10-22
89917,"Daily Discussion Thread for October 12, 2021",When does the SPY whistleblower testify?,10-12-2021,riffdex,9.0,when does the spy whistleblower testify,neutral,0.7343792,,,-1,-1_spce_000_price_bags,2021-10-12
93128,"Daily Discussion Thread for October 20, 2021",Forgive me lord for I have sinned. NIO 35$ puts weekly. Tesla plz die and China plz invade Mars,10-20-2021,Homeoand,8.0,forgive me lord for i have sinned nio 35 puts weekly tesla plz die and china plz invade mars,negative,0.8421222,,nio,20,20_tesla_700_900_teslas,2021-10-20
86734,"Weekend Discussion Thread for the Weekend of October 01, 2021",Nervous about tomorrow :/,10-03-2021,cashflow_,8.0,nervous about tomorrow,neutral,0.61726826,,,-1,-1_spce_000_price_bags,2021-10-03
91003,"Daily Discussion Thread for October 14, 2021",I will build $9000 PC if NVDA $230 and $AMD $120 by the end of next week,10-14-2021,StonksInvesteur,7.0,i will build 9000 pc if nvda 230 and amd 120 by the end of next week,neutral,0.84182006,,,109,109_nvda_split_200_amd,2021-10-14
87783,"Daily Discussion Thread for October 06, 2021",I hate it when you go “poop” at work just to have a break and someone picks the stall next to you and starts shitting for real.,10-06-2021,TitaniumTacos,52.0,i hate it when you go poop at work just to have a break and someone picks the stall next to you and starts shitting for real,negative,0.9641965,,,95,95_toilet_smell_poop_smells,2021-10-06
93330,"Daily Discussion Thread for October 21, 2021",If you aren't holding Tesla then you ain't black!,10-21-2021,qwert1225,11.0,if you arent holding tesla then you aint black,neutral,0.5530681,,tesla,20,20_tesla_700_900_teslas,2021-10-21
91937,"Daily Discussion Thread for October 18, 2021","Apple event sneak peek

Next year…

We are proud to announce…

The iPhone 14",10-18-2021,Xinlitik,10.0,apple event sneak peek next year we are proud to announce the iphone 14,positive,0.9759504,,,-1,-1_spce_000_price_bags,2021-10-18
92189,"Daily Discussion Thread for October 18, 2021",TSLA going up on retard strength?,10-18-2021,WorkingCorrect1062,8.0,tsla going up on retard strength,neutral,0.6728366,,tsla,29,29_tsla_tslas_autopilot_og,2021-10-18
91929,"Daily Discussion Thread for October 18, 2021","Top 10% of wealthy Americans own 89% of all US stocks. Holy shit , it’s to be expected but isn’t that wild to think about ?",10-18-2021,antliu56,11.0,top 10 of wealthy americans own 89 of all us stocks holy shit its to be expected but isnt that wild to think about,negative,0.4469487,,,4,4_investor_growth_investing_invest,2021-10-18
92443,"Daily Discussion Thread for October 19, 2021",!banbet GME 300 2w or I’ll delete this account,10-19-2021,tonylix,11.0,banbet gme 300 2w or ill delete this account,negative,0.50421715,,gme,-1,-1_spce_000_price_bags,2021-10-19
85998,"Daily Discussion Thread for October 01, 2021",Hoping this infamous 1st of the month rally can power thru 433,10-01-2021,o3Zany,17.0,hoping this infamous 1st of the month rally can power thru 433,positive,0.7121005,,,357,357_rally_gas_bamboozle_silverado,2021-10-01
89296,"Weekend Discussion Thread for the Weekend of October 08, 2021",Is there someone more retarded than me who bought SPY 500C for Nov?,10-09-2021,tired_trotter,8.0,is there someone more retarded than me who bought spy 500c for nov,negative,0.9264241,,,-1,-1_spce_000_price_bags,2021-10-09
92584,"Daily Discussion Thread for October 19, 2021","bers lurking in the bushes saying ""it's too bullish in here""",10-19-2021,cryptohorn,11.0,bers lurking in the bushes saying its too bullish in here,neutral,0.591976,,,124,124_bers_ber_fuk_fukd,2021-10-19
86677,"Weekend Discussion Thread for the Weekend of October 01, 2021","you guys made u/cashflow_ cry, so he signed up again on a different acct and is secretly shitposting here",10-02-2021,UpperSpinach,9.0,you guys made u cashflow_ cry so he signed up again on a different acct and is secretly shitposting here,negative,0.87104946,,,-1,-1_spce_000_price_bags,2021-10-02
89441,"Daily Discussion Thread for October 11, 2021",Make money on SOFI stock --> transfer profits to SoFi app --> SoFi benefits --> make more money on SOFI stock,10-11-2021,moonman518,13.0,make money on sofi stock transfer profits to sofi app sofi benefits make more money on sofi stock,neutral,0.49443427,,,30,30_sofi_fa_charter_sos,2021-10-11
87875,"Daily Discussion Thread for October 06, 2021",28 and my mom still makes more money than me,10-06-2021,arbitragemyass,9.0,28 and my mom still makes more money than me,neutral,0.53633755,,,195,195_dad_mom_fathers_father,2021-10-06
88600,"Daily Discussion Thread for October 08, 2021",Bought such a stupid option that I can’t even sell it at market.,10-08-2021,h4ppyfolk,16.0,bought such a stupid option that i cant even sell it at market,negative,0.95408976,,,55,55_options_option_trading_learn,2021-10-08
86694,"Weekend Discussion Thread for the Weekend of October 01, 2021",Waiting for monday to see how much pltr will drill 📉📉📉,10-02-2021,clint1reid,8.0,waiting for monday to see how much pltr will drill,neutral,0.9199497,,,86,86_drill_drilling_duty_morale,2021-10-02
93603,"Daily Discussion Thread for October 21, 2021",Didn’t think it was possible to hate Pinterest more than I already did but now they are fucking up my PYPL gains,10-21-2021,mishka__,7.0,didnt think it was possible to hate pinterest more than i already did but now they are fucking up my pypl gains,negative,0.96215594,,,74,74_porn_pornhub_content_hentai,2021-10-21
91358,"Daily Discussion Thread for October 15, 2021",I cannot help but laugh at people who bought SPCE at 40 lol.,10-15-2021,pantsinmyhands,6.0,i cannot help but laugh at people who bought spce at 40 lol,neutral,0.4073161,,,104,104_spce_frontier_spice_flight,2021-10-15
89264,"Weekend Discussion Thread for the Weekend of October 08, 2021",SoFi bank charter when,10-08-2021,isweat_,8.0,sofi bank charter when,neutral,0.856996,,,30,30_sofi_fa_charter_sos,2021-10-08
90822,"Daily Discussion Thread for October 14, 2021",Welp down 98% all time after this morning.  17k in 18 months.  Deleting the RH account after these puts expire worthless tomorrow and never doing this shit again 🤙,10-14-2021,sodakffl,10.0,welp down 98 all time after this morning 17k in 18 months deleting the rh account after these puts expire worthless tomorrow and never doing this shit again,negative,0.93996084,,,72,72_account_blew_blown_blow,2021-10-14
89279,"Weekend Discussion Thread for the Weekend of October 08, 2021","I don't have no problem with you fuckin me, 
But I do have a little problem with you not fuckin me. 

-ODB",10-09-2021,hvnwntw8,8.0,i dont have no problem with you fuckin me but i do have a little problem with you not fuckin me odb,negative,0.56417876,,,-1,-1_spce_000_price_bags,2021-10-09
92200,"Daily Discussion Thread for October 18, 2021",TSLA $900 calls 10/22 have a nice day,10-18-2021,Sweaty-Bumblebee4055,6.0,tsla 900 calls 10 22 have a nice day,positive,0.9600343,,tsla,36,36_700_900_800_690,2021-10-18
88014,"Daily Discussion Thread for October 06, 2021","*The next fashion trend is clothes that don't exist*

Bullish AF",10-06-2021,GoBeaversOSU,8.0,the next fashion trend is clothes that dont exist bullish af,negative,0.5171961,,,141,141_gym_treadmill_lululemon_leggings,2021-10-06
87085,"Daily Discussion Thread for October 04, 2021","china ddosing our internet backbone while they start waging war on taiwan

nice knowing ya guys",10-04-2021,yayahi,11.0,china ddosing our internet backbone while they start waging war on taiwan nice knowing ya guys,negative,0.7210877,,,33,33_china_chinese_chinas_usa,2021-10-04
88495,"Daily Discussion Thread for October 07, 2021","If today turned out to be a bull trap setup for the biggest dump of the century from 438 to like 426, I'm going to quit investing until 2022 lmao",10-07-2021,Momma_Sophie,7.0,if today turned out to be a bull trap setup for the biggest dump of the century from 438 to like 426 im going to quit investing until 2022 lmao,negative,0.84504133,,,191,191_bull_history_greatest_historys,2021-10-07
94192,"Weekend Discussion Thread for the Weekend of October 22, 2021",The rotation to tech starts Monday,10-22-2021,optionsCone,19.0,the rotation to tech starts monday,neutral,0.91381794,,,-1,-1_spce_000_price_bags,2021-10-22
87081,"Daily Discussion Thread for October 04, 2021",productivity in middle america has broken all time highs today.,10-04-2021,OhNoMoFomo,8.0,productivity in middle america has broken all time highs today,negative,0.659065,,,18,18_jobs_unemployment_boss_jobless,2021-10-04
93861,"Daily Discussion Thread for October 22, 2021","#tump just commented on the DWAC situation:


Halts are the greatest threat in the US to both bald and golden eagles. Media claims fictional ‘global warming’ is worse. They would never halt Hillary. SAD!",10-22-2021,South_Onion,11.0,tump just commented on the dwac situation halts are the greatest threat in the us to both bald and golden eagles media claims fictional global warming is worse they would never halt hillary sad,negative,0.87032247,,,-1,-1_spce_000_price_bags,2021-10-22
87572,"Daily Discussion Thread for October 05, 2021",The comments in the daily thread are so diverse. They range from any combination of “Bears lmaoooo” to “bulls lmaooooo” with the occasional “imagine not <XYZ>”.,10-05-2021,mrfinnlee,7.0,the comments in the daily thread are so diverse they range from any combination of bears lmaoooo to bulls lmaooooo with the occasional imagine not xyz,neutral,0.5844324,,,42,42_bulls_bull_bears_bear,2021-10-05
91997,"Daily Discussion Thread for October 18, 2021",ok at this point just teleport to 450 and vaporize my puts to -100%. I accept my fate,10-18-2021,antliu56,8.0,ok at this point just teleport to 450 and vaporize my puts to 100 i accept my fate,neutral,0.75628144,,,9,9_0dte_sold_expiring_loss,2021-10-18
90660,"Daily Discussion Thread for October 14, 2021",My SPY calls would've been worth 28k. I want to vomit,10-14-2021,HeinekenCoC,16.0,my spy calls wouldve been worth 28k i want to vomit,negative,0.8156687,,,0,0_expire_expiring_call_expired,2021-10-14
86053,"Daily Discussion Thread for October 01, 2021",The recession is ~~on~~ ~~off~~ ~~on~~ ~~off~~ ~~on~~ off,10-01-2021,animositisomina35,10.0,the recession is on off on off on off,negative,0.5804521,,,121,121_recession_cancelled_canceled_recessions,2021-10-01
93019,"Daily Discussion Thread for October 20, 2021",TSLA dropping making spy drop,10-20-2021,iMonterenfleche,8.0,tsla dropping making spy drop,neutral,0.83293676,,tsla,427,427_lambda_tortured_hostage_destiny,2021-10-20
94314,"Weekend Discussion Thread for the Weekend of October 22, 2021","I low key enjoy these Trump SPAC gains (or losses when they eventually show up) cuz I can't responsibly yolo into these so I live thru these posts.

Every day it's a struggle being on here to not yolo 500k into some new meme shit.

2021 really is the year of the meme.",10-23-2021,freehouse_throwaway,6.0,i low key enjoy these trump spac gains or losses when they eventually show up cuz i cant responsibly yolo into these so i live thru these posts every day its a struggle being on here to not yolo 500k into some new meme shit 2021 really is the year of the meme,negative,0.40050566,,,24,24_meme_memes_boomer_memestock,2021-10-23
93455,"Daily Discussion Thread for October 21, 2021","If you always max out your margin, does your broker loves you more or less? I want my broker to love me",10-21-2021,WatchingyouNyouNyou,9.0,if you always max out your margin does your broker loves you more or less i want my broker to love me,positive,0.48162758,,,91,91_margin_called_call_calling,2021-10-21
88753,"Daily Discussion Thread for October 08, 2021","If markets go up, it’s a “bull” market. 

If they go down, it’s a “bear” market. 

Volatility means you have a “kangaroo” market. 

But what animal do we use if the market is flat?",10-08-2021,Kythirius,9.0,if markets go up its a bull market if they go down its a bear market volatility means you have a kangaroo market but what animal do we use if the market is flat,negative,0.4874729,,,32,32_bear_bears_bull_bulls,2021-10-08
89799,"Daily Discussion Thread for October 12, 2021","Fiancé when she sees the gumball machine ring I'm gonna propose with:

*He went to Margin* 🥲",10-12-2021,DannyDirtStar,19.0,fiancé when she sees the gumball machine ring im gonna propose with he went to margin,neutral,0.79473954,,,23,23_wife_tinder_married_girlfriend,2021-10-12
86885,"Daily Discussion Thread for October 04, 2021",This is officially worse than September 2020,10-04-2021,putsonmymental,12.0,this is officially worse than september 2020,negative,0.97927487,,,137,137_september_august_january_october,2021-10-04
89587,"Daily Discussion Thread for October 11, 2021",Baba these nuts in your mouth,10-11-2021,Luke421_Rick,8.0,baba these nuts in your mouth,negative,0.6476322,,,-1,-1_spce_000_price_bags,2021-10-11
87615,"Daily Discussion Thread for October 05, 2021",Buy the dip. You’re welcome.,10-05-2021,BarbellPadawan,7.0,buy the dip youre welcome,positive,0.7470391,,,2,2_dips_dipping_dip_dipped,2021-10-05
94367,"Weekend Discussion Thread for the Weekend of October 22, 2021","Hey, I'm not rly in the circle here, but I am retarded🗿 wtf do I do here?",10-23-2021,pk160702,6.0,hey im not rly in the circle here but i am retarded wtf do i do here,negative,0.90835965,,,52,52_retarded_retard_retards_iq,2021-10-23
91161,"Daily Discussion Thread for October 15, 2021",Spy 447 eod is not a meme!!,10-15-2021,jnkrumah96,11.0,spy 447 eod is not a meme,neutral,0.59197825,,,145,145_eod_eoy_eom_momtron9000,2021-10-15
86974,"Daily Discussion Thread for October 04, 2021","Looks like Facebook was hacked and all the information has been dumped/sold. Damn Zuck, you're in for a rough ride.",10-04-2021,superarmy,10.0,looks like facebook was hacked and all the information has been dumped sold damn zuck youre in for a rough ride,negative,0.9416824,,facebook,118,118_facebook_fb_whistleblower_zuckerberg,2021-10-04
88333,"Daily Discussion Thread for October 07, 2021",SPY 443 EODDDDDDDDDDD,10-07-2021,putsonmymental,9.0,spy 443 eoddddddddddd,neutral,0.6909736,,,6,6_440_445_444_453,2021-10-07
87217,"Daily Discussion Thread for October 04, 2021","Tlry big drop before earnings, always a good sign",10-04-2021,650KLR,8.0,tlry big drop before earnings always a good sign,positive,0.6767981,,,264,264_tlry_earnings_twtr_33c,2021-10-04
91468,"Weekend Discussion Thread for the Weekend of October 15, 2021",Just saw a girl do a ton of coke on the train. Let’s have a Friday,10-15-2021,TJwhosurmomma,26.0,just saw a girl do a ton of coke on the train lets have a friday,neutral,0.5766601,,,-1,-1_spce_000_price_bags,2021-10-15
92521,"Daily Discussion Thread for October 19, 2021",BB flying. Just took a look at that option chain. 🥰,10-19-2021,Gewoongary,11.0,bb flying just took a look at that option chain,neutral,0.88070416,,bb,-1,-1_spce_000_price_bags,2021-10-19
93028,"Daily Discussion Thread for October 20, 2021",These tsla options eat up some cash. I’m too scared.,10-20-2021,SnooGiraffes3827,8.0,these tsla options eat up some cash im too scared,negative,0.8994496,,tsla,-1,-1_spce_000_price_bags,2021-10-20
88154,"Daily Discussion Thread for October 07, 2021",My interviews have gotten much better since I stopped checking my options midway through,10-07-2021,Above_Everything,15.0,my interviews have gotten much better since i stopped checking my options midway through,positive,0.95291716,,,313,313_interview_hired_job_interviewer,2021-10-07
93008,"Daily Discussion Thread for October 20, 2021",People keep shorting $WISH thinking it's September and every pop will sell-off instantly. More and more people are adding now and will have to cover eventually. Could get ugly for them.,10-20-2021,kk7766,7.0,people keep shorting wish thinking its september and every pop will sell off instantly more and more people are adding now and will have to cover eventually could get ugly for them,negative,0.64064556,,,1,1_priced_sale_discount_price,2021-10-20
86267,"Daily Discussion Thread for October 01, 2021",As if millions of 434 puts cried out in terror and were suddenly silenced.,10-01-2021,iThinkiStartedATrend,9.0,as if millions of 434 puts cried out in terror and were suddenly silenced,negative,0.67618287,,,217,217_fighting_morale_beatings_violence,2021-10-01
90569,"Daily Discussion Thread for October 13, 2021",theta is my safe word,10-13-2021,taker52,8.0,theta is my safe word,neutral,0.5233807,,,62,62_theta_gang_wins_thetagang,2021-10-13
91869,"Daily Discussion Thread for October 18, 2021",Why buy $199 airpods when I can buy $5 airpods from Alibaba? Calls on Alibaba,10-18-2021,ODNI_NSA_FBI_CIA_DIA,14.0,why buy 199 airpods when i can buy 5 airpods from alibaba calls on alibaba,neutral,0.6102395,,,-1,-1_spce_000_price_bags,2021-10-18
88155,"Daily Discussion Thread for October 07, 2021",Wow Tesla about to announce teleportation,10-07-2021,Super_NiceGuy,16.0,wow tesla about to announce teleportation,neutral,0.56239045,,tesla,20,20_tesla_700_900_teslas,2021-10-07
86862,"Daily Discussion Thread for October 04, 2021","Kind of amazing how every move I make turns out to be the completely wrong thing to do, not even close.",10-04-2021,delta8meditate,13.0,kind of amazing how every move i make turns out to be the completely wrong thing to do not even close,negative,0.7857289,,,245,245_moves_move_rooooooooookie_turns,2021-10-04
87193,"Daily Discussion Thread for October 04, 2021",So are you guys losing money today,10-04-2021,Stormwingx,8.0,so are you guys losing money today,negative,0.65937114,,,-1,-1_spce_000_price_bags,2021-10-04
90407,"Daily Discussion Thread for October 13, 2021",SPY is dangerous af right now bulls bears tread lightly,10-13-2021,mrscrewup,9.0,spy is dangerous af right now bulls bears tread lightly,negative,0.8892021,,,42,42_bulls_bull_bears_bear,2021-10-13
88612,"Daily Discussion Thread for October 08, 2021",Spy 435 or 445 on numbers,10-08-2021,TopBuyer777,14.0,spy 435 or 445 on numbers,neutral,0.8718578,,,6,6_440_445_444_453,2021-10-08
87938,"Daily Discussion Thread for October 06, 2021","me an hour ago down 70%: please god just get me back to even I swear i'll sell

me 5 minutes ago managing to recover fully: at this point might as well see what happnes...",10-06-2021,ambitlover,9.0,me an hour ago down 70 please god just get me back to even i swear ill sell me 5 minutes ago managing to recover fully at this point might as well see what happnes,neutral,0.56675094,,,-1,-1_spce_000_price_bags,2021-10-06
92909,"Daily Discussion Thread for October 20, 2021",I loaded up on PINS yesterday. Lucky me.,10-20-2021,iwantyourforskin,9.0,i loaded up on pins yesterday lucky me,positive,0.88017,,,-1,-1_spce_000_price_bags,2021-10-20
93542,"Daily Discussion Thread for October 21, 2021","7 minutes of pure fomo, then fomo at open",10-21-2021,AxemanFromMA,9.0,7 minutes of pure fomo then fomo at open,neutral,0.8662842,,,101,101_fomo_fds_obliteration_death,2021-10-21
92350,"Daily Discussion Thread for October 19, 2021",TLRY getting high on its own supply,10-19-2021,oofnig,15.0,tlry getting high on its own supply,neutral,0.7075411,,,31,31_tlry_moving_awakens_tlghey,2021-10-19
90839,"Daily Discussion Thread for October 14, 2021","McRib is back, time to buy lean hog futures",10-14-2021,OrangeJudas,8.0,mcrib is back time to buy lean hog futures,neutral,0.8014042,,,-1,-1_spce_000_price_bags,2021-10-14
92216,"Daily Discussion Thread for October 18, 2021",Sell or hold tsla calls into earnings,10-18-2021,ismytatbad,7.0,sell or hold tsla calls into earnings,neutral,0.7946053,,tsla,-1,-1_spce_000_price_bags,2021-10-18
91043,"Daily Discussion Thread for October 14, 2021",you know what fucking sucks. being used to doing absolutely no work during the week. like maybe a solid 2 - 4 hours max. Then you get one of those days where it's non stop work for the ENTIRE 8 hours. shit is rough.,10-14-2021,Jonnydoo,7.0,you know what fucking sucks being used to doing absolutely no work during the week like maybe a solid 2 4 hours max then you get one of those days where its non stop work for the entire 8 hours shit is rough,negative,0.9664283,,,18,18_jobs_unemployment_boss_jobless,2021-10-14
88674,"Daily Discussion Thread for October 08, 2021","u/cashflow_ the type of guy to let you fuck his wife, then make your breakfast after.",10-08-2021,sonofalando,10.0,u cashflow_ the type of guy to let you fuck his wife then make your breakfast after,negative,0.83189285,,,65,65_cash_cashflow_gang_cashflows,2021-10-08
87089,"Daily Discussion Thread for October 04, 2021",We back bois. Don’t do that to me again I felt lost and confused,10-04-2021,Gingerescapeplan,10.0,we back bois dont do that to me again i felt lost and confused,negative,0.86443615,,,-1,-1_spce_000_price_bags,2021-10-04
86961,"Daily Discussion Thread for October 04, 2021","""This is a great entry point. Buy the dip""

Aka ""My bags are heavy""",10-04-2021,johndalysbeergut,9.0,this is a great entry point buy the dip aka my bags are heavy,positive,0.8242974,,,-1,-1_spce_000_price_bags,2021-10-04
87148,"Daily Discussion Thread for October 04, 2021",buying most dips is lucrative.  buying all dips is devastating.,10-04-2021,OhNoMoFomo,8.0,buying most dips is lucrative buying all dips is devastating,negative,0.5621113,,,2,2_dips_dipping_dip_dipped,2021-10-04
88520,"Daily Discussion Thread for October 07, 2021",Y’all for real excited about TLRY when it has gone up overnight about half of what it lost yesterday lmao,10-07-2021,8HokiePokie8,7.0,yall for real excited about tlry when it has gone up overnight about half of what it lost yesterday lmao,positive,0.665092,,,31,31_tlry_moving_awakens_tlghey,2021-10-07
89124,"Weekend Discussion Thread for the Weekend of October 08, 2021","“Only jackasses go around saying how much money they make”

Hank Hill

*fin*",10-10-2021,Aerotyne69,11.0,only jackasses go around saying how much money they make hank hill fin,negative,0.8278009,,,-1,-1_spce_000_price_bags,2021-10-10
88748,"Daily Discussion Thread for October 08, 2021","If u feel dumb just know there's ppl who actually believed a ""communist"" party who've been full blown capitalists for decades would actually nationalize their money making private companies and decided to short after prices already tanked 50% on FUD",10-08-2021,generatedaccount101,10.0,if u feel dumb just know theres ppl who actually believed a communist party whove been full blown capitalists for decades would actually nationalize their money making private companies and decided to short after prices already tanked 50 on fud,negative,0.8334481,,,33,33_china_chinese_chinas_usa,2021-10-08
87795,"Daily Discussion Thread for October 06, 2021","I was supposed to be at work an hour ago 

If these calls don’t come back from the dead I’m going to have to pull one hell of an excuse out of my ass",10-06-2021,HowLongCanIMakeACock,11.0,i was supposed to be at work an hour ago if these calls dont come back from the dead im going to have to pull one hell of an excuse out of my ass,negative,0.9546782,,,0,0_expire_expiring_call_expired,2021-10-06
86544,"Weekend Discussion Thread for the Weekend of October 01, 2021","this afternoon i ordered a single onion from doordash (0.86c), they charged me for 5lbs of onions ($5.40), and just issued me a refund for $10",10-02-2021,SmoresPies,12.0,this afternoon i ordered a single onion from doordash 0 86c they charged me for 5lbs of onions 5 40 and just issued me a refund for 10,neutral,0.69072974,,nio,523,523_ubereats_order_refunded_uber,2021-10-02
86502,"Weekend Discussion Thread for the Weekend of October 01, 2021",It's it ok to swear on the weekends?,10-03-2021,Duffbeers71,11.0,its it ok to swear on the weekends,neutral,0.72292,,,46,46_weekends_weekend_friday_monday,2021-10-03
88885,"Daily Discussion Thread for October 08, 2021",Spy gonna fuck both puts and calls today,10-08-2021,UsedTask,7.0,spy gonna fuck both puts and calls today,negative,0.9315322,,,9,9_0dte_sold_expiring_loss,2021-10-08
88817,"Daily Discussion Thread for October 08, 2021","apparently the showrunner for the Netflix program *Dear White People* is a white woman who is suggesting she will be boycotting Netflix because of the supposedly transphobic most recent comedy special by legendary comedian Dave Chappelle, who is a black man.

I have no social or political opinions about this but I am very bullish on NFLX",10-08-2021,AmericanHerstoryX,8.0,apparently the showrunner for the netflix program dear white people is a white woman who is suggesting she will be boycotting netflix because of the supposedly transphobic most recent comedy special by legendary comedian dave chappelle who is a black man i have no social or political opinions about this but i am very bullish on nflx,neutral,0.49739617,,nio,13,13_netflix_movie_movies_push,2021-10-08
93619,"Daily Discussion Thread for October 22, 2021","Don’t hold the bag if you can’t afford the tag.

Don’t spend the paper if you think we gonna taper.

Don’t by the call if you can’t lose it all.

Don’t call her a bitch when she’s the quad witch.

Don’t sell a put unless you collateral your foot.

Don’t buy the top if your lizard brain says stop.

Don’t chase the cheese if you can’t work on your knees.",10-22-2021,dvdr1029,30.0,dont hold the bag if you cant afford the tag dont spend the paper if you think we gonna taper dont by the call if you cant lose it all dont call her a bitch when shes the quad witch dont sell a put unless you collateral your foot dont buy the top if your lizard brain says stop dont chase the cheese if you cant work on your knees,negative,0.8434011,,ford,-1,-1_spce_000_price_bags,2021-10-22
88340,"Daily Discussion Thread for October 07, 2021",glad i don't have kids cuz they'd be going hungry,10-07-2021,pat-nasty,9.0,glad i dont have kids cuz theyd be going hungry,negative,0.69018376,,,-1,-1_spce_000_price_bags,2021-10-07
89591,"Daily Discussion Thread for October 11, 2021",This is about to reverse huh,10-11-2021,Fleeing_Sunlight,7.0,this is about to reverse huh,neutral,0.7590581,,,495,495_reversal_reverse_inverse_bicycles,2021-10-11
91223,"Daily Discussion Thread for October 15, 2021",I can’t wait for the Wendy’s 4for$69 meal in 2025,10-15-2021,ucaliptastree,10.0,i cant wait for the wendys 4for 69 meal in 2025,positive,0.9766187,,,63,63_wendys_dumpster_mcdonalds_careers,2021-10-15
94363,"Weekend Discussion Thread for the Weekend of October 22, 2021",we are just lambs to the cosmic slaughter!,10-23-2021,isellamdcalls,6.0,we are just lambs to the cosmic slaughter,negative,0.9140977,,,343,343_aliens_ufo_alien_ufos,2021-10-23
94380,"Weekend Discussion Thread for the Weekend of October 22, 2021","Imo the new orange man social media should call posts ""dumps"".

Then I can take a dump while dumping @ people.",10-23-2021,PatrickSebast,16.0,imo the new orange man social media should call posts dumps then i can take a dump while dumping people,negative,0.8635932,,,108,108_dump_dumping_dumps_dumpster,2021-10-23
90939,"Daily Discussion Thread for October 14, 2021",Addicts chasing their last high. Run Forrest run 🏃‍♂️ 💪 😳,10-14-2021,wthisgoingonanymore,9.0,addicts chasing their last high run forrest run,neutral,0.82086957,,,39,39_weed_smoked_cannabis_legalization,2021-10-14
86487,"Weekend Discussion Thread for the Weekend of October 01, 2021","My dad knew this guy who one day wound up in one of those doomsday cults. You know, the kind that says the world will end on X date, then X comes around and they’re like 😲 and then eventually they come up with a reason why the real date is a few years / month later. 

I used to think I’d never talked to anyone who did something as dumb as that. But then I realized I’ve talked to people on here that think AMC / GME will be worth $10 million / share soon. So  I guess people are the same as they ever were.",10-03-2021,ascendant23,14.0,my dad knew this guy who one day wound up in one of those doomsday cults you know the kind that says the world will end on x date then x comes around and theyre like and then eventually they come up with a reason why the real date is a few years month later i used to think id never talked to anyone who did something as dumb as that but then i realized ive talked to people on here that think amc gme will be worth 10 million share soon so i guess people are the same as they ever were,negative,0.59686816,,amc,27,27_nok_silver_line_charts,2021-10-03
93181,"Daily Discussion Thread for October 21, 2021",Wait it's a BB day again??,10-21-2021,stenglboy96,21.0,wait its a bb day again,neutral,0.67382795,,bb,81,81_climb_daq_undertaker_coffin,2021-10-21
90130,"Daily Discussion Thread for October 12, 2021",Anyone driven mad by how Fidelity app uses last trade price and their website uses bid?,10-12-2021,quarantrader,8.0,anyone driven mad by how fidelity app uses last trade price and their website uses bid,negative,0.61753917,,,114,114_brokerage_broker_apps_brokers,2021-10-12
88005,"Daily Discussion Thread for October 06, 2021","Oh what a feeling

Getting crushed by the debt ceiling",10-06-2021,whoatethekidsthen,8.0,oh what a feeling getting crushed by the debt ceiling,negative,0.6101331,,,186,186_debt_ceiling_raise_congress,2021-10-06
87734,"Daily Discussion Thread for October 06, 2021",I sold naked calls on Affirm yesterday. Am financially ruined.,10-06-2021,TheGhostofBillHwang,14.0,i sold naked calls on affirm yesterday am financially ruined,negative,0.9219722,,,0,0_expire_expiring_call_expired,2021-10-06
90017,"Daily Discussion Thread for October 12, 2021",Guys just literally buy the stocks before they go up and then sell them before they go down its so easy,10-12-2021,sm2016,8.0,guys just literally buy the stocks before they go up and then sell them before they go down its so easy,positive,0.50376034,,,4,4_investor_growth_investing_invest,2021-10-12
